all_awardings,allow_live_comments,author,author_flair_css_class,author_flair_richtext,author_flair_text,author_flair_type,author_fullname,author_patreon_flair,author_premium,awarders,can_mod_post,contest_mode,created_utc,domain,full_link,gildings,id,is_crosspostable,is_meta,is_original_content,is_reddit_media_domain,is_robot_indexable,is_self,is_video,link_flair_background_color,link_flair_richtext,link_flair_text_color,link_flair_type,locked,media_only,no_follow,num_comments,num_crossposts,over_18,parent_whitelist_status,permalink,pinned,pwls,retrieved_on,score,selftext,send_replies,spoiler,stickied,subreddit,subreddit_id,subreddit_subscribers,subreddit_type,thumbnail,title,total_awards_received,treatment_tags,upvote_ratio,url,whitelist_status,wls,post_hint,preview,thumbnail_height,thumbnail_width,url_overridden_by_dest,link_flair_text,removed_by_category,media,media_embed,secure_media,secure_media_embed,crosspost_parent,crosspost_parent_list
[],False,Freddierothschild,,[],,text,t2_2rlmj20r,False,False,[],False,False,1600649086,i.redd.it,https://www.reddit.com/r/math/comments/iwq5w2/please_help_thank_you_for_your_time/,{},iwq5w2,False,False,False,True,False,False,False,,[],dark,text,False,False,True,2,0,False,all_ads,/r/math/comments/iwq5w2/please_help_thank_you_for_your_time/,False,6,1600649097,1,,True,False,False,math,t5_2qh0n,1344893,public,image,Please help 🙏 thank you for your time,0,[],1.0,https://i.redd.it/smgh5ml0eeo51.jpg,all_ads,6,image,"{'enabled': True, 'images': [{'id': '3GxOHvIGQ1pEAtjH7Tp5TYOnmla_YEpv-JErGU-HbW8', 'resolutions': [{'height': 216, 'url': 'https://preview.redd.it/smgh5ml0eeo51.jpg?width=108&amp;crop=smart&amp;auto=webp&amp;s=00f002b0a6273b240de762968b324cd12f467d25', 'width': 108}, {'height': 432, 'url': 'https://preview.redd.it/smgh5ml0eeo51.jpg?width=216&amp;crop=smart&amp;auto=webp&amp;s=b5ce77b2da08dcad352f8e21c0759a92f8760425', 'width': 216}, {'height': 640, 'url': 'https://preview.redd.it/smgh5ml0eeo51.jpg?width=320&amp;crop=smart&amp;auto=webp&amp;s=429defc34a8a2d1567d43a0f665eef90021b642d', 'width': 320}, {'height': 1280, 'url': 'https://preview.redd.it/smgh5ml0eeo51.jpg?width=640&amp;crop=smart&amp;auto=webp&amp;s=fb35bd8d28ae74b0293babf1b2bf61e9ecde4b19', 'width': 640}], 'source': {'height': 1792, 'url': 'https://preview.redd.it/smgh5ml0eeo51.jpg?auto=webp&amp;s=13f797342606b20c3db328cfe76201d404d356cf', 'width': 828}, 'variants': {}}]}",140.0,140.0,https://i.redd.it/smgh5ml0eeo51.jpg,Removed - try /r/learnmath,moderator,,,,,,
[],False,Periplokos,,[],,text,t2_9ynte5q,False,False,[],False,False,1600643151,self.math,https://www.reddit.com/r/math/comments/iwogrw/how_many_cells_in_the_conways_game_of_life_must/,{},iwogrw,True,False,False,False,True,True,False,,[],dark,text,False,False,True,3,0,False,all_ads,/r/math/comments/iwogrw/how_many_cells_in_the_conways_game_of_life_must/,False,6,1600643162,1,"I suppose this question could only be answerable if all the kinds of constructible turing machines are known.

Another question would be how many cells must be marked in order for the Turing Machine to  persist for a number of rounds.",True,False,False,math,t5_2qh0n,1344791,public,self,How many cells in the conway's game of life must be marked in a grid of certain size for the highest chance that some of them form a turing machine ?,0,[],1.0,https://www.reddit.com/r/math/comments/iwogrw/how_many_cells_in_the_conways_game_of_life_must/,all_ads,6,,,,,,,,,,,,,
[],False,OtherwiseTailor0,,[],,text,t2_6lhuyva5,False,False,[],False,False,1600641589,self.math,https://www.reddit.com/r/math/comments/iwnzq9/renormalization_a_technique_that_helps_bridge_the/,{},iwnzq9,True,False,False,False,True,True,False,,[],dark,text,False,False,True,2,0,False,all_ads,/r/math/comments/iwnzq9/renormalization_a_technique_that_helps_bridge_the/,False,6,1600641600,1,[https://www.wired.com/story/mathematical-hocus-pocus-saved-particle-physics/](https://www.wired.com/story/mathematical-hocus-pocus-saved-particle-physics/),True,False,False,math,t5_2qh0n,1344712,public,self,"Renormalization, a technique that helps bridge the big and the small, has become perhaps the single most important advance in theoretical physics in 50 years.",0,[],1.0,https://www.reddit.com/r/math/comments/iwnzq9/renormalization_a_technique_that_helps_bridge_the/,all_ads,6,self,"{'enabled': False, 'images': [{'id': 'fsNNCgi_t4FCVh6zGAhP773RnC-DV-cH-Jc3xLNVLP8', 'resolutions': [{'height': 56, 'url': 'https://external-preview.redd.it/A8_NF931zRTK7JF4AlwvSFzMaLWq4SvmZt0R6hq4VxE.jpg?width=108&amp;crop=smart&amp;auto=webp&amp;s=4ec87b6d2eb53f8fd7ae8717bdb736f2f354495d', 'width': 108}, {'height': 113, 'url': 'https://external-preview.redd.it/A8_NF931zRTK7JF4AlwvSFzMaLWq4SvmZt0R6hq4VxE.jpg?width=216&amp;crop=smart&amp;auto=webp&amp;s=fd324058ba7b0b41084d405afc6e84ee8f97c9a6', 'width': 216}, {'height': 167, 'url': 'https://external-preview.redd.it/A8_NF931zRTK7JF4AlwvSFzMaLWq4SvmZt0R6hq4VxE.jpg?width=320&amp;crop=smart&amp;auto=webp&amp;s=6be34ac90d5d9bf93bb52f5fff853c438bb42895', 'width': 320}, {'height': 335, 'url': 'https://external-preview.redd.it/A8_NF931zRTK7JF4AlwvSFzMaLWq4SvmZt0R6hq4VxE.jpg?width=640&amp;crop=smart&amp;auto=webp&amp;s=7374cedd8870924a5e6ca093b6811c765f04917b', 'width': 640}, {'height': 502, 'url': 'https://external-preview.redd.it/A8_NF931zRTK7JF4AlwvSFzMaLWq4SvmZt0R6hq4VxE.jpg?width=960&amp;crop=smart&amp;auto=webp&amp;s=3f1656ae663b3209a20cf1ea16d306714e44a852', 'width': 960}, {'height': 565, 'url': 'https://external-preview.redd.it/A8_NF931zRTK7JF4AlwvSFzMaLWq4SvmZt0R6hq4VxE.jpg?width=1080&amp;crop=smart&amp;auto=webp&amp;s=07c27dbc8616a783e9847aa2209e4c38ed2da18a', 'width': 1080}], 'source': {'height': 670, 'url': 'https://external-preview.redd.it/A8_NF931zRTK7JF4AlwvSFzMaLWq4SvmZt0R6hq4VxE.jpg?auto=webp&amp;s=baf8329446048d67c81dbc9161703f9ed04062d5', 'width': 1280}, 'variants': {}}]}",,,,,,,,,,,
[],False,Zeddy-Ryan,,[],,text,t2_7ujwafsp,False,False,[],False,False,1600640434,self.math,https://www.reddit.com/r/math/comments/iwnmi5/a_characterization_of_coset_multiplication_in/,{},iwnmi5,True,False,False,False,True,True,False,,[],dark,text,False,False,True,3,0,False,all_ads,/r/math/comments/iwnmi5/a_characterization_of_coset_multiplication_in/,False,6,1600640444,1,"Let R be a ring. I don't assume the existence of a multiplicative identity, though I don't think that makes difference for what I'm talking about.  Let I be a two-sided ideal of R. We have the quotient ring R/I, in which the sum of cosets is defined as (r+I)+(s+I)=(r+s)+I. I recently noticed, for the first time, that (r+s)+I is precisely the set of all sums a+b, where a belongs to r+I and b belongs to s+I. In other words, our definition of coset addition ""by fiat"" is nothing more than ""the collection of all sums between the two cosets"".

But now, we define the product of two cosets as (r+I)(s+I)=(rs)+I. It is in fact true that ""the collection of all products between r+I and s+I"" is contained within (rs)+I, but I'm not sure if they are actually equal. So I'm wondering if for any i in I there exist j and k in I such that rs + i = (r+j)(s+k), which is equivalent to i = js + rk + jk. This seems like a lot to expect from an arbitrary ideal of an arbitrary ring, but I haven't been able to identify a counterexample.

Any advice?",True,False,False,math,t5_2qh0n,1344664,public,self,A Characterization of Coset Multiplication in Rings?,0,[],1.0,https://www.reddit.com/r/math/comments/iwnmi5/a_characterization_of_coset_multiplication_in/,all_ads,6,,,,,,,,,,,,,
[],False,jimmystar889,,[],,text,t2_114vv1,False,False,[],False,False,1600639323,self.math,https://www.reddit.com/r/math/comments/iwna8u/standard_cross_product_vs_levi_covina/,{},iwna8u,True,False,False,False,True,True,False,,[],dark,text,False,False,True,5,0,False,all_ads,/r/math/comments/iwna8u/standard_cross_product_vs_levi_covina/,False,6,1600639334,1,I’m in a vector calculus class and I was wondering if it would be beneficial to do all my problems using index notation rather than the standard methods. The professor introduced us to the Einstein summation notation but left it up to us what we do. I’m much much better at using the standard notation but would it be worth the extra effort to make the transition? For context I’m an EE major looking to get into RF. Thanks!,True,False,False,math,t5_2qh0n,1344655,public,self,Standard cross product vs Levi Covina,0,[],1.0,https://www.reddit.com/r/math/comments/iwna8u/standard_cross_product_vs_levi_covina/,all_ads,6,,,,,,,,,,,,,
[],False,Lolalovesmath,,[],,text,t2_4ggex5nb,False,False,[],False,False,1600638722,self.math,https://www.reddit.com/r/math/comments/iwn3dk/do_i_need_an_ipad/,{},iwn3dk,True,False,False,False,True,True,False,,[],dark,text,False,False,True,2,0,False,all_ads,/r/math/comments/iwn3dk/do_i_need_an_ipad/,False,6,1600638733,1,"I have spent £400-£300 over the past 2 years on paper, pens and printing. I'm just wondering will this be a fast and effective way to take notes as a maths student? Do lecturers/professors allow electronic note taking in your classes?",True,False,False,math,t5_2qh0n,1344649,public,self,Do I need an iPad?,0,[],1.0,https://www.reddit.com/r/math/comments/iwn3dk/do_i_need_an_ipad/,all_ads,6,,,,,,,,,,,,,
[],False,fmlcole,,[],,text,t2_6fk9afhc,False,False,[],False,False,1600637310,i.redd.it,https://www.reddit.com/r/math/comments/iwmnu6/i_need_help_solving_this_page/,{},iwmnu6,False,False,False,True,False,False,False,,[],dark,text,False,False,True,2,0,False,all_ads,/r/math/comments/iwmnu6/i_need_help_solving_this_page/,False,6,1600637321,1,,True,False,False,math,t5_2qh0n,1344636,public,image,I need Help solving this page,0,[],1.0,https://i.redd.it/29ep32rzedo51.jpg,all_ads,6,image,"{'enabled': True, 'images': [{'id': 'xzdkeyG3bE8XYOX_D2Usw03M75Pm_weBnnNfYblHsqQ', 'resolutions': [{'height': 144, 'url': 'https://preview.redd.it/29ep32rzedo51.jpg?width=108&amp;crop=smart&amp;auto=webp&amp;s=eb57b2b91a1c8c72892577b5f22aad44f6a9375a', 'width': 108}, {'height': 288, 'url': 'https://preview.redd.it/29ep32rzedo51.jpg?width=216&amp;crop=smart&amp;auto=webp&amp;s=710ccd132d2f1834589924adc6281e095de462e4', 'width': 216}, {'height': 426, 'url': 'https://preview.redd.it/29ep32rzedo51.jpg?width=320&amp;crop=smart&amp;auto=webp&amp;s=85ce3bd55318521e1d00ffc54c4a70da9aed39f8', 'width': 320}, {'height': 853, 'url': 'https://preview.redd.it/29ep32rzedo51.jpg?width=640&amp;crop=smart&amp;auto=webp&amp;s=f1ad3b235713c19bd3e5645055d44e1b6ae64c42', 'width': 640}, {'height': 1280, 'url': 'https://preview.redd.it/29ep32rzedo51.jpg?width=960&amp;crop=smart&amp;auto=webp&amp;s=824c63ce01a5d017e30d1233c973275d0f042e17', 'width': 960}, {'height': 1440, 'url': 'https://preview.redd.it/29ep32rzedo51.jpg?width=1080&amp;crop=smart&amp;auto=webp&amp;s=499fa7f984a7b029085c3a5ba3a20aee504b63cf', 'width': 1080}], 'source': {'height': 4032, 'url': 'https://preview.redd.it/29ep32rzedo51.jpg?auto=webp&amp;s=8a5282a209b97519485fa3aceecfbf99edb804ab', 'width': 3024}, 'variants': {}}]}",140.0,140.0,https://i.redd.it/29ep32rzedo51.jpg,Removed - try /r/learnmath,moderator,,,,,,
[],False,anosu,,[],,text,t2_yhlts,False,False,[],False,False,1600636609,self.math,https://www.reddit.com/r/math/comments/iwmgcy/how_do_i_know_which_math_is_for_me_w_a_ba_in_math/,{},iwmgcy,True,False,False,False,True,True,False,,[],dark,text,False,False,True,7,0,False,all_ads,/r/math/comments/iwmgcy/how_do_i_know_which_math_is_for_me_w_a_ba_in_math/,False,6,1600636620,1,I have a ba in math and I want to pursue math despite being out of the game for a little while now due to a job search and schizophrenia.  But things are better now and I want to discover math again.  How do I go about that?  I mean money is an issue but I’m a few years I can deal with that and get a PhD in math or something.,True,False,False,math,t5_2qh0n,1344628,public,self,How do I know which math is for me? W/ a ba in math,0,[],1.0,https://www.reddit.com/r/math/comments/iwmgcy/how_do_i_know_which_math_is_for_me_w_a_ba_in_math/,all_ads,6,,,,,,,,,,,,,
[],False,Pengiin,,[],,text,t2_37hyoziz,False,False,[],False,False,1600636290,self.math,https://www.reddit.com/r/math/comments/iwmcwd/for_which_a_0_does_the_inverse_of_fx_x_xᵃ_have_a/,{},iwmcwd,True,False,False,False,True,True,False,,[],dark,text,False,False,True,18,0,False,all_ads,/r/math/comments/iwmcwd/for_which_a_0_does_the_inverse_of_fx_x_xᵃ_have_a/,False,6,1600636301,1,"Hello dear reddit folks!

First of all, since xᵃ and x are both strictly monotonously increasing for x≥0, there exists an inverse function on the positive real numbers. By ""nice"" I basically meant any closed form, let it be an integral expression, any elementary function or any other well known functions. 

For values a in {0,1,2,3,4} the inverse has a nice closed form because there are formulas to solve these polynomials. This also implies (by substitution) that for a = p/q with p in {0,1,2,3,4} and q in {1,2,3,4} there exists a nice inverse. However, this is all I can come up with. Any ideas?  
(By the way, this is not a homework or anything, I'm just curious)",True,False,False,math,t5_2qh0n,1344623,public,self,"For which a ≥ 0 does the inverse of f(x) = x + xᵃ have a ""nice"" expression?",0,[],1.0,https://www.reddit.com/r/math/comments/iwmcwd/for_which_a_0_does_the_inverse_of_fx_x_xᵃ_have_a/,all_ads,6,,,,,,,,,,,,,
[],False,RagingLion04,,[],,text,t2_3elfosa6,False,False,[],False,False,1600634386,i.redd.it,https://www.reddit.com/r/math/comments/iwlrll/need_help_with_this_system_of_equations_problem/,{},iwlrll,False,False,False,True,False,False,False,,[],dark,text,False,False,True,2,0,False,all_ads,/r/math/comments/iwlrll/need_help_with_this_system_of_equations_problem/,False,6,1600634398,1,,True,False,False,math,t5_2qh0n,1344612,public,image,Need help with this system of equations problem,0,[],1.0,https://i.redd.it/vs4pxpra6do51.jpg,all_ads,6,image,"{'enabled': True, 'images': [{'id': 'iVd-YBK2GoR9R0FGGmFVKAknY3ivTt2ttOEnaxFZYsw', 'resolutions': [{'height': 144, 'url': 'https://preview.redd.it/vs4pxpra6do51.jpg?width=108&amp;crop=smart&amp;auto=webp&amp;s=40d2856890e1226bafaf6c79c2eacdebe08cf106', 'width': 108}, {'height': 288, 'url': 'https://preview.redd.it/vs4pxpra6do51.jpg?width=216&amp;crop=smart&amp;auto=webp&amp;s=3bd0a901b800c04239b6f4e90ebb2329f5bd1508', 'width': 216}, {'height': 426, 'url': 'https://preview.redd.it/vs4pxpra6do51.jpg?width=320&amp;crop=smart&amp;auto=webp&amp;s=da1cb8a55537443f57f2c247406c4a7326149ab7', 'width': 320}, {'height': 853, 'url': 'https://preview.redd.it/vs4pxpra6do51.jpg?width=640&amp;crop=smart&amp;auto=webp&amp;s=da36dd696481fbf93bd876eb2110469027bb86d7', 'width': 640}, {'height': 1280, 'url': 'https://preview.redd.it/vs4pxpra6do51.jpg?width=960&amp;crop=smart&amp;auto=webp&amp;s=6bd27cf361bccc757d36a1db73eb1f06c161e4fa', 'width': 960}, {'height': 1440, 'url': 'https://preview.redd.it/vs4pxpra6do51.jpg?width=1080&amp;crop=smart&amp;auto=webp&amp;s=2c8348ef27debc2bca710312947a5e82392a9a35', 'width': 1080}], 'source': {'height': 4032, 'url': 'https://preview.redd.it/vs4pxpra6do51.jpg?auto=webp&amp;s=cb5dfbde4cb6bcb98a1829ee1717de30fcd694d6', 'width': 3024}, 'variants': {}}]}",140.0,140.0,https://i.redd.it/vs4pxpra6do51.jpg,Removed - try /r/learnmath,moderator,,,,,,
[],False,k0k0max,,[],,text,t2_3pd0ftxv,False,False,[],False,False,1600633141,i.redd.it,https://www.reddit.com/r/math/comments/iwldr6/the_forbidden_number/,{},iwldr6,False,False,False,True,False,False,False,,[],dark,text,False,False,True,2,0,False,all_ads,/r/math/comments/iwldr6/the_forbidden_number/,False,6,1600633153,1,,True,False,False,math,t5_2qh0n,1344602,public,image,the forbidden number,0,[],1.0,https://i.redd.it/zn66yyll2do51.jpg,all_ads,6,image,"{'enabled': True, 'images': [{'id': '7zuN1TzvXd2fh6ZeiNcv7Pz6msh2KscE1nzfbogo38I', 'resolutions': [{'height': 144, 'url': 'https://preview.redd.it/zn66yyll2do51.jpg?width=108&amp;crop=smart&amp;auto=webp&amp;s=55ee7cadc3c72ade5c949dff7b9cf5871e3a8064', 'width': 108}, {'height': 288, 'url': 'https://preview.redd.it/zn66yyll2do51.jpg?width=216&amp;crop=smart&amp;auto=webp&amp;s=529d4baf292415f30526ef4828a77f06ed0128f3', 'width': 216}, {'height': 426, 'url': 'https://preview.redd.it/zn66yyll2do51.jpg?width=320&amp;crop=smart&amp;auto=webp&amp;s=b30d9cf5d00a2f306ddc9d8473b0a39f02c51e35', 'width': 320}, {'height': 853, 'url': 'https://preview.redd.it/zn66yyll2do51.jpg?width=640&amp;crop=smart&amp;auto=webp&amp;s=9c903a752ec3db75da82983dd46af3fcf0412890', 'width': 640}, {'height': 1280, 'url': 'https://preview.redd.it/zn66yyll2do51.jpg?width=960&amp;crop=smart&amp;auto=webp&amp;s=bcb92e8ea5b17975670874bef7b05e6570e231e3', 'width': 960}, {'height': 1440, 'url': 'https://preview.redd.it/zn66yyll2do51.jpg?width=1080&amp;crop=smart&amp;auto=webp&amp;s=7f1101445253c7a7179efcff11e274a007dc7de7', 'width': 1080}], 'source': {'height': 4032, 'url': 'https://preview.redd.it/zn66yyll2do51.jpg?auto=webp&amp;s=b9b7bce4b5e6e89380a5fd932a9351fde7426add', 'width': 3024}, 'variants': {}}]}",140.0,140.0,https://i.redd.it/zn66yyll2do51.jpg,Removed - add explanation,automod_filtered,,,,,,
[],False,Ihsiasih,,[],,text,t2_hboap,False,False,[],False,False,1600632150,self.math,https://www.reddit.com/r/math/comments/iwl27x/counting_fences_vs_counting_fenceposts/,{},iwl27x,True,False,False,False,True,True,False,,[],dark,text,False,False,True,9,0,False,all_ads,/r/math/comments/iwl27x/counting_fences_vs_counting_fenceposts/,False,6,1600632162,1,"If I ask myself a question like ""Given that it's the 20th of September today, how many days until the 27th or September?"", I always second guess myself due to off by one errors. (The answer: 8 = 27 - 20 + 1 days).

Here's a neat trick I came up with to remember the + 1; i.e., how to remember what the difference of integers a - b really means.

First, think of counting starting at 1 as corresponding to enumerating a collection of physical objects, like rocks. (This corresponds to treating counting starting at 1 as counting fences, not fence posts). ""1 rock"", ""2 rocks"", etc. Therefore, the set {1, 2, ..., b} has b elements in it!

Where I always get tripped up is trying to count the number of integers in the set \[a, b\]. In the example above, I wanted to count the number of integers in the set \[20, 27\].

Well, \[a, b\] = {a, a + 1, ..., a + (b - a)} = {a}  ∪ {a + 1, ..., a + (b - a)}. The second set in the union clearly has the same number of elements as {1, 2, ..., b - a}, which has b - a elements in it. Therefore there are (b - a) + 1 integers in the set \[a, b\].

I hope this helps someone other than me!",True,False,False,math,t5_2qh0n,1344591,public,self,Counting fences vs. counting fenceposts,0,[],1.0,https://www.reddit.com/r/math/comments/iwl27x/counting_fences_vs_counting_fenceposts/,all_ads,6,,,,,,,,,,,,,
[],False,VideleNews,,[],,text,t2_4jvnff54,False,False,[],False,False,1600631315,youtube.com,https://www.reddit.com/r/math/comments/iwks7g/soru_çözüm_31_9_sınıf_mantık_ve_kümeler_kümelerde/,{},iwks7g,False,False,False,False,False,False,False,,[],dark,text,False,False,True,0,0,False,all_ads,/r/math/comments/iwks7g/soru_çözüm_31_9_sınıf_mantık_ve_kümeler_kümelerde/,False,6,1600631345,1,,True,False,False,math,t5_2qh0n,1344578,public,image,Soru Çözüm 31 || 9. Sınıf || Mantık ve Kümeler || Kümelerde Birleşim ve ...,0,[],1.0,https://www.youtube.com/watch?v=U_HBKWuioEI&amp;feature=share,all_ads,6,rich:video,"{'enabled': False, 'images': [{'id': 'aAQHmBkGc1l36rnFSgb37-ej16k-tjGzN-9PmMbdj6U', 'resolutions': [{'height': 81, 'url': 'https://external-preview.redd.it/m__sKx78xXZV6Jzrq78z_eRAFuczo2-J79xoZd4UfYs.jpg?width=108&amp;crop=smart&amp;auto=webp&amp;s=10012d3a0133605ab01c7af66fa7e4996910a740', 'width': 108}, {'height': 162, 'url': 'https://external-preview.redd.it/m__sKx78xXZV6Jzrq78z_eRAFuczo2-J79xoZd4UfYs.jpg?width=216&amp;crop=smart&amp;auto=webp&amp;s=d698cb1eb3fccebf48a3cb18df9752b380d94738', 'width': 216}, {'height': 240, 'url': 'https://external-preview.redd.it/m__sKx78xXZV6Jzrq78z_eRAFuczo2-J79xoZd4UfYs.jpg?width=320&amp;crop=smart&amp;auto=webp&amp;s=a057e54cc4d3dd7e747c64c9f4ada858307ef6d4', 'width': 320}], 'source': {'height': 360, 'url': 'https://external-preview.redd.it/m__sKx78xXZV6Jzrq78z_eRAFuczo2-J79xoZd4UfYs.jpg?auto=webp&amp;s=d148e36923830b7714ce12aad19a3827548e629a', 'width': 480}, 'variants': {}}]}",105.0,140.0,https://www.youtube.com/watch?v=U_HBKWuioEI&amp;feature=share,,automod_filtered,"{'oembed': {'author_name': 'Matematik Soru Çözüm', 'author_url': 'https://www.youtube.com/channel/UCm07ykzvpmPZuWMorgC1ooQ', 'height': 338, 'html': '&lt;iframe width=""600"" height=""338"" src=""https://www.youtube.com/embed/U_HBKWuioEI?feature=oembed&amp;enablejsapi=1"" frameborder=""0"" allow=""accelerometer; autoplay; clipboard-write; encrypted-media; gyroscope; picture-in-picture"" allowfullscreen&gt;&lt;/iframe&gt;', 'provider_name': 'YouTube', 'provider_url': 'https://www.youtube.com/', 'thumbnail_height': 360, 'thumbnail_url': 'https://i.ytimg.com/vi/U_HBKWuioEI/hqdefault.jpg', 'thumbnail_width': 480, 'title': 'Soru Çözüm 31 || 9. Sınıf || Mantık ve Kümeler || Kümelerde Birleşim ve Kesişim İşlemleri', 'type': 'video', 'version': '1.0', 'width': 600}, 'type': 'youtube.com'}","{'content': '&lt;iframe width=""600"" height=""338"" src=""https://www.youtube.com/embed/U_HBKWuioEI?feature=oembed&amp;enablejsapi=1"" frameborder=""0"" allow=""accelerometer; autoplay; clipboard-write; encrypted-media; gyroscope; picture-in-picture"" allowfullscreen&gt;&lt;/iframe&gt;', 'height': 338, 'scrolling': False, 'width': 600}","{'oembed': {'author_name': 'Matematik Soru Çözüm', 'author_url': 'https://www.youtube.com/channel/UCm07ykzvpmPZuWMorgC1ooQ', 'height': 338, 'html': '&lt;iframe width=""600"" height=""338"" src=""https://www.youtube.com/embed/U_HBKWuioEI?feature=oembed&amp;enablejsapi=1"" frameborder=""0"" allow=""accelerometer; autoplay; clipboard-write; encrypted-media; gyroscope; picture-in-picture"" allowfullscreen&gt;&lt;/iframe&gt;', 'provider_name': 'YouTube', 'provider_url': 'https://www.youtube.com/', 'thumbnail_height': 360, 'thumbnail_url': 'https://i.ytimg.com/vi/U_HBKWuioEI/hqdefault.jpg', 'thumbnail_width': 480, 'title': 'Soru Çözüm 31 || 9. Sınıf || Mantık ve Kümeler || Kümelerde Birleşim ve Kesişim İşlemleri', 'type': 'video', 'version': '1.0', 'width': 600}, 'type': 'youtube.com'}","{'content': '&lt;iframe width=""600"" height=""338"" src=""https://www.youtube.com/embed/U_HBKWuioEI?feature=oembed&amp;enablejsapi=1"" frameborder=""0"" allow=""accelerometer; autoplay; clipboard-write; encrypted-media; gyroscope; picture-in-picture"" allowfullscreen&gt;&lt;/iframe&gt;', 'height': 338, 'media_domain_url': 'https://www.redditmedia.com/mediaembed/iwks7g', 'scrolling': False, 'width': 600}",,
[],False,sat129,,[],,text,t2_52x3efig,False,False,[],False,False,1600626416,i.redd.it,https://www.reddit.com/r/math/comments/iwj7rh/im_having_a_hard_time_solving_this_please_help/,{},iwj7rh,False,False,False,True,False,False,False,,[],dark,text,False,False,True,2,0,False,all_ads,/r/math/comments/iwj7rh/im_having_a_hard_time_solving_this_please_help/,False,6,1600626427,1,,True,False,False,math,t5_2qh0n,1344538,public,image,I’m having a hard time solving this please help ! It’s my last chance to get the answer correct or I fail my hw !!!,0,[],1.0,https://i.redd.it/2j8x6ivlico51.jpg,all_ads,6,image,"{'enabled': True, 'images': [{'id': 'WUhDRSd04o90jN1y85UxYHDeM3lht45HDdJocvNI51g', 'resolutions': [{'height': 91, 'url': 'https://preview.redd.it/2j8x6ivlico51.jpg?width=108&amp;crop=smart&amp;auto=webp&amp;s=9d00c1dcd24291bdc848e2520e459c2c71139b97', 'width': 108}, {'height': 182, 'url': 'https://preview.redd.it/2j8x6ivlico51.jpg?width=216&amp;crop=smart&amp;auto=webp&amp;s=204a702d78f95c7fbc70923146cdcb212933e1ab', 'width': 216}, {'height': 270, 'url': 'https://preview.redd.it/2j8x6ivlico51.jpg?width=320&amp;crop=smart&amp;auto=webp&amp;s=1d889a897639a7f1c0bb296f24ea985bc2bf87f6', 'width': 320}, {'height': 540, 'url': 'https://preview.redd.it/2j8x6ivlico51.jpg?width=640&amp;crop=smart&amp;auto=webp&amp;s=7b78e2f1ea4c75cf3b6bb8044d4478590b7aa617', 'width': 640}], 'source': {'height': 762, 'url': 'https://preview.redd.it/2j8x6ivlico51.jpg?auto=webp&amp;s=3c556dbd8ffa5abf87d8b4fdebddb216c965ea81', 'width': 902}, 'variants': {}}]}",118.0,140.0,https://i.redd.it/2j8x6ivlico51.jpg,Removed - try /r/learnmath,moderator,,,,,,
[],False,6686450,,[],,text,t2_6campu2x,False,False,[],False,False,1600626003,self.math,https://www.reddit.com/r/math/comments/iwj36b/significant_numbers/,{},iwj36b,True,False,False,False,True,True,False,,[],dark,text,False,False,True,1,0,False,all_ads,/r/math/comments/iwj36b/significant_numbers/,False,6,1600626014,1,"0.54/2.07= express the result of this division in the correct number of significant figures 

#next 
5.67-1.1-0.9378 =

Thanks gang ;)",True,False,False,math,t5_2qh0n,1344537,public,self,Significant numbers,0,[],1.0,https://www.reddit.com/r/math/comments/iwj36b/significant_numbers/,all_ads,6,,,,,,,,,,,,,
