all_awardings,allow_live_comments,author,author_flair_css_class,author_flair_richtext,author_flair_text,author_flair_type,author_fullname,author_patreon_flair,author_premium,awarders,can_mod_post,contest_mode,created_utc,domain,full_link,gildings,id,is_crosspostable,is_meta,is_original_content,is_reddit_media_domain,is_robot_indexable,is_self,is_video,link_flair_background_color,link_flair_richtext,link_flair_text_color,link_flair_type,locked,media_only,no_follow,num_comments,num_crossposts,over_18,parent_whitelist_status,permalink,pinned,pwls,retrieved_on,score,selftext,send_replies,spoiler,stickied,subreddit,subreddit_id,subreddit_subscribers,subreddit_type,thumbnail,title,total_awards_received,treatment_tags,upvote_ratio,url,whitelist_status,wls,post_hint,preview,thumbnail_height,thumbnail_width,url_overridden_by_dest,link_flair_text,removed_by_category,media,media_embed,secure_media,secure_media_embed,crosspost_parent,crosspost_parent_list
[],False,Rairport,,[],,text,t2_1mibbbhk,False,False,[],False,False,1600591939,self.math,https://www.reddit.com/r/math/comments/iwads6/whats_an_unsolved_problem_which_a_solution_has/,{},iwads6,True,False,False,False,True,True,False,,[],dark,text,False,False,True,308,0,False,all_ads,/r/math/comments/iwads6/whats_an_unsolved_problem_which_a_solution_has/,False,6,1600591950,1,,True,False,False,math,t5_2qh0n,1343902,public,self,"What's an unsolved problem which a solution has been proven to exist, but which remains unsolved because no one has been able to find a solution?",0,[],1.0,https://www.reddit.com/r/math/comments/iwads6/whats_an_unsolved_problem_which_a_solution_has/,all_ads,6,,,,,,,,,,,,,
[],False,skywalkerb1,,[],,text,t2_2vn5skju,False,False,[],False,False,1600585118,self.math,https://www.reddit.com/r/math/comments/iw91dd/does_this_sub_care_about_the_state_of_the_world/,{},iw91dd,True,False,False,False,True,True,False,,[],dark,text,False,False,True,63,0,False,all_ads,/r/math/comments/iw91dd/does_this_sub_care_about_the_state_of_the_world/,False,6,1600585129,1,"New to this sub, but I sorted by “best” for awhile and saw nothing whatsoever about our planetary challenges. Does this sub have nothing to do with math’s application in the real world?",True,False,False,math,t5_2qh0n,1343755,public,self,Does this sub care about the state of the world today?,0,[],1.0,https://www.reddit.com/r/math/comments/iw91dd/does_this_sub_care_about_the_state_of_the_world/,all_ads,6,,,,,,,,,,,,,
[],False,WhiteRaven_M,,[],,text,t2_dh2td7x,False,False,[],False,False,1600584436,i.redd.it,https://www.reddit.com/r/math/comments/iw8x12/how_to_visualize_planes_in_3d_coordinate_system/,{},iw8x12,False,False,False,True,False,False,False,,[],dark,text,False,False,True,2,0,False,all_ads,/r/math/comments/iw8x12/how_to_visualize_planes_in_3d_coordinate_system/,False,6,1600584446,1,,True,False,False,math,t5_2qh0n,1343737,public,image,How to visualize planes in 3D coordinate system with papers.,0,[],1.0,https://i.redd.it/xvehpjtr19o51.jpg,all_ads,6,image,"{'enabled': True, 'images': [{'id': '2Gbu6YxnJncCIftQ8jK5DNWinBdF_dJRQkeMhB1VS1I', 'resolutions': [{'height': 144, 'url': 'https://preview.redd.it/xvehpjtr19o51.jpg?width=108&amp;crop=smart&amp;auto=webp&amp;s=5a753d62d867fe9791a486a129942b30e46438d7', 'width': 108}, {'height': 288, 'url': 'https://preview.redd.it/xvehpjtr19o51.jpg?width=216&amp;crop=smart&amp;auto=webp&amp;s=459378f9324fae4972d3473208f7ed0816f28807', 'width': 216}, {'height': 426, 'url': 'https://preview.redd.it/xvehpjtr19o51.jpg?width=320&amp;crop=smart&amp;auto=webp&amp;s=2b7e28b0d1fe41615517d2663dfc0ea96b4ad723', 'width': 320}, {'height': 853, 'url': 'https://preview.redd.it/xvehpjtr19o51.jpg?width=640&amp;crop=smart&amp;auto=webp&amp;s=90d848829b7807a2c29df9621bc57e1e441294fb', 'width': 640}, {'height': 1280, 'url': 'https://preview.redd.it/xvehpjtr19o51.jpg?width=960&amp;crop=smart&amp;auto=webp&amp;s=91ba528b912ced7df6ca7489aac9245da253000d', 'width': 960}, {'height': 1440, 'url': 'https://preview.redd.it/xvehpjtr19o51.jpg?width=1080&amp;crop=smart&amp;auto=webp&amp;s=8f04d64c7a9d887a96c51ed6f5ac13c35e393edb', 'width': 1080}], 'source': {'height': 4032, 'url': 'https://preview.redd.it/xvehpjtr19o51.jpg?auto=webp&amp;s=c4589177e26e3a8c988292c67007b5f09ee16e70', 'width': 3024}, 'variants': {}}]}",140.0,140.0,https://i.redd.it/xvehpjtr19o51.jpg,Removed - add explanation,automod_filtered,,,,,,
[],False,Topology22,,[],,text,t2_6n4dwjgq,False,True,[],False,False,1600579522,self.math,https://www.reddit.com/r/math/comments/iw80rs/what_motivates_you_to_help_others_in_maths/,{},iw80rs,True,False,False,False,True,True,False,,[],dark,text,False,False,True,27,0,False,all_ads,/r/math/comments/iw80rs/what_motivates_you_to_help_others_in_maths/,False,6,1600579532,1,"So I’m curious as to what people’s motivations are. I am very grateful to those that help me and others out with our basic quest1ons, but why do people do it?

For me personally, either the quest1on is easy for me to answer or it isn’t. If it’s easy, then I’ll help out cause it’s little trouble to me and a big help to the asker. If it’s not easy, then I’ll still try to answer cause it’s good practice.

What is your personal reason?",True,False,False,math,t5_2qh0n,1343667,public,self,What motivates you to help others in maths?,0,[],1.0,https://www.reddit.com/r/math/comments/iw80rs/what_motivates_you_to_help_others_in_maths/,all_ads,6,,,,,,,,,,,,,
[],False,dopedog_,,[],,text,t2_84ghmsgm,False,False,[],False,False,1600577452,i.redd.it,https://www.reddit.com/r/math/comments/iw7lhb/someone_explain_now/,{},iw7lhb,False,False,False,True,False,False,False,,[],dark,text,False,False,True,2,0,False,all_ads,/r/math/comments/iw7lhb/someone_explain_now/,False,6,1600577463,1,,True,False,False,math,t5_2qh0n,1343609,public,image,Someone explain. Now,0,[],1.0,https://i.redd.it/8cm8sle0h8o51.jpg,all_ads,6,image,"{'enabled': True, 'images': [{'id': 'dGIiLAhoKC6MvNT32HJPGWX2GhYoVSWUqJx_D4qRfcw', 'resolutions': [{'height': 144, 'url': 'https://preview.redd.it/8cm8sle0h8o51.jpg?width=108&amp;crop=smart&amp;auto=webp&amp;s=9fa4efe1c8861dcfd8c3f5c6319e1afe35f42e30', 'width': 108}, {'height': 288, 'url': 'https://preview.redd.it/8cm8sle0h8o51.jpg?width=216&amp;crop=smart&amp;auto=webp&amp;s=24bd0cfbcc80eed028ed2b03eb207a35b017e38b', 'width': 216}, {'height': 426, 'url': 'https://preview.redd.it/8cm8sle0h8o51.jpg?width=320&amp;crop=smart&amp;auto=webp&amp;s=40c3cb9248821124a0bd84c2d9b0b31a9842a073', 'width': 320}, {'height': 853, 'url': 'https://preview.redd.it/8cm8sle0h8o51.jpg?width=640&amp;crop=smart&amp;auto=webp&amp;s=74337a13470a0c98d4b0d241f9dffba989bb210e', 'width': 640}], 'source': {'height': 1200, 'url': 'https://preview.redd.it/8cm8sle0h8o51.jpg?auto=webp&amp;s=3cbb31f8ad1bb75a9fa1f9718fe22d175852f762', 'width': 900}, 'variants': {}}]}",140.0,140.0,https://i.redd.it/8cm8sle0h8o51.jpg,Removed - try /r/learnmath,moderator,,,,,,
[],False,nihagranger,,[],,text,t2_785auai8,False,False,[],False,False,1600576018,astralambrosia.com,https://www.reddit.com/r/math/comments/iw7ar3/how_to_study_mathematics/,{},iw7ar3,False,False,False,False,False,False,False,,[],dark,text,False,False,True,0,0,False,all_ads,/r/math/comments/iw7ar3/how_to_study_mathematics/,False,6,1600576029,1,,True,False,False,math,t5_2qh0n,1343600,public,default,How to study mathematics,0,[],1.0,http://astralambrosia.com/how-i-study-mathematics/,all_ads,6,link,"{'enabled': False, 'images': [{'id': 'BaXHW9aLV9ebVtbNoFVWgCbfTc-rO3TyDaUO4_NJSCs', 'resolutions': [{'height': 72, 'url': 'https://external-preview.redd.it/WUgy15kbc9g_yz41nm3tFdA0GbK64A2XSHwLgwprie4.jpg?width=108&amp;crop=smart&amp;auto=webp&amp;s=3767d5e40541572ece2dbe01899e234aa4f52ca2', 'width': 108}, {'height': 144, 'url': 'https://external-preview.redd.it/WUgy15kbc9g_yz41nm3tFdA0GbK64A2XSHwLgwprie4.jpg?width=216&amp;crop=smart&amp;auto=webp&amp;s=6bd14ac0b0a32881628e26477fa8ca11c1b17f8e', 'width': 216}, {'height': 213, 'url': 'https://external-preview.redd.it/WUgy15kbc9g_yz41nm3tFdA0GbK64A2XSHwLgwprie4.jpg?width=320&amp;crop=smart&amp;auto=webp&amp;s=4bfcc4c7c736e77f6044904ed2c094129dd21613', 'width': 320}, {'height': 426, 'url': 'https://external-preview.redd.it/WUgy15kbc9g_yz41nm3tFdA0GbK64A2XSHwLgwprie4.jpg?width=640&amp;crop=smart&amp;auto=webp&amp;s=1250cb7ae6d7b5acf812290eb18a9821db270cf0', 'width': 640}, {'height': 640, 'url': 'https://external-preview.redd.it/WUgy15kbc9g_yz41nm3tFdA0GbK64A2XSHwLgwprie4.jpg?width=960&amp;crop=smart&amp;auto=webp&amp;s=7dc5587e154b95a421dd000b972199e7d21d8a1c', 'width': 960}, {'height': 720, 'url': 'https://external-preview.redd.it/WUgy15kbc9g_yz41nm3tFdA0GbK64A2XSHwLgwprie4.jpg?width=1080&amp;crop=smart&amp;auto=webp&amp;s=0be659626f1eac4eee80a02599c7c93e055a6615', 'width': 1080}], 'source': {'height': 1707, 'url': 'https://external-preview.redd.it/WUgy15kbc9g_yz41nm3tFdA0GbK64A2XSHwLgwprie4.jpg?auto=webp&amp;s=a1c4468f87a1ca00f231a9f3f0fdb1a8b2167b4b', 'width': 2560}, 'variants': {}}]}",93.0,140.0,http://astralambrosia.com/how-i-study-mathematics/,,automod_filtered,,,,,,
[],False,BasedIndividual,,[],,text,t2_669afz82,False,False,[],False,False,1600575883,self.math,https://www.reddit.com/r/math/comments/iw79rq/mathematical_formulas/,{},iw79rq,True,False,False,False,True,True,False,,[],dark,text,False,False,True,4,0,False,all_ads,/r/math/comments/iw79rq/mathematical_formulas/,False,6,1600575894,1,"Hello Everyone,

I am currently doing some applied Machine Learning for school. However, I do not have a math background and mathematical formulas and notation seem foreign to me. Is there a good website or book that will serve as a reference whenever I come across a complex formula? I would like it as comprehensive as possible. I want to know what the subscripts mean, certain letters, etc.. I just want a resource that I can use to understand any formula. Any thoughts?",True,False,False,math,t5_2qh0n,1343600,public,self,Mathematical Formulas,0,[],1.0,https://www.reddit.com/r/math/comments/iw79rq/mathematical_formulas/,all_ads,6,,,,,,,,,,,,,
[],False,cozy_slippers,,[],,text,t2_6l32mf7g,False,False,[],False,False,1600575850,self.math,https://www.reddit.com/r/math/comments/iw79je/tutoring_factors/,{},iw79je,True,False,False,False,True,True,False,,[],dark,text,False,False,True,3,0,False,all_ads,/r/math/comments/iw79je/tutoring_factors/,False,6,1600575860,1,"Any advice for tutoring a Grade 7 student in finding factors of numbers (only on 2 digit numbers right now but assuming they’ll get bigger as the school year progresses)? He is really discouraged when he has to do math and having to find all the factors stresses him out. So far, I’ve written out divisibility rules but they just made him more stressed and confused. We are also practicing times tables because he needs to know his multiplication better. Any other advice to make it less stressful for him?",True,False,False,math,t5_2qh0n,1343601,public,self,Tutoring Factors,0,[],1.0,https://www.reddit.com/r/math/comments/iw79je/tutoring_factors/,all_ads,6,,,,,,,,,,,,,
[],False,altdudeguy,,[],,text,t2_5b3aggk2,False,False,[],False,False,1600575413,self.math,https://www.reddit.com/r/math/comments/iw764w/careless_mistakes/,{},iw764w,True,False,False,False,True,True,False,,[],dark,text,False,False,True,5,0,False,all_ads,/r/math/comments/iw764w/careless_mistakes/,False,6,1600575424,1,"I'm still in school and this post is mainly for me to remember when I realized this, but here goes...

I looked back at all the 'Careless Mistakes' I made in the past 3 years, and noticed a common trend. There are 2 main mistakes I make when I don't know a concept.

&amp;#x200B;

1. I mess up a concept or formula (this happens to everyone, nothing new here)
2. In showing my work, I calculate a step ahead mentally, and plug in the numbers (from the step ahead) into the expression I'm writing at the moment.  

This is why I generally have a higher correctness ratio when I do it mentally, or do a problem that's so mechanical to me, that I barely have to actively think while trying to solve it. I'm guessing this is why people generally say to practice that specific concept and all the problems like it, till I have it basically memorized. 

This was originally just for me to remember, but that being said, I'm curious whether any others feel the same way.",True,False,False,math,t5_2qh0n,1343596,public,self,"""Careless mistakes""",0,[],1.0,https://www.reddit.com/r/math/comments/iw764w/careless_mistakes/,all_ads,6,,,,,,,,,,,,,
