all_awardings,allow_live_comments,author,author_flair_css_class,author_flair_richtext,author_flair_text,author_flair_type,author_fullname,author_patreon_flair,author_premium,awarders,can_mod_post,contest_mode,created_utc,domain,full_link,gildings,id,is_crosspostable,is_meta,is_original_content,is_reddit_media_domain,is_robot_indexable,is_self,is_video,link_flair_background_color,link_flair_richtext,link_flair_text_color,link_flair_type,locked,media_only,no_follow,num_comments,num_crossposts,over_18,parent_whitelist_status,permalink,pinned,pwls,retrieved_on,score,selftext,send_replies,spoiler,stickied,subreddit,subreddit_id,subreddit_subscribers,subreddit_type,thumbnail,title,total_awards_received,treatment_tags,upvote_ratio,url,whitelist_status,wls,post_hint,preview,thumbnail_height,thumbnail_width,url_overridden_by_dest,link_flair_text,removed_by_category,media,media_embed,secure_media,secure_media_embed,crosspost_parent,crosspost_parent_list
[],False,WhySoSaltySeriously,,[],,text,t2_jnqistt,False,False,[],False,False,1600693030,self.math,https://www.reddit.com/r/math/comments/iwzw6v/is_there_any_podcast_focusing_on_maths/,{},iwzw6v,True,False,False,False,True,True,False,,[],dark,text,False,False,True,3,0,False,all_ads,/r/math/comments/iwzw6v/is_there_any_podcast_focusing_on_maths/,False,6,1600693041,1,Thought it’d be an interesting hear.,True,False,False,math,t5_2qh0n,1345736,public,self,Is there any podcast focusing on maths?,0,[],1.0,https://www.reddit.com/r/math/comments/iwzw6v/is_there_any_podcast_focusing_on_maths/,all_ads,6,,,,,,,,,,,,,
[],False,martinno17,,[],,text,t2_12bahesk,False,False,[],False,False,1600692556,self.math,https://www.reddit.com/r/math/comments/iwzroq/weird_question_about_pi/,{},iwzroq,True,False,False,False,True,True,False,,[],dark,text,False,False,True,4,0,False,all_ads,/r/math/comments/iwzroq/weird_question_about_pi/,False,6,1600692569,1,"So this might be a silly question but bear with me please.

Is the only reason Pi is irrational that the circumference of a perfect circle consists of infinitely many points?

It only makes sense that something infinitely complex and basically undefinable would have to have an irrational relation to a line (considering the line is in relation with the infinitely complex thing)",True,False,False,math,t5_2qh0n,1345736,public,self,Weird question about Pi,0,[],1.0,https://www.reddit.com/r/math/comments/iwzroq/weird_question_about_pi/,all_ads,6,,,,,,,,,,,,,
[],False,foodfordikzak,,[],,text,t2_1m3061l,False,False,[],False,False,1600691904,self.math,https://www.reddit.com/r/math/comments/iwzlgm/is_there_anyone_else_who_thinks_that_q_being/,{},iwzlgm,True,False,False,False,True,True,False,,[],dark,text,False,False,True,3,0,False,all_ads,/r/math/comments/iwzlgm/is_there_anyone_else_who_thinks_that_q_being/,False,6,1600691916,1,,True,False,False,math,t5_2qh0n,1345729,public,self,Is there anyone else who thinks that Q being dense in R while still having measure 0 is a major flaw in mathematics?,0,[],1.0,https://www.reddit.com/r/math/comments/iwzlgm/is_there_anyone_else_who_thinks_that_q_being/,all_ads,6,,,,,,,,,,,,,
[],False,flexibeast,,[],,text,t2_3tmsj,False,False,[],False,False,1600691398,mathoverflow.net,https://www.reddit.com/r/math/comments/iwzgr5/mathoverflow_discussion_ideas_that_began_as_small/,{},iwzgr5,True,False,False,False,True,False,False,,[],dark,text,False,False,True,4,0,False,all_ads,/r/math/comments/iwzgr5/mathoverflow_discussion_ideas_that_began_as_small/,False,6,1600691410,1,,True,False,False,math,t5_2qh0n,1345716,public,default,"MathOverflow discussion: ""[I]deas that began as small and maybe naïve or weak ... but at some point in history turned into big powerful tools in research opening new paths or suggesting new ways of thinking""",0,[],1.0,https://mathoverflow.net/questions/369179/small-ideas-that-became-big,all_ads,6,link,"{'enabled': False, 'images': [{'id': 'eZNtfumrg-9Zn3ozvWRD7M-Wg8P0pWCf4cLUKN5ekWo', 'resolutions': [{'height': 108, 'url': 'https://external-preview.redd.it/vI4bRdgLwJ4GI023P4dxVAh6OM-WsHsrr9qgdh4Fx_k.jpg?width=108&amp;crop=smart&amp;auto=webp&amp;s=4ae187e64c99f89a456600c5952804c3eb149b57', 'width': 108}, {'height': 216, 'url': 'https://external-preview.redd.it/vI4bRdgLwJ4GI023P4dxVAh6OM-WsHsrr9qgdh4Fx_k.jpg?width=216&amp;crop=smart&amp;auto=webp&amp;s=e7c6968dd6e61dbd0157ec2e36cca2cdbe496946', 'width': 216}], 'source': {'height': 316, 'url': 'https://external-preview.redd.it/vI4bRdgLwJ4GI023P4dxVAh6OM-WsHsrr9qgdh4Fx_k.jpg?auto=webp&amp;s=47f309a2bb936a2dc757495e07e9b7cdb285abe1', 'width': 316}, 'variants': {}}]}",140.0,140.0,https://mathoverflow.net/questions/369179/small-ideas-that-became-big,,,,,,,,
[],False,SlayerofSouls555,,[],,text,t2_4dije4tg,False,False,[],False,False,1600691055,self.math,https://www.reddit.com/r/math/comments/iwzdpd/simple_parent_function_transformation_help/,{},iwzdpd,True,False,False,False,True,True,False,,[],dark,text,False,False,True,1,0,False,all_ads,/r/math/comments/iwzdpd/simple_parent_function_transformation_help/,False,6,1600691066,1,"Hello I am a calc student who forgot one basic concept: transformations. I was doing limits without a graphing calc when I saw this problem. Can anyone provide me with a step by step analysis as to how the equation of y=1/|2-x|  is transformed from y=1/|x|.?


I guess my biggest issue here is the 2-x shift. It is had been the x variable that came first, I’d be able to tell what direction the shift is but since the constant is first it throws me off


This is what I thought of 

Y = 1/|-(x-2)| 
So that it’s a shift of 2 units to the right and the graph is reflected over the x. Is that correct.",True,False,False,math,t5_2qh0n,1345694,public,self,Simple Parent function transformation help.,0,[],1.0,https://www.reddit.com/r/math/comments/iwzdpd/simple_parent_function_transformation_help/,all_ads,6,,,,,,,,,,,,,
[],False,Candid_Obligation158,,[],,text,t2_7rpzlrs3,False,False,[],False,False,1600690907,i.redd.it,https://www.reddit.com/r/math/comments/iwzccd/how_do_i_solve_this/,{},iwzccd,False,False,False,True,False,False,False,,[],dark,text,False,False,True,2,0,False,all_ads,/r/math/comments/iwzccd/how_do_i_solve_this/,False,6,1600690918,1,,True,False,False,math,t5_2qh0n,1345683,public,image,How do I solve this?,0,[],1.0,https://i.redd.it/c4yzmw7duho51.jpg,all_ads,6,image,"{'enabled': True, 'images': [{'id': 'y_gtH9OBv2VL6OsTAsmYCnyuRCjaWnM30pgElyzPnhM', 'resolutions': [{'height': 144, 'url': 'https://preview.redd.it/c4yzmw7duho51.jpg?width=108&amp;crop=smart&amp;auto=webp&amp;s=79669147e50255d3e351f42761cea1dd5b47da58', 'width': 108}, {'height': 288, 'url': 'https://preview.redd.it/c4yzmw7duho51.jpg?width=216&amp;crop=smart&amp;auto=webp&amp;s=fcade722cea1e396f62ab8e0d374478be2f5f297', 'width': 216}, {'height': 426, 'url': 'https://preview.redd.it/c4yzmw7duho51.jpg?width=320&amp;crop=smart&amp;auto=webp&amp;s=8b15d5e1c8af9a34dc1294385e4b5c7ae9475e80', 'width': 320}, {'height': 853, 'url': 'https://preview.redd.it/c4yzmw7duho51.jpg?width=640&amp;crop=smart&amp;auto=webp&amp;s=809d76603e7b86809d4cf9100c66d23f7faf72c6', 'width': 640}, {'height': 1280, 'url': 'https://preview.redd.it/c4yzmw7duho51.jpg?width=960&amp;crop=smart&amp;auto=webp&amp;s=1d482e64d97d70064cdad1e1b0bffb51fa096ddd', 'width': 960}, {'height': 1440, 'url': 'https://preview.redd.it/c4yzmw7duho51.jpg?width=1080&amp;crop=smart&amp;auto=webp&amp;s=ac587d5015c73d800c161ef71401cfe34b91be23', 'width': 1080}], 'source': {'height': 4032, 'url': 'https://preview.redd.it/c4yzmw7duho51.jpg?auto=webp&amp;s=fd3be0daebb895cd8a46460bca28a349798782af', 'width': 3024}, 'variants': {}}]}",140.0,140.0,https://i.redd.it/c4yzmw7duho51.jpg,Removed - try /r/learnmath,moderator,,,,,,
[],False,starcraftgamerz77,,[],,text,t2_63nwx,False,False,[],False,False,1600690471,themathbehindthemagic.wordpress.com,https://www.reddit.com/r/math/comments/iwz8eg/surprising_algorithm_for_calculating_gcd/,{},iwz8eg,True,False,False,False,True,False,False,,[],dark,text,False,False,True,0,0,False,all_ads,/r/math/comments/iwz8eg/surprising_algorithm_for_calculating_gcd/,False,6,1600690482,1,,True,False,False,math,t5_2qh0n,1345676,public,default,Surprising algorithm for calculating GCD,0,[],1.0,https://themathbehindthemagic.wordpress.com/2020/09/21/gcd-algorithm/,all_ads,6,link,"{'enabled': False, 'images': [{'id': 'sAYY86zgdT-GUuuQxQ55XhcVr4wy0uMIajd_UOBdg3Y', 'resolutions': [{'height': 108, 'url': 'https://external-preview.redd.it/F6AGihc6sjMmnVLm-XWIe0jcP2vPZpBwjOqH2PhZX-c.jpg?width=108&amp;crop=smart&amp;auto=webp&amp;s=0563ade4652d2408b81c0d4fd5f4ad1c26458007', 'width': 108}], 'source': {'height': 200, 'url': 'https://external-preview.redd.it/F6AGihc6sjMmnVLm-XWIe0jcP2vPZpBwjOqH2PhZX-c.jpg?auto=webp&amp;s=13353f39561ed11ccd79ec9880d3b36c19dcc81c', 'width': 200}, 'variants': {}}]}",140.0,140.0,https://themathbehindthemagic.wordpress.com/2020/09/21/gcd-algorithm/,,,,,,,,
[],False,DavidMiguelangel,,[],,text,t2_7aoz8lq5,False,False,[],False,False,1600690159,youtube.com,https://www.reddit.com/r/math/comments/iwz5my/how_to_add_two_irrational_numbers_the_easy_way/,{},iwz5my,False,False,False,False,False,False,False,,[],dark,text,False,False,True,0,0,False,all_ads,/r/math/comments/iwz5my/how_to_add_two_irrational_numbers_the_easy_way/,False,6,1600690170,1,,True,False,False,math,t5_2qh0n,1345670,public,image,How to add two irrational numbers THE EASY WAY,0,[],1.0,https://www.youtube.com/watch?v=2Jhh92sLMz8,all_ads,6,rich:video,"{'enabled': False, 'images': [{'id': '52igMdHPUhUk3bExNItba_qBArUvf2TgFhrnJDQcyhQ', 'resolutions': [{'height': 81, 'url': 'https://external-preview.redd.it/gPWA7wIfIr7Mp0P88zpK4Qdphncpm62VEX5fRsMkXCA.jpg?width=108&amp;crop=smart&amp;auto=webp&amp;s=68b4d9883503d6ff1d890a18cd0b8f86e2a7ee86', 'width': 108}, {'height': 162, 'url': 'https://external-preview.redd.it/gPWA7wIfIr7Mp0P88zpK4Qdphncpm62VEX5fRsMkXCA.jpg?width=216&amp;crop=smart&amp;auto=webp&amp;s=3058324d51ddff853556f05a1b75094c4600ac54', 'width': 216}, {'height': 240, 'url': 'https://external-preview.redd.it/gPWA7wIfIr7Mp0P88zpK4Qdphncpm62VEX5fRsMkXCA.jpg?width=320&amp;crop=smart&amp;auto=webp&amp;s=2e5ba021d67482e6abccfcfe677d5923ef676d90', 'width': 320}], 'source': {'height': 360, 'url': 'https://external-preview.redd.it/gPWA7wIfIr7Mp0P88zpK4Qdphncpm62VEX5fRsMkXCA.jpg?auto=webp&amp;s=662d6816916c5cf7785a1d9a4bc663db753914f4', 'width': 480}, 'variants': {}}]}",105.0,140.0,https://www.youtube.com/watch?v=2Jhh92sLMz8,,automod_filtered,"{'oembed': {'author_name': 'Elvis David Rodríguez Fernández', 'author_url': 'https://www.youtube.com/channel/UCjJxw2J63sX0kYS8kiS9MCg', 'height': 338, 'html': '&lt;iframe width=""600"" height=""338"" src=""https://www.youtube.com/embed/2Jhh92sLMz8?feature=oembed&amp;enablejsapi=1"" frameborder=""0"" allow=""accelerometer; autoplay; clipboard-write; encrypted-media; gyroscope; picture-in-picture"" allowfullscreen&gt;&lt;/iframe&gt;', 'provider_name': 'YouTube', 'provider_url': 'https://www.youtube.com/', 'thumbnail_height': 360, 'thumbnail_url': 'https://i.ytimg.com/vi/2Jhh92sLMz8/hqdefault.jpg', 'thumbnail_width': 480, 'title': 'How to add two irrational numbers THE EASY WAY', 'type': 'video', 'version': '1.0', 'width': 600}, 'type': 'youtube.com'}","{'content': '&lt;iframe width=""600"" height=""338"" src=""https://www.youtube.com/embed/2Jhh92sLMz8?feature=oembed&amp;enablejsapi=1"" frameborder=""0"" allow=""accelerometer; autoplay; clipboard-write; encrypted-media; gyroscope; picture-in-picture"" allowfullscreen&gt;&lt;/iframe&gt;', 'height': 338, 'scrolling': False, 'width': 600}","{'oembed': {'author_name': 'Elvis David Rodríguez Fernández', 'author_url': 'https://www.youtube.com/channel/UCjJxw2J63sX0kYS8kiS9MCg', 'height': 338, 'html': '&lt;iframe width=""600"" height=""338"" src=""https://www.youtube.com/embed/2Jhh92sLMz8?feature=oembed&amp;enablejsapi=1"" frameborder=""0"" allow=""accelerometer; autoplay; clipboard-write; encrypted-media; gyroscope; picture-in-picture"" allowfullscreen&gt;&lt;/iframe&gt;', 'provider_name': 'YouTube', 'provider_url': 'https://www.youtube.com/', 'thumbnail_height': 360, 'thumbnail_url': 'https://i.ytimg.com/vi/2Jhh92sLMz8/hqdefault.jpg', 'thumbnail_width': 480, 'title': 'How to add two irrational numbers THE EASY WAY', 'type': 'video', 'version': '1.0', 'width': 600}, 'type': 'youtube.com'}","{'content': '&lt;iframe width=""600"" height=""338"" src=""https://www.youtube.com/embed/2Jhh92sLMz8?feature=oembed&amp;enablejsapi=1"" frameborder=""0"" allow=""accelerometer; autoplay; clipboard-write; encrypted-media; gyroscope; picture-in-picture"" allowfullscreen&gt;&lt;/iframe&gt;', 'height': 338, 'media_domain_url': 'https://www.redditmedia.com/mediaembed/iwz5my', 'scrolling': False, 'width': 600}",,
[],False,ErAndriu,,[],,text,t2_1kmxf9a,False,False,[],False,False,1600686806,i.redd.it,https://www.reddit.com/r/math/comments/iwye2r/found_this_on_instagram_anyone_knows_its_mame/,{},iwye2r,False,False,False,True,False,False,False,,[],dark,text,False,False,True,2,0,False,all_ads,/r/math/comments/iwye2r/found_this_on_instagram_anyone_knows_its_mame/,False,6,1600686823,1,,True,False,False,math,t5_2qh0n,1345569,public,image,Found this on Instagram. Anyone knows it's mame?,0,[],1.0,https://i.redd.it/vvaymsc6iho51.jpg,all_ads,6,image,"{'enabled': True, 'images': [{'id': 'E_4arHT-_SntyCFlZQZ0Q1t-d-1bYT1-_4p9stcvcYA', 'resolutions': [{'height': 101, 'url': 'https://preview.redd.it/vvaymsc6iho51.jpg?width=108&amp;crop=smart&amp;auto=webp&amp;s=a1f389589774eda9bf6e3e8df5b8faa53e484193', 'width': 108}, {'height': 202, 'url': 'https://preview.redd.it/vvaymsc6iho51.jpg?width=216&amp;crop=smart&amp;auto=webp&amp;s=b8ccf07f164920807d857aa5fdceed320d472bd3', 'width': 216}, {'height': 299, 'url': 'https://preview.redd.it/vvaymsc6iho51.jpg?width=320&amp;crop=smart&amp;auto=webp&amp;s=6ad6cd0a113daf4110945d42af8b4b50da09c312', 'width': 320}, {'height': 599, 'url': 'https://preview.redd.it/vvaymsc6iho51.jpg?width=640&amp;crop=smart&amp;auto=webp&amp;s=a69c71fb4c6fde1e19c9e48bdc027099f8340da1', 'width': 640}], 'source': {'height': 824, 'url': 'https://preview.redd.it/vvaymsc6iho51.jpg?auto=webp&amp;s=9fb1534f140962899c04f9b53e5675ca772076d5', 'width': 879}, 'variants': {}}]}",131.0,140.0,https://i.redd.it/vvaymsc6iho51.jpg,Removed - try /r/learnmath,moderator,,,,,,
[],False,lucidmath,,[],,text,t2_34wjf5ko,False,False,[],False,False,1600682663,self.math,https://www.reddit.com/r/math/comments/iwxjo1/how_would_you_explain_your_field_to_a_first_year/,{},iwxjo1,True,False,False,False,True,True,False,,[],dark,text,False,False,True,9,0,False,all_ads,/r/math/comments/iwxjo1/how_would_you_explain_your_field_to_a_first_year/,False,6,1600682674,1,,True,False,False,math,t5_2qh0n,1345496,public,self,How would you explain your field to a first year undergraduate?,0,[],1.0,https://www.reddit.com/r/math/comments/iwxjo1/how_would_you_explain_your_field_to_a_first_year/,all_ads,6,,,,,,,,,,,,,
[],False,StarrAnnSwaybeeBro,,[],,text,t2_85w4ds69,False,False,[],False,False,1600677327,reddit.com,https://www.reddit.com/r/math/comments/iwwk1z/eon_blue_apocalypse/,{},iwwk1z,False,False,False,False,False,False,False,,[],dark,text,False,False,True,2,0,False,all_ads,/r/math/comments/iwwk1z/eon_blue_apocalypse/,False,6,1600677338,1,,True,False,False,math,t5_2qh0n,1345441,public,default,Eon Blue Apocalypse,0,[],1.0,https://reddit.com/r/dataisbeautiful/w/rules/rule1?utm_source=share&amp;utm_medium=android_app,all_ads,6,,,,,https://reddit.com/r/dataisbeautiful/w/rules/rule1?utm_source=share&amp;utm_medium=android_app,,moderator,,,,,,
[],False,moxy64,,[],,text,t2_5h0vw4o5,False,False,[],False,False,1600674395,self.math,https://www.reddit.com/r/math/comments/iwvzrf/how_to_get_back_into_math/,{},iwvzrf,True,False,False,False,True,True,False,,[],dark,text,False,False,True,2,0,False,all_ads,/r/math/comments/iwvzrf/how_to_get_back_into_math/,False,6,1600674406,1,"A little context, I've always loved math and especially pure math. Right now I'm studying computer science, because I had to come to terms that having a degree in CS would prove to be more beneficial than having one in pure mathematics as far as career choices would go. Before the quarantine, I would always be reading something math related like a paper, articles or just books on math, but since the quarantine started I've lost all interest in anything math related and that fact has been bugging me for a while now.  


My two favourite fields are analytic number theory and field theory or just anything that's related to number theory or algebra. If someone can suggest some reading material that would be great.",True,False,False,math,t5_2qh0n,1345379,public,self,how to get back into math,0,[],1.0,https://www.reddit.com/r/math/comments/iwvzrf/how_to_get_back_into_math/,all_ads,6,,,,,,,,,,,,,
[],False,Zzzonmike,,[],,text,t2_7z831954,False,False,[],False,False,1600674216,self.math,https://www.reddit.com/r/math/comments/iwvygl/probability_theory_poker_dice/,{},iwvygl,True,False,False,False,True,True,False,,[],dark,text,False,False,True,1,0,False,all_ads,/r/math/comments/iwvygl/probability_theory_poker_dice/,False,6,1600674226,1,"Hello! 

I am confused by this question on poker dice (basically poker but with 5 dice). I got the probability of three of a kind, four of a kind, full house, etc correct except for 2 pair and one pair. This is how I calculate the event space for two pair (each quantity is multiplied together):

6(5choose2) choice of first pair x 6 possibilities
5(3choose2) choice of remaining 3 x 5 possibilities 
(4) remaining possibilities for last dice 
=3600.

It seems like I need to divide by 2 somewhere. Even when I use the multinomial coefficients I get stuck with the same answer:

(5!/2!2!) orders of 5 dice where 2 pairs are the same
(6) possibilities for the pair 1
(5) possibilities for pair 2 
(4) possibilities for remaining die that cannot be the same
=3600.

Part of me believes division by 2 is necessary because of permutations of the pairs but shouldn’t the multinomial coefficient taken care of that? Help me pls :)",True,False,False,math,t5_2qh0n,1345373,public,self,Probability Theory - Poker Dice,0,[],1.0,https://www.reddit.com/r/math/comments/iwvygl/probability_theory_poker_dice/,all_ads,6,,,,,,,,,,,,,
[],False,blagaga104,,[],,text,t2_3glc1a1e,False,False,[],False,False,1600672064,self.math,https://www.reddit.com/r/math/comments/iwviu8/differential_topology/,{},iwviu8,True,False,False,False,True,True,False,,[],dark,text,False,False,True,8,0,False,all_ads,/r/math/comments/iwviu8/differential_topology/,False,6,1600672075,1,"I want to take a course on differential topology this year, what do you like about the field, and what are some of the best results from it? Does it relate to other fields as well?",True,False,False,math,t5_2qh0n,1345353,public,self,differential topology,0,[],1.0,https://www.reddit.com/r/math/comments/iwviu8/differential_topology/,all_ads,6,,,,,,,,,,,,,
[],False,falcon_automation,,[],,text,t2_7lfjjni9,False,False,[],False,False,1600671645,i.redd.it,https://www.reddit.com/r/math/comments/iwvfuz/11/,{},iwvfuz,False,False,False,True,False,False,False,,[],dark,text,False,False,True,2,0,False,all_ads,/r/math/comments/iwvfuz/11/,False,6,1600671655,1,,True,False,False,math,t5_2qh0n,1345348,public,image,1+1=??,0,[],1.0,https://i.redd.it/6usf5ec39go51.jpg,all_ads,6,image,"{'enabled': True, 'images': [{'id': '7t21d2uVS5U_WvBBW4EaC6fT93Y2SbD0Ty_HN-FR-ao', 'resolutions': [{'height': 138, 'url': 'https://preview.redd.it/6usf5ec39go51.jpg?width=108&amp;crop=smart&amp;auto=webp&amp;s=1f06c7b966ca874fd32277e61e01cd8d919c9b3b', 'width': 108}, {'height': 276, 'url': 'https://preview.redd.it/6usf5ec39go51.jpg?width=216&amp;crop=smart&amp;auto=webp&amp;s=74dad4276573125ea6ecc99e8883b790784d9108', 'width': 216}, {'height': 409, 'url': 'https://preview.redd.it/6usf5ec39go51.jpg?width=320&amp;crop=smart&amp;auto=webp&amp;s=d35129a583f837655256be27a6273e74083ca4a5', 'width': 320}, {'height': 818, 'url': 'https://preview.redd.it/6usf5ec39go51.jpg?width=640&amp;crop=smart&amp;auto=webp&amp;s=51e0ec9739cd6e7a9c92d967491e86130f6b9b73', 'width': 640}], 'source': {'height': 1001, 'url': 'https://preview.redd.it/6usf5ec39go51.jpg?auto=webp&amp;s=b77f1107a91f436ab72893b08070a6a87da5d545', 'width': 783}, 'variants': {}}]}",140.0,140.0,https://i.redd.it/6usf5ec39go51.jpg,Removed - try /r/learnmath,moderator,,,,,,
[],False,DepressedCubic,,[],,text,t2_5l9kxxzv,False,False,[],False,False,1600670023,self.math,https://www.reddit.com/r/math/comments/iwv4oe/what_is_the_optimal_way_to_interpret_mathematics/,{},iwv4oe,True,False,False,False,True,True,False,,[],dark,text,False,False,True,3,0,False,all_ads,/r/math/comments/iwv4oe/what_is_the_optimal_way_to_interpret_mathematics/,False,6,1600670035,1,"The last few months, I’ve been stuck in thoughts that make me unable to keep up with my mathematical education or having fun with math.
Honestly, when I began to learn elementary math, I didn’t give much thought to the philosophical problems with mathematics that one might encounter, but recently I’ve probably given too much thought on these problems. And this prevents me from learning more math.

The thing is, I don’t know how am I supposed to interpret mathematics. For example, elementary arithmetic of natural numbers can be fully interpreted physically: I could just count some grains of sand or something. But once you arrive at other, “less real” parts of mathematics (such as real numbers and the continuum itself), I just don’t know how am I supposed to interpret some axioms. Some say that they are motivated by physical reality, but the truth is, they aren’t exactly it. Instead, they are a kind of ideal version of it. And it seemed, as a consolation to me, that I should do mathematics because it is a representation of an ideal reality (so some kind of platonism, then?). When I envision mathematics as this I have trouble divorcing it from physical reality, and always try to find a physical interpretation or visualization of it even if there isn’t one. And I think this is a problem.

But then I remembered that there are parts of mathematics so divorced from anything in reality that it simply makes no sense to say that they are a representation of an ideal reality (an example might be transfinite cardinals or octonions), so I just start thinking that it is a meaningless game of symbols.

Neither platonism nor formalism seem right to me, psychologically speaking. And I do not know what I should do so that I can enjoy doing math again without any insecurities regarding the meaning of what is being done.",True,False,False,math,t5_2qh0n,1345336,public,self,What is the optimal way to interpret mathematics and mathematical truths?,0,[],1.0,https://www.reddit.com/r/math/comments/iwv4oe/what_is_the_optimal_way_to_interpret_mathematics/,all_ads,6,,,,,,,,,,,,,
[],False,punkindrublicyo,,[],,text,t2_2qmk7hed,False,False,[],False,False,1600668705,self.math,https://www.reddit.com/r/math/comments/iwuvcc/looking_for_a_way_to_generate_the_probability/,{},iwuvcc,True,False,False,False,True,True,False,,[],dark,text,False,False,True,1,0,False,all_ads,/r/math/comments/iwuvcc/looking_for_a_way_to_generate_the_probability/,False,6,1600668716,1,"ie I have my probability distribution

X	1	2	3
Pr(X)	0.7	0.2	0.1

The probability distribution for 2 spins is as follows

Xbar2           1       1.5          2 	       2.5    	3
Pr(Xbar2)   0.49    0.28       0.18      0.04         0.01

Could somebody point me in the direction for some software/a script to generate this table for say 30 trials / 100 trials?

Also, this should show the central limit theorem right?",True,False,False,math,t5_2qh0n,1345324,public,self,Looking for a way to generate the probability distribution table for the mean of a random variable from n trials (trying to visualise the central limit theorem),0,[],1.0,https://www.reddit.com/r/math/comments/iwuvcc/looking_for_a_way_to_generate_the_probability/,all_ads,6,,,,,,,,,,,,,
[],False,jim1174,,[],,text,t2_llcaun,False,False,[],False,False,1600667457,self.math,https://www.reddit.com/r/math/comments/iwum6v/can_you_recommend_a_good_game_theory_book/,{},iwum6v,True,False,False,False,True,True,False,,[],dark,text,False,False,True,1,0,False,all_ads,/r/math/comments/iwum6v/can_you_recommend_a_good_game_theory_book/,False,6,1600667467,1,"Are there any good game theory books that were written so any one can understand it. Like books that don’t require you no be s math wiz 
?",True,False,False,math,t5_2qh0n,1345251,public,self,Can you recommend a good game theory book?,0,[],1.0,https://www.reddit.com/r/math/comments/iwum6v/can_you_recommend_a_good_game_theory_book/,all_ads,6,,,,,,,,,,,,,
