all_awardings,allow_live_comments,author,author_flair_css_class,author_flair_richtext,author_flair_text,author_flair_type,author_fullname,author_patreon_flair,author_premium,awarders,can_mod_post,contest_mode,created_utc,domain,full_link,gildings,id,is_crosspostable,is_meta,is_original_content,is_reddit_media_domain,is_robot_indexable,is_self,is_video,link_flair_background_color,link_flair_richtext,link_flair_text_color,link_flair_type,locked,media_only,no_follow,num_comments,num_crossposts,over_18,parent_whitelist_status,permalink,pinned,post_hint,preview,pwls,retrieved_on,score,selftext,send_replies,spoiler,stickied,subreddit,subreddit_id,subreddit_subscribers,subreddit_type,thumbnail,title,total_awards_received,treatment_tags,upvote_ratio,url,whitelist_status,wls,link_flair_text,media,media_embed,removed_by_category,secure_media,secure_media_embed,thumbnail_height,thumbnail_width,url_overridden_by_dest,author_flair_background_color,author_flair_text_color,collections,distinguished,suggested_sort,media_metadata,gallery_data,is_gallery
[],False,ImprisonedTown,,[],,text,t2_73o5g8wc,False,False,[],False,False,1601057740,self.math,https://www.reddit.com/r/math/comments/izoqjp/so_uh_did_i_just_prove_the_4_color_theorem_wrong/,{},izoqjp,True,False,False,False,True,True,False,,[],dark,text,False,False,True,5,0,False,all_ads,/r/math/comments/izoqjp/so_uh_did_i_just_prove_the_4_color_theorem_wrong/,False,self,"{'enabled': False, 'images': [{'id': '-WV9aVUS7uIEAanf15ZE3u1_dSDZwp6CFuW5mebyMuQ', 'resolutions': [{'height': 55, 'url': 'https://external-preview.redd.it/Ag8mYxofbZzR0UoTnL44rhC98_aJZQ-ACT-wgvEILK4.png?width=108&amp;crop=smart&amp;auto=webp&amp;s=810cde4fa04c421e20cb65bbddf7dd67658ba99e', 'width': 108}, {'height': 110, 'url': 'https://external-preview.redd.it/Ag8mYxofbZzR0UoTnL44rhC98_aJZQ-ACT-wgvEILK4.png?width=216&amp;crop=smart&amp;auto=webp&amp;s=469d690aa200b823dbd5d59192a985953bc24f4e', 'width': 216}, {'height': 164, 'url': 'https://external-preview.redd.it/Ag8mYxofbZzR0UoTnL44rhC98_aJZQ-ACT-wgvEILK4.png?width=320&amp;crop=smart&amp;auto=webp&amp;s=5960a2948241fc08aa1b568044dc3987826e6ca7', 'width': 320}, {'height': 328, 'url': 'https://external-preview.redd.it/Ag8mYxofbZzR0UoTnL44rhC98_aJZQ-ACT-wgvEILK4.png?width=640&amp;crop=smart&amp;auto=webp&amp;s=b7c196aa5ab934f8ae8c21a28ded9763ee1aa3ea', 'width': 640}, {'height': 492, 'url': 'https://external-preview.redd.it/Ag8mYxofbZzR0UoTnL44rhC98_aJZQ-ACT-wgvEILK4.png?width=960&amp;crop=smart&amp;auto=webp&amp;s=2b91553189203e75e1e20921190c9718176d1375', 'width': 960}, {'height': 553, 'url': 'https://external-preview.redd.it/Ag8mYxofbZzR0UoTnL44rhC98_aJZQ-ACT-wgvEILK4.png?width=1080&amp;crop=smart&amp;auto=webp&amp;s=00d393c5ce622f74b62a6c5187975f28e2794efc', 'width': 1080}], 'source': {'height': 732, 'url': 'https://external-preview.redd.it/Ag8mYxofbZzR0UoTnL44rhC98_aJZQ-ACT-wgvEILK4.png?auto=webp&amp;s=4b5b2b7bd4d01d072193e827fd5f1eb19fb07cfb', 'width': 1428}, 'variants': {}}]}",6,1601057751,1,"I'm not into math and only by chance heard about this theorem but from the start I had doubts that you could always use only 4 colors to make sure adjacent countries on any given map would not have the same color.

Then just now I saw a random youtube video which showed a map of Europe and then I realized why this theorem is wrong.

If you merely extend France's northern part to border the Netherlands as well, the four color theorem no longer works.

Image proof:
https://i.imgur.com/66y7Q0f.png",True,False,False,math,t5_2qh0n,1352483,public,self,"So, uh did I just prove the 4 color theorem wrong?",0,[],1.0,https://www.reddit.com/r/math/comments/izoqjp/so_uh_did_i_just_prove_the_4_color_theorem_wrong/,all_ads,6,,,,,,,,,,,,,,,,,
[],False,ASinglePlant,,[],,text,t2_2zkgtxqb,False,False,[],False,False,1601055985,youtube.com,https://www.reddit.com/r/math/comments/izo6a4/pascals_triangle_implemented_in_java/,{},izo6a4,False,False,False,False,False,False,False,,[],dark,text,False,False,True,2,0,False,all_ads,/r/math/comments/izo6a4/pascals_triangle_implemented_in_java/,False,rich:video,"{'enabled': False, 'images': [{'id': 'U5DkQ5jALQYxUthOr7Gp4UAt6SU5rHAOP7C5Z2FUB6Y', 'resolutions': [{'height': 81, 'url': 'https://external-preview.redd.it/nnH6GVs7px-aHzzuCt_DXGdF9nu1VsgofhBl1BQOkYE.jpg?width=108&amp;crop=smart&amp;auto=webp&amp;s=cf94a93c76e8d61aad5fa1ffc76fe6c98ff0d58a', 'width': 108}, {'height': 162, 'url': 'https://external-preview.redd.it/nnH6GVs7px-aHzzuCt_DXGdF9nu1VsgofhBl1BQOkYE.jpg?width=216&amp;crop=smart&amp;auto=webp&amp;s=5cc70a00d16e86eec8a683bb1e928c9d74c7a199', 'width': 216}, {'height': 240, 'url': 'https://external-preview.redd.it/nnH6GVs7px-aHzzuCt_DXGdF9nu1VsgofhBl1BQOkYE.jpg?width=320&amp;crop=smart&amp;auto=webp&amp;s=7ff6510eb0d62b13d6fb1bc0a9d2d37f1d1dd5e5', 'width': 320}], 'source': {'height': 360, 'url': 'https://external-preview.redd.it/nnH6GVs7px-aHzzuCt_DXGdF9nu1VsgofhBl1BQOkYE.jpg?auto=webp&amp;s=7dfd005c10cfa36bff9d3aedc85d6b128d893c3d', 'width': 480}, 'variants': {}}]}",6,1601055996,1,,True,False,False,math,t5_2qh0n,1352461,public,image,Pascal's Triangle Implemented In Java,0,[],1.0,https://www.youtube.com/watch?v=xP1Q1sJqhjY&amp;feature=share,all_ads,6,Removed - add explanation,"{'oembed': {'author_name': 'Not Tofu Food', 'author_url': 'https://www.youtube.com/channel/UCFZwWJCqiTlwNotlPgUBpMQ', 'height': 338, 'html': '&lt;iframe width=""600"" height=""338"" src=""https://www.youtube.com/embed/xP1Q1sJqhjY?feature=oembed&amp;enablejsapi=1"" frameborder=""0"" allow=""accelerometer; autoplay; clipboard-write; encrypted-media; gyroscope; picture-in-picture"" allowfullscreen&gt;&lt;/iframe&gt;', 'provider_name': 'YouTube', 'provider_url': 'https://www.youtube.com/', 'thumbnail_height': 360, 'thumbnail_url': 'https://i.ytimg.com/vi/xP1Q1sJqhjY/hqdefault.jpg', 'thumbnail_width': 480, 'title': ""Pascal's Triangle In Java (Demonstration Video)"", 'type': 'video', 'version': '1.0', 'width': 600}, 'type': 'youtube.com'}","{'content': '&lt;iframe width=""600"" height=""338"" src=""https://www.youtube.com/embed/xP1Q1sJqhjY?feature=oembed&amp;enablejsapi=1"" frameborder=""0"" allow=""accelerometer; autoplay; clipboard-write; encrypted-media; gyroscope; picture-in-picture"" allowfullscreen&gt;&lt;/iframe&gt;', 'height': 338, 'scrolling': False, 'width': 600}",automod_filtered,"{'oembed': {'author_name': 'Not Tofu Food', 'author_url': 'https://www.youtube.com/channel/UCFZwWJCqiTlwNotlPgUBpMQ', 'height': 338, 'html': '&lt;iframe width=""600"" height=""338"" src=""https://www.youtube.com/embed/xP1Q1sJqhjY?feature=oembed&amp;enablejsapi=1"" frameborder=""0"" allow=""accelerometer; autoplay; clipboard-write; encrypted-media; gyroscope; picture-in-picture"" allowfullscreen&gt;&lt;/iframe&gt;', 'provider_name': 'YouTube', 'provider_url': 'https://www.youtube.com/', 'thumbnail_height': 360, 'thumbnail_url': 'https://i.ytimg.com/vi/xP1Q1sJqhjY/hqdefault.jpg', 'thumbnail_width': 480, 'title': ""Pascal's Triangle In Java (Demonstration Video)"", 'type': 'video', 'version': '1.0', 'width': 600}, 'type': 'youtube.com'}","{'content': '&lt;iframe width=""600"" height=""338"" src=""https://www.youtube.com/embed/xP1Q1sJqhjY?feature=oembed&amp;enablejsapi=1"" frameborder=""0"" allow=""accelerometer; autoplay; clipboard-write; encrypted-media; gyroscope; picture-in-picture"" allowfullscreen&gt;&lt;/iframe&gt;', 'height': 338, 'media_domain_url': 'https://www.redditmedia.com/mediaembed/izo6a4', 'scrolling': False, 'width': 600}",105.0,140.0,https://www.youtube.com/watch?v=xP1Q1sJqhjY&amp;feature=share,,,,,,,,
[],False,makko007,,[],,text,t2_3fnyatzs,False,False,[],False,False,1601054254,self.math,https://www.reddit.com/r/math/comments/iznm2d/is_707_an_integer/,{},iznm2d,True,False,False,False,True,True,False,,[],dark,text,False,False,True,1,0,False,all_ads,/r/math/comments/iznm2d/is_707_an_integer/,False,,,6,1601054264,1,I would feel like not because it’s a fraction but it reduces to -10 anyway so I feel like it could be?,True,False,False,math,t5_2qh0n,1352444,public,self,Is -70/7 an integer?,0,[],1.0,https://www.reddit.com/r/math/comments/iznm2d/is_707_an_integer/,all_ads,6,,,,,,,,,,,,,,,,,
[],False,yuuluul,,[],,text,t2_7axcn4dt,False,False,[],False,False,1601052533,self.math,https://www.reddit.com/r/math/comments/izn236/could_anyone_find_me_a_pdf_form_of_an_english/,{},izn236,True,False,False,False,True,True,False,,[],dark,text,False,False,True,6,0,False,all_ads,/r/math/comments/izn236/could_anyone_find_me_a_pdf_form_of_an_english/,False,,,6,1601052544,1,,True,False,False,math,t5_2qh0n,1352436,public,self,Could anyone find me a pdf form of an english translation of Grundlagen see Arithmetik by Frege.,0,[],0.99,https://www.reddit.com/r/math/comments/izn236/could_anyone_find_me_a_pdf_form_of_an_english/,all_ads,6,,,,,,,,,,,,,,,,,
[],False,chigi1198,,[],,text,t2_6avprb2d,False,False,[],False,False,1601049920,i.redd.it,https://www.reddit.com/r/math/comments/izm82e/covid19_recorded_deaths_closely_follow_benfords/,{},izm82e,False,False,False,True,False,False,False,,[],dark,text,False,False,True,2,0,False,all_ads,/r/math/comments/izm82e/covid19_recorded_deaths_closely_follow_benfords/,False,image,"{'enabled': True, 'images': [{'id': 'Af4El6QHfTh0xQhPWj2LFPOOFCYz6BeK8kLDW9qwBXE', 'resolutions': [{'height': 68, 'url': 'https://preview.redd.it/p1fnaxewhbp51.jpg?width=108&amp;crop=smart&amp;auto=webp&amp;s=76b53738e63c26d615a1e8463d399ecf5d1e613f', 'width': 108}, {'height': 136, 'url': 'https://preview.redd.it/p1fnaxewhbp51.jpg?width=216&amp;crop=smart&amp;auto=webp&amp;s=e8385142b49bd2cca94b6bea0ecfbfdc143e9937', 'width': 216}, {'height': 202, 'url': 'https://preview.redd.it/p1fnaxewhbp51.jpg?width=320&amp;crop=smart&amp;auto=webp&amp;s=b9139170a74031709f3b9ae3d5e22e7ffaa7c768', 'width': 320}, {'height': 404, 'url': 'https://preview.redd.it/p1fnaxewhbp51.jpg?width=640&amp;crop=smart&amp;auto=webp&amp;s=3568b1cba8e7a91d68e25668c3b9cad8d94dfb61', 'width': 640}, {'height': 606, 'url': 'https://preview.redd.it/p1fnaxewhbp51.jpg?width=960&amp;crop=smart&amp;auto=webp&amp;s=9b95b2e03647712db552c158bf525b490251f3d6', 'width': 960}, {'height': 682, 'url': 'https://preview.redd.it/p1fnaxewhbp51.jpg?width=1080&amp;crop=smart&amp;auto=webp&amp;s=b4d1bc483d3dcc952f4ba9985d46390222d11235', 'width': 1080}], 'source': {'height': 895, 'url': 'https://preview.redd.it/p1fnaxewhbp51.jpg?auto=webp&amp;s=2de62b8857f074dc6ccc81a5de374bf803d9d1ec', 'width': 1417}, 'variants': {}}]}",6,1601049931,1,,True,False,False,math,t5_2qh0n,1352402,public,image,Covid-19 recorded deaths closely follow Benford's Law,0,[],1.0,https://i.redd.it/p1fnaxewhbp51.jpg,all_ads,6,Removed - add explanation,,,automod_filtered,,,88.0,140.0,https://i.redd.it/p1fnaxewhbp51.jpg,,,,,,,,
[],False,useless_kid7,,[],,text,t2_518hqdbg,False,False,[],False,False,1601049692,self.math,https://www.reddit.com/r/math/comments/izm5f2/i_am_wondering_how_to_figure_out_the_order_of/,{},izm5f2,True,False,False,False,True,True,False,,[],dark,text,False,False,True,0,0,False,all_ads,/r/math/comments/izm5f2/i_am_wondering_how_to_figure_out_the_order_of/,False,,,6,1601049703,1,,True,False,False,math,t5_2qh0n,1352389,public,self,I am wondering how to figure out the order of AAS/ASA/SAS/SSS like how do I know if it’s AAS or ASA or SAA?,0,[],1.0,https://www.reddit.com/r/math/comments/izm5f2/i_am_wondering_how_to_figure_out_the_order_of/,all_ads,6,,,,,,,,,,,,,,,,,
[],False,inherentlyawesome,grad,[],Homotopy Theory,text,t2_6kiwi,False,False,[],False,False,1601049622,self.math,https://www.reddit.com/r/math/comments/izm4jz/this_week_i_learned/,{},izm4jz,True,False,False,False,True,True,False,,[],dark,text,False,False,True,1,0,False,all_ads,/r/math/comments/izm4jz/this_week_i_learned/,False,,,6,1601049633,1,"This recurring thread is meant for users to share cool recently discovered facts, observations, proofs or concepts which that might not warrant their own threads. Please be encouraging and share as many details as possible as we would like this to be a good place for people to learn!",False,False,False,math,t5_2qh0n,1352390,public,self,This Week I Learned,0,[],1.0,https://www.reddit.com/r/math/comments/izm4jz/this_week_i_learned/,all_ads,6,,,,,,,,,,,dark,"[{'author_id': 't2_6kiwi', 'author_name': 'inherentlyawesome', 'collection_id': '8d773177-d8bb-4691-9040-ea9f831b6c09', 'created_at_utc': 1600641340.233, 'description': '', 'display_layout': None, 'last_update_utc': 1601049622.281, 'link_ids': ['t3_izm4jz'], 'permalink': 'https://www.reddit.com/r/math/collection/8d773177-d8bb-4691-9040-ea9f831b6c09', 'subreddit_id': 't5_2qh0n', 'title': 'This Week I Learned'}]",moderator,new,,,
[],False,flowerandcats,,[],,text,t2_674d47rk,False,False,[],False,False,1601049449,self.math,https://www.reddit.com/r/math/comments/izm2mj/what_are_some_mathematical_books_you_recomend/,{},izm2mj,True,False,False,False,True,True,False,,[],dark,text,False,False,True,1,0,False,all_ads,/r/math/comments/izm2mj/what_are_some_mathematical_books_you_recomend/,False,,,6,1601049461,1,High school senior here interested in majoring in the math field. I would like books that cover the foundations but also some philosophy books too for fun \^\_\^,True,False,False,math,t5_2qh0n,1352390,public,self,What are some mathematical books you recomend?,0,[],1.0,https://www.reddit.com/r/math/comments/izm2mj/what_are_some_mathematical_books_you_recomend/,all_ads,6,,,,,,,,,,,,,,,,,
[],False,chigi1198,,[],,text,t2_6avprb2d,False,False,[],False,False,1601049355,i.redd.it,https://www.reddit.com/r/math/comments/izm1me/covid19_recorded_deaths_closely_follow_benfords/,{},izm1me,False,False,False,True,False,False,False,,[],dark,text,False,False,True,3,0,False,all_ads,/r/math/comments/izm1me/covid19_recorded_deaths_closely_follow_benfords/,False,image,"{'enabled': True, 'images': [{'id': 'ELfA4KhBmWM6pJexd02gBQ07b2xrEppyax8oTbQJTC4', 'resolutions': [{'height': 68, 'url': 'https://preview.redd.it/t5s4gsx7gbp51.jpg?width=108&amp;crop=smart&amp;auto=webp&amp;s=46822a2854011ab40c87c549d097f46042f42647', 'width': 108}, {'height': 136, 'url': 'https://preview.redd.it/t5s4gsx7gbp51.jpg?width=216&amp;crop=smart&amp;auto=webp&amp;s=9cf0476a512955ea2a0580a89de8469c07f2acc9', 'width': 216}, {'height': 202, 'url': 'https://preview.redd.it/t5s4gsx7gbp51.jpg?width=320&amp;crop=smart&amp;auto=webp&amp;s=233a4f28afb079870754934ac23c12c0b71203c0', 'width': 320}, {'height': 404, 'url': 'https://preview.redd.it/t5s4gsx7gbp51.jpg?width=640&amp;crop=smart&amp;auto=webp&amp;s=4054f21257f04b32ba3a4d7eef0c8665bcca1faa', 'width': 640}, {'height': 606, 'url': 'https://preview.redd.it/t5s4gsx7gbp51.jpg?width=960&amp;crop=smart&amp;auto=webp&amp;s=2049acc3810dee6370da45037a5ca26c89aad3f7', 'width': 960}, {'height': 682, 'url': 'https://preview.redd.it/t5s4gsx7gbp51.jpg?width=1080&amp;crop=smart&amp;auto=webp&amp;s=22532e19a9a7b8e2585a5d937abb4755192b693e', 'width': 1080}], 'source': {'height': 895, 'url': 'https://preview.redd.it/t5s4gsx7gbp51.jpg?auto=webp&amp;s=08736c42dc7f5bd2588db8e53f9cde6417cdf4bb', 'width': 1417}, 'variants': {}}]}",6,1601049366,1,,True,False,False,math,t5_2qh0n,1352390,public,image,Covid-19 recorded deaths closely follow Benford's Law,0,[],1.0,https://i.redd.it/t5s4gsx7gbp51.jpg,all_ads,6,Removed - add explanation,,,automod_filtered,,,88.0,140.0,https://i.redd.it/t5s4gsx7gbp51.jpg,,,,,,,,
[],False,chigi1198,,[],,text,t2_6avprb2d,False,False,[],False,False,1601049271,reddit.com,https://www.reddit.com/r/math/comments/izm0pn/thoughts_id_repost_this_where_people_might/,{},izm0pn,False,False,False,False,False,False,False,,[],dark,text,False,False,True,2,0,False,all_ads,/r/math/comments/izm0pn/thoughts_id_repost_this_where_people_might/,False,,,6,1601049283,1,,True,False,False,math,t5_2qh0n,1352391,public,default,Thoughts I'd repost this where people might actually understand this...,0,[],1.0,https://www.reddit.com/r/interestingasfuck/comments/izlwna/covid19_recorded_deaths_closely_follow_benfords/?utm_medium=android_app&amp;utm_source=share,all_ads,6,Removed - try /r/learnmath,,,moderator,,,,,https://www.reddit.com/r/interestingasfuck/comments/izlwna/covid19_recorded_deaths_closely_follow_benfords/?utm_medium=android_app&amp;utm_source=share,,,,,,,,
[],False,jackteacher88,,[],,text,t2_rpcr2,False,False,[],False,False,1601046578,self.math,https://www.reddit.com/r/math/comments/izl6gw/is_there_any_real_context_where_the_mode_would_be/,{},izl6gw,True,False,False,False,True,True,False,,[],dark,text,False,False,True,12,0,False,all_ads,/r/math/comments/izl6gw/is_there_any_real_context_where_the_mode_would_be/,False,,,6,1601046588,1,"Any academic or professional context where the mode would be a helpful concept, as opposed to just referring to the most common or popular. In the UK the mode is taught as a measure of central tendency alonside mean and median and it just strikes me as unhelpful to do so.   


I would vote to remove the word from the curriculum and examiniation.",True,False,False,math,t5_2qh0n,1352325,public,self,Is there any real context where the mode would be used as an average.,0,[],1.0,https://www.reddit.com/r/math/comments/izl6gw/is_there_any_real_context_where_the_mode_would_be/,all_ads,6,,,,,,,,,,,,,,,,,
[],False,dmishin,,[],,text,t2_hfg3i,False,False,[],False,False,1601046474,self.math,https://www.reddit.com/r/math/comments/izl5b7/i_found_an_algebraic_structure_whose_pointed/,{},izl5b7,True,False,False,False,True,True,False,,[],dark,text,False,False,True,23,0,False,all_ads,/r/math/comments/izl5b7/i_found_an_algebraic_structure_whose_pointed/,False,,,6,1601046485,1,"It is my personal little discovery. Indeed, it is too easy to be a genuinely new result, but it was new for me!

So, consider a group-like algebraic structure (T,\*), consisting of a set T and *ternary* operation \*: T^(3) → T, complying two axioms:

1. Ternary associativity: (a\*b\*c)\*d\*e = a\*(d\*c\*b)\*e = a\*b\*(c\*d\*e)
2. Cancellation: a\*a\*b = b\*a\*a = b

Without a better idea, I dubbed them t-groups (from ""ternary""). As any other structure, t-groups form a category (let's call it **Tgrp**), whose objects are t-groups and arrows are t-group homomorphisms (functions, compatible with the ternary operation).

One quick observation is that for any group (G,· ) there is a t-group (G,\*) with the same set of elements and ternary operation \* defined as: x\*y\*z = x·y^(-1)·z

Now, the category of pointed t-groups **Tgrp**\* (like any other similar pointed category) has pairs of t-group and a distinguished element of it as objects: (T,t∈T), and morphisms are homomorphisms that preserve the distinguished element.

Now the fun thing: *the category* ***Tgrp****\* is isomorphic to the category of groups* ***Grp***

The **Grp**→**Tgrp**\* functor is given by the above construction, with group identity becoming a distinguished point. Its inverse is a bit less obvious, I'll leave it as a small funny excercise.

This means that t-groups can be interpreted as groups that ""forgot"" their identity (just like affine space is a linear space that ""forgot"" its point of origin). Looking at the definition, this is not obvious at all. 

Do such structures have an official name?  
By the way, I arrived to this construction from my another idea: [https://www.reddit.com/r/math/comments/dazg6x/theory\_of\_anticategories\_a\_toy\_construction/](https://www.reddit.com/r/math/comments/dazg6x/theory_of_anticategories_a_toy_construction/) considering an ""anticategory"" with one hom-set. A category with one hom-set (==one object) is a group, and ""anticategory"" is a t-group.",True,False,False,math,t5_2qh0n,1352324,public,self,"I found an algebraic structure, whose *pointed* category is (isomorphic to) the category of groups. Isn't it interesting, and does it have a name?",0,[],1.0,https://www.reddit.com/r/math/comments/izl5b7/i_found_an_algebraic_structure_whose_pointed/,all_ads,6,,,,,,,,,,,,,,,,,
[],False,IamKun2,,[],,text,t2_6bcv5guy,False,False,[],False,False,1601037042,self.math,https://www.reddit.com/r/math/comments/izik75/getting_the_equivalent_of_an_exponential/,{},izik75,True,False,False,False,True,True,False,,[],dark,text,False,False,True,1,0,False,all_ads,/r/math/comments/izik75/getting_the_equivalent_of_an_exponential/,False,,,6,1601037053,1,"Hi all!  
I hope this is the right place for this question.

I need to use the below equation for an image. This equation is a conformal mapping, which only makes sense in the complex domain.

&amp;#x200B;

Question: Is there a way to obtain an equivalent mapping but on the real domain?  
(technical reasons are there to avoid the complex domain).

&amp;#x200B;

By ""equivalent"" I mean: something that will produce the same mapping, but I won't have to use the complex domain to obtain it.

&amp;#x200B;

I have tried to decompose it in Laurent Series, but I got stuck. Any pointers will be appreciated.

&amp;#x200B;

The equation is:

&amp;#x200B;

$h(w) = w\^{(2πi + Ln(256))/(2πi)}$

&amp;#x200B;

This equation produces the image below. I would like an equivalent equation that will give me the same mapping of pixels (i.e. the same results) but using only Real numbers. Thanks!  


&amp;#x200B;

https://preview.redd.it/8cf5syhlfap51.jpg?width=405&amp;format=pjpg&amp;auto=webp&amp;s=0e6c340828b95a6bcc47e8bb2596d9b0fe6547ef",True,False,False,math,t5_2qh0n,1352171,public,self,Getting the equivalent of an exponential conformal mapping in the Real domain,0,[],1.0,https://www.reddit.com/r/math/comments/izik75/getting_the_equivalent_of_an_exponential/,all_ads,6,,,,,,,140.0,140.0,,,,,,,"{'8cf5syhlfap51': {'e': 'Image', 'id': '8cf5syhlfap51', 'm': 'image/jpg', 'p': [{'u': 'https://preview.redd.it/8cf5syhlfap51.jpg?width=108&amp;crop=smart&amp;auto=webp&amp;s=3862508f8aa432670eeb6c476a73fc167e8106ae', 'x': 108, 'y': 171}, {'u': 'https://preview.redd.it/8cf5syhlfap51.jpg?width=216&amp;crop=smart&amp;auto=webp&amp;s=ca94207026cce6586cb7537e4960baeabd7e6e5e', 'x': 216, 'y': 343}, {'u': 'https://preview.redd.it/8cf5syhlfap51.jpg?width=320&amp;crop=smart&amp;auto=webp&amp;s=43ca5b32b52d40b44d21a969e75beec8cb63bcbd', 'x': 320, 'y': 508}], 's': {'u': 'https://preview.redd.it/8cf5syhlfap51.jpg?width=405&amp;format=pjpg&amp;auto=webp&amp;s=0e6c340828b95a6bcc47e8bb2596d9b0fe6547ef', 'x': 405, 'y': 644}, 'status': 'valid'}}",,
[],False,r8irtyit,,[],,text,t2_5u1obut8,False,False,[],False,False,1601029014,self.math,https://www.reddit.com/r/math/comments/izgyo7/how_would_you_describe_π/,{},izgyo7,True,False,False,False,True,True,False,,[],dark,text,False,False,True,4,0,False,all_ads,/r/math/comments/izgyo7/how_would_you_describe_π/,False,,,6,1601029025,1,"﹦{Γ(1/2)}² 
when Γ(p)=∫[0→∞]x^(p-1)*e^(-x)dx",True,False,False,math,t5_2qh0n,1352101,public,self,How would you describe π?,0,[],1.0,https://www.reddit.com/r/math/comments/izgyo7/how_would_you_describe_π/,all_ads,6,,,,,,,,,,,,,,,,,
