[],False,nouveaubird,,[],,text,t2_5wfaf2gk,False,False,[],False,False,1601611410,self.Physics,https://www.reddit.com/r/Physics/comments/j3nqyc/not_sure_this_is_the_correct_sub/,{},j3nqyc,True,False,False,False,True,True,False,,[],dark,text,False,False,True,1,0,False,all_ads,/r/Physics/comments/j3nqyc/not_sure_this_is_the_correct_sub/,False,,,6,1601611421,1,"Hey not really sure if this is the right sub for this kind if question or not? Feel free to remove if not

So if I had a room with a strong smell in it (take your pick) with an open window, and place a fan on the windowsill, would the smell leave the room faster if the fan was facing outside the room or facing inside the room? Which would cause the air in the the room to circulate faster? The door is closed in this scenario.

Thanks (and a little sorry), in advance.",True,False,False,Physics,t5_2qhi6,1449804,public,self,Not sure this is the correct sub?,0,[],1.0,https://www.reddit.com/r/Physics/comments/j3nqyc/not_sure_this_is_the_correct_sub/,all_ads,6,question,Question,,,,,,,,,,,,,,,,,,
[],False,Aqeel01,,[],,text,t2_4tw76gm9,False,True,[],False,False,1601609893,self.Physics,https://www.reddit.com/r/Physics/comments/j3nesp/how_much_of_physics_is_math/,{},j3nesp,True,False,False,False,True,True,False,,[],dark,text,False,False,True,12,0,False,all_ads,/r/Physics/comments/j3nesp/how_much_of_physics_is_math/,False,,,6,1601609904,1,,True,False,False,Physics,t5_2qhi6,1449810,public,self,How much of physics is math?,0,[],1.0,https://www.reddit.com/r/Physics/comments/j3nesp/how_much_of_physics_is_math/,all_ads,6,question,Question,,,,,,,,,,,,,,,,,,
[],False,kaulsayan,,[],,text,t2_7i6a0kxz,False,False,[],False,False,1601609734,youtu.be,https://www.reddit.com/r/Physics/comments/j3ndgg/what_is_wormholea_brief_information_about_wormhole/,{},j3ndgg,True,False,False,False,True,False,False,,[],dark,text,False,False,True,0,0,False,all_ads,/r/Physics/comments/j3ndgg/what_is_wormholea_brief_information_about_wormhole/,False,rich:video,"{'enabled': False, 'images': [{'id': 'XBlNeVCLvIbUo9nC5alSjoNYWzjaLMTf0XNsVIDH2Do', 'resolutions': [{'height': 81, 'url': 'https://external-preview.redd.it/JAr75iJp5GKN_WztHYybTDhpKQB1ayHXOVLt8XokT2I.jpg?width=108&amp;crop=smart&amp;auto=webp&amp;s=2b4891f42e089bdfb5768e881fe94aa746b4a412', 'width': 108}, {'height': 162, 'url': 'https://external-preview.redd.it/JAr75iJp5GKN_WztHYybTDhpKQB1ayHXOVLt8XokT2I.jpg?width=216&amp;crop=smart&amp;auto=webp&amp;s=1e13e323b47da5c458b974056c02a865b1c14692', 'width': 216}, {'height': 240, 'url': 'https://external-preview.redd.it/JAr75iJp5GKN_WztHYybTDhpKQB1ayHXOVLt8XokT2I.jpg?width=320&amp;crop=smart&amp;auto=webp&amp;s=5f79af3f3a6118bb8a67bbc7d12488d640fc3c06', 'width': 320}], 'source': {'height': 360, 'url': 'https://external-preview.redd.it/JAr75iJp5GKN_WztHYybTDhpKQB1ayHXOVLt8XokT2I.jpg?auto=webp&amp;s=0e34702116534fa7603d50ed12556b957d7bcd4e', 'width': 480}, 'variants': {}}]}",6,1601609745,1,,True,False,False,Physics,t5_2qhi6,1449810,public,https://b.thumbs.redditmedia.com/QF_NbsOaykvYLXJ8YnqrpqFArCaEsGSfxhwGUX02ziI.jpg,What is Wormhole...A brief information about Wormhole,0,[],1.0,https://youtu.be/znpqmEtlCNY,all_ads,6,image,Video,,,105.0,140.0,https://youtu.be/znpqmEtlCNY,"{'oembed': {'author_name': 'Fact Sci Guy', 'author_url': 'https://www.youtube.com/channel/UC5eZpaCexQV7fSuxBbkYMaA', 'height': 338, 'html': '&lt;iframe width=""600"" height=""338"" src=""https://www.youtube.com/embed/znpqmEtlCNY?feature=oembed&amp;enablejsapi=1"" frameborder=""0"" allow=""accelerometer; autoplay; clipboard-write; encrypted-media; gyroscope; picture-in-picture"" allowfullscreen&gt;&lt;/iframe&gt;', 'provider_name': 'YouTube', 'provider_url': 'https://www.youtube.com/', 'thumbnail_height': 360, 'thumbnail_url': 'https://i.ytimg.com/vi/znpqmEtlCNY/hqdefault.jpg', 'thumbnail_width': 480, 'title': 'What is Wormhole||A brief information about Wormhole(Part1)....© AkashVeer', 'type': 'video', 'version': '1.0', 'width': 600}, 'type': 'youtube.com'}","{'content': '&lt;iframe width=""600"" height=""338"" src=""https://www.youtube.com/embed/znpqmEtlCNY?feature=oembed&amp;enablejsapi=1"" frameborder=""0"" allow=""accelerometer; autoplay; clipboard-write; encrypted-media; gyroscope; picture-in-picture"" allowfullscreen&gt;&lt;/iframe&gt;', 'height': 338, 'scrolling': False, 'width': 600}",,"{'oembed': {'author_name': 'Fact Sci Guy', 'author_url': 'https://www.youtube.com/channel/UC5eZpaCexQV7fSuxBbkYMaA', 'height': 338, 'html': '&lt;iframe width=""600"" height=""338"" src=""https://www.youtube.com/embed/znpqmEtlCNY?feature=oembed&amp;enablejsapi=1"" frameborder=""0"" allow=""accelerometer; autoplay; clipboard-write; encrypted-media; gyroscope; picture-in-picture"" allowfullscreen&gt;&lt;/iframe&gt;', 'provider_name': 'YouTube', 'provider_url': 'https://www.youtube.com/', 'thumbnail_height': 360, 'thumbnail_url': 'https://i.ytimg.com/vi/znpqmEtlCNY/hqdefault.jpg', 'thumbnail_width': 480, 'title': 'What is Wormhole||A brief information about Wormhole(Part1)....© AkashVeer', 'type': 'video', 'version': '1.0', 'width': 600}, 'type': 'youtube.com'}","{'content': '&lt;iframe width=""600"" height=""338"" src=""https://www.youtube.com/embed/znpqmEtlCNY?feature=oembed&amp;enablejsapi=1"" frameborder=""0"" allow=""accelerometer; autoplay; clipboard-write; encrypted-media; gyroscope; picture-in-picture"" allowfullscreen&gt;&lt;/iframe&gt;', 'height': 338, 'media_domain_url': 'https://www.redditmedia.com/mediaembed/j3ndgg', 'scrolling': False, 'width': 600}",,,,,,,,
[],False,trampshoe,,[],,text,t2_5xlzdw21,False,False,[],False,False,1601606104,self.Physics,https://www.reddit.com/r/Physics/comments/j3mj7a/help_for_quiz/,{},j3mj7a,True,False,False,False,True,True,False,,[],dark,text,False,False,True,0,0,False,all_ads,/r/Physics/comments/j3mj7a/help_for_quiz/,False,,,6,1601606115,1,"I have a quiz on kinematics that needs to be submitted in 10mins, anyone who is willing to help? Please message me",True,False,False,Physics,t5_2qhi6,1449753,public,self,Help for quiz,0,[],1.0,https://www.reddit.com/r/Physics/comments/j3mj7a/help_for_quiz/,all_ads,6,,,,,,,,,,,,,,,,,,,,
[],False,Obsidian743,,[],,text,t2_3s2nl,False,False,[],False,False,1601604264,popularmechanics.com,https://www.reddit.com/r/Physics/comments/j3m321/for_the_first_time_ever_scientists_caught_time/,{},j3m321,False,False,False,False,False,False,False,,[],dark,text,False,False,True,0,0,False,all_ads,/r/Physics/comments/j3m321/for_the_first_time_ever_scientists_caught_time/,False,link,"{'enabled': False, 'images': [{'id': 'ADR_LD_K3OF8ObmGbutz2rpeuVJVPHYFndge0ostgK4', 'resolutions': [{'height': 54, 'url': 'https://external-preview.redd.it/5MP3tGOND29EytYGlPN8g3Wsry2qMhL9GN1UfxIi5HE.jpg?width=108&amp;crop=smart&amp;auto=webp&amp;s=5631e4478f84adf6d22490d483c81530ad20d16a', 'width': 108}, {'height': 108, 'url': 'https://external-preview.redd.it/5MP3tGOND29EytYGlPN8g3Wsry2qMhL9GN1UfxIi5HE.jpg?width=216&amp;crop=smart&amp;auto=webp&amp;s=b64cc9efc9f70edd25bc6fd8f2e39c5050b4309f', 'width': 216}, {'height': 160, 'url': 'https://external-preview.redd.it/5MP3tGOND29EytYGlPN8g3Wsry2qMhL9GN1UfxIi5HE.jpg?width=320&amp;crop=smart&amp;auto=webp&amp;s=29c5b7708d306bc44f86be6a6cf67103b9701a96', 'width': 320}, {'height': 321, 'url': 'https://external-preview.redd.it/5MP3tGOND29EytYGlPN8g3Wsry2qMhL9GN1UfxIi5HE.jpg?width=640&amp;crop=smart&amp;auto=webp&amp;s=52e316dddf5cdff58035fa485d78c1266843864e', 'width': 640}, {'height': 481, 'url': 'https://external-preview.redd.it/5MP3tGOND29EytYGlPN8g3Wsry2qMhL9GN1UfxIi5HE.jpg?width=960&amp;crop=smart&amp;auto=webp&amp;s=fe928f939139b0d16a21604b2fb6e3a5d52c49c3', 'width': 960}, {'height': 541, 'url': 'https://external-preview.redd.it/5MP3tGOND29EytYGlPN8g3Wsry2qMhL9GN1UfxIi5HE.jpg?width=1080&amp;crop=smart&amp;auto=webp&amp;s=899550607843fe23d1679ad074ad41245a890d0f', 'width': 1080}], 'source': {'height': 602, 'url': 'https://external-preview.redd.it/5MP3tGOND29EytYGlPN8g3Wsry2qMhL9GN1UfxIi5HE.jpg?auto=webp&amp;s=35d86e9664b7fb14a3084d9d85294e4701987c89', 'width': 1200}, 'variants': {}}]}",6,1601604275,1,,True,False,False,Physics,t5_2qhi6,1449745,public,https://a.thumbs.redditmedia.com/_75q44XwSL-0Avt3lNbz3C3Tc9KqEriD9uXEhDutUY0.jpg,"For the First Time Ever, Scientists Caught Time Crystals Interacting",0,[],1.0,https://www.popularmechanics.com/science/amp33648414/scientists-catch-time-crystals-interacting/,all_ads,6,,,,,70.0,140.0,https://www.popularmechanics.com/science/amp33648414/scientists-catch-time-crystals-interacting/,,,moderator,,,,,,,,,,
[],False,PhysSocColloquium,,[],,text,t2_7tnng6mi,False,True,[],False,False,1601602277,i.redd.it,https://www.reddit.com/r/Physics/comments/j3lltg/nergis_mavalvala_mit_will_give_the_20202021_anna/,{},j3lltg,False,False,False,True,False,False,False,,[],dark,text,False,False,True,5,0,False,all_ads,/r/Physics/comments/j3lltg/nergis_mavalvala_mit_will_give_the_20202021_anna/,False,image,"{'enabled': True, 'images': [{'id': 'TG_lfBm77MXqif1WZ9mIwunBVxaY7rCmKnTmaMg34KY', 'resolutions': [{'height': 60, 'url': 'https://preview.redd.it/zfz25jab4lq51.png?width=108&amp;crop=smart&amp;auto=webp&amp;s=b10ac74ac6a1525afd5d0bd658d9631c5ccdb026', 'width': 108}, {'height': 121, 'url': 'https://preview.redd.it/zfz25jab4lq51.png?width=216&amp;crop=smart&amp;auto=webp&amp;s=bc384745c25a60791af527217d88d800f67605b5', 'width': 216}, {'height': 180, 'url': 'https://preview.redd.it/zfz25jab4lq51.png?width=320&amp;crop=smart&amp;auto=webp&amp;s=2f60490d8212b20359042b632b28420a1fd6dd2b', 'width': 320}, {'height': 360, 'url': 'https://preview.redd.it/zfz25jab4lq51.png?width=640&amp;crop=smart&amp;auto=webp&amp;s=4ace5654edc796ed120d66dab8ec15c45dd69825', 'width': 640}, {'height': 540, 'url': 'https://preview.redd.it/zfz25jab4lq51.png?width=960&amp;crop=smart&amp;auto=webp&amp;s=8484631fe365657dcf81efb07f054300f3010357', 'width': 960}, {'height': 607, 'url': 'https://preview.redd.it/zfz25jab4lq51.png?width=1080&amp;crop=smart&amp;auto=webp&amp;s=0a671d98d218497df96c39c1515bc17d499b04da', 'width': 1080}], 'source': {'height': 720, 'url': 'https://preview.redd.it/zfz25jab4lq51.png?auto=webp&amp;s=76cccd96a3a97b049c8a26f46fdf3fe63727907a', 'width': 1280}, 'variants': {}}]}",6,1601602288,1,,True,False,False,Physics,t5_2qhi6,1449735,public,https://b.thumbs.redditmedia.com/nODW_E9g6dahjVdKdUFlD57qMb0CFEvwhmAiKKXM7zk.jpg,"Nergis Mavalvala (MIT) will give the 2020/2021 Anna I McPherson Scientific Lecture ""Listening for Gravitational Waves Above the Quantum Din"" on Friday Oct. 2, 2020 at 3:30pm ET. Join the livestream for free -- all are welcome!: https://www.physics.mcgill.ca/live/",0,[],1.0,https://i.redd.it/zfz25jab4lq51.png,all_ads,6,,,,,78.0,140.0,https://i.redd.it/zfz25jab4lq51.png,,,automod_filtered,,,,,,,,,,
[],False,IamTwaxx,,[],,text,t2_mdnmk,False,False,[],False,False,1601602111,self.Physics,https://www.reddit.com/r/Physics/comments/j3lkbq/thanks_to_law_the_torus_doesnt_exist/,{},j3lkbq,True,False,False,False,True,True,False,,[],dark,text,False,False,True,3,0,False,all_ads,/r/Physics/comments/j3lkbq/thanks_to_law_the_torus_doesnt_exist/,False,,,6,1601602123,1,"Hey guys,

Torus of hell, is torus of hell, ever repeating

Torus of heaven , is torus of heaven, ever repeating.

&amp;#x200B;

Thanks to energy loss, we don't have to endure either.

Drop your ""torus"" physics.

Because,

Big bang is much more complex than you imagined.

It's a particle field, drag explosion (according to our data), rather than a pure explosion.

&amp;#x200B;

""Particle field change, due to implosion, leading towards an explosion"" is our current, most plausible theory.",True,False,False,Physics,t5_2qhi6,1449735,public,self,"Thanks to law, the Torus doesn't exist.",0,[],1.0,https://www.reddit.com/r/Physics/comments/j3lkbq/thanks_to_law_the_torus_doesnt_exist/,all_ads,6,,,,,,,,,,,,,,,,,,,,
[],False,HeLovesThatStuff,,[],,text,t2_6et5ywl9,False,True,[],False,False,1601601161,self.Physics,https://www.reddit.com/r/Physics/comments/j3lc1n/what_will_there_be_left_to_discover_once_we_find/,{},j3lc1n,True,False,False,False,True,True,False,,[],dark,text,False,False,True,3,0,False,all_ads,/r/Physics/comments/j3lc1n/what_will_there_be_left_to_discover_once_we_find/,False,,,6,1601601171,1,,True,False,False,Physics,t5_2qhi6,1449729,public,self,What will there be left to discover once we find a grand unified field theory and solve it?,0,[],1.0,https://www.reddit.com/r/Physics/comments/j3lc1n/what_will_there_be_left_to_discover_once_we_find/,all_ads,6,question,Question,,,,,,,,,,,,,,,,,,
[],False,boxcarjakey,,[],,text,t2_glyug,False,False,[],False,False,1601598822,self.Physics,https://www.reddit.com/r/Physics/comments/j3krf3/falling_behind_quick_any_tips/,{},j3krf3,True,False,False,False,True,True,False,,[],dark,text,False,False,True,5,0,False,all_ads,/r/Physics/comments/j3krf3/falling_behind_quick_any_tips/,False,,,6,1601599190,1,"Hello, in College Physics 1, probably doing the typical route of topics. We just moved on from displacement and freefalling equations and are now onto vectors however I find that I am quickly not understanding what the hell is going on. 

 I’m aware I can get extra help but is there possibly any suggestions for really good resources I can start self studying such as a workbook or another source?

Hopefully you understand what I’m saying, any guidance is appreciated thank you!",True,False,False,Physics,t5_2qhi6,1449695,public,self,Falling behind quick - any tips?,0,[],1.0,https://www.reddit.com/r/Physics/comments/j3krf3/falling_behind_quick_any_tips/,all_ads,6,question,Question,,,,,,,,,,,,,,,,,,
[],False,miggsd28,,[],,text,t2_hgi5c8b,False,False,[],False,False,1601597900,self.Physics,https://www.reddit.com/r/Physics/comments/j3kj1z/difference_between_wwork_and_w_weight/,{},j3kj1z,True,False,False,False,True,True,False,,[],dark,text,False,False,True,31,0,False,all_ads,/r/Physics/comments/j3kj1z/difference_between_wwork_and_w_weight/,False,,,6,1601598539,2,"Hey I’m a chem major, who hates physics because I can not visualize forces well. To make things more confusing some times W=weight and sometimes W= work. I’m so lost. How do I distinguish the two in an exam

Edit also why is radius sometimes r and some times R I hate this. In chem one symbol means one and only one thing. And capitalization makes all the difference. Dear physics I hate you",True,False,False,Physics,t5_2qhi6,1449683,public,self,Difference between W=work and W= weight,0,[],1.0,https://www.reddit.com/r/Physics/comments/j3kj1z/difference_between_wwork_and_w_weight/,all_ads,6,,,,,,,,,,,,,,,,,,1601598085.0,,
[],False,Mrclean135135,,[],,text,t2_6auijvok,False,False,[],False,False,1601594454,self.Physics,https://www.reddit.com/r/Physics/comments/j3jn89/help/,{},j3jn89,True,False,False,False,True,True,False,,[],dark,text,False,False,True,9,0,False,all_ads,/r/Physics/comments/j3jn89/help/,False,,,6,1601596163,0,Does this subreddit help with homework,True,False,False,Physics,t5_2qhi6,1449607,public,self,Help,0,[],0.5,https://www.reddit.com/r/Physics/comments/j3jn89/help/,all_ads,6,,,,,,,,,,,,,,,,,,,,
[],False,sultryspyglass,,[],,text,t2_3ye13ra6,False,False,[],False,False,1601592049,self.Physics,https://www.reddit.com/r/Physics/comments/j3j07i/feministintersectional_theory_in_physics/,{},j3j07i,True,False,False,False,True,True,False,,[],dark,text,False,False,True,23,0,False,all_ads,/r/Physics/comments/j3j07i/feministintersectional_theory_in_physics/,False,,,6,1601594467,0,"Hi! I'm hoping for some direction on where to start. Looking for feminist/intersectional papers [preferably no more than 10 pages] that deal with approaching physics, especially quantum physics, with this lensing.",True,False,False,Physics,t5_2qhi6,1449594,public,self,Feminist/Intersectional Theory in Physics,0,[],0.29,https://www.reddit.com/r/Physics/comments/j3j07i/feministintersectional_theory_in_physics/,all_ads,6,,,,,,,,,,,,,,,,,,,,
[],False,imomushi8,pf,[],Nuclear physics,text,t2_1i6gc,False,False,[],False,False,1601588165,nytimes.com,https://www.reddit.com/r/Physics/comments/j3hv5f/astronomers_have_discovered_a_giant_black_hole/,{},j3hv5f,True,False,False,False,True,False,False,,[],dark,text,False,False,False,68,0,False,all_ads,/r/Physics/comments/j3hv5f/astronomers_have_discovered_a_giant_black_hole/,False,link,"{'enabled': False, 'images': [{'id': 't9pfhJKkPPITQBTeNWLIWJFmk4N6tuFSB1s93XxvDdE', 'resolutions': [{'height': 56, 'url': 'https://external-preview.redd.it/uVS8rH1HQ-2O1FoQfCw1EoAiIWIKnzPHA4QHib5dm_w.jpg?width=108&amp;crop=smart&amp;auto=webp&amp;s=6b6c10320ca877ebad1d1581bf27b61fc5640b83', 'width': 108}, {'height': 113, 'url': 'https://external-preview.redd.it/uVS8rH1HQ-2O1FoQfCw1EoAiIWIKnzPHA4QHib5dm_w.jpg?width=216&amp;crop=smart&amp;auto=webp&amp;s=9d905416914d5778f2e608b1657ba08532b517d2', 'width': 216}, {'height': 167, 'url': 'https://external-preview.redd.it/uVS8rH1HQ-2O1FoQfCw1EoAiIWIKnzPHA4QHib5dm_w.jpg?width=320&amp;crop=smart&amp;auto=webp&amp;s=e8fb0f440bec28fe92535ecaeb0c00aa0c72bfb0', 'width': 320}, {'height': 335, 'url': 'https://external-preview.redd.it/uVS8rH1HQ-2O1FoQfCw1EoAiIWIKnzPHA4QHib5dm_w.jpg?width=640&amp;crop=smart&amp;auto=webp&amp;s=8f37d62ea16358f40d6b4a0760278125f913d701', 'width': 640}, {'height': 502, 'url': 'https://external-preview.redd.it/uVS8rH1HQ-2O1FoQfCw1EoAiIWIKnzPHA4QHib5dm_w.jpg?width=960&amp;crop=smart&amp;auto=webp&amp;s=0760240b94e6c0582fc3a12750d4cc6e54736305', 'width': 960}], 'source': {'height': 550, 'url': 'https://external-preview.redd.it/uVS8rH1HQ-2O1FoQfCw1EoAiIWIKnzPHA4QHib5dm_w.jpg?auto=webp&amp;s=89f34e34b9b538a700518db83e7678e6ea5a94a6', 'width': 1050}, 'variants': {}}]}",6,1601591461,4,,True,False,False,Physics,t5_2qhi6,1449580,public,https://b.thumbs.redditmedia.com/u0jalJxFh3DHbXdVwLF1XtmrVpGA46wiikQ0ysoSxkA.jpg,Astronomers have discovered a giant black hole surrounded by a litter of young protogalaxies that date to the early universe,0,[],1.0,https://www.nytimes.com/2020/10/01/science/astronomy-galaxies-black-hole.html,all_ads,6,article,Article,,dark,73.0,140.0,https://www.nytimes.com/2020/10/01/science/astronomy-galaxies-black-hole.html,,,,,,,,,,,,50a50f84-f99c-11e3-957e-12313b01142d,
[],False,Nox2448,,[],,text,t2_3srogmqn,False,False,[],False,False,1601587645,self.Physics,https://www.reddit.com/r/Physics/comments/j3hpis/electromagnetic_wave_frequency_in_space/,{},j3hpis,True,False,False,False,True,True,False,,[],dark,text,False,False,True,15,0,False,all_ads,/r/Physics/comments/j3hpis/electromagnetic_wave_frequency_in_space/,False,,,6,1601591012,1,"Dear Physics community,

I am an avid follower of the YouTube science and physics community. While I am not familiar with the complex math behind most physics problems I have a general phenomenological understanding.

I recently stumbled upon a video of a physics professor explaining how electromagnetic waves of different wavelengths are represented in the electromagnetic spectrum from radio waves to gamma rays. In it he explained what happened when an electromagnetic wave lost energy, namely a red-shift which just means that the wave's frequency is reduced.
Light or electromagnetic waves in general travel with the speed light which is constant.
The question I asked myself then was:
If all these waves travel with the speed of light but have different frequencies wouldn't this mean that they actually take different times to travel between point A and B?
The distance between A and B is a straight line, so therefore if a wave (""travels up and down from pivot to pivot"") which has a higher frequency will take longer than a wave with a lower frequency (""which spends less time traveling up and down on the way to its goal ""B"""").

I quickly realized that this is probably not the case and my understanding of what a wave and it's frequency is, is probably just a simple and understandable way that has been taught to me, because the actual property is way more complex than this phenomenological explanation.

Could any knowledgeable person please help me understand this on a deeper level?",True,False,False,Physics,t5_2qhi6,1449579,public,self,Electromagnetic wave frequency in space,0,[],1.0,https://www.reddit.com/r/Physics/comments/j3hpis/electromagnetic_wave_frequency_in_space/,all_ads,6,,,,,,,,,,,,,,,,,,,,
[],False,lohborn,inter,[],Education and outreach,text,t2_512dr,False,False,[],False,False,1601587185,self.Physics,https://www.reddit.com/r/Physics/comments/j3hkja/new_very_simple_apps_for_students_to_practice/,{},j3hkja,True,False,False,False,True,True,False,,[],dark,text,False,False,True,0,0,False,all_ads,/r/Physics/comments/j3hkja/new_very_simple_apps_for_students_to_practice/,False,,,6,1601590607,1,"Hey /r/physics

I know that a few of you are using my simple simulation apps in your physics classrooms. They aren't anything fancy like [other's have posted recently](https://www.reddit.com/r/Physics/comments/iwbv6j/an_open_source_physics_simulations_project/) but they are easy to use for middle and high school science classes. 

[Here is my first post on /r/physics](https://www.reddit.com/r/Physics/comments/i4wwky/ive_been_making_physics_apps_for_my_own_classroom/) in case you want some more background.

I don't have much new since I've been busy teaching but I noticed that the [Ants](https://whscience.org/ants/) was the most popular one in September so I made a few more versions of that teachers some more options and students some extra practice. 

I know many of you are using the [Ants](https://whscience.org/ants/) app to give students practice with measurement and calculation. In fact, ants has been the most popular app last month with 2.5k views in September! So I made several new version of that to give you some more choices:

**New Apps**

*[Ants II](https://whscience.org/antsii/)* has students estimate initial and final velocity by using sets of lines close together to see which ant has a higher acceleration. Ants II is also available with the [opposite outcome](https://whscience.org/antsii/ii/) incase you want different sections to get different results. 

*[Ants III](https://whscience.org/antsiii/)* shows both ants with constant velocity. Students can use them to measure distance or see which ant is faster. Ants III is also available with the [opposite result](https://whscience.org/antsiii/iii/) in case you want different sections to get different results. 

It's not much but I hope it helps a few people. I'm working on a carbon pool and sync app that I hope to have ready soon so be on the look out. 

---

Link to all [bio apps](https://whscience.org/biology.html) - [chem apps](https://whscience.org/chemistry.html) - [earth&amp;space apps](https://whscience.org/earthspace.html) - [physics apps](https://whscience.org/physics.html)",True,False,False,Physics,t5_2qhi6,1449576,public,self,New very simple apps for students to practice measurement and calculation. Ants running across your screen.,0,[],1.0,https://www.reddit.com/r/Physics/comments/j3hkja/new_very_simple_apps_for_students_to_practice/,all_ads,6,,,,dark,,,,,,,,,,,,,4a8885d4-c6b2-11e4-827e-22000b2a8bad,,,
[],False,comixhub,,[],,text,t2_57eze090,False,False,[],False,False,1601584619,self.Physics,https://www.reddit.com/r/Physics/comments/j3grb3/if_you_designed_a_concave_mirror_with_a_radius_of/,{},j3grb3,True,False,False,False,True,True,False,,[],dark,text,False,False,True,14,0,False,all_ads,/r/Physics/comments/j3grb3/if_you_designed_a_concave_mirror_with_a_radius_of/,False,,,6,1601588145,1,,True,False,False,Physics,t5_2qhi6,1449509,public,self,"If you designed a concave mirror with a radius of curvature at 30 cm, where would you place the food to heat it the fastest?",0,[],1.0,https://www.reddit.com/r/Physics/comments/j3grb3/if_you_designed_a_concave_mirror_with_a_radius_of/,all_ads,6,question,Question,,,,,,,,,,,,,,,,,,
[],False,FoxInBubbleTea,,[],,text,t2_1j4407to,False,False,[],False,False,1601584126,self.Physics,https://www.reddit.com/r/Physics/comments/j3glrc/simply_curious_about_what_ive_spotted_one_day/,{},j3glrc,True,False,False,False,True,True,False,,[],dark,text,False,False,True,3,0,False,all_ads,/r/Physics/comments/j3glrc/simply_curious_about_what_ive_spotted_one_day/,False,,,6,1601587648,1,"So I live in a dorm room with two windows, and usually, when I come up close to them there's a bunch of mosquitoes all gathered on the window, today I came up with just the weirdest thought to zoom in onto the mosquito, and I even put my eyes right on the window, but what happened was that the mosquito did not block the field of vision behind it but it only instead blurred that specific area of the buildings behind it, I'm not sure how I could explain what I said any better, but does anyone know how this happens, I'm really curious to understand this?",True,False,False,Physics,t5_2qhi6,1449499,public,self,Simply curious about what I've spotted one day,0,[],1.0,https://www.reddit.com/r/Physics/comments/j3glrc/simply_curious_about_what_ive_spotted_one_day/,all_ads,6,,,,,,,,,,,,,,,,,,,,
