[],False,CockVersion10,,[],,text,t2_7i0355iv,False,False,[],False,False,1602614705,sciencenatures.com,https://www.reddit.com/r/Physics/comments/jajn8h/can_someone_clarify_what_theyre_talking_about_in/,{},jajn8h,True,False,False,False,True,False,False,,[],dark,text,False,False,True,3,0,False,all_ads,/r/Physics/comments/jajn8h/can_someone_clarify_what_theyre_talking_about_in/,False,6,1602614717,1,,True,False,False,Physics,t5_2qhi6,1468280,public,https://b.thumbs.redditmedia.com/o43lRekayeJWrVeG3Nqa8F0GlVhEZ4LQhSehTFpLawo.jpg,Can someone clarify what they're talking about in this over sensationalized article?,0,[],1.0,https://www.sciencenatures.com/2020/10/researchers-at-large-hadron-collider.html?fbclid=IwAR2YrYrc0drGF8xqBP8JVQofNKOOO97EGBuUBWEA-IGza0vsEUh2pl72_og&amp;m=1,all_ads,6,,,link,"{'enabled': False, 'images': [{'id': 'FOFKpckaEFc-rKNRGzAUxubYeF9KCppDnOF1JUbcPAI', 'resolutions': [{'height': 56, 'url': 'https://external-preview.redd.it/NmgJyhCjI_Z4hbEKCYl74aco-gGGgPquroAnEM3dhL0.jpg?width=108&amp;crop=smart&amp;auto=webp&amp;s=8be4a5cac5089c449f9f22b7684f4eadcdb29aaf', 'width': 108}, {'height': 113, 'url': 'https://external-preview.redd.it/NmgJyhCjI_Z4hbEKCYl74aco-gGGgPquroAnEM3dhL0.jpg?width=216&amp;crop=smart&amp;auto=webp&amp;s=48c8b2adb63411f48cdc18fd7a683c6eac720503', 'width': 216}, {'height': 168, 'url': 'https://external-preview.redd.it/NmgJyhCjI_Z4hbEKCYl74aco-gGGgPquroAnEM3dhL0.jpg?width=320&amp;crop=smart&amp;auto=webp&amp;s=fc932633e3b054fa21ff4f0a589ef3b6f341ce45', 'width': 320}], 'source': {'height': 310, 'url': 'https://external-preview.redd.it/NmgJyhCjI_Z4hbEKCYl74aco-gGGgPquroAnEM3dhL0.jpg?auto=webp&amp;s=098b65abf2c64836fda6f64a2fac341c8eccfc38', 'width': 590}, 'variants': {}}]}",,73.0,140.0,https://www.sciencenatures.com/2020/10/researchers-at-large-hadron-collider.html?fbclid=IwAR2YrYrc0drGF8xqBP8JVQofNKOOO97EGBuUBWEA-IGza0vsEUh2pl72_og&amp;m=1,,,,,,,,,,,
[],False,adamnredwine,,[],,text,t2_nkxeh,False,False,[],False,False,1602613442,i.redd.it,https://www.reddit.com/r/Physics/comments/jaj7ti/feynman_diagram_of_neutrinoless_beta_decay/,{},jaj7ti,True,False,False,True,True,False,False,,[],dark,text,False,False,True,1,0,False,all_ads,/r/Physics/comments/jaj7ti/feynman_diagram_of_neutrinoless_beta_decay/,False,6,1602613454,1,,True,False,False,Physics,t5_2qhi6,1468224,public,https://b.thumbs.redditmedia.com/wZLyk8hxmyxfBjRkNBi1EwEiH2EtLOR0nHyP9K5IT5Y.jpg,Feynman Diagram of Neutrinoless Beta Decay Knitted into a Cap,0,[],1.0,https://i.redd.it/4ixvepr1nws51.jpg,all_ads,6,image,Image,image,"{'enabled': True, 'images': [{'id': 'aqMBLG4HbXkbJ8VMiB4gXb69LqRxAa2Wmk_B1mRDSE8', 'resolutions': [{'height': 108, 'url': 'https://preview.redd.it/4ixvepr1nws51.jpg?width=108&amp;crop=smart&amp;auto=webp&amp;s=9ae71400b80fb5f0ad63761768378e2f9fce88a1', 'width': 108}, {'height': 216, 'url': 'https://preview.redd.it/4ixvepr1nws51.jpg?width=216&amp;crop=smart&amp;auto=webp&amp;s=65c0361c63ae16c00b9c3b613056c40b632e8d17', 'width': 216}, {'height': 320, 'url': 'https://preview.redd.it/4ixvepr1nws51.jpg?width=320&amp;crop=smart&amp;auto=webp&amp;s=41ba9ba9d0e2d125e73f63fe1a2fe0498bea9ff3', 'width': 320}, {'height': 640, 'url': 'https://preview.redd.it/4ixvepr1nws51.jpg?width=640&amp;crop=smart&amp;auto=webp&amp;s=857f4575e4c25f337bf6410705d2d6ef72bf3bae', 'width': 640}, {'height': 960, 'url': 'https://preview.redd.it/4ixvepr1nws51.jpg?width=960&amp;crop=smart&amp;auto=webp&amp;s=8abb56be7e0fecd2c70c3c83c6f0ddb4b0c3c5ef', 'width': 960}, {'height': 1080, 'url': 'https://preview.redd.it/4ixvepr1nws51.jpg?width=1080&amp;crop=smart&amp;auto=webp&amp;s=5a442e41d0683e5b25fb7037adab9c32793c52fe', 'width': 1080}], 'source': {'height': 1242, 'url': 'https://preview.redd.it/4ixvepr1nws51.jpg?auto=webp&amp;s=067d8e47082ef53099036f1f916c89f76658c2dd', 'width': 1242}, 'variants': {}}]}",,140.0,140.0,https://i.redd.it/4ixvepr1nws51.jpg,,,,,,,,,,,
[],False,Cirick1661,,[],,text,t2_36kw9lx4,False,False,[],False,False,1602612701,self.Physics,https://www.reddit.com/r/Physics/comments/jaiyq2/i_know_this_thought_is_wrong_can_you_help_tell_me/,{},jaiyq2,True,False,False,False,True,True,False,,[],dark,text,False,False,True,1,0,False,all_ads,/r/Physics/comments/jaiyq2/i_know_this_thought_is_wrong_can_you_help_tell_me/,False,6,1602612712,1,"I have been absolutely blown away by the multiple instances of black holes being confirmed, most popularly via ligo and also the image that was released in 2019. That being said, whislt arguing with myself, I ran across a thread of thought that I'm sure is flawed, I just can't  come up with the reason why it's wrong.

The thought goes something like this: as far as I understand it, black holes originaly arose as an anomaly resulting from applying the theory of general relativity to our classical observations.

My thought is this, if we are using instruments that are fundamentally dependant on a theory that prices in anomalous black holes, could the data not be self reinforcing this anomalous behaviour.

Sorry if this is really basic and a dumb question, I'm pretty bad with words and the concept makes way more sense in my head IE: if we built tools to find black holes on the same foundation that generated the anomaly in the first place, how could that system NOT find those anomalies.

Once again, sorry if this makes absolutely no sense, just a highschool graduate with an intrest in cosmology thats well above my head.",True,False,False,Physics,t5_2qhi6,1468197,public,self,"I know this thought is wrong, can you help tell me why?",0,[],1.0,https://www.reddit.com/r/Physics/comments/jaiyq2/i_know_this_thought_is_wrong_can_you_help_tell_me/,all_ads,6,question,Question,,,,,,,,,,,,,,,,,
[],False,AyushiSuman,,[],,text,t2_7u3dtkio,False,False,[],False,False,1602611001,self.Physics,https://www.reddit.com/r/Physics/comments/jaie2h/one_or_two_dimensional_system/,{},jaie2h,True,False,False,False,True,True,False,,[],dark,text,False,False,True,1,0,False,all_ads,/r/Physics/comments/jaie2h/one_or_two_dimensional_system/,False,6,1602611012,2,"For dynamical systems, we consider position and momentum as independent generalized coordinates. Sure it makes the study easier. But can a system with 2nd order ODE (e.g. an oscillator) be considered 2 dimensional? And the corresponding accelerations would be 2nd and 3nd derivative of position coordinate?  
Reference in comment.",True,False,False,Physics,t5_2qhi6,1468179,public,self,One or two dimensional system?,0,[],1.0,https://www.reddit.com/r/Physics/comments/jaie2h/one_or_two_dimensional_system/,all_ads,6,question,Question,,,,,,,,,,,,,,,,,
[],False,Nikita1306,,[],,text,t2_5rd4dupa,False,False,[],False,False,1602610406,self.Physics,https://www.reddit.com/r/Physics/comments/jai738/what_of_books_listed_below_you_would_recommend_as/,{},jai738,True,False,False,False,True,True,False,,[],dark,text,False,False,True,4,0,False,all_ads,/r/Physics/comments/jai738/what_of_books_listed_below_you_would_recommend_as/,False,6,1602610416,1," 

Basic Physics: A Self–Teaching Guide

Introduction to Physics                

Conceptual Physics by Pearson

Foundation Science Physics for Class – 9 (2019-2020) Examination

University Physics with Modern Physics

Principles of Physics, 10ed, ISV

Science for Everyone: Aptitude Test Problem In Physics

Problems In GENERAL PHYSICS

Physics for Scientists and Engineers with Modern Physics

Electricity and Magnetism (In Si Units): Berkeley Physics Course – Vol.2",True,False,False,Physics,t5_2qhi6,1468159,public,self,"what of books listed below , you would recommend as a beginning self-study book?",0,[],1.0,https://www.reddit.com/r/Physics/comments/jai738/what_of_books_listed_below_you_would_recommend_as/,all_ads,6,question,Question,,,,,,,,,,,,,,,,,
[],False,x07adam,,[],,text,t2_7hnj9sis,False,False,[],False,False,1602609516,self.Physics,https://www.reddit.com/r/Physics/comments/jahwbz/what_if_we_broke_the_laws_of_physics/,{},jahwbz,True,False,False,False,True,True,False,,[],dark,text,False,False,True,3,0,False,all_ads,/r/Physics/comments/jahwbz/what_if_we_broke_the_laws_of_physics/,False,6,1602609527,1,"Although I know it is impossible to break the laws of physics, I've always wondered what would happen if we did.  Can anyone describe what would happen?",True,False,False,Physics,t5_2qhi6,1468144,public,self,What if we broke the Laws of Physics?,0,[],1.0,https://www.reddit.com/r/Physics/comments/jahwbz/what_if_we_broke_the_laws_of_physics/,all_ads,6,question,Question,,,,,,,,,,,,,,,,,
[],False,Geekyguy20,,[],,text,t2_8e9v66nw,False,False,[],False,False,1602606883,sciencemint.com,https://www.reddit.com/r/Physics/comments/jah0bi/scientists_developed_an_ultrafast_fiber_laser/,{},jah0bi,False,False,False,False,False,False,False,,[],dark,text,False,False,True,0,0,False,all_ads,/r/Physics/comments/jah0bi/scientists_developed_an_ultrafast_fiber_laser/,False,6,1602606894,1,,True,False,False,Physics,t5_2qhi6,1468094,public,https://b.thumbs.redditmedia.com/T1Ja7tAd1Z5JYOD8PKJ8UiSnc-mXpE2vpTh7W8-n_Vk.jpg,Scientists developed an ultrafast fiber laser that produces record-high power,0,[],1.0,https://sciencemint.com/scientists-developed-an-ultrafast-fiber-laser-that-produces-record-high-power/,all_ads,6,,,link,"{'enabled': False, 'images': [{'id': '6OmIZDuEw4l2Tjs2xyWd8MJaxTT2jXBX5Opm5LV70gA', 'resolutions': [{'height': 71, 'url': 'https://external-preview.redd.it/j5mIRDfQmzCMhuuhoRBiqTjyVU9U3my41kg1qHESAFQ.jpg?width=108&amp;crop=smart&amp;auto=webp&amp;s=9acae33043e65c3522b7ee1a45dc06605e10fa34', 'width': 108}, {'height': 143, 'url': 'https://external-preview.redd.it/j5mIRDfQmzCMhuuhoRBiqTjyVU9U3my41kg1qHESAFQ.jpg?width=216&amp;crop=smart&amp;auto=webp&amp;s=151a2dfac032ba71c439c174a94802c2b7307446', 'width': 216}, {'height': 213, 'url': 'https://external-preview.redd.it/j5mIRDfQmzCMhuuhoRBiqTjyVU9U3my41kg1qHESAFQ.jpg?width=320&amp;crop=smart&amp;auto=webp&amp;s=76ab4821fa57ec5c17ca6a7b6ad44940d98404c1', 'width': 320}, {'height': 426, 'url': 'https://external-preview.redd.it/j5mIRDfQmzCMhuuhoRBiqTjyVU9U3my41kg1qHESAFQ.jpg?width=640&amp;crop=smart&amp;auto=webp&amp;s=91587402149baf922b6011747e690ba2cdb92b17', 'width': 640}, {'height': 639, 'url': 'https://external-preview.redd.it/j5mIRDfQmzCMhuuhoRBiqTjyVU9U3my41kg1qHESAFQ.jpg?width=960&amp;crop=smart&amp;auto=webp&amp;s=2b13d54c973bac4cf448d357461b10bdc53dab84', 'width': 960}, {'height': 718, 'url': 'https://external-preview.redd.it/j5mIRDfQmzCMhuuhoRBiqTjyVU9U3my41kg1qHESAFQ.jpg?width=1080&amp;crop=smart&amp;auto=webp&amp;s=8b27c7a7799bc6f04ebb4d932d75081659824f2d', 'width': 1080}], 'source': {'height': 1278, 'url': 'https://external-preview.redd.it/j5mIRDfQmzCMhuuhoRBiqTjyVU9U3my41kg1qHESAFQ.jpg?auto=webp&amp;s=0678d337d2b7dbb4557216d4c22dd7c406310154', 'width': 1920}, 'variants': {}}]}",reddit,93.0,140.0,https://sciencemint.com/scientists-developed-an-ultrafast-fiber-laser-that-produces-record-high-power/,,,,,,,,,,,
[],False,mmmmmmrrraleeeeeeee,,[],,text,t2_7jziygib,False,False,[],False,False,1602606393,self.Physics,https://www.reddit.com/r/Physics/comments/jagumn/please_help_if_you_can_thanks/,{},jagumn,True,False,False,False,True,True,False,,[],dark,text,False,False,True,0,0,False,all_ads,/r/Physics/comments/jagumn/please_help_if_you_can_thanks/,False,6,1602606404,1,"So the task goes like this: “There are two scales on the Moon. One is your common bathroom scale and the other is the precise scale that uses the balancing ( i dont know how to translate the other scale sorry)”


Question is: “which scale is going to show the exact mass of the 1 kilogram weight?”",True,False,False,Physics,t5_2qhi6,1468084,public,self,Please help if you can. Thanks,0,[],1.0,https://www.reddit.com/r/Physics/comments/jagumn/please_help_if_you_can_thanks/,all_ads,6,,,,,,,,,,,,,,,,,,,
[],False,nist,,[],,text,t2_4j9dwau1,False,False,[],False,False,1602606226,nist.gov,https://www.reddit.com/r/Physics/comments/jagsmz/microchip_resonators_produce_a_wide_range_of/,{},jagsmz,True,False,False,False,True,False,False,,[],dark,text,False,False,True,0,0,False,all_ads,/r/Physics/comments/jagsmz/microchip_resonators_produce_a_wide_range_of/,False,6,1602606239,1,,True,False,False,Physics,t5_2qhi6,1468075,public,https://b.thumbs.redditmedia.com/k3MSJg_ykN2VRdjQy2FQ4IJkupRs4LBdYuchKkv2fLo.jpg,Microchip resonators produce a wide range of visible hues from near-infrared light,0,[],1.0,https://www.nist.gov/news-events/news/2020/10/what-laser-color-do-you,all_ads,6,article,News,link,"{'enabled': False, 'images': [{'id': 'gLlsXvMw3rLEv993a_LhUHLbloYHoQgfR3NsxE4nbPQ', 'resolutions': [{'height': 96, 'url': 'https://external-preview.redd.it/CODX5N9TY1xJaVYlIA9EXo6nGpxAFd6C7FlZ_XxVeyg.jpg?width=108&amp;crop=smart&amp;auto=webp&amp;s=f35a8f7e514c83ea8b4ea75f90856955c20d0642', 'width': 108}, {'height': 193, 'url': 'https://external-preview.redd.it/CODX5N9TY1xJaVYlIA9EXo6nGpxAFd6C7FlZ_XxVeyg.jpg?width=216&amp;crop=smart&amp;auto=webp&amp;s=305e37d458082c0755527f32d6b9c2853064fd50', 'width': 216}, {'height': 286, 'url': 'https://external-preview.redd.it/CODX5N9TY1xJaVYlIA9EXo6nGpxAFd6C7FlZ_XxVeyg.jpg?width=320&amp;crop=smart&amp;auto=webp&amp;s=f30dd46706dd52f44f60b31096ecb5dae9f016c6', 'width': 320}], 'source': {'height': 545, 'url': 'https://external-preview.redd.it/CODX5N9TY1xJaVYlIA9EXo6nGpxAFd6C7FlZ_XxVeyg.jpg?auto=webp&amp;s=3fc5e34376e45bb2e86a527267e2faca6b9698f8', 'width': 609}, 'variants': {}}]}",,125.0,140.0,https://www.nist.gov/news-events/news/2020/10/what-laser-color-do-you,,,,,,,,,,,
[],False,ZimplemanLearning,,[],,text,t2_7rpwyfnm,False,False,[],False,False,1602601903,zimplelearn.com,https://www.reddit.com/r/Physics/comments/jafd04/wanna_learn_about_physics_but_dont_know_where_to/,{},jafd04,True,False,False,False,True,False,False,,[],dark,text,False,False,True,0,0,False,all_ads,/r/Physics/comments/jafd04/wanna_learn_about_physics_but_dont_know_where_to/,False,6,1602601914,1,,True,False,False,Physics,t5_2qhi6,1467992,public,default,Wanna learn about physics but don't know where to start? Here's a nice collection of online learning platforms that offer learning resources on physics 👏,0,[],1.0,https://zimplelearn.com/physics/,all_ads,6,,,,,,,,https://zimplelearn.com/physics/,,,,,,,,,,,
[],False,Clarm-Alock,,[],,text,t2_5xgoried,False,False,[],False,False,1602601760,self.Physics,https://www.reddit.com/r/Physics/comments/jafbay/diffraction_pattern_when_viewing_ac_light_with_a/,{},jafbay,True,False,False,False,True,True,False,,[],dark,text,False,False,True,3,0,False,all_ads,/r/Physics/comments/jafbay/diffraction_pattern_when_viewing_ac_light_with_a/,False,6,1602601772,1,"I had an online class today, and the entire screen had horizontal lines of light moving down the screen that looked a lot like a diffraction pattern. Can anyone tell me why what i'm fairly sure is a diffraction pattern is formed when looking at AC light through a camera?",True,False,False,Physics,t5_2qhi6,1467992,public,self,Diffraction pattern when viewing AC light with a camera,0,[],1.0,https://www.reddit.com/r/Physics/comments/jafbay/diffraction_pattern_when_viewing_ac_light_with_a/,all_ads,6,,,,,,,,,,,,,,,,,,,
[],False,hahseo,,[],,text,t2_c0vhy,False,False,[],False,False,1602600529,linkedin.com,https://www.reddit.com/r/Physics/comments/jaewu3/semiconductor/,{},jaewu3,False,False,False,False,False,False,False,,[],dark,text,False,False,True,0,0,False,all_ads,/r/Physics/comments/jaewu3/semiconductor/,False,6,1602600541,1,,True,False,False,Physics,t5_2qhi6,1467981,public,https://b.thumbs.redditmedia.com/-U0kA0A67V_mNXaEMNCPEqoX23YVLDpi067TnOiDV8w.jpg,Semiconductor,0,[],1.0,https://www.linkedin.com/pulse/semiconductor-homework-assignment-help,all_ads,6,,,link,"{'enabled': False, 'images': [{'id': 'MIjJgmLE_xeyXG9As-zdzZSJLeHfzUf160-6OuQ6Z4c', 'resolutions': [{'height': 44, 'url': 'https://external-preview.redd.it/s1umF_ifx0032aIhaFu_9qWkF9j-XFJxLUM2rmlbmqo.jpg?width=108&amp;crop=smart&amp;auto=webp&amp;s=7da4bff8e2c13bff590377177ac7b3b4db7f559f', 'width': 108}, {'height': 89, 'url': 'https://external-preview.redd.it/s1umF_ifx0032aIhaFu_9qWkF9j-XFJxLUM2rmlbmqo.jpg?width=216&amp;crop=smart&amp;auto=webp&amp;s=a3593d4d7c1e22382424f4a6d110311308bb11f0', 'width': 216}, {'height': 132, 'url': 'https://external-preview.redd.it/s1umF_ifx0032aIhaFu_9qWkF9j-XFJxLUM2rmlbmqo.jpg?width=320&amp;crop=smart&amp;auto=webp&amp;s=e94bddcecb3146373d8903c04c6f5125b32e1b69', 'width': 320}, {'height': 264, 'url': 'https://external-preview.redd.it/s1umF_ifx0032aIhaFu_9qWkF9j-XFJxLUM2rmlbmqo.jpg?width=640&amp;crop=smart&amp;auto=webp&amp;s=ed644c4594cecf9b2ada8371b694020057184923', 'width': 640}], 'source': {'height': 373, 'url': 'https://external-preview.redd.it/s1umF_ifx0032aIhaFu_9qWkF9j-XFJxLUM2rmlbmqo.jpg?auto=webp&amp;s=5507f502cd4393bda3619c8fb82c01a4238c5a15', 'width': 904}, 'variants': {}}]}",reddit,57.0,140.0,https://www.linkedin.com/pulse/semiconductor-homework-assignment-help,,,,,,,,,,,
[],False,tsseleeh,,[],,text,t2_82mfof41,False,False,[],False,False,1602599378,self.Physics,https://www.reddit.com/r/Physics/comments/jaejdo/can_anyone_tell_me_how_to_solve_this_im_not_very/,{},jaejdo,True,False,False,False,True,True,False,,[],dark,text,False,False,True,4,0,False,all_ads,/r/Physics/comments/jaejdo/can_anyone_tell_me_how_to_solve_this_im_not_very/,False,6,1602599389,1,"   
You found a treasure map and it said: start at the well, go 100 m straight South, then 30 mWest, then 25 straight East, and finally 45 m, North. Using the component method of vector addition, how far from the well and in what direction is the hidden treasure?",True,False,False,Physics,t5_2qhi6,1467967,public,self,can anyone tell me how to solve this im not very smart,0,[],0.99,https://www.reddit.com/r/Physics/comments/jaejdo/can_anyone_tell_me_how_to_solve_this_im_not_very/,all_ads,6,,,,,,,,,,,,,,,,,,,
[],False,purecssindia,,[],,text,t2_8ccp5ex9,False,False,[],False,False,1602599196,self.Physics,https://www.reddit.com/r/Physics/comments/jaehbc/smart_devices_radiations/,{},jaehbc,True,False,False,False,True,True,False,,[],dark,text,False,False,True,3,0,False,all_ads,/r/Physics/comments/jaehbc/smart_devices_radiations/,False,6,1602599211,1,"How can I check mobile radiations in workplace or Home?

Is it possible if number of Smart Devices increased can increase radiation?

Your answer will be helpful for our audience in INDIA so Thanks in advance

[smartsaviors.blogspot.com](https://smartsaviors.blogspot.com)

[www.facebook.com/SMARTSAVIORS](https://www.facebook.com/SMARTSAVIORS)

[https://www.youtube.com/channel/UCKlKyrRd1Rt7N\_KGKVNmcgA](https://www.youtube.com/channel/UCKlKyrRd1Rt7N_KGKVNmcgA)",True,False,False,Physics,t5_2qhi6,1467962,public,self,Smart Devices Radiations,0,[],1.0,https://www.reddit.com/r/Physics/comments/jaehbc/smart_devices_radiations/,all_ads,6,,,,,,,,,,,,,,,,,,,
[],False,Geekyguy20,,[],,text,t2_8e9v66nw,False,False,[],False,False,1602595702,sciencemint.com,https://www.reddit.com/r/Physics/comments/jaddbb/scientists_developed_an_ultrafast_fiber_laser/,{},jaddbb,False,False,False,False,False,False,False,,[],dark,text,False,False,True,0,0,False,all_ads,/r/Physics/comments/jaddbb/scientists_developed_an_ultrafast_fiber_laser/,False,6,1602595712,1,,True,False,False,Physics,t5_2qhi6,1467844,public,https://b.thumbs.redditmedia.com/T1Ja7tAd1Z5JYOD8PKJ8UiSnc-mXpE2vpTh7W8-n_Vk.jpg,Scientists developed an ultrafast fiber laser that produces record-high power,0,[],1.0,https://sciencemint.com/scientists-developed-an-ultrafast-fiber-laser-that-produces-record-high-power/,all_ads,6,,,link,"{'enabled': False, 'images': [{'id': '6OmIZDuEw4l2Tjs2xyWd8MJaxTT2jXBX5Opm5LV70gA', 'resolutions': [{'height': 71, 'url': 'https://external-preview.redd.it/j5mIRDfQmzCMhuuhoRBiqTjyVU9U3my41kg1qHESAFQ.jpg?width=108&amp;crop=smart&amp;auto=webp&amp;s=9acae33043e65c3522b7ee1a45dc06605e10fa34', 'width': 108}, {'height': 143, 'url': 'https://external-preview.redd.it/j5mIRDfQmzCMhuuhoRBiqTjyVU9U3my41kg1qHESAFQ.jpg?width=216&amp;crop=smart&amp;auto=webp&amp;s=151a2dfac032ba71c439c174a94802c2b7307446', 'width': 216}, {'height': 213, 'url': 'https://external-preview.redd.it/j5mIRDfQmzCMhuuhoRBiqTjyVU9U3my41kg1qHESAFQ.jpg?width=320&amp;crop=smart&amp;auto=webp&amp;s=76ab4821fa57ec5c17ca6a7b6ad44940d98404c1', 'width': 320}, {'height': 426, 'url': 'https://external-preview.redd.it/j5mIRDfQmzCMhuuhoRBiqTjyVU9U3my41kg1qHESAFQ.jpg?width=640&amp;crop=smart&amp;auto=webp&amp;s=91587402149baf922b6011747e690ba2cdb92b17', 'width': 640}, {'height': 639, 'url': 'https://external-preview.redd.it/j5mIRDfQmzCMhuuhoRBiqTjyVU9U3my41kg1qHESAFQ.jpg?width=960&amp;crop=smart&amp;auto=webp&amp;s=2b13d54c973bac4cf448d357461b10bdc53dab84', 'width': 960}, {'height': 718, 'url': 'https://external-preview.redd.it/j5mIRDfQmzCMhuuhoRBiqTjyVU9U3my41kg1qHESAFQ.jpg?width=1080&amp;crop=smart&amp;auto=webp&amp;s=8b27c7a7799bc6f04ebb4d932d75081659824f2d', 'width': 1080}], 'source': {'height': 1278, 'url': 'https://external-preview.redd.it/j5mIRDfQmzCMhuuhoRBiqTjyVU9U3my41kg1qHESAFQ.jpg?auto=webp&amp;s=0678d337d2b7dbb4557216d4c22dd7c406310154', 'width': 1920}, 'variants': {}}]}",reddit,93.0,140.0,https://sciencemint.com/scientists-developed-an-ultrafast-fiber-laser-that-produces-record-high-power/,,,,,,,,,,,
[],False,drsmba729,,[],,text,t2_13noiq,False,False,[],False,False,1602595697,self.Physics,https://www.reddit.com/r/Physics/comments/jadd9t/since_humans_generate_a_small_charge_of/,{},jadd9t,True,False,False,False,True,True,False,,[],dark,text,False,False,True,10,0,False,all_ads,/r/Physics/comments/jadd9t/since_humans_generate_a_small_charge_of/,False,6,1602595709,1,,True,False,False,Physics,t5_2qhi6,1467844,public,self,"Since humans generate a small charge of electricity, how many people would it take to power things?",0,[],1.0,https://www.reddit.com/r/Physics/comments/jadd9t/since_humans_generate_a_small_charge_of/,all_ads,6,question,Question,,,,,,,,,,,,,,,,,
[],False,rhettallain,inter,[],Education and outreach,text,t2_37955,False,False,[],False,False,1602592120,youtu.be,https://www.reddit.com/r/Physics/comments/jacdj0/finding_a_path_with_the_shortest_time_is_called/,{},jacdj0,True,False,False,False,True,False,False,,[],dark,text,False,False,True,31,0,False,all_ads,/r/Physics/comments/jacdj0/finding_a_path_with_the_shortest_time_is_called/,False,6,1602592130,1,,True,False,False,Physics,t5_2qhi6,1467780,public,https://b.thumbs.redditmedia.com/yC7hvVDn9SSc6BpiQOkb0zBYduovCurtC8adXEEDO7w.jpg,Finding a path with the shortest time is called the Brachistochrone problem. Here is my solution - it only needs 7 simple tricks (and totally not obvious).,0,[],1.0,https://youtu.be/geBj865enOg,all_ads,6,image,Video,rich:video,"{'enabled': False, 'images': [{'id': 'dGNrrJb0C_uvOWBHtufZadsxL3hmbWTAf9-YQzyAfGU', 'resolutions': [{'height': 81, 'url': 'https://external-preview.redd.it/rIVGaqoylFlsACI2hK4oV9lbzfyrotcL6DPeZ1KbuYk.jpg?width=108&amp;crop=smart&amp;auto=webp&amp;s=c579223cb695c725cb8cfea02d4b73c4dd4e5472', 'width': 108}, {'height': 162, 'url': 'https://external-preview.redd.it/rIVGaqoylFlsACI2hK4oV9lbzfyrotcL6DPeZ1KbuYk.jpg?width=216&amp;crop=smart&amp;auto=webp&amp;s=5d8bb9cc2c29de87bce83e32c4b15d91dfe072f2', 'width': 216}, {'height': 240, 'url': 'https://external-preview.redd.it/rIVGaqoylFlsACI2hK4oV9lbzfyrotcL6DPeZ1KbuYk.jpg?width=320&amp;crop=smart&amp;auto=webp&amp;s=a09c176d31b0d89dc3cfd78e9ce865e0a0c9c222', 'width': 320}], 'source': {'height': 360, 'url': 'https://external-preview.redd.it/rIVGaqoylFlsACI2hK4oV9lbzfyrotcL6DPeZ1KbuYk.jpg?auto=webp&amp;s=4909ff6bdb65374ccd610a2a5f65f98bcfda1a59', 'width': 480}, 'variants': {}}]}",,105.0,140.0,https://youtu.be/geBj865enOg,4a8885d4-c6b2-11e4-827e-22000b2a8bad,dark,,"{'oembed': {'author_name': 'Physics Explained', 'author_url': 'https://www.youtube.com/channel/UCVxIDFY01y4n_c2lK1TB-KA', 'height': 338, 'html': '&lt;iframe width=""600"" height=""338"" src=""https://www.youtube.com/embed/geBj865enOg?feature=oembed&amp;enablejsapi=1"" frameborder=""0"" allow=""accelerometer; autoplay; clipboard-write; encrypted-media; gyroscope; picture-in-picture"" allowfullscreen&gt;&lt;/iframe&gt;', 'provider_name': 'YouTube', 'provider_url': 'https://www.youtube.com/', 'thumbnail_height': 360, 'thumbnail_url': 'https://i.ytimg.com/vi/geBj865enOg/hqdefault.jpg', 'thumbnail_width': 480, 'title': 'A solution to the Brachistochrone problem using only 7 tricks.', 'type': 'video', 'version': '1.0', 'width': 600}, 'type': 'youtube.com'}","{'content': '&lt;iframe width=""600"" height=""338"" src=""https://www.youtube.com/embed/geBj865enOg?feature=oembed&amp;enablejsapi=1"" frameborder=""0"" allow=""accelerometer; autoplay; clipboard-write; encrypted-media; gyroscope; picture-in-picture"" allowfullscreen&gt;&lt;/iframe&gt;', 'height': 338, 'scrolling': False, 'width': 600}","{'oembed': {'author_name': 'Physics Explained', 'author_url': 'https://www.youtube.com/channel/UCVxIDFY01y4n_c2lK1TB-KA', 'height': 338, 'html': '&lt;iframe width=""600"" height=""338"" src=""https://www.youtube.com/embed/geBj865enOg?feature=oembed&amp;enablejsapi=1"" frameborder=""0"" allow=""accelerometer; autoplay; clipboard-write; encrypted-media; gyroscope; picture-in-picture"" allowfullscreen&gt;&lt;/iframe&gt;', 'provider_name': 'YouTube', 'provider_url': 'https://www.youtube.com/', 'thumbnail_height': 360, 'thumbnail_url': 'https://i.ytimg.com/vi/geBj865enOg/hqdefault.jpg', 'thumbnail_width': 480, 'title': 'A solution to the Brachistochrone problem using only 7 tricks.', 'type': 'video', 'version': '1.0', 'width': 600}, 'type': 'youtube.com'}","{'content': '&lt;iframe width=""600"" height=""338"" src=""https://www.youtube.com/embed/geBj865enOg?feature=oembed&amp;enablejsapi=1"" frameborder=""0"" allow=""accelerometer; autoplay; clipboard-write; encrypted-media; gyroscope; picture-in-picture"" allowfullscreen&gt;&lt;/iframe&gt;', 'height': 338, 'media_domain_url': 'https://www.redditmedia.com/mediaembed/jacdj0', 'scrolling': False, 'width': 600}",,,,
