[],False,Galileos_grandson,astro,[],Astronomy,text,t2_rws7n,False,False,[],False,False,1602953251,centauri-dreams.org,https://www.reddit.com/r/Physics/comments/jcyke0/on_john_barrow_19522020_cosmologist_mathematician/,{},jcyke0,True,False,False,False,True,False,False,,,[],,dark,text,False,False,True,20,0,False,all_ads,/r/Physics/comments/jcyke0/on_john_barrow_19522020_cosmologist_mathematician/,False,6,1602953262,1,,True,False,False,Physics,t5_2qhi6,1474947,public,https://b.thumbs.redditmedia.com/rIr5u4yhGMxyFELby2KiLG8tU7PMUHKPwoLuDyVGBwM.jpg,"On John Barrow (1952-2020) - Cosmologist, mathematician and physicist",0,[],1.0,https://www.centauri-dreams.org/2020/10/16/on-john-barrow-1952-2020/,all_ads,6,link,"{'enabled': False, 'images': [{'id': 'xHgmlCQnHQ_3yA69aznbIfx3ZggCxRapBEqm66LfFYw', 'resolutions': [{'height': 86, 'url': 'https://external-preview.redd.it/_wdc8m6YVt0SxKqduE4aDejeANgpW4NE-v2jZvBfwzE.jpg?width=108&amp;crop=smart&amp;auto=webp&amp;s=17a4a0705a906354513873438d75fd85df11cac9', 'width': 108}, {'height': 172, 'url': 'https://external-preview.redd.it/_wdc8m6YVt0SxKqduE4aDejeANgpW4NE-v2jZvBfwzE.jpg?width=216&amp;crop=smart&amp;auto=webp&amp;s=ab73aeed7c35d36f1a26ecd33588dfe8d37152bf', 'width': 216}, {'height': 255, 'url': 'https://external-preview.redd.it/_wdc8m6YVt0SxKqduE4aDejeANgpW4NE-v2jZvBfwzE.jpg?width=320&amp;crop=smart&amp;auto=webp&amp;s=936129f8b6f4ccef438984ad5358b5b20df700ed', 'width': 320}], 'source': {'height': 439, 'url': 'https://external-preview.redd.it/_wdc8m6YVt0SxKqduE4aDejeANgpW4NE-v2jZvBfwzE.jpg?auto=webp&amp;s=d1e61d6eea5f542e8a4f12ce39067d70c855f85b', 'width': 550}, 'variants': {}}]}",111.0,140.0,https://www.centauri-dreams.org/2020/10/16/on-john-barrow-1952-2020/,,,,dark,,,,,,,,,,
[],False,krlosrope,,[],,text,t2_q2ggrs5,False,False,[],False,False,1602953124,self.Physics,https://www.reddit.com/r/Physics/comments/jcyiyx/college_jobs_that_also_help_further_education/,{},jcyiyx,True,False,False,False,True,True,False,,,[],,dark,text,False,False,False,0,0,False,all_ads,/r/Physics/comments/jcyiyx/college_jobs_that_also_help_further_education/,False,6,1602953135,1,"What are some sidejobs to have during college to not only earn some money, but also help with building a career as a physicst. Things involving physics, programming, etc",True,False,False,Physics,t5_2qhi6,1474948,public,self,College jobs that also help further education.,0,[],1.0,https://www.reddit.com/r/Physics/comments/jcyiyx/college_jobs_that_also_help_further_education/,all_ads,6,,,,,,,,,,,,,,,,,,,
[],False,paultamio_05,,[],,text,t2_8fltkfxu,False,False,[],False,False,1602952412,self.Physics,https://www.reddit.com/r/Physics/comments/jcyatd/hey_guys_kindly_share_some_sites_books_or_apps/,{},jcyatd,True,False,False,False,True,True,False,,,[],,dark,text,False,False,True,0,0,False,all_ads,/r/Physics/comments/jcyatd/hey_guys_kindly_share_some_sites_books_or_apps/,False,6,1602952422,1,,True,False,False,Physics,t5_2qhi6,1474940,public,self,"Hey guys! Kindly share some sites, books or apps that you are using right now to study physics. Much better if you will recommend me some Physics for Engineers references",0,[],1.0,https://www.reddit.com/r/Physics/comments/jcyatd/hey_guys_kindly_share_some_sites_books_or_apps/,all_ads,6,,,,,,,,,,,,,,,,,,,
[],False,dlpr,,[],,text,t2_4bzhq,False,False,[],False,False,1602948760,youtube.com,https://www.reddit.com/r/Physics/comments/jcx6vg/fascinating_talk/,{},jcx6vg,True,False,False,False,True,False,False,,image,[],Video,dark,text,False,False,True,0,0,False,all_ads,/r/Physics/comments/jcx6vg/fascinating_talk/,False,6,1602948770,1,,True,False,False,Physics,t5_2qhi6,1474835,public,https://b.thumbs.redditmedia.com/iO0eR0qr7dNQPgmZTX99yvpKIUelVaUrG20SD-X6h2E.jpg,Fascinating talk,0,[],1.0,https://www.youtube.com/watch?v=oVi9FqmcZBM,all_ads,6,rich:video,"{'enabled': False, 'images': [{'id': 'fglyCWjNa8kMud3XO9R7uvn_QZDQC2owyzkAZEewKZc', 'resolutions': [{'height': 81, 'url': 'https://external-preview.redd.it/TAeq10F1HnlcTCayQ5tN67HEk2312y-RVkK0s3-qrb4.jpg?width=108&amp;crop=smart&amp;auto=webp&amp;s=35893885d8acedff2d996069e7e7370949e2bca3', 'width': 108}, {'height': 162, 'url': 'https://external-preview.redd.it/TAeq10F1HnlcTCayQ5tN67HEk2312y-RVkK0s3-qrb4.jpg?width=216&amp;crop=smart&amp;auto=webp&amp;s=2cbf4bb7bb4a796773c647d1bbd016fd22f325f0', 'width': 216}, {'height': 240, 'url': 'https://external-preview.redd.it/TAeq10F1HnlcTCayQ5tN67HEk2312y-RVkK0s3-qrb4.jpg?width=320&amp;crop=smart&amp;auto=webp&amp;s=f7ccf92dd8474ecc061e4076f7390e6c852f7c58', 'width': 320}], 'source': {'height': 360, 'url': 'https://external-preview.redd.it/TAeq10F1HnlcTCayQ5tN67HEk2312y-RVkK0s3-qrb4.jpg?auto=webp&amp;s=19e2f7a8d97cda5de38ffd81bec3495bb111adfa', 'width': 480}, 'variants': {}}]}",105.0,140.0,https://www.youtube.com/watch?v=oVi9FqmcZBM,,,,,,"{'oembed': {'author_name': 'Pioneer Works', 'author_url': 'https://www.youtube.com/channel/UCvz10aafWdDEvO_4ehcr0jQ', 'height': 338, 'html': '&lt;iframe width=""600"" height=""338"" src=""https://www.youtube.com/embed/oVi9FqmcZBM?feature=oembed&amp;enablejsapi=1"" frameborder=""0"" allow=""accelerometer; autoplay; clipboard-write; encrypted-media; gyroscope; picture-in-picture"" allowfullscreen&gt;&lt;/iframe&gt;', 'provider_name': 'YouTube', 'provider_url': 'https://www.youtube.com/', 'thumbnail_height': 360, 'thumbnail_url': 'https://i.ytimg.com/vi/oVi9FqmcZBM/hqdefault.jpg', 'thumbnail_width': 480, 'title': 'Scientific Controversies: Black Holes', 'type': 'video', 'version': '1.0', 'width': 600}, 'type': 'youtube.com'}","{'content': '&lt;iframe width=""600"" height=""338"" src=""https://www.youtube.com/embed/oVi9FqmcZBM?feature=oembed&amp;enablejsapi=1"" frameborder=""0"" allow=""accelerometer; autoplay; clipboard-write; encrypted-media; gyroscope; picture-in-picture"" allowfullscreen&gt;&lt;/iframe&gt;', 'height': 338, 'scrolling': False, 'width': 600}","{'oembed': {'author_name': 'Pioneer Works', 'author_url': 'https://www.youtube.com/channel/UCvz10aafWdDEvO_4ehcr0jQ', 'height': 338, 'html': '&lt;iframe width=""600"" height=""338"" src=""https://www.youtube.com/embed/oVi9FqmcZBM?feature=oembed&amp;enablejsapi=1"" frameborder=""0"" allow=""accelerometer; autoplay; clipboard-write; encrypted-media; gyroscope; picture-in-picture"" allowfullscreen&gt;&lt;/iframe&gt;', 'provider_name': 'YouTube', 'provider_url': 'https://www.youtube.com/', 'thumbnail_height': 360, 'thumbnail_url': 'https://i.ytimg.com/vi/oVi9FqmcZBM/hqdefault.jpg', 'thumbnail_width': 480, 'title': 'Scientific Controversies: Black Holes', 'type': 'video', 'version': '1.0', 'width': 600}, 'type': 'youtube.com'}","{'content': '&lt;iframe width=""600"" height=""338"" src=""https://www.youtube.com/embed/oVi9FqmcZBM?feature=oembed&amp;enablejsapi=1"" frameborder=""0"" allow=""accelerometer; autoplay; clipboard-write; encrypted-media; gyroscope; picture-in-picture"" allowfullscreen&gt;&lt;/iframe&gt;', 'height': 338, 'media_domain_url': 'https://www.redditmedia.com/mediaembed/jcx6vg', 'scrolling': False, 'width': 600}",,,,,
[],False,informationtiger,,[],,text,t2_5ffgxz3,False,False,[],False,False,1602944919,self.Physics,https://www.reddit.com/r/Physics/comments/jcw2fu/a_few_questions_about_quantum_physics/,{},jcw2fu,True,False,False,False,True,True,False,,question,[],Question,dark,text,False,False,False,10,0,False,all_ads,/r/Physics/comments/jcw2fu/a_few_questions_about_quantum_physics/,False,6,1602944929,1,"So I've recently been watching Veritasium and The Royal Institution videos... and I still don't understand most of the stuff.

My journey in trying to understand quantum physics has gone from total Deepak Chopra woo nonsense, to somewhat respectable... and yet I feel there are lots of gaps in my knowledge and misunderstandings which I blame on popular media (Schrodinger's cat memes ugh). And every time I watch a video to try understand it, it only leads me to a ton of new questions which I have trouble resolving.

So here are a few questions/assumptions, please go ahead and correct &amp; add to all of this ""knowledge"":

What is a a wave-particle duality?

Is a ""particle"" really also a wave at the same time, or is it better to view this whole thing in a ""quantum fields"" way - where a particle is simply a disturbance traveling on a quantum field?

​ ※

In orbital models, does the 3D blob shape really mean that the the electron is everywhere in that blob area at the same time UNTIL we make a measurement when the ""wave function collapses"" and it ""chooses"" it's location. OR is it better to think of it as a visual representation of the probability of finding an electron WERE we to make a measurement, meaning that the electron COULD have been in that location prior to making the measurement, and in an empirical sense it actually being there.

Epistemologically - How do we know the state of a particle prior to making a measurement? I mean it's impossible to see what's going on behind closed doors, so how do physicists know whether a particle is everywhere at the same time or only in a specific location, prior to observation?

How do we measure the location of the particle? Does it involve hitting a particle with another particle, but due to it being so small, the act of ""measuring"" (""hitting"") it influences it in a way that a big sized object wouldn't be?

Also what does it mean that we can't know a particle's position and location at the same time?

Observer effect

What is meant by observer effect? I'm assuming that means the act of measurement, and not the literal physical presence of the brains and eyes of the researchers, as often implied. Is that correct?

Quantum physics - brain/consciousness connection. Total woo or some truth in that?

What does the double slit experiment tell us? How should I go about visualising it? I'm assuming thinking about it as literal waves is misleading, since real waves are classical objects. Could the pattern on the detector sheet simply be an interference pattern like with sound, except it's a ""quantum field"" adding and subtracting ""energy (amplitude)"" - sometimes there being enough energy to create a particle\*, and sometimes cancelling it out to create nothing - appearing as a blank space on the detector sheet. (That is assuming the quantum fields interpretation or whatever).

\* I'm going on the assumption that a certain ""energy"" threshold needs to be crossed for a particle to appear, just as with a certain energy threshold needing to be crossed for an electron to move from one orbital energy level to another in an atom, and there being nothing in between.

※ Continuing on the quantum fields thread:

Is it possible that each of the properties of a particle exists on a separate quantum ""field"", ones that interact, some of which overlap? So when a particle is entangled, the information does not travel instantaneously at all, but was literally the same ""particle"" (disturbance) on a quantum field for that single property of a particle, whereas the other properties are ""distant"", or rather separate, on other quantum fields. Is this also what could explain particles knowing ""the future"" in the double slit experiment - where the electrons are all related in some way, yet physically and timewise(?) distant on another ""field"". (if that is that some of these fields aren't simply checkboxes in some settings menu).

Speaking of time and space - how do they relate to particles? Do particles see/experience/care about space and time or not at all... (sorry I'm having a hard time explaining this... it's related to particles 'knowing' the future, and properties being ""distant"", or if that's completely wrong - information travelling instantly between two entangled particles.)

My physics education has been pretty poor, but I'm unsatisfied with the mainstream vague explanations. Please update me on anything I got wrong, as well as add anything I should know about.

Any material for further understanding (that's easy to understand as a layperson) much appreciated!",True,False,False,Physics,t5_2qhi6,1474759,public,self,A few questions about quantum physics,0,[],1.0,https://www.reddit.com/r/Physics/comments/jcw2fu/a_few_questions_about_quantum_physics/,all_ads,6,,,,,,,,,,,,,,,,,,,
[],False,Weary_Lynx8253,,[],,text,t2_8hol9tn4,False,False,[],False,False,1602941416,youtu.be,https://www.reddit.com/r/Physics/comments/jcv4yn/convert_degree_min_and_second_into_radian/,{},jcv4yn,False,False,False,False,False,False,False,,,[],,dark,text,False,False,True,1,0,False,all_ads,/r/Physics/comments/jcv4yn/convert_degree_min_and_second_into_radian/,False,6,1602941427,1,,True,False,False,Physics,t5_2qhi6,1474696,public,https://b.thumbs.redditmedia.com/BgfttvVjTdx17Out0V3NL21Mmaovn5FSYTlPu8sNt_c.jpg,"convert degree, min and second into radian",0,[],1.0,https://youtu.be/7f_FvwlSZfw,all_ads,6,rich:video,"{'enabled': False, 'images': [{'id': 'gsjBrs8XEZ73tqt0IjdlwdXap6OdTSsGqLBKJ_gLiXg', 'resolutions': [{'height': 81, 'url': 'https://external-preview.redd.it/xT-Aw1t067g0MKXuFzJaa-zjQDjs_kHLyuE1ZyoJOt4.jpg?width=108&amp;crop=smart&amp;auto=webp&amp;s=43ab62ab2aedb9378c13ac59ffda8aa74be60d17', 'width': 108}, {'height': 162, 'url': 'https://external-preview.redd.it/xT-Aw1t067g0MKXuFzJaa-zjQDjs_kHLyuE1ZyoJOt4.jpg?width=216&amp;crop=smart&amp;auto=webp&amp;s=abf780fed88974a4ac7f9ad5793a3d3744c38c22', 'width': 216}, {'height': 240, 'url': 'https://external-preview.redd.it/xT-Aw1t067g0MKXuFzJaa-zjQDjs_kHLyuE1ZyoJOt4.jpg?width=320&amp;crop=smart&amp;auto=webp&amp;s=5748f1d7ca9b71aa97cea2500815ee24bb91f9a8', 'width': 320}], 'source': {'height': 360, 'url': 'https://external-preview.redd.it/xT-Aw1t067g0MKXuFzJaa-zjQDjs_kHLyuE1ZyoJOt4.jpg?auto=webp&amp;s=fa9e75031ef44a305c74e4dc60dd7e3288c5415a', 'width': 480}, 'variants': {}}]}",105.0,140.0,https://youtu.be/7f_FvwlSZfw,moderator,,,,,"{'oembed': {'author_name': 'Learn CBSE Er. Onkar Singh', 'author_url': 'https://www.youtube.com/channel/UCPPSth9R4xdWTEun-w9fGmQ', 'height': 338, 'html': '&lt;iframe width=""600"" height=""338"" src=""https://www.youtube.com/embed/7f_FvwlSZfw?feature=oembed&amp;enablejsapi=1"" frameborder=""0"" allow=""accelerometer; autoplay; clipboard-write; encrypted-media; gyroscope; picture-in-picture"" allowfullscreen&gt;&lt;/iframe&gt;', 'provider_name': 'YouTube', 'provider_url': 'https://www.youtube.com/', 'thumbnail_height': 360, 'thumbnail_url': 'https://i.ytimg.com/vi/7f_FvwlSZfw/hqdefault.jpg', 'thumbnail_width': 480, 'title': 'Convert 1degree 1min and 1sec into radian', 'type': 'video', 'version': '1.0', 'width': 600}, 'type': 'youtube.com'}","{'content': '&lt;iframe width=""600"" height=""338"" src=""https://www.youtube.com/embed/7f_FvwlSZfw?feature=oembed&amp;enablejsapi=1"" frameborder=""0"" allow=""accelerometer; autoplay; clipboard-write; encrypted-media; gyroscope; picture-in-picture"" allowfullscreen&gt;&lt;/iframe&gt;', 'height': 338, 'scrolling': False, 'width': 600}","{'oembed': {'author_name': 'Learn CBSE Er. Onkar Singh', 'author_url': 'https://www.youtube.com/channel/UCPPSth9R4xdWTEun-w9fGmQ', 'height': 338, 'html': '&lt;iframe width=""600"" height=""338"" src=""https://www.youtube.com/embed/7f_FvwlSZfw?feature=oembed&amp;enablejsapi=1"" frameborder=""0"" allow=""accelerometer; autoplay; clipboard-write; encrypted-media; gyroscope; picture-in-picture"" allowfullscreen&gt;&lt;/iframe&gt;', 'provider_name': 'YouTube', 'provider_url': 'https://www.youtube.com/', 'thumbnail_height': 360, 'thumbnail_url': 'https://i.ytimg.com/vi/7f_FvwlSZfw/hqdefault.jpg', 'thumbnail_width': 480, 'title': 'Convert 1degree 1min and 1sec into radian', 'type': 'video', 'version': '1.0', 'width': 600}, 'type': 'youtube.com'}","{'content': '&lt;iframe width=""600"" height=""338"" src=""https://www.youtube.com/embed/7f_FvwlSZfw?feature=oembed&amp;enablejsapi=1"" frameborder=""0"" allow=""accelerometer; autoplay; clipboard-write; encrypted-media; gyroscope; picture-in-picture"" allowfullscreen&gt;&lt;/iframe&gt;', 'height': 338, 'media_domain_url': 'https://www.redditmedia.com/mediaembed/jcv4yn', 'scrolling': False, 'width': 600}",,,,,
[],False,Weary_Lynx8253,,[],,text,t2_8hol9tn4,False,False,[],False,False,1602941274,youtube.com,https://www.reddit.com/r/Physics/comments/jcv3ox/3_methods_to_find_limit_of_rational_function_lect/,{},jcv3ox,False,False,False,False,False,False,False,,,[],,dark,text,False,False,True,0,0,False,all_ads,/r/Physics/comments/jcv3ox/3_methods_to_find_limit_of_rational_function_lect/,False,6,1602941285,1,,True,False,False,Physics,t5_2qhi6,1474693,public,https://b.thumbs.redditmedia.com/__DO-HZSYBNlDoaZNF8UgEdAtWS2RBRmK9rZ34UoyLg.jpg,3 methods to find limit of Rational Function Lect 6 Chap 13 Class 11,0,[],1.0,https://www.youtube.com/watch?v=W_gt8skkK_8&amp;feature=share,all_ads,6,rich:video,"{'enabled': False, 'images': [{'id': 'EFUSJoWkK--uUQzsNwjmDWVwE3gfWrrjDZB41d9q5ig', 'resolutions': [{'height': 81, 'url': 'https://external-preview.redd.it/kbpzNTNw99tnkPe0VNERepQwyAnwP1ZOt_WpEs4hiwc.jpg?width=108&amp;crop=smart&amp;auto=webp&amp;s=75de3ec64cc2f46de4ecf01b47ee07fa8d5576f0', 'width': 108}, {'height': 162, 'url': 'https://external-preview.redd.it/kbpzNTNw99tnkPe0VNERepQwyAnwP1ZOt_WpEs4hiwc.jpg?width=216&amp;crop=smart&amp;auto=webp&amp;s=ca4397e961a2b9d12d94dd7ab29760fe22d5cb8b', 'width': 216}, {'height': 240, 'url': 'https://external-preview.redd.it/kbpzNTNw99tnkPe0VNERepQwyAnwP1ZOt_WpEs4hiwc.jpg?width=320&amp;crop=smart&amp;auto=webp&amp;s=60c98cf5e37d1c11f843cea18705f7e9dc8e5811', 'width': 320}], 'source': {'height': 360, 'url': 'https://external-preview.redd.it/kbpzNTNw99tnkPe0VNERepQwyAnwP1ZOt_WpEs4hiwc.jpg?auto=webp&amp;s=ce6f9ed9159feca42422129edeaccef95fb63a75', 'width': 480}, 'variants': {}}]}",105.0,140.0,https://www.youtube.com/watch?v=W_gt8skkK_8&amp;feature=share,moderator,,,,,"{'oembed': {'author_name': 'Learn CBSE Er. Onkar Singh', 'author_url': 'https://www.youtube.com/channel/UCPPSth9R4xdWTEun-w9fGmQ', 'height': 338, 'html': '&lt;iframe width=""600"" height=""338"" src=""https://www.youtube.com/embed/W_gt8skkK_8?feature=oembed&amp;enablejsapi=1"" frameborder=""0"" allow=""accelerometer; autoplay; clipboard-write; encrypted-media; gyroscope; picture-in-picture"" allowfullscreen&gt;&lt;/iframe&gt;', 'provider_name': 'YouTube', 'provider_url': 'https://www.youtube.com/', 'thumbnail_height': 360, 'thumbnail_url': 'https://i.ytimg.com/vi/W_gt8skkK_8/hqdefault.jpg', 'thumbnail_width': 480, 'title': '3 methods to find limit of Rational Function Lect 6 Chap 13 Class 11', 'type': 'video', 'version': '1.0', 'width': 600}, 'type': 'youtube.com'}","{'content': '&lt;iframe width=""600"" height=""338"" src=""https://www.youtube.com/embed/W_gt8skkK_8?feature=oembed&amp;enablejsapi=1"" frameborder=""0"" allow=""accelerometer; autoplay; clipboard-write; encrypted-media; gyroscope; picture-in-picture"" allowfullscreen&gt;&lt;/iframe&gt;', 'height': 338, 'scrolling': False, 'width': 600}","{'oembed': {'author_name': 'Learn CBSE Er. Onkar Singh', 'author_url': 'https://www.youtube.com/channel/UCPPSth9R4xdWTEun-w9fGmQ', 'height': 338, 'html': '&lt;iframe width=""600"" height=""338"" src=""https://www.youtube.com/embed/W_gt8skkK_8?feature=oembed&amp;enablejsapi=1"" frameborder=""0"" allow=""accelerometer; autoplay; clipboard-write; encrypted-media; gyroscope; picture-in-picture"" allowfullscreen&gt;&lt;/iframe&gt;', 'provider_name': 'YouTube', 'provider_url': 'https://www.youtube.com/', 'thumbnail_height': 360, 'thumbnail_url': 'https://i.ytimg.com/vi/W_gt8skkK_8/hqdefault.jpg', 'thumbnail_width': 480, 'title': '3 methods to find limit of Rational Function Lect 6 Chap 13 Class 11', 'type': 'video', 'version': '1.0', 'width': 600}, 'type': 'youtube.com'}","{'content': '&lt;iframe width=""600"" height=""338"" src=""https://www.youtube.com/embed/W_gt8skkK_8?feature=oembed&amp;enablejsapi=1"" frameborder=""0"" allow=""accelerometer; autoplay; clipboard-write; encrypted-media; gyroscope; picture-in-picture"" allowfullscreen&gt;&lt;/iframe&gt;', 'height': 338, 'media_domain_url': 'https://www.redditmedia.com/mediaembed/jcv3ox', 'scrolling': False, 'width': 600}",,,,,
[],False,ashishcss,,[],,text,t2_6lpzpy6n,False,False,[],False,False,1602938556,youtu.be,https://www.reddit.com/r/Physics/comments/jcugj6/a_second_magnetic_field_surrounding_our_planet/,{},jcugj6,True,False,False,False,True,False,False,,image,[],Video,dark,text,False,False,True,0,0,False,all_ads,/r/Physics/comments/jcugj6/a_second_magnetic_field_surrounding_our_planet/,False,6,1602938567,1,,True,False,False,Physics,t5_2qhi6,1474664,public,https://b.thumbs.redditmedia.com/UGB1-itN4GN-PznSnnIFQxRmRO3upu5ViEzzDtQURwY.jpg,A second magnetic field surrounding our planet has been detected,0,[],1.0,https://youtu.be/7hk2MUOnK_U,all_ads,6,rich:video,"{'enabled': False, 'images': [{'id': '_A-64DT7UezECbcAiMm2A58LYMkHyje2cMSvjgAK2OQ', 'resolutions': [{'height': 81, 'url': 'https://external-preview.redd.it/DrnDWLSNaP2dgX9kgnwpOhAkhvPK5zNo_oMYMkioKLk.jpg?width=108&amp;crop=smart&amp;auto=webp&amp;s=c12ef95bf0c9a4ec826be1eed87c93905b735d8b', 'width': 108}, {'height': 162, 'url': 'https://external-preview.redd.it/DrnDWLSNaP2dgX9kgnwpOhAkhvPK5zNo_oMYMkioKLk.jpg?width=216&amp;crop=smart&amp;auto=webp&amp;s=0acf006262adcf333d5e856330c56fe5a7a32d7a', 'width': 216}, {'height': 240, 'url': 'https://external-preview.redd.it/DrnDWLSNaP2dgX9kgnwpOhAkhvPK5zNo_oMYMkioKLk.jpg?width=320&amp;crop=smart&amp;auto=webp&amp;s=460e8414f18459f9a52b73bf2414cf2c687b6b5a', 'width': 320}], 'source': {'height': 360, 'url': 'https://external-preview.redd.it/DrnDWLSNaP2dgX9kgnwpOhAkhvPK5zNo_oMYMkioKLk.jpg?auto=webp&amp;s=4db82db8824e2afa3e41e0373c08544ca7018d71', 'width': 480}, 'variants': {}}]}",105.0,140.0,https://youtu.be/7hk2MUOnK_U,,,,,,"{'oembed': {'author_name': 'Nature Health and Science Knowledge', 'author_url': 'https://www.youtube.com/channel/UCQ1-Xa-Z7NLNwAelYx166ng', 'height': 344, 'html': '&lt;iframe width=""459"" height=""344"" src=""https://www.youtube.com/embed/7hk2MUOnK_U?feature=oembed&amp;enablejsapi=1"" frameborder=""0"" allow=""accelerometer; autoplay; clipboard-write; encrypted-media; gyroscope; picture-in-picture"" allowfullscreen&gt;&lt;/iframe&gt;', 'provider_name': 'YouTube', 'provider_url': 'https://www.youtube.com/', 'thumbnail_height': 360, 'thumbnail_url': 'https://i.ytimg.com/vi/7hk2MUOnK_U/hqdefault.jpg', 'thumbnail_width': 480, 'title': 'A second magnetic field surrounding our planet has been detected', 'type': 'video', 'version': '1.0', 'width': 459}, 'type': 'youtube.com'}","{'content': '&lt;iframe width=""459"" height=""344"" src=""https://www.youtube.com/embed/7hk2MUOnK_U?feature=oembed&amp;enablejsapi=1"" frameborder=""0"" allow=""accelerometer; autoplay; clipboard-write; encrypted-media; gyroscope; picture-in-picture"" allowfullscreen&gt;&lt;/iframe&gt;', 'height': 344, 'scrolling': False, 'width': 459}","{'oembed': {'author_name': 'Nature Health and Science Knowledge', 'author_url': 'https://www.youtube.com/channel/UCQ1-Xa-Z7NLNwAelYx166ng', 'height': 344, 'html': '&lt;iframe width=""459"" height=""344"" src=""https://www.youtube.com/embed/7hk2MUOnK_U?feature=oembed&amp;enablejsapi=1"" frameborder=""0"" allow=""accelerometer; autoplay; clipboard-write; encrypted-media; gyroscope; picture-in-picture"" allowfullscreen&gt;&lt;/iframe&gt;', 'provider_name': 'YouTube', 'provider_url': 'https://www.youtube.com/', 'thumbnail_height': 360, 'thumbnail_url': 'https://i.ytimg.com/vi/7hk2MUOnK_U/hqdefault.jpg', 'thumbnail_width': 480, 'title': 'A second magnetic field surrounding our planet has been detected', 'type': 'video', 'version': '1.0', 'width': 459}, 'type': 'youtube.com'}","{'content': '&lt;iframe width=""459"" height=""344"" src=""https://www.youtube.com/embed/7hk2MUOnK_U?feature=oembed&amp;enablejsapi=1"" frameborder=""0"" allow=""accelerometer; autoplay; clipboard-write; encrypted-media; gyroscope; picture-in-picture"" allowfullscreen&gt;&lt;/iframe&gt;', 'height': 344, 'media_domain_url': 'https://www.redditmedia.com/mediaembed/jcugj6', 'scrolling': False, 'width': 459}",,,,,
