[],False,notre_coeur_baiser,misc,[],Undergraduate,text,t2_2946fhw2,False,False,[],False,False,1602531806,self.Physics,https://www.reddit.com/r/Physics/comments/j9xz1b/qm/,{},j9xz1b,True,False,False,False,True,True,False,,[],dark,text,False,False,True,5,0,False,all_ads,/r/Physics/comments/j9xz1b/qm/,False,6,1602531817,1,"Hello.r/physics. This post is directed at people who have relatively developed (likely a bachelor or above degree) education/understanding of either mathematicians or quantum mechanics... TLDR below


I'm a third year undergrad studying english (s/, I'm studying physics) and I've started my first ""real"" class in physics (where other classes used to be high-schools material or degree requirements). I'm worried by the fact that the class isn't very rigorous. We talk about various equations (de Broglie, schrodinger, etc...) and the professor, doing his best to oblige our requests, went through some of the derivation. I wasn't really worried until just now, he started talking about how a wave function wil change under different regions of potential energy (think: the typical infinite square well in R1) It's fairly typical stuff, but the professor started talking about the point that most of these equations are ""guesses"" (where i had assumed they were derived from some assumptions) that satisfy boundary conditions and the point that finding a particle between infinity and negative infinity must equal 1. Im not sure what to make of this: the class itself is designed to brush people against the concept of quantum mechanics and relativity, but it was never made to go in depth. So in that sense, everything is fine. 

(TLDR) Now the point of the post follows: is quantum mechanics rigorously unsatisfying (why or why not, ofc) ? Can we talk about the various assumptions in the field? If there are mathematicians out here, can you join and provide information?",True,False,False,Physics,t5_2qhi6,1466611,public,self,QM,0,[],1.0,https://www.reddit.com/r/Physics/comments/j9xz1b/qm/,all_ads,6,,,,,,,,,57a6acb4-c6b2-11e4-a929-22000b2a8bad,dark,,,,,,,,,
[],False,clliatso,,[],,text,t2_1xf94lny,False,False,[],False,False,1602530316,self.Physics,https://www.reddit.com/r/Physics/comments/j9xhm3/experiment_for_centripetal_force/,{},j9xhm3,True,False,False,False,True,True,False,,[],dark,text,False,False,True,0,0,False,all_ads,/r/Physics/comments/j9xhm3/experiment_for_centripetal_force/,False,6,1602530327,1,"To the gods of Physics...i need help!  I am in a College Physics Course online due to Covid.  I recently had Covid, and was, quite literally, laid in the bed for 5 days, and obviously, couldnt study during this time.  So i will write down the experiment, the information that i already have, and am looking for one answer.  How do i find the Velocity of the plumb bob?  

The formulas are as follows, in accordance with my professors instructions: Fc=mv\^2/r, where m= mass of plumb bob(106.7kg), and r=radius(.1 meters.)  V=d/t, where v=velocity, d=circumference(2 pi r), and t= im guessing, is how long it took for the apparatus to rotate for a full 20 rotations, which is 18.75seconds.  My understanding  to find the Velocity is Velocity=20(the rotations) \* (2\*pi\*r)/ the time it took for the 20 rotations.

Experiement:  A plumb bob will be suspended by a string and held in place horizontally by a spring. Once the apparatus starts to rotate, the plumb bob will swing out and stretch the spring by a measurable amount.  once the spring stretches, dictated by the rotation of the apparatus, to the point where the orange indicator (this orange indicator lets me know when the plumb bob is completely horizontal) is in the indicator bracket, then i take count of 20 revolutions, and how long it took for those 20 revolutions.  

With the radius being .1 meters

mass of the plumb bob being 106.7kg

&amp;#x200B;

If anyone can help me to find the Velocity, with the information that i have provided, and if you need anymore, please let me know, i would greatly appreciate it.

&amp;#x200B;

thanks,

chris",True,False,False,Physics,t5_2qhi6,1466586,public,self,Experiment for Centripetal Force,0,[],1.0,https://www.reddit.com/r/Physics/comments/j9xhm3/experiment_for_centripetal_force/,all_ads,6,,,,,,,,,,,,,,,,,,,
[],False,v_span,,[],,text,t2_4txf74yj,False,False,[],False,False,1602530283,self.Physics,https://www.reddit.com/r/Physics/comments/j9xh7y/should_i_major_in_physics_or_computer_science/,{},j9xh7y,True,False,False,False,True,True,False,,[],dark,text,False,False,True,1,0,False,all_ads,/r/Physics/comments/j9xh7y/should_i_major_in_physics_or_computer_science/,False,6,1602530294,1," I am a Philosophy major(mostly a waste of time), doing odd jobs for a few years now and decided to go back to uni for another major(free in my country).  
I struggle a bit with math but I already have most of calculus I down after 1.5 year of preparation.  
I enjoy both sciences and I have a bit of experience with C#,C and C++.  
I have 2-3 career paths in mind that I would like to take in the future and computer vision or graphics low level programming is one of these.

I was wondering how much of an advantage a physics major would give me in this area, if I would have to take more geometry courses for example, more advance math etc.

Question no.2 is if I am in the right track being scared of the difficulty of a physics major.Obviously I would like the easier way out but I also want to make the most out of the major and enjoy it in the meantime.

Also I would like to mention that I love some of the subjects in physics like waves,electronics,stats and hate others(material science chemistry).Same with cs, I enjoy most but hate some boring databases etc.",True,False,False,Physics,t5_2qhi6,1466586,public,self,Should I major in Physics or Computer Science?,0,[],1.0,https://www.reddit.com/r/Physics/comments/j9xh7y/should_i_major_in_physics_or_computer_science/,all_ads,6,question,Question,,,,,,,,,,,,,,,,,
[],False,pizza0614,,[],,text,t2_6jn63m9y,False,False,[],False,False,1602528801,youtube.com,https://www.reddit.com/r/Physics/comments/j9wznm/when_conservation_of_energy_fails_noethers_theorem/,{},j9wznm,True,False,False,False,True,False,False,,[],dark,text,False,False,True,0,0,False,all_ads,/r/Physics/comments/j9wznm/when_conservation_of_energy_fails_noethers_theorem/,False,6,1602528813,1,,True,False,False,Physics,t5_2qhi6,1466520,public,https://a.thumbs.redditmedia.com/uezQTjbIkr4W56L7DScNPHtbsA9B2nJwG47P-iaVo98.jpg,When Conservation of Energy FAILS! (Noether's Theorem),0,[],1.0,https://www.youtube.com/watch?v=cnGYMe6GBeQ,all_ads,6,image,Video,rich:video,"{'enabled': False, 'images': [{'id': 't4xEOmNroVD0Q-VdY5mNgipoMLow948UGi4B-fNR8SY', 'resolutions': [{'height': 81, 'url': 'https://external-preview.redd.it/fuvXdFKMjXYM0Kv59ZfxAqVty3hIoLfk0y1kqD7M0P0.jpg?width=108&amp;crop=smart&amp;auto=webp&amp;s=f4c09b570821da37a1f777dbd8802a74decced42', 'width': 108}, {'height': 162, 'url': 'https://external-preview.redd.it/fuvXdFKMjXYM0Kv59ZfxAqVty3hIoLfk0y1kqD7M0P0.jpg?width=216&amp;crop=smart&amp;auto=webp&amp;s=29648c356ea8574975d33b4108e1bc2f15e4f133', 'width': 216}, {'height': 240, 'url': 'https://external-preview.redd.it/fuvXdFKMjXYM0Kv59ZfxAqVty3hIoLfk0y1kqD7M0P0.jpg?width=320&amp;crop=smart&amp;auto=webp&amp;s=65af59610e3dbfb63128ad41580a64b7512801a7', 'width': 320}], 'source': {'height': 360, 'url': 'https://external-preview.redd.it/fuvXdFKMjXYM0Kv59ZfxAqVty3hIoLfk0y1kqD7M0P0.jpg?auto=webp&amp;s=62c7775d4f8b1774cb9aa092e5ff6e66f6043f2b', 'width': 480}, 'variants': {}}]}",,105.0,140.0,https://www.youtube.com/watch?v=cnGYMe6GBeQ,,,,"{'oembed': {'author_name': 'The Science Asylum', 'author_url': 'https://www.youtube.com/user/TheScienceAsylum', 'height': 338, 'html': '&lt;iframe width=""600"" height=""338"" src=""https://www.youtube.com/embed/cnGYMe6GBeQ?feature=oembed&amp;enablejsapi=1"" frameborder=""0"" allow=""accelerometer; autoplay; clipboard-write; encrypted-media; gyroscope; picture-in-picture"" allowfullscreen&gt;&lt;/iframe&gt;', 'provider_name': 'YouTube', 'provider_url': 'https://www.youtube.com/', 'thumbnail_height': 360, 'thumbnail_url': 'https://i.ytimg.com/vi/cnGYMe6GBeQ/hqdefault.jpg', 'thumbnail_width': 480, 'title': ""When Conservation of Energy FAILS! (Noether's Theorem)"", 'type': 'video', 'version': '1.0', 'width': 600}, 'type': 'youtube.com'}","{'content': '&lt;iframe width=""600"" height=""338"" src=""https://www.youtube.com/embed/cnGYMe6GBeQ?feature=oembed&amp;enablejsapi=1"" frameborder=""0"" allow=""accelerometer; autoplay; clipboard-write; encrypted-media; gyroscope; picture-in-picture"" allowfullscreen&gt;&lt;/iframe&gt;', 'height': 338, 'scrolling': False, 'width': 600}","{'oembed': {'author_name': 'The Science Asylum', 'author_url': 'https://www.youtube.com/user/TheScienceAsylum', 'height': 338, 'html': '&lt;iframe width=""600"" height=""338"" src=""https://www.youtube.com/embed/cnGYMe6GBeQ?feature=oembed&amp;enablejsapi=1"" frameborder=""0"" allow=""accelerometer; autoplay; clipboard-write; encrypted-media; gyroscope; picture-in-picture"" allowfullscreen&gt;&lt;/iframe&gt;', 'provider_name': 'YouTube', 'provider_url': 'https://www.youtube.com/', 'thumbnail_height': 360, 'thumbnail_url': 'https://i.ytimg.com/vi/cnGYMe6GBeQ/hqdefault.jpg', 'thumbnail_width': 480, 'title': ""When Conservation of Energy FAILS! (Noether's Theorem)"", 'type': 'video', 'version': '1.0', 'width': 600}, 'type': 'youtube.com'}","{'content': '&lt;iframe width=""600"" height=""338"" src=""https://www.youtube.com/embed/cnGYMe6GBeQ?feature=oembed&amp;enablejsapi=1"" frameborder=""0"" allow=""accelerometer; autoplay; clipboard-write; encrypted-media; gyroscope; picture-in-picture"" allowfullscreen&gt;&lt;/iframe&gt;', 'height': 338, 'media_domain_url': 'https://www.redditmedia.com/mediaembed/j9wznm', 'scrolling': False, 'width': 600}",,,,
[],False,xChrisner,,[],,text,t2_kacr0kp,False,False,[],False,False,1602524821,self.Physics,https://www.reddit.com/r/Physics/comments/j9vnsa/physics_vs_engineering_degree/,{},j9vnsa,True,False,False,False,True,True,False,,[],dark,text,False,False,True,1,0,False,all_ads,/r/Physics/comments/j9vnsa/physics_vs_engineering_degree/,False,6,1602524832,1,What degree has a better foundation for thinking for the future,True,False,False,Physics,t5_2qhi6,1466459,public,self,Physics vs engineering degree.,0,[],1.0,https://www.reddit.com/r/Physics/comments/j9vnsa/physics_vs_engineering_degree/,all_ads,6,,,,,,,,,,,,,,,,,,,
[],False,Stuff_Former,,[],,text,t2_6ybg3ipe,False,False,[],False,False,1602524694,knowledgearea51.com,https://www.reddit.com/r/Physics/comments/j9vm9c/maximum_speed_of_sound_calculated_at_100_times/,{},j9vm9c,False,False,False,False,False,False,False,,[],dark,text,False,False,True,0,0,False,all_ads,/r/Physics/comments/j9vm9c/maximum_speed_of_sound_calculated_at_100_times/,False,6,1602524705,1,,True,False,False,Physics,t5_2qhi6,1466448,public,https://b.thumbs.redditmedia.com/GRHEZ7muT-dCpxTyEo6zyUsNtLyUGIV9fl_DTyi8O3Y.jpg,Maximum speed of sound calculated at 100 times faster than through air,0,[],1.0,https://www.knowledgearea51.com/10/research/maximum-speed-of-sound-calculated-that-is-100-times-faster-than-through-air/,all_ads,6,,,link,"{'enabled': False, 'images': [{'id': 'D5IiH7vt4xtvFbl71V1vksHlOISWyw3UybM0vXET6AU', 'resolutions': [{'height': 51, 'url': 'https://external-preview.redd.it/1UiS3yjaj0IUPks2eMZmhKomcooxgIWfBPSHdMQLRSI.jpg?width=108&amp;crop=smart&amp;auto=webp&amp;s=bbc4105e4120a32d755b249194958d3ac54a4784', 'width': 108}, {'height': 103, 'url': 'https://external-preview.redd.it/1UiS3yjaj0IUPks2eMZmhKomcooxgIWfBPSHdMQLRSI.jpg?width=216&amp;crop=smart&amp;auto=webp&amp;s=027dbf31d876ac80460c8bb2d720d361ca82616f', 'width': 216}, {'height': 153, 'url': 'https://external-preview.redd.it/1UiS3yjaj0IUPks2eMZmhKomcooxgIWfBPSHdMQLRSI.jpg?width=320&amp;crop=smart&amp;auto=webp&amp;s=fb0e2a32e7caebf5acec402d90f7858eb880c1f9', 'width': 320}], 'source': {'height': 275, 'url': 'https://external-preview.redd.it/1UiS3yjaj0IUPks2eMZmhKomcooxgIWfBPSHdMQLRSI.jpg?auto=webp&amp;s=b77240d42ec7d49f1ee5eb1665483685656fba3f', 'width': 575}, 'variants': {}}]}",reddit,66.0,140.0,https://www.knowledgearea51.com/10/research/maximum-speed-of-sound-calculated-that-is-100-times-faster-than-through-air/,,,,,,,,,,,
[],False,levoniust,,[],,text,t2_9d0jn,False,False,[],False,False,1602524633,youtube.com,https://www.reddit.com/r/Physics/comments/j9vlkf/visualization_of_quantum_physics/,{},j9vlkf,True,False,False,False,True,False,False,,[],dark,text,False,False,True,2,0,False,all_ads,/r/Physics/comments/j9vlkf/visualization_of_quantum_physics/,False,6,1602524645,1,,True,False,False,Physics,t5_2qhi6,1466444,public,https://b.thumbs.redditmedia.com/Uml3Cq7WmX11Ypr2wtwsKGYwOhzSCTPpSp7KA7keRSM.jpg,Visualization of Quantum Physics.,0,[],1.0,https://www.youtube.com/watch?v=p7bzE1E5PMY,all_ads,6,image,Video,rich:video,"{'enabled': False, 'images': [{'id': 'bqKMxcn-6RG2dgkWjHnY1BtnfcUqk83hKEH5i2XolgU', 'resolutions': [{'height': 81, 'url': 'https://external-preview.redd.it/JvKfPu6yG-acznrq4YdCbWbW6OZF7zqcOzma4nJk9v0.jpg?width=108&amp;crop=smart&amp;auto=webp&amp;s=907a8497530b50c57a520b649fac0094ea335404', 'width': 108}, {'height': 162, 'url': 'https://external-preview.redd.it/JvKfPu6yG-acznrq4YdCbWbW6OZF7zqcOzma4nJk9v0.jpg?width=216&amp;crop=smart&amp;auto=webp&amp;s=c30947535e03e6574efeca3a111ec29341bbfb55', 'width': 216}, {'height': 240, 'url': 'https://external-preview.redd.it/JvKfPu6yG-acznrq4YdCbWbW6OZF7zqcOzma4nJk9v0.jpg?width=320&amp;crop=smart&amp;auto=webp&amp;s=551155bdf673fb5f1242db3ac3b19a8e37cedfa5', 'width': 320}], 'source': {'height': 360, 'url': 'https://external-preview.redd.it/JvKfPu6yG-acznrq4YdCbWbW6OZF7zqcOzma4nJk9v0.jpg?auto=webp&amp;s=c39583bc3b863a1288c2dd7a4150e0474a373519', 'width': 480}, 'variants': {}}]}",,105.0,140.0,https://www.youtube.com/watch?v=p7bzE1E5PMY,,,,"{'oembed': {'author_name': 'udiprod', 'author_url': 'https://www.youtube.com/user/udiprod', 'height': 338, 'html': '&lt;iframe width=""600"" height=""338"" src=""https://www.youtube.com/embed/p7bzE1E5PMY?feature=oembed&amp;enablejsapi=1"" frameborder=""0"" allow=""accelerometer; autoplay; clipboard-write; encrypted-media; gyroscope; picture-in-picture"" allowfullscreen&gt;&lt;/iframe&gt;', 'provider_name': 'YouTube', 'provider_url': 'https://www.youtube.com/', 'thumbnail_height': 360, 'thumbnail_url': 'https://i.ytimg.com/vi/p7bzE1E5PMY/hqdefault.jpg', 'thumbnail_width': 480, 'title': 'Visualization of Quantum Physics (Quantum Mechanics)', 'type': 'video', 'version': '1.0', 'width': 600}, 'type': 'youtube.com'}","{'content': '&lt;iframe width=""600"" height=""338"" src=""https://www.youtube.com/embed/p7bzE1E5PMY?feature=oembed&amp;enablejsapi=1"" frameborder=""0"" allow=""accelerometer; autoplay; clipboard-write; encrypted-media; gyroscope; picture-in-picture"" allowfullscreen&gt;&lt;/iframe&gt;', 'height': 338, 'scrolling': False, 'width': 600}","{'oembed': {'author_name': 'udiprod', 'author_url': 'https://www.youtube.com/user/udiprod', 'height': 338, 'html': '&lt;iframe width=""600"" height=""338"" src=""https://www.youtube.com/embed/p7bzE1E5PMY?feature=oembed&amp;enablejsapi=1"" frameborder=""0"" allow=""accelerometer; autoplay; clipboard-write; encrypted-media; gyroscope; picture-in-picture"" allowfullscreen&gt;&lt;/iframe&gt;', 'provider_name': 'YouTube', 'provider_url': 'https://www.youtube.com/', 'thumbnail_height': 360, 'thumbnail_url': 'https://i.ytimg.com/vi/p7bzE1E5PMY/hqdefault.jpg', 'thumbnail_width': 480, 'title': 'Visualization of Quantum Physics (Quantum Mechanics)', 'type': 'video', 'version': '1.0', 'width': 600}, 'type': 'youtube.com'}","{'content': '&lt;iframe width=""600"" height=""338"" src=""https://www.youtube.com/embed/p7bzE1E5PMY?feature=oembed&amp;enablejsapi=1"" frameborder=""0"" allow=""accelerometer; autoplay; clipboard-write; encrypted-media; gyroscope; picture-in-picture"" allowfullscreen&gt;&lt;/iframe&gt;', 'height': 338, 'media_domain_url': 'https://www.redditmedia.com/mediaembed/j9vlkf', 'scrolling': False, 'width': 600}",,,,
[],False,19f191ty,,[],,text,t2_3cck6,False,False,[],False,False,1602524443,nature.com,https://www.reddit.com/r/Physics/comments/j9vj9j/theoretical_biologists_find_hits_of_hamiltonian/,{},j9vj9j,True,False,False,False,True,False,False,,[],dark,text,False,False,True,2,0,False,all_ads,/r/Physics/comments/j9vj9j/theoretical_biologists_find_hits_of_hamiltonian/,False,6,1602524454,1,,True,False,False,Physics,t5_2qhi6,1466432,public,https://b.thumbs.redditmedia.com/EMqH4mebbzBdtwqzFITMP8R8v96aeYooLU12kfi5BFI.jpg,Theoretical biologists find hits of Hamiltonian chaos in animal locomotion!,0,[],1.0,https://www.nature.com/articles/s41567-020-01036-8,all_ads,6,,,link,"{'enabled': False, 'images': [{'id': 'zHDrTy1gKz-73BErhcsgaaQIhutsR2g0gNaxTIZKCT0', 'resolutions': [{'height': 52, 'url': 'https://external-preview.redd.it/y1TWgat_f5BjX5qkmLuBU9ftM99v71JoHdarA_4mvxQ.jpg?width=108&amp;crop=smart&amp;auto=webp&amp;s=4c602efa389db83738f62c41db677ee3e924e9bb', 'width': 108}, {'height': 104, 'url': 'https://external-preview.redd.it/y1TWgat_f5BjX5qkmLuBU9ftM99v71JoHdarA_4mvxQ.jpg?width=216&amp;crop=smart&amp;auto=webp&amp;s=c9a4862606c59d1377603e0a30df7e286d6ad174', 'width': 216}, {'height': 154, 'url': 'https://external-preview.redd.it/y1TWgat_f5BjX5qkmLuBU9ftM99v71JoHdarA_4mvxQ.jpg?width=320&amp;crop=smart&amp;auto=webp&amp;s=8a10188e598e6d5a348b7d9a06c3eedf64b1c1f4', 'width': 320}, {'height': 308, 'url': 'https://external-preview.redd.it/y1TWgat_f5BjX5qkmLuBU9ftM99v71JoHdarA_4mvxQ.jpg?width=640&amp;crop=smart&amp;auto=webp&amp;s=322b84c92c7015928b405004e4e328b2fa16e372', 'width': 640}], 'source': {'height': 330, 'url': 'https://external-preview.redd.it/y1TWgat_f5BjX5qkmLuBU9ftM99v71JoHdarA_4mvxQ.jpg?auto=webp&amp;s=b9f053feca7c0ca5f6006df2f62f2166221d6f42', 'width': 685}, 'variants': {}}]}",,67.0,140.0,https://www.nature.com/articles/s41567-020-01036-8,,,,,,,,,,,
[],False,19f191ty,,[],,text,t2_3cck6,False,False,[],False,False,1602524306,nature.com,https://www.reddit.com/r/Physics/comments/j9vhnr/theoretical_biologists_find_hints_of_hamiltonian/,{},j9vhnr,True,False,False,False,True,False,False,,[],dark,text,False,False,True,0,0,False,all_ads,/r/Physics/comments/j9vhnr/theoretical_biologists_find_hints_of_hamiltonian/,False,6,1602524318,1,,True,False,False,Physics,t5_2qhi6,1466427,public,https://b.thumbs.redditmedia.com/EMqH4mebbzBdtwqzFITMP8R8v96aeYooLU12kfi5BFI.jpg,Theoretical biologists find hints of Hamiltonian in animal locomotion,0,[],1.0,https://www.nature.com/articles/s41567-020-01036-8,all_ads,6,,,link,"{'enabled': False, 'images': [{'id': 'zHDrTy1gKz-73BErhcsgaaQIhutsR2g0gNaxTIZKCT0', 'resolutions': [{'height': 52, 'url': 'https://external-preview.redd.it/y1TWgat_f5BjX5qkmLuBU9ftM99v71JoHdarA_4mvxQ.jpg?width=108&amp;crop=smart&amp;auto=webp&amp;s=4c602efa389db83738f62c41db677ee3e924e9bb', 'width': 108}, {'height': 104, 'url': 'https://external-preview.redd.it/y1TWgat_f5BjX5qkmLuBU9ftM99v71JoHdarA_4mvxQ.jpg?width=216&amp;crop=smart&amp;auto=webp&amp;s=c9a4862606c59d1377603e0a30df7e286d6ad174', 'width': 216}, {'height': 154, 'url': 'https://external-preview.redd.it/y1TWgat_f5BjX5qkmLuBU9ftM99v71JoHdarA_4mvxQ.jpg?width=320&amp;crop=smart&amp;auto=webp&amp;s=8a10188e598e6d5a348b7d9a06c3eedf64b1c1f4', 'width': 320}, {'height': 308, 'url': 'https://external-preview.redd.it/y1TWgat_f5BjX5qkmLuBU9ftM99v71JoHdarA_4mvxQ.jpg?width=640&amp;crop=smart&amp;auto=webp&amp;s=322b84c92c7015928b405004e4e328b2fa16e372', 'width': 640}], 'source': {'height': 330, 'url': 'https://external-preview.redd.it/y1TWgat_f5BjX5qkmLuBU9ftM99v71JoHdarA_4mvxQ.jpg?auto=webp&amp;s=b9f053feca7c0ca5f6006df2f62f2166221d6f42', 'width': 685}, 'variants': {}}]}",,67.0,140.0,https://www.nature.com/articles/s41567-020-01036-8,,,,,,,,,,,
[],False,xChrisner,,[],,text,t2_kacr0kp,False,False,[],False,False,1602524292,self.Physics,https://www.reddit.com/r/Physics/comments/j9vhhm/would_you_say_that_a_physics_degree_and/,{},j9vhhm,True,False,False,False,True,True,False,,[],dark,text,False,False,True,5,0,False,all_ads,/r/Physics/comments/j9vhhm/would_you_say_that_a_physics_degree_and/,False,6,1602524303,1,?,True,False,False,Physics,t5_2qhi6,1466425,public,self,Would you say that a physics degree and philosophy degree is worth it for the sake of thinking.,0,[],1.0,https://www.reddit.com/r/Physics/comments/j9vhhm/would_you_say_that_a_physics_degree_and/,all_ads,6,,,,,,,,,,,,,,,,,,,
[],False,Jason_Protell,inter,[],Education and outreach,text,t2_7rwi6l2j,False,False,[],False,False,1602522738,physics.aps.org,https://www.reddit.com/r/Physics/comments/j9uz52/theorists_react_to_potential_signal_in_dark/,{},j9uz52,True,False,False,False,True,False,False,,[],dark,text,False,False,True,46,0,False,all_ads,/r/Physics/comments/j9uz52/theorists_react_to_potential_signal_in_dark/,False,6,1602522749,1,,True,False,False,Physics,t5_2qhi6,1466405,public,https://b.thumbs.redditmedia.com/9A3bgmrI7VyCvX0_8mqdxtjWbSseooGcCOnYy7ICWlc.jpg,Theorists React to Potential Signal in Dark Matter Detector,0,[],1.0,https://physics.aps.org/articles/v13/s132,all_ads,6,,,link,"{'enabled': False, 'images': [{'id': 'YuxrIpZKi1yhz6KtWw4RBC2hyFRRdkkliYrdwGjUyv0', 'resolutions': [{'height': 54, 'url': 'https://external-preview.redd.it/lB_qEdxcGe1O3eN8SltQ0YcMwUh_BBm4IZLXKZQ1mhs.jpg?width=108&amp;crop=smart&amp;auto=webp&amp;s=9702d38f032b72b7c900da20d0b6c7135432dec8', 'width': 108}, {'height': 108, 'url': 'https://external-preview.redd.it/lB_qEdxcGe1O3eN8SltQ0YcMwUh_BBm4IZLXKZQ1mhs.jpg?width=216&amp;crop=smart&amp;auto=webp&amp;s=acc9ec4bb9d7133f5acdbb58e084f74f8813b8c4', 'width': 216}, {'height': 160, 'url': 'https://external-preview.redd.it/lB_qEdxcGe1O3eN8SltQ0YcMwUh_BBm4IZLXKZQ1mhs.jpg?width=320&amp;crop=smart&amp;auto=webp&amp;s=12387ee7f7d13d8b3034561b85587798805b4386', 'width': 320}], 'source': {'height': 250, 'url': 'https://external-preview.redd.it/lB_qEdxcGe1O3eN8SltQ0YcMwUh_BBm4IZLXKZQ1mhs.jpg?auto=webp&amp;s=bf1d1a96fa2b3799597c6e945d13c98eeffb5cee', 'width': 500}, 'variants': {}}]}",,70.0,140.0,https://physics.aps.org/articles/v13/s132,4a8885d4-c6b2-11e4-827e-22000b2a8bad,dark,,,,,,,,,
[],False,Jason_Protell,inter,[],Education and outreach,text,t2_7rwi6l2j,False,False,[],False,False,1602522539,journals.aps.org,https://www.reddit.com/r/Physics/comments/j9uwrx/high_energy_qcd_multiplicity_distribution_and/,{},j9uwrx,True,False,False,False,True,False,False,,[],dark,text,False,False,True,0,0,False,all_ads,/r/Physics/comments/j9uwrx/high_energy_qcd_multiplicity_distribution_and/,False,6,1602522551,1,,True,False,False,Physics,t5_2qhi6,1466401,public,https://b.thumbs.redditmedia.com/nKo0H0N08kKGEUIkrrVetzxsD_MoZ0wL61vMNYRh1tA.jpg,High energy QCD: Multiplicity distribution and entanglement entropy,0,[],1.0,https://journals.aps.org/prd/abstract/10.1103/PhysRevD.102.074008,all_ads,6,,,link,"{'enabled': False, 'images': [{'id': 'pQFrIbRLO7IWfSYC0tlkq8CpsKmnURdMPzfkYbpcTuE', 'resolutions': [{'height': 61, 'url': 'https://external-preview.redd.it/8jAv-M4U63oUXabXFUR6FlCf5O6bgJ-w5E9oIfQxl-8.jpg?width=108&amp;crop=smart&amp;auto=webp&amp;s=6233341359acd220a46151a3d5d618f3d40f0237', 'width': 108}, {'height': 122, 'url': 'https://external-preview.redd.it/8jAv-M4U63oUXabXFUR6FlCf5O6bgJ-w5E9oIfQxl-8.jpg?width=216&amp;crop=smart&amp;auto=webp&amp;s=940a9860f69cee65fea599c1da4e132f6148d51b', 'width': 216}, {'height': 180, 'url': 'https://external-preview.redd.it/8jAv-M4U63oUXabXFUR6FlCf5O6bgJ-w5E9oIfQxl-8.jpg?width=320&amp;crop=smart&amp;auto=webp&amp;s=b2e84e124bbed4e603b77c85d04d0e08aa157206', 'width': 320}], 'source': {'height': 226, 'url': 'https://external-preview.redd.it/8jAv-M4U63oUXabXFUR6FlCf5O6bgJ-w5E9oIfQxl-8.jpg?auto=webp&amp;s=871883f40dc3beb16ede6133e8159cbfcf952600', 'width': 400}, 'variants': {}}]}",,79.0,140.0,https://journals.aps.org/prd/abstract/10.1103/PhysRevD.102.074008,4a8885d4-c6b2-11e4-827e-22000b2a8bad,dark,,,,,,,,,
[],False,Jason_Protell,,[],,text,t2_7rwi6l2j,False,False,[],False,False,1602522140,physics.aps.org,https://www.reddit.com/r/Physics/comments/j9urzl/dark_matter_detector_delivers_enigmatic_signal/,{},j9urzl,True,False,False,False,True,False,False,,[],dark,text,False,False,True,3,0,False,all_ads,/r/Physics/comments/j9urzl/dark_matter_detector_delivers_enigmatic_signal/,False,6,1602522152,1,,True,False,False,Physics,t5_2qhi6,1466376,public,https://a.thumbs.redditmedia.com/wbJy3fH-otyAOqdkUn10UF8G3db6aXWg51RtP0yg3r8.jpg,Dark Matter Detector Delivers Enigmatic Signal,0,[],1.0,https://physics.aps.org/articles/v13/135,all_ads,6,,,link,"{'enabled': False, 'images': [{'id': 'C5OxjWDOqC8BhDR3C5hG5H2851qCY4OQt2Sm4tmmyPc', 'resolutions': [{'height': 54, 'url': 'https://external-preview.redd.it/7V0NpdxmgPpZoztDOy-PL5rkWplJ-Z_VOBrqLCrBLdg.jpg?width=108&amp;crop=smart&amp;auto=webp&amp;s=9bbbf946abed9dd55b2a87e798df445613ceda76', 'width': 108}, {'height': 108, 'url': 'https://external-preview.redd.it/7V0NpdxmgPpZoztDOy-PL5rkWplJ-Z_VOBrqLCrBLdg.jpg?width=216&amp;crop=smart&amp;auto=webp&amp;s=a0608fcaca9627783a476a4cffd5e303e737d0df', 'width': 216}, {'height': 160, 'url': 'https://external-preview.redd.it/7V0NpdxmgPpZoztDOy-PL5rkWplJ-Z_VOBrqLCrBLdg.jpg?width=320&amp;crop=smart&amp;auto=webp&amp;s=5ff422ff029c93da575d0329674affeb2ebaeb1f', 'width': 320}], 'source': {'height': 250, 'url': 'https://external-preview.redd.it/7V0NpdxmgPpZoztDOy-PL5rkWplJ-Z_VOBrqLCrBLdg.jpg?auto=webp&amp;s=0d179cc11492723e5544809db45cc782ff4b29d5', 'width': 500}, 'variants': {}}]}",,70.0,140.0,https://physics.aps.org/articles/v13/135,,,,,,,,,,,
