all_awardings,allow_live_comments,author,author_flair_css_class,author_flair_richtext,author_flair_text,author_flair_type,author_fullname,author_patreon_flair,author_premium,awarders,can_mod_post,contest_mode,created_utc,domain,full_link,gildings,id,is_crosspostable,is_meta,is_original_content,is_reddit_media_domain,is_robot_indexable,is_self,is_video,link_flair_background_color,link_flair_css_class,link_flair_richtext,link_flair_text,link_flair_text_color,link_flair_type,locked,media_only,no_follow,num_comments,num_crossposts,over_18,parent_whitelist_status,permalink,pinned,pwls,retrieved_on,score,selftext,send_replies,spoiler,stickied,subreddit,subreddit_id,subreddit_subscribers,subreddit_type,thumbnail,title,total_awards_received,treatment_tags,upvote_ratio,url,whitelist_status,wls,post_hint,preview,thumbnail_height,thumbnail_width,url_overridden_by_dest,removed_by_category,author_cakeday,author_flair_template_id,author_flair_text_color,poll_data,media,media_embed,secure_media,secure_media_embed,author_flair_background_color,gallery_data,is_gallery,media_metadata,distinguished
[],False,phymathnerd,,[],,text,t2_2zwndxlf,False,False,[],False,False,1603042569,self.Physics,https://www.reddit.com/r/Physics/comments/jdkh2l/anyone_has_the_answer_key_to_introduction_to/,{},jdkh2l,True,False,False,False,True,True,False,,question,[],Question,dark,text,False,False,True,0,0,False,all_ads,/r/Physics/comments/jdkh2l/anyone_has_the_answer_key_to_introduction_to/,False,6,1603042581,1,"So I am taking my MCAT in a few months, and this book was recommended to me by a student who used it. The book has lots of practice questions, and that is one of the reasons I started studying from it. However, there is no possible way I can check my answers since it doesn't contain the solutions. Can someone please help?",True,False,False,Physics,t5_2qhi6,1476566,public,self,Anyone has the Answer Key to Introduction To Biological Physics for the Health and Life Sciences?,0,[],1.0,https://www.reddit.com/r/Physics/comments/jdkh2l/anyone_has_the_answer_key_to_introduction_to/,all_ads,6,,,,,,,,,,,,,,,,,,,
[],False,Snowball_Furball,,[],,text,t2_5p1ukwpq,False,False,[],False,False,1603042164,self.Physics,https://www.reddit.com/r/Physics/comments/jdkck5/question_if_the_big_bang_happened_again_the_exact/,{},jdkck5,True,False,False,False,True,True,False,,question,[],Question,dark,text,False,False,True,4,0,False,all_ads,/r/Physics/comments/jdkck5/question_if_the_big_bang_happened_again_the_exact/,False,6,1603042175,1,,True,False,False,Physics,t5_2qhi6,1476559,public,self,"[Question] If the Big Bang happened again the exact same way, would the following universe be different than ours in any way?",0,[],1.0,https://www.reddit.com/r/Physics/comments/jdkck5/question_if_the_big_bang_happened_again_the_exact/,all_ads,6,,,,,,,,,,,,,,,,,,,
[],False,Squidwards_Mentor,,[],,text,t2_3354n0f0,False,False,[],False,False,1603041141,self.Physics,https://www.reddit.com/r/Physics/comments/jdk1u2/why_does_my_trap_bar_turn_on_my_printers/,{},jdk1u2,True,False,False,False,True,True,False,,question,[],Question,dark,text,False,False,True,0,0,False,all_ads,/r/Physics/comments/jdk1u2/why_does_my_trap_bar_turn_on_my_printers/,False,6,1603041152,1,"TLDR: A heavy object hitting the floor activates 2 nearby printers

I have a power rack in my house next to a foam mat, where a trap bar lays on the mat. Today I loaded it with 195 lbs (transmitted through the contact area of 2 45-lb discs) for 3 sets. 

After the concentric, I lean forward and let it fall on the ground **CLUNK** while still holding the handles. Even at 195 lbs, the shock vibrates through the foam mat into the floor, and thunders the whole house. You can even hear it outside.

About 7 feet to my left is a desk with a laser and inkjet printer (the latter will be ditched once I finish the setup on the former). Towards the end of my sets (about the 4th or 5th rep), the power light shows up on either or both of them, and I hear a few mechanical actions making noise inside. This stops after a few seconds.

What causes this?",True,False,False,Physics,t5_2qhi6,1476508,public,self,Why does my trap bar turn on my printers?,0,[],1.0,https://www.reddit.com/r/Physics/comments/jdk1u2/why_does_my_trap_bar_turn_on_my_printers/,all_ads,6,,,,,,,,,,,,,,,,,,,
[],False,SaintCurve,,[],,text,t2_2gznmcfa,False,False,[],False,False,1603040940,self.Physics,https://www.reddit.com/r/Physics/comments/jdjznc/the_concept_of_gravity_not_being_a_force_in_the/,{},jdjznc,True,False,False,False,True,True,False,,,[],,dark,text,False,False,True,1,0,False,all_ads,/r/Physics/comments/jdjznc/the_concept_of_gravity_not_being_a_force_in_the/,False,6,1603040951,1,"Hello

&amp;#x200B;

I've been reading into general relativity and gravity lately, aswell as watching several videos on this topic. As we are humans and stuck in our limited possibility of imagining and visualizing things in a 3-dimensional way and without a correct understanding of the time dimension I found it hard understanding some of the aspects of this theory. Especially words that aren't familiar to most of the people, such as geodatic, space-time curvature etc. Nevertheless, due to reading different articles and watching different videos I finally think I understood the fundamental part of the concept why gravitation is no actual force, but more a phenomenon that occurs due to the space-time being curved around mass-heavy objects such as planets etc. The analogies with ants walking over a sphere made it quite easier to understand why objects follow straight lines, even though to us it seems as if their orbit is curved. 

But after I started understanding the concept there was a question coming to my mind which I haven't found to be answered from the content I was watching and reading. If we understand that it is not the mass of the earth pulling objects towards it, rather the objects follow the lines of a curved space-time close to the earth, why do these objects keep accelerating when they are in free fall? I mean given that they are following these geodatic lines, why would they accelerate when there is no force acting on them?

&amp;#x200B;

I didn't study physics or mathematics at a university, I received the general qualification for university entrance in Switzerland this year. So I struggle understanding some of the Einstein's formulas and the complex mathematics behind his concept. But due to my interest in physics I attained a deeper knowledge than my school degree which helps me understand some of the mathematical stuff :). If you could try to keep it on my level with the explanation it would help me, but if something is unavoidable don't hesitate to use it to explain, I will then do my research to understand it.

&amp;#x200B;

Thank you very much &lt;3",True,False,False,Physics,t5_2qhi6,1476496,public,self,The concept of gravity not being a force in the general relativity,0,[],1.0,https://www.reddit.com/r/Physics/comments/jdjznc/the_concept_of_gravity_not_being_a_force_in_the/,all_ads,6,,,,,,,,,,,,,,,,,,,
[],False,ScAr420-1312,,[],,text,t2_7xosqxa7,False,False,[],False,False,1603032004,self.Physics,https://www.reddit.com/r/Physics/comments/jdherg/check_that_people/,{},jdherg,True,False,False,False,True,True,False,,,[],,dark,text,False,False,False,0,0,False,all_ads,/r/Physics/comments/jdherg/check_that_people/,False,6,1603032015,1,"you agree with me that the machines will win the world or ?? we also assume that this will happen next, we will notice the machine survived in space and we will arrive on other planets at least in machine form and if we have a second destination and we will settle there we will communicate with each other we send information faster than the light we will try and notice it is just a hole in the law of gravity and thus in the light. We will recognize and notice between these first 2 points that information can only be sent if it is smaller than the light the particles and if we have the information between the first 2 planets, we will travel with faster than light speed through space and time between two pilots porten telwportieren call it what you want",True,False,False,Physics,t5_2qhi6,1476238,public,self,Check that people,0,[],1.0,https://www.reddit.com/r/Physics/comments/jdherg/check_that_people/,all_ads,6,,,,,,,,,,,,,,,,,,,
[],False,Dedo_rapido,,[],,text,t2_64ryssv9,False,False,[],False,False,1603031775,self.Physics,https://www.reddit.com/r/Physics/comments/jdhcnm/quantum_mechanic_experiments/,{},jdhcnm,True,False,False,False,True,True,False,,,[],,dark,text,False,False,True,0,0,False,all_ads,/r/Physics/comments/jdhcnm/quantum_mechanic_experiments/,False,6,1603031786,1,"Hi, I just want to learn more about quantum mechanics, so I'm looking for curious experiments that you can do in your home (if possible). I'm a physics student but the COVID situation doesn't let me experiment with the things I'm working :(
Thanks for the help!",True,False,False,Physics,t5_2qhi6,1476238,public,self,Quantum mechanic experiments,0,[],1.0,https://www.reddit.com/r/Physics/comments/jdhcnm/quantum_mechanic_experiments/,all_ads,6,,,,,,,,,,,,,,,,,,,
[],False,starknight6,,[],,text,t2_5fmiakmc,False,False,[],False,False,1603030361,i.redd.it,https://www.reddit.com/r/Physics/comments/jdgzto/can_you_guys_help_me_out_its_unit_conversion/,{},jdgzto,True,False,False,True,True,False,False,,image,[],Image,dark,text,False,False,True,7,0,False,all_ads,/r/Physics/comments/jdgzto/can_you_guys_help_me_out_its_unit_conversion/,False,6,1603030371,1,,True,False,False,Physics,t5_2qhi6,1476222,public,https://a.thumbs.redditmedia.com/WalIccRfBgy0hxKJIB-vAqftGwteiUlHaGqcbP4GKs0.jpg,"Can you guys help me out ? , it's unit conversion.",0,[],1.0,https://i.redd.it/e9kygklr2vt51.jpg,all_ads,6,image,"{'enabled': True, 'images': [{'id': 'A_dWLauIIorgIsYYf9ZEXbC-FiLv08L5vxrxA5e3W0o', 'resolutions': [{'height': 61, 'url': 'https://preview.redd.it/e9kygklr2vt51.jpg?width=108&amp;crop=smart&amp;auto=webp&amp;s=0d32ae2494dd81953653913ea8b4eb7e74a3fb34', 'width': 108}, {'height': 123, 'url': 'https://preview.redd.it/e9kygklr2vt51.jpg?width=216&amp;crop=smart&amp;auto=webp&amp;s=72070cc367eb1a42849a9170dc94022691635593', 'width': 216}, {'height': 182, 'url': 'https://preview.redd.it/e9kygklr2vt51.jpg?width=320&amp;crop=smart&amp;auto=webp&amp;s=141fbf801b51ce7721e8f6d65f835ce65e520def', 'width': 320}, {'height': 365, 'url': 'https://preview.redd.it/e9kygklr2vt51.jpg?width=640&amp;crop=smart&amp;auto=webp&amp;s=eb8cd6b22be827b034a5e94455fe986f7a73d105', 'width': 640}], 'source': {'height': 455, 'url': 'https://preview.redd.it/e9kygklr2vt51.jpg?auto=webp&amp;s=05206ce1b31b8064706ba2ce70e00bfc0e42570f', 'width': 796}, 'variants': {}}]}",80.0,140.0,https://i.redd.it/e9kygklr2vt51.jpg,,,,,,,,,,,,,,
[],False,gofvotreg,,[],,text,t2_8chacatj,False,False,[],False,False,1603029055,self.Physics,https://www.reddit.com/r/Physics/comments/jdgncz/why_do_particular_colors_flicker_on_camera_while/,{},jdgncz,True,False,False,False,True,True,False,,question,[],Question,dark,text,False,False,True,0,0,False,all_ads,/r/Physics/comments/jdgncz/why_do_particular_colors_flicker_on_camera_while/,False,6,1603029184,1,"I was watching a video of someone whining about how the LEDs they installed in their office were flickering in videos unless their color was set to purple or pink. I think they mentioned green didn't flicker as well.

Why is that? I know why we can see light sources flickering as the camera captures the instants where the lights are off thanks to Alternating Current which goes 'positive maximum - minimum - negative maximum - minimum...'

Is it because colors have dfiferent wavelengths and the waves are in the same medium, thus they have the same velocity, resulting in different frequencies due to ***f = c / λ***, where *f* is frequency, *c* is wave speed, and *λ* is wavelength?",True,False,False,Physics,t5_2qhi6,1476169,public,self,Why do Particular Colors Flicker on Camera While Some Don't?,0,[],1.0,https://www.reddit.com/r/Physics/comments/jdgncz/why_do_particular_colors_flicker_on_camera_while/,all_ads,6,,,,,,,,,,,,,,,,,,,
[],False,Arkadans,,[],,text,t2_1tjns4o9,False,False,[],False,False,1603028831,self.Physics,https://www.reddit.com/r/Physics/comments/jdgm9g/whats_the_difference_of_a_ba_and_bs_in_applied/,{},jdgm9g,True,False,False,False,True,True,False,,question,[],Question,dark,text,False,False,True,0,0,False,all_ads,/r/Physics/comments/jdgm9g/whats_the_difference_of_a_ba_and_bs_in_applied/,False,6,1603028968,1,What are the pratical differences ?,True,False,False,Physics,t5_2qhi6,1476166,public,self,What's the difference of a B.A and B.S in Applied Physics ?,0,[],1.0,https://www.reddit.com/r/Physics/comments/jdgm9g/whats_the_difference_of_a_ba_and_bs_in_applied/,all_ads,6,,,,,,,,,,,,,,,,,,,
[],False,am_mundhe,,[],,text,t2_89gh86kx,False,False,[],False,False,1603027258,i.redd.it,https://www.reddit.com/r/Physics/comments/jdg8ax/pascals_law_understand_with_the_example/,{},jdg8ax,False,False,False,True,False,False,False,,image,[],Image,dark,text,False,False,True,0,0,False,all_ads,/r/Physics/comments/jdg8ax/pascals_law_understand_with_the_example/,False,6,1603027269,1,,True,False,False,Physics,t5_2qhi6,1476155,public,https://a.thumbs.redditmedia.com/Ln3c_6gIYWStOSpcAGSccpxEy_HrnJpUUCGm1z6iJx8.jpg,Pascal's Law: understand with the example,0,[],1.0,https://i.redd.it/hj95d4gjtut51.jpg,all_ads,6,image,"{'enabled': True, 'images': [{'id': 'Khs297oyh-6sXh6DTFocPWDeZDQUG5aoQDlLNVFBvb8', 'resolutions': [{'height': 129, 'url': 'https://preview.redd.it/hj95d4gjtut51.jpg?width=108&amp;crop=smart&amp;auto=webp&amp;s=aadb09b84d03796811a1c04bac634eb516766a23', 'width': 108}, {'height': 259, 'url': 'https://preview.redd.it/hj95d4gjtut51.jpg?width=216&amp;crop=smart&amp;auto=webp&amp;s=75aec0875163b51a4b7430ab8081a2d304d4898d', 'width': 216}, {'height': 384, 'url': 'https://preview.redd.it/hj95d4gjtut51.jpg?width=320&amp;crop=smart&amp;auto=webp&amp;s=c8151376763c621bf9237bd65ce0d4329cfb7722', 'width': 320}, {'height': 769, 'url': 'https://preview.redd.it/hj95d4gjtut51.jpg?width=640&amp;crop=smart&amp;auto=webp&amp;s=446b5091fc48f5cbefbcc7eba3ac244b53690ecf', 'width': 640}, {'height': 1154, 'url': 'https://preview.redd.it/hj95d4gjtut51.jpg?width=960&amp;crop=smart&amp;auto=webp&amp;s=33d7c3b0bcc4b5b061798389fbefe93f3de5663d', 'width': 960}, {'height': 1298, 'url': 'https://preview.redd.it/hj95d4gjtut51.jpg?width=1080&amp;crop=smart&amp;auto=webp&amp;s=2354f0cebb89383c3f97823b7ce2246b1d29bb4a', 'width': 1080}], 'source': {'height': 1689, 'url': 'https://preview.redd.it/hj95d4gjtut51.jpg?auto=webp&amp;s=fe11501dde022120afd4bd32bb4f171a1059a8b3', 'width': 1405}, 'variants': {}}]}",140.0,140.0,https://i.redd.it/hj95d4gjtut51.jpg,reddit,,,,,,,,,,,,,
[],False,BenTennyson2101,,[],,text,t2_7tz741ib,False,False,[],False,False,1603023945,self.Physics,https://www.reddit.com/r/Physics/comments/jdfgut/quantum_mechanics_book_which_teaches_everything/,{},jdfgut,True,False,False,False,True,True,False,,question,[],Question,dark,text,False,False,True,3,0,False,all_ads,/r/Physics/comments/jdfgut/quantum_mechanics_book_which_teaches_everything/,False,6,1603023956,1,"I am highly interested  in quantum mechanics, but am not able to decide which would be a good book for someone who has never studied these stuffs before.",True,False,False,Physics,t5_2qhi6,1476097,public,self,Quantum mechanics book which teaches everything from scratch?,0,[],1.0,https://www.reddit.com/r/Physics/comments/jdfgut/quantum_mechanics_book_which_teaches_everything/,all_ads,6,,,,,,,,,,,,,,,,,,,
[],False,prateek_luitel10,,[],,text,t2_4tojljk5,False,False,[],False,False,1603023278,self.Physics,https://www.reddit.com/r/Physics/comments/jdfbi2/today_89_years_ago_thomas_edison_died_he_was_an/,{},jdfbi2,True,False,False,False,True,True,False,,,[],,dark,text,False,False,True,12,0,False,all_ads,/r/Physics/comments/jdfbi2/today_89_years_ago_thomas_edison_died_he_was_an/,False,6,1603023289,1,,True,False,False,Physics,t5_2qhi6,1476068,public,self,"Today, 89 years ago, Thomas Edison died. He was an American inventor who, singly or jointly, held a world record 1,093 patents. In addition, he created the world’s first industrial research laboratory.",0,[],1.0,https://www.reddit.com/r/Physics/comments/jdfbi2/today_89_years_ago_thomas_edison_died_he_was_an/,all_ads,6,,,,,,,True,,,,,,,,,,,,
[],False,LemarOkay,,[],,text,t2_87pknm2a,False,False,[],False,False,1603016438,self.Physics,https://www.reddit.com/r/Physics/comments/jddyx2/will_we_ever_have_a_theory_of_everything/,{},jddyx2,True,False,False,False,True,True,False,,question,[],Question,dark,text,False,False,True,10,0,False,all_ads,/r/Physics/comments/jddyx2/will_we_ever_have_a_theory_of_everything/,False,6,1603016449,1,"I'm obviously not talking about an enormous equation that will describe everything around us. But something like a unified model would describe all the interactions with a set of equations (that do not overlap and are accurate irrespective of the scale of the interaction). 

If we will (ever) have one, it would be the biggest achievement in physics.",True,False,False,Physics,t5_2qhi6,1476014,public,self,Will we ever have a theory of everything?,0,[],1.0,https://www.reddit.com/r/Physics/comments/jddyx2/will_we_ever_have_a_theory_of_everything/,all_ads,6,,,,,,,,,,,,,,,,,,,
[],False,melodious_mongolian,misc,[],High school,text,t2_a5exc6m,False,False,[],False,False,1603014401,self.Physics,https://www.reddit.com/r/Physics/comments/jddlb2/discussion_teaching_similarities_between_e_fields/,{},jddlb2,True,False,False,False,True,True,False,,question,[],Question,dark,text,False,False,False,0,0,False,all_ads,/r/Physics/comments/jddlb2/discussion_teaching_similarities_between_e_fields/,False,6,1603014412,1,"Hi all. I run a small YouTube channel where I talk about Maths and Physics. I've recently been thinking about ways to explain concepts in electrical circuit physics to kids who have never touched the topic before.

At the moment the basis of how I want to explain it centers on introducing potential difference as we see it in the world around us (\Delta V = g \Delta h), explaining how charge in E fields is like mass in G fields, and modelling circuits as rivers moving down a hill through various contraptions and obstacles (i.e. from high V to low V; for instance, a capacitor might be explained as a dam that draws water from the ocean and holds it up high, where the water has some potential energy).

However, I can't for the life of me imagine how I might explain resistance in this context. As far as I understand it (I'm just about to graduate high school) resistance is a collisions-based phenomenon that occurs when charge carriers run into the crystal structure of the things they are moving through. Is this idea correct? I invite discussion if you have a suggestion as to how one might visualize resistance on a macro scale (like this or otherwise!)",True,False,False,Physics,t5_2qhi6,1476001,public,self,[Discussion] Teaching Similarities Between E Fields and G Fields | Visualizing Resistance as in a G Field?,0,[],1.0,https://www.reddit.com/r/Physics/comments/jddlb2/discussion_teaching_similarities_between_e_fields/,all_ads,6,,,,,,,,56820ba8-c6b2-11e4-92f0-22000b6d820d,dark,,,,,,,,,,
[],False,biocutie_patootie,,[],,text,t2_7eormqib,False,False,[],False,False,1603010403,self.Physics,https://www.reddit.com/r/Physics/comments/jdctuc/do_you_guys_ever_feel_isolated_from_talking_to/,{},jdctuc,True,False,False,False,True,True,False,,,[],,dark,text,False,False,False,234,0,False,all_ads,/r/Physics/comments/jdctuc/do_you_guys_ever_feel_isolated_from_talking_to/,False,6,1603010414,1,"I’m not a physics major, but it was something I took interest in before choosing to go the bio/med route. I often go off on a tangent to my closest friends about various unexplainable phenomena, and I get no conversations in return. It just sucks that I have no one to talk to, about any of these thoughts that fill my mind.",True,False,False,Physics,t5_2qhi6,1475968,public,self,Do you guys ever feel isolated from talking to anyone about your interests and thoughts,0,[],1.0,https://www.reddit.com/r/Physics/comments/jdctuc/do_you_guys_ever_feel_isolated_from_talking_to/,all_ads,6,,,,,,,,,,,,,,,,,,,
[],False,iwasnotheimposter,,[],,text,t2_8j05ivdw,False,False,[],False,False,1603006059,i.redd.it,https://www.reddit.com/r/Physics/comments/jdc1av/hi_i_would_like_to_ask_if_anyone_understood_b_i/,{},jdc1av,False,False,False,True,False,False,False,,,[],,dark,text,False,False,True,0,0,False,all_ads,/r/Physics/comments/jdc1av/hi_i_would_like_to_ask_if_anyone_understood_b_i/,False,6,1603006071,1,,True,False,False,Physics,t5_2qhi6,1475878,public,https://b.thumbs.redditmedia.com/p6r4w97pwO4b_utqK1P2trqu0RmN6C-CNT2S6xb8HXk.jpg,"Hi! I would like to ask if anyone understood b? I know the answer is that both items have equal charges, but why? Thank you ~",0,[],1.0,https://i.redd.it/nqhgsw1i2tt51.jpg,all_ads,6,image,"{'enabled': True, 'images': [{'id': 'Txm2VAr7YVlpgBHjMScV79N9JJR49s_SaBjM-tMcFzA', 'resolutions': [{'height': 22, 'url': 'https://preview.redd.it/nqhgsw1i2tt51.jpg?width=108&amp;crop=smart&amp;auto=webp&amp;s=eb1efc31de13d7d7e6823c4df417084adfac06aa', 'width': 108}, {'height': 44, 'url': 'https://preview.redd.it/nqhgsw1i2tt51.jpg?width=216&amp;crop=smart&amp;auto=webp&amp;s=97f0db47cd68e8e9fc39057c76e6490bbaca0fea', 'width': 216}, {'height': 65, 'url': 'https://preview.redd.it/nqhgsw1i2tt51.jpg?width=320&amp;crop=smart&amp;auto=webp&amp;s=5567be7877d8452b4127c29f92a75a6bbfbf6f97', 'width': 320}, {'height': 130, 'url': 'https://preview.redd.it/nqhgsw1i2tt51.jpg?width=640&amp;crop=smart&amp;auto=webp&amp;s=4c152122262a5ed47d30b2023e56cfed2f5b1f6a', 'width': 640}, {'height': 195, 'url': 'https://preview.redd.it/nqhgsw1i2tt51.jpg?width=960&amp;crop=smart&amp;auto=webp&amp;s=d818e8e8caf5de252d9d9b9bffdeeb257d5e391f', 'width': 960}, {'height': 220, 'url': 'https://preview.redd.it/nqhgsw1i2tt51.jpg?width=1080&amp;crop=smart&amp;auto=webp&amp;s=7997dec0413a0ae13c6b1835b2ea423c12567c95', 'width': 1080}], 'source': {'height': 724, 'url': 'https://preview.redd.it/nqhgsw1i2tt51.jpg?auto=webp&amp;s=c62f485fef258fd3def4d9778d5b8b72c93665f6', 'width': 3554}, 'variants': {}}]}",28.0,140.0,https://i.redd.it/nqhgsw1i2tt51.jpg,moderator,,,,,,,,,,,,,
[],False,Instantinopaul,,[],,text,t2_68t1dlwp,False,False,[],False,False,1603003089,self.Physics,https://www.reddit.com/r/Physics/comments/jdbhhn/simulation_of_youngs_double_slit_experiment/,{},jdbhhn,True,False,False,False,True,True,False,,,[],,dark,text,False,False,True,6,0,False,all_ads,/r/Physics/comments/jdbhhn/simulation_of_youngs_double_slit_experiment/,False,6,1603003100,1," Coded Double Slit Experiment in Python and Visualized in matplotlib. 

Full project github link: [https://github.com/sayan1999/PhysiPy/tree/master/double-slit-experiment](https://github.com/sayan1999/PhysiPy/tree/master/double-slit-experiment) (Contains triple slit setup as well)

Video Tutorial to produce simulation:

Part 1: [https://youtu.be/KVsDWgcmJCo](https://youtu.be/KVsDWgcmJCo)

Part 2: [https://youtu.be/G1Yhx7QBNN8](https://youtu.be/G1Yhx7QBNN8)

![video](6e87losbtst51 ""Interference Pattern with Double Slit Experiment"")",True,False,False,Physics,t5_2qhi6,1475840,public,self,Simulation of Young's Double Slit Experiment,0,[],1.0,https://www.reddit.com/r/Physics/comments/jdbhhn/simulation_of_youngs_double_slit_experiment/,all_ads,6,,,,,,,,,,,,,,,,,,,
[],False,Instantinopaul,,[],,text,t2_68t1dlwp,False,False,[],False,False,1603002658,self.Physics,https://www.reddit.com/r/Physics/comments/jdbeiz/simulation_of_youngs_double_slit_experiment/,{},jdbeiz,True,False,False,False,True,True,False,,,[],,dark,text,False,False,True,0,0,False,all_ads,/r/Physics/comments/jdbeiz/simulation_of_youngs_double_slit_experiment/,False,6,1603002669,1,Coded the Double Slit Experiment in Python and Visualized in matplotlib. Full project github link: [https://github.com/sayan1999/PhysiPy/tree/master/double-slit-experiment](https://github.com/sayan1999/PhysiPy/tree/master/double-slit-experiment) (Includes triple slit code and pattern generation as well),True,False,False,Physics,t5_2qhi6,1475839,public,self,Simulation of Young's Double Slit Experiment,0,[],1.0,https://www.reddit.com/r/Physics/comments/jdbeiz/simulation_of_youngs_double_slit_experiment/,all_ads,6,self,"{'enabled': False, 'images': [{'id': 'w_fchQzfFYd2MrKsigg-wB99WQP-ngMfRfYvELDV8EU', 'resolutions': [{'height': 108, 'url': 'https://external-preview.redd.it/a86IXBMD7dQ56dgWbWdlPEdARG3R5PaHysZCB7MrfMw.jpg?width=108&amp;crop=smart&amp;auto=webp&amp;s=0963807540a5d5ecb68212a398b9b336af2889ed', 'width': 108}, {'height': 216, 'url': 'https://external-preview.redd.it/a86IXBMD7dQ56dgWbWdlPEdARG3R5PaHysZCB7MrfMw.jpg?width=216&amp;crop=smart&amp;auto=webp&amp;s=e3eac3a4b2bc08594cd384108a8404f2ce524b71', 'width': 216}, {'height': 320, 'url': 'https://external-preview.redd.it/a86IXBMD7dQ56dgWbWdlPEdARG3R5PaHysZCB7MrfMw.jpg?width=320&amp;crop=smart&amp;auto=webp&amp;s=8b47f45d0d29f09f9be384981d6f35dfc7a5c3f1', 'width': 320}], 'source': {'height': 400, 'url': 'https://external-preview.redd.it/a86IXBMD7dQ56dgWbWdlPEdARG3R5PaHysZCB7MrfMw.jpg?auto=webp&amp;s=865da3bf81070ffb1408c7b87b47483309c15b5a', 'width': 400}, 'variants': {}}]}",,,,,,,,,,,,,,,,,
