[],False,praiseprince_,misc,[],High school,text,t2_6pkn6sej,False,False,[],False,False,1602590643,self.Physics,https://www.reddit.com/r/Physics/comments/jac05g/what_does_the_area_under_the_curve_in/,{},jac05g,True,False,False,False,True,True,False,,[],dark,text,False,False,True,0,0,False,all_ads,/r/Physics/comments/jac05g/what_does_the_area_under_the_curve_in/,False,6,1602590654,1,"I know it's called Absement, but what is it.",True,False,False,Physics,t5_2qhi6,1467738,public,self,What does the area under the curve in Displacement-Time graph signify?,0,[],1.0,https://www.reddit.com/r/Physics/comments/jac05g/what_does_the_area_under_the_curve_in/,all_ads,6,question,Question,,,,,,,56820ba8-c6b2-11e4-92f0-22000b6d820d,dark,,,,,,,,,
[],False,TACO828,,[],,text,t2_3lv4v2wb,False,False,[],False,False,1602590500,self.Physics,https://www.reddit.com/r/Physics/comments/jabys0/projectile_motion_with_air_resistance/,{},jabys0,True,False,False,False,True,True,False,,[],dark,text,False,False,True,0,0,False,all_ads,/r/Physics/comments/jabys0/projectile_motion_with_air_resistance/,False,6,1602590512,1,"I'm currently working on a math IA about the relationship between velocity and air resistance in projectile motion and solving with differential equations. While in a vacuum, it would be simple, air resistance has no effect, but in reality, air resistance has a huge effect on the projectile trajectory, how would I pursue this and derive an equation involving the two? I've seen an equation with the derivative of the x component of velocity with respect to x and it uses the density of air, and speed of sound at firing location, along with ballistic coefficient, density function and function of air resistance, but I was wondering how do some of these things factor in with the effect of air resistance, and how I would go about deriving the equations involved.

I should also note that I figured out the equation of velocity as a function of time with air resistance but in free fall, although unsure how to add the trajectory to this.",True,False,False,Physics,t5_2qhi6,1467737,public,self,Projectile motion with air resistance differential equations,0,[],1.0,https://www.reddit.com/r/Physics/comments/jabys0/projectile_motion_with_air_resistance/,all_ads,6,,,,,,,,,,,,,,,,,,,
[],False,Gratis_Bier,,[],,text,t2_owa7v,False,False,[],False,False,1602584617,self.Physics,https://www.reddit.com/r/Physics/comments/jaao6l/who_are_among_the_leading_theoretical_physicists/,{},jaao6l,True,False,False,False,True,True,False,,[],dark,text,False,False,True,1,0,False,all_ads,/r/Physics/comments/jaao6l/who_are_among_the_leading_theoretical_physicists/,False,6,1602584627,1,"There are of course still some giants among us like Weinberg and 't Hooft, but I don't think they are still doing revolutionary research (or are they?).

Who do you think should be included in a list of 'most important/influential theoretical physicists of the time'?",True,False,False,Physics,t5_2qhi6,1467588,public,self,Who are among the leading theoretical physicists today?,0,[],1.0,https://www.reddit.com/r/Physics/comments/jaao6l/who_are_among_the_leading_theoretical_physicists/,all_ads,6,question,Question,,,,,,,,,,,,,,,,,
[],False,codeavail_expert,,[],,text,t2_3tdu8ok7,False,False,[],False,False,1602583658,codeavail.com,https://www.reddit.com/r/Physics/comments/jaahb4/download_physics_stats_best_ever_queries_with/,{},jaahb4,True,False,False,False,True,False,False,,[],dark,text,False,False,True,0,0,False,all_ads,/r/Physics/comments/jaahb4/download_physics_stats_best_ever_queries_with/,False,6,1602583668,1,,True,False,False,Physics,t5_2qhi6,1467577,public,https://a.thumbs.redditmedia.com/m-PyuHGzY5GPLtI08sV02ghO4LExYmpeXkjyYIpt-D0.jpg,Download Physics Stats Best Ever Queries with Solutions,0,[],1.0,https://www.codeavail.com/Statistics-Help,all_ads,6,,,link,"{'enabled': False, 'images': [{'id': 'EwivCw1NTYwFbrrcynMfGJiJm-x8cgY_utOxklaR5ug', 'resolutions': [{'height': 60, 'url': 'https://external-preview.redd.it/kbrTX1nP5OTfe67IpiGuMKgti7BZgVbfv8Aq7z5O-Lw.jpg?width=108&amp;crop=smart&amp;auto=webp&amp;s=7833cfe468e22ab58e1452449eb03fc02e5ab0c2', 'width': 108}, {'height': 121, 'url': 'https://external-preview.redd.it/kbrTX1nP5OTfe67IpiGuMKgti7BZgVbfv8Aq7z5O-Lw.jpg?width=216&amp;crop=smart&amp;auto=webp&amp;s=63f7866cd09ef48b51fd1537abba31b1ec6bda72', 'width': 216}, {'height': 180, 'url': 'https://external-preview.redd.it/kbrTX1nP5OTfe67IpiGuMKgti7BZgVbfv8Aq7z5O-Lw.jpg?width=320&amp;crop=smart&amp;auto=webp&amp;s=0a145a4e8d167fd3a49711e64ce557bc3ba82a5f', 'width': 320}, {'height': 360, 'url': 'https://external-preview.redd.it/kbrTX1nP5OTfe67IpiGuMKgti7BZgVbfv8Aq7z5O-Lw.jpg?width=640&amp;crop=smart&amp;auto=webp&amp;s=1c84e59a11f809ad5c6f3112735c54b06ffb75bd', 'width': 640}, {'height': 540, 'url': 'https://external-preview.redd.it/kbrTX1nP5OTfe67IpiGuMKgti7BZgVbfv8Aq7z5O-Lw.jpg?width=960&amp;crop=smart&amp;auto=webp&amp;s=911254f58fc5726a869399954d215df8be89d2fd', 'width': 960}, {'height': 608, 'url': 'https://external-preview.redd.it/kbrTX1nP5OTfe67IpiGuMKgti7BZgVbfv8Aq7z5O-Lw.jpg?width=1080&amp;crop=smart&amp;auto=webp&amp;s=b1e7d68609e70e725b73b11b33a0b17c98f6dd9c', 'width': 1080}], 'source': {'height': 676, 'url': 'https://external-preview.redd.it/kbrTX1nP5OTfe67IpiGuMKgti7BZgVbfv8Aq7z5O-Lw.jpg?auto=webp&amp;s=b34c89d091a0b42363bc0fdc31446d6ff6f9f818', 'width': 1200}, 'variants': {}}]}",,78.0,140.0,https://www.codeavail.com/Statistics-Help,,,,,,,,,,,
[],False,PaulGoes,,[],,text,t2_1vvut236,False,False,[],False,False,1602583624,self.Physics,https://www.reddit.com/r/Physics/comments/jaah1q/writings_of_oppenheimer/,{},jaah1q,True,False,False,False,True,True,False,,[],dark,text,False,False,True,0,0,False,all_ads,/r/Physics/comments/jaah1q/writings_of_oppenheimer/,False,6,1602583634,1,"Hello Physicists

I am interested in finding a collection of Robert's philosophical and journal writings. I'm aware of several biographies and pieces on the Manhattan Project and his trial, and of course scientific papers, but I'm really looking for a good published collection of his writing about his life and philosophy in his own words. Nothing really comes up for me on Amazon / Ebay / Google. Any advice appreciated!

PG",True,False,False,Physics,t5_2qhi6,1467575,public,self,Writings of Oppenheimer,0,[],1.0,https://www.reddit.com/r/Physics/comments/jaah1q/writings_of_oppenheimer/,all_ads,6,,,,,,,,,,,,,,,,,,,
[],False,gr0omLak3,,[],,text,t2_4uf0i2yo,False,False,[],False,False,1602582253,reddit.com,https://www.reddit.com/r/Physics/comments/jaa7bd/ive_always_been_interested_in_wormholes_but/,{},jaa7bd,True,False,False,False,True,False,False,,[],dark,text,False,False,True,3,0,False,all_ads,/r/Physics/comments/jaa7bd/ive_always_been_interested_in_wormholes_but/,False,6,1602582264,1,,True,False,False,Physics,t5_2qhi6,1467541,public,https://b.thumbs.redditmedia.com/LucnCAaEdaXWv_vVOoMeuP8kiM3DHtc0ltgF-LR4zdw.jpg,"I’ve always been interested in wormholes - but there’s one part I’m stumped on. If space were to be bent like this to connect to points for faster travel, would that not destroy every solar system in between due to the condensing of gravitational fields? TIA",0,[],1.0,https://www.reddit.com/gallery/jaa7bd,all_ads,6,,,,,,105.0,140.0,https://www.reddit.com/gallery/jaa7bd,,,,,,,,"{'items': [{'id': 8506804, 'media_id': 'd4oiky7b2us51'}, {'id': 8506805, 'media_id': 'n5624z7b2us51'}]}",True,"{'d4oiky7b2us51': {'e': 'Image', 'id': 'd4oiky7b2us51', 'm': 'image/jpg', 'p': [{'u': 'https://preview.redd.it/d4oiky7b2us51.jpg?width=108&amp;crop=smart&amp;auto=webp&amp;s=ceecab1700d45a476501399b4686031ba83f716f', 'x': 108, 'y': 81}, {'u': 'https://preview.redd.it/d4oiky7b2us51.jpg?width=216&amp;crop=smart&amp;auto=webp&amp;s=12f9786d3ad709882501b02b579c92695bafe259', 'x': 216, 'y': 162}, {'u': 'https://preview.redd.it/d4oiky7b2us51.jpg?width=320&amp;crop=smart&amp;auto=webp&amp;s=6a0c05a6101d4051442b7d6b979d485a4d30ca34', 'x': 320, 'y': 240}, {'u': 'https://preview.redd.it/d4oiky7b2us51.jpg?width=640&amp;crop=smart&amp;auto=webp&amp;s=161b5e931b69d9012fe102b412f9c7d5857981b0', 'x': 640, 'y': 480}], 's': {'u': 'https://preview.redd.it/d4oiky7b2us51.jpg?width=640&amp;format=pjpg&amp;auto=webp&amp;s=9d4829076d92ba31b4981a9789bad3c9d7717d1d', 'x': 640, 'y': 480}, 'status': 'valid'}, 'n5624z7b2us51': {'e': 'Image', 'id': 'n5624z7b2us51', 'm': 'image/jpg', 'p': [{'u': 'https://preview.redd.it/n5624z7b2us51.jpg?width=108&amp;crop=smart&amp;auto=webp&amp;s=c68ac41d06d9c4b033c445abb640b480d6fc83f0', 'x': 108, 'y': 60}, {'u': 'https://preview.redd.it/n5624z7b2us51.jpg?width=216&amp;crop=smart&amp;auto=webp&amp;s=c887e45d7e3155aacbb244b1c514cc17d7016d56', 'x': 216, 'y': 121}, {'u': 'https://preview.redd.it/n5624z7b2us51.jpg?width=320&amp;crop=smart&amp;auto=webp&amp;s=ff46f87edb181a128dd93e10bd379dc4356d3d39', 'x': 320, 'y': 179}, {'u': 'https://preview.redd.it/n5624z7b2us51.jpg?width=640&amp;crop=smart&amp;auto=webp&amp;s=71793ed767f27f359ff0f21b987484c5bbcd8795', 'x': 640, 'y': 359}], 's': {'u': 'https://preview.redd.it/n5624z7b2us51.jpg?width=700&amp;format=pjpg&amp;auto=webp&amp;s=4c2466056a0a182e8f05a8094b0200e0a408cef0', 'x': 700, 'y': 393}, 'status': 'valid'}}",
[],False,HurricaneHell,,[],,text,t2_plcxjr9,False,False,[],False,False,1602582094,self.Physics,https://www.reddit.com/r/Physics/comments/jaa61c/a_level_physics_resistivity_practical_question/,{},jaa61c,True,False,False,False,True,True,False,,[],dark,text,False,False,True,0,0,False,all_ads,/r/Physics/comments/jaa61c/a_level_physics_resistivity_practical_question/,False,6,1602582105,1,"So guys I have just done the practical where I have measured the length of a wire, the resistance and diameter of a constantin wire. I have gotten the cross sectional area, plotted a graph of resistance (y axis) to length (X axis) and calculated the resistivity by multiplying the gradient by the area. One of my questions is: ""Determine a value for the uncertainty in your values for the gradient and A. Hence calculate the uncertainty in your value for the resistivity.' I'm not sure how to approach this because, and excuse my abruptness, I have a terrible teacher who hasn't told us what any of it means, I measured the length probably to the nearest mm, area to 0.00 mm using a micrometer and resistance to 0.0 ohms, using a multimeter. I'm not sure what to do with these values. I think is to divide them (with error formats like +-0.005mm for diameter, which I will also have to turn to area, would appreciate if you could confirm that that will be just half) by my values and add them up, finally multiplying that value by my resistivity. Help would be greatly appreciated, if I am too much of a scrub feel free to tell me, thanks",True,False,False,Physics,t5_2qhi6,1467539,public,self,A level physics resistivity practical question,0,[],1.0,https://www.reddit.com/r/Physics/comments/jaa61c/a_level_physics_resistivity_practical_question/,all_ads,6,question,Question,,,,,,,,,,,,,,,,,
[],False,jeed_for,,[],,text,t2_6bqv9oes,False,False,[],False,False,1602581095,self.Physics,https://www.reddit.com/r/Physics/comments/ja9z0g/general_relativity_question/,{},ja9z0g,True,False,False,False,True,True,False,,[],dark,text,False,False,True,1,0,False,all_ads,/r/Physics/comments/ja9z0g/general_relativity_question/,False,6,1602581105,1,"Before I start, I've only been watching videos and what not on gr conceptionally, I know very little physics and math.

So from what I understand is we are moving through time and therefore every path isn't a straight path and everything will converge at some point and so relative to you sitting on Earth it just looks like something is being pulled in a straight line downwards towards the earth.

The way this is explained, I don't know where the fabric of spacetime comes into play and why masses bending spacetime relates to gravity. To me its just all to do with the fact we are moving through time and everything will converge at some point and I fail to see why the fabric of spacetime is relevant.",True,False,False,Physics,t5_2qhi6,1467528,public,self,General Relativity Question,0,[],1.0,https://www.reddit.com/r/Physics/comments/ja9z0g/general_relativity_question/,all_ads,6,question,Question,,,,,,,,,,,,,,,,,
[],False,bokononon,,[],,text,t2_1wq96,False,False,[],False,False,1602580655,arxiv.org,https://www.reddit.com/r/Physics/comments/ja9w7g/demystifying_the_delayedchoice_quantum_eraser/,{},ja9w7g,True,False,False,False,True,False,False,,[],dark,text,False,False,True,17,0,False,all_ads,/r/Physics/comments/ja9w7g/demystifying_the_delayedchoice_quantum_eraser/,False,6,1602580666,1,,True,False,False,Physics,t5_2qhi6,1467526,public,default,Demystifying the Delayed-Choice Quantum Eraser: there is no retro-causality,0,[],1.0,https://arxiv.org/abs/1908.03920,all_ads,6,article,Academic,,,,,,https://arxiv.org/abs/1908.03920,,,,,,,,,,,
[],False,Cummy_Bunny,,[],,text,t2_67f4lrh,False,False,[],False,False,1602579672,self.Physics,https://www.reddit.com/r/Physics/comments/ja9pk9/please_explain_this_to_a_layman/,{},ja9pk9,True,False,False,False,True,True,False,,[],dark,text,False,False,True,2,0,False,all_ads,/r/Physics/comments/ja9pk9/please_explain_this_to_a_layman/,False,6,1602579682,1,"I saw this on youtube and i want to learn how this happens. Plz explain.

[https://www.youtube.com/watch?v=u\_P6wrLvQak](https://www.youtube.com/watch?v=u_P6wrLvQak)",True,False,False,Physics,t5_2qhi6,1467523,public,self,Please explain this to a layman,0,[],1.0,https://www.reddit.com/r/Physics/comments/ja9pk9/please_explain_this_to_a_layman/,all_ads,6,,,self,"{'enabled': False, 'images': [{'id': '2C8V2O8NS1gjhEt3bTwbroe4Gx8m6awHKlVfq7vthnM', 'resolutions': [{'height': 81, 'url': 'https://external-preview.redd.it/33Ehc9jQw52ypS_-Z-VHrNn24TffLyZE4QTTinzmNZ0.jpg?width=108&amp;crop=smart&amp;auto=webp&amp;s=b85e8d9134253e934aa1b56aef6e2988e7936572', 'width': 108}, {'height': 162, 'url': 'https://external-preview.redd.it/33Ehc9jQw52ypS_-Z-VHrNn24TffLyZE4QTTinzmNZ0.jpg?width=216&amp;crop=smart&amp;auto=webp&amp;s=cdecbc0fa9b4be94332b070dfc14bda2d5275b0f', 'width': 216}, {'height': 240, 'url': 'https://external-preview.redd.it/33Ehc9jQw52ypS_-Z-VHrNn24TffLyZE4QTTinzmNZ0.jpg?width=320&amp;crop=smart&amp;auto=webp&amp;s=fe09e4070e2f963aa444073695db25c002972da3', 'width': 320}], 'source': {'height': 360, 'url': 'https://external-preview.redd.it/33Ehc9jQw52ypS_-Z-VHrNn24TffLyZE4QTTinzmNZ0.jpg?auto=webp&amp;s=bb431dda441fa44ec24d99e20a9dd9c47ab155dd', 'width': 480}, 'variants': {}}]}",,,,,,,,,,,,,,,
[],False,ScienceReddit1,,[],,text,t2_7726zrm7,False,False,[],False,False,1602579317,thescienceloop.com,https://www.reddit.com/r/Physics/comments/ja9n5u/telescope_captures_supermassive_black_hole/,{},ja9n5u,False,False,False,False,False,False,False,,[],dark,text,False,False,True,0,0,False,all_ads,/r/Physics/comments/ja9n5u/telescope_captures_supermassive_black_hole/,False,6,1602579328,1,,True,False,False,Physics,t5_2qhi6,1467505,public,https://b.thumbs.redditmedia.com/bgIhtO4XBBPYbltKXiI-mMzeVLWWqBVixS9FAptva5Y.jpg,Telescope captures supermassive black hole devouring star,0,[],1.0,https://www.thescienceloop.com/2020/10/telescopes-capture-supermassive-black.html,all_ads,6,,,link,"{'enabled': False, 'images': [{'id': '4BjM9zFnReJUvubu3By6Ddoek6o_0WxsUhT0Y8VYZWg', 'resolutions': [{'height': 60, 'url': 'https://external-preview.redd.it/YYI2saVy7La5Ex60D-rfGba5xdROj494R-6VwmgKXpk.jpg?width=108&amp;crop=smart&amp;auto=webp&amp;s=9fe77f03300d71c922753cd8034c38235bded28e', 'width': 108}, {'height': 121, 'url': 'https://external-preview.redd.it/YYI2saVy7La5Ex60D-rfGba5xdROj494R-6VwmgKXpk.jpg?width=216&amp;crop=smart&amp;auto=webp&amp;s=0b5259e89eaf388d366cd0890ca6ee8f1a958932', 'width': 216}, {'height': 180, 'url': 'https://external-preview.redd.it/YYI2saVy7La5Ex60D-rfGba5xdROj494R-6VwmgKXpk.jpg?width=320&amp;crop=smart&amp;auto=webp&amp;s=49717654421f20a3e95eb7c2318669e0002e26b5', 'width': 320}], 'source': {'height': 270, 'url': 'https://external-preview.redd.it/YYI2saVy7La5Ex60D-rfGba5xdROj494R-6VwmgKXpk.jpg?auto=webp&amp;s=a175e3c8e1da830e8156aaf88097a4d8f1b06dcb', 'width': 480}, 'variants': {}}]}",reddit,78.0,140.0,https://www.thescienceloop.com/2020/10/telescopes-capture-supermassive-black.html,,,,,,,,,,,
[],False,mubukugrappa,,[],,text,t2_avxhh,False,False,[],False,False,1602579041,nyu.edu,https://www.reddit.com/r/Physics/comments/ja9lhg/chemists_create_new_crystal_form_of_insecticide/,{},ja9lhg,True,False,False,False,True,False,False,,[],dark,text,False,False,True,1,0,False,all_ads,/r/Physics/comments/ja9lhg/chemists_create_new_crystal_form_of_insecticide/,False,6,1602579052,1,,False,False,False,Physics,t5_2qhi6,1467493,public,default,"Chemists Create New Crystal Form of Insecticide, Boosting Its Ability to Fight Mosquitoes and Malaria:Researchers use a simple, inexpensive technique to develop a new fast-acting form of deltamethrin that may help with growing insecticide resistance",0,[],1.0,https://www.nyu.edu/about/news-publications/news/2020/october/chemists-create-new-crystal-form-of-insecticide.html,all_ads,6,article,News,,,,,,https://www.nyu.edu/about/news-publications/news/2020/october/chemists-create-new-crystal-form-of-insecticide.html,,,,,,,,,,,
[],False,Saphsin,,[],,text,t2_y7ufo,False,False,[],False,False,1602577409,self.Physics,https://www.reddit.com/r/Physics/comments/ja9bbe/who_is_arieh_ben_naim/,{},ja9bbe,True,False,False,False,True,True,False,,[],dark,text,False,False,True,2,0,False,all_ads,/r/Physics/comments/ja9bbe/who_is_arieh_ben_naim/,False,6,1602577419,1,He has all these books criticizing other physicists and chemistry on entropy that are selling well but I can’t find professional reviews on them.,True,False,False,Physics,t5_2qhi6,1467470,public,self,Who is Arieh Ben Naim?,0,[],1.0,https://www.reddit.com/r/Physics/comments/ja9bbe/who_is_arieh_ben_naim/,all_ads,6,question,Question,,,,,,,,,,,,,,,,,
[],False,DefsNotQualified4Dis,mat,[],Condensed matter physics,text,t2_1f6ihges,False,False,[],False,False,1602576774,physics.aps.org,https://www.reddit.com/r/Physics/comments/ja97dz/detecting_acoustic_blackbody_radiation/,{},ja97dz,True,False,False,False,True,False,False,,[],dark,text,False,False,True,1,0,False,all_ads,/r/Physics/comments/ja97dz/detecting_acoustic_blackbody_radiation/,False,6,1602576785,1,,True,False,False,Physics,t5_2qhi6,1467462,public,https://b.thumbs.redditmedia.com/pPtzjcXwEBYYcLB9LUR065u8J9ghPw5zA_-o-llLEZk.jpg,Detecting Acoustic Blackbody Radiation,0,[],1.0,https://physics.aps.org/articles/v13/s118,all_ads,6,,,link,"{'enabled': False, 'images': [{'id': 'cPwGFoSsyAu2P1rvdZXeMph0CY7ZdBxgRtW_AO6EO-g', 'resolutions': [{'height': 54, 'url': 'https://external-preview.redd.it/FJ9Ywhc9-UxxE59U_tpehujbvnzzsXCWGBvnyK9VIHU.jpg?width=108&amp;crop=smart&amp;auto=webp&amp;s=1a0886f76d3afa9b03b213cb2cec06c52be528b7', 'width': 108}, {'height': 108, 'url': 'https://external-preview.redd.it/FJ9Ywhc9-UxxE59U_tpehujbvnzzsXCWGBvnyK9VIHU.jpg?width=216&amp;crop=smart&amp;auto=webp&amp;s=677f4febea5d3dc97b3f81caa3ff64605e88fcdd', 'width': 216}, {'height': 160, 'url': 'https://external-preview.redd.it/FJ9Ywhc9-UxxE59U_tpehujbvnzzsXCWGBvnyK9VIHU.jpg?width=320&amp;crop=smart&amp;auto=webp&amp;s=2df5c1119c1b5607182518c9ce8d4872eed204e4', 'width': 320}], 'source': {'height': 250, 'url': 'https://external-preview.redd.it/FJ9Ywhc9-UxxE59U_tpehujbvnzzsXCWGBvnyK9VIHU.jpg?auto=webp&amp;s=fe9a39f0fd03c1a0c7440f1ca2641a9f0087fed8', 'width': 500}, 'variants': {}}]}",,70.0,140.0,https://physics.aps.org/articles/v13/s118,3d6fcda8-c6b2-11e4-b88b-22000bc08516,dark,,,,,,,,,
[],False,DefsNotQualified4Dis,mat,[],Condensed matter physics,text,t2_1f6ihges,False,False,[],False,False,1602576750,physics.aps.org,https://www.reddit.com/r/Physics/comments/ja978p/major_physics_publisher_goes_double_blind/,{},ja978p,True,False,False,False,True,False,False,,[],dark,text,False,False,True,14,0,False,all_ads,/r/Physics/comments/ja978p/major_physics_publisher_goes_double_blind/,False,6,1602576761,1,,True,False,False,Physics,t5_2qhi6,1467462,public,https://b.thumbs.redditmedia.com/GVj4x3rTR0AZxcbFJelfVlfUWgBZTVBcyC4y1c2eYVQ.jpg,Major Physics Publisher Goes Double Blind,0,[],1.0,https://physics.aps.org/articles/v13/148,all_ads,6,,,link,"{'enabled': False, 'images': [{'id': 'ZzOPQ826j5lLLzPJ1gbMuEQfb8LmSYU311LbxtuNXZI', 'resolutions': [{'height': 54, 'url': 'https://external-preview.redd.it/pHAwAjePSWKMBSMp-JbuZBjGjM2IKnT66mzP0UMNxpY.jpg?width=108&amp;crop=smart&amp;auto=webp&amp;s=1e053339838dfddab8dde585c4f53a425abd65e2', 'width': 108}, {'height': 108, 'url': 'https://external-preview.redd.it/pHAwAjePSWKMBSMp-JbuZBjGjM2IKnT66mzP0UMNxpY.jpg?width=216&amp;crop=smart&amp;auto=webp&amp;s=20171610964e7e97ba9f4359094e5f5b55c71bc7', 'width': 216}, {'height': 160, 'url': 'https://external-preview.redd.it/pHAwAjePSWKMBSMp-JbuZBjGjM2IKnT66mzP0UMNxpY.jpg?width=320&amp;crop=smart&amp;auto=webp&amp;s=e7217d026e31300639c5c0bbfa1125909ab82c32', 'width': 320}], 'source': {'height': 250, 'url': 'https://external-preview.redd.it/pHAwAjePSWKMBSMp-JbuZBjGjM2IKnT66mzP0UMNxpY.jpg?auto=webp&amp;s=68d2e0b3bd841ca5d48ebd8edc974bcd07f9b121', 'width': 500}, 'variants': {}}]}",,70.0,140.0,https://physics.aps.org/articles/v13/148,3d6fcda8-c6b2-11e4-b88b-22000bc08516,dark,,,,,,,,,
[],False,Omry_Moraly,,[],,text,t2_7z1i8d7h,False,False,[],False,False,1602572550,self.Physics,https://www.reddit.com/r/Physics/comments/ja8fhu/faradays_law/,{},ja8fhu,True,False,False,False,True,True,False,,[],dark,text,False,False,True,0,0,False,all_ads,/r/Physics/comments/ja8fhu/faradays_law/,False,6,1602572561,1,"A conductor moving on its own through a magnetic cylinder, generating an electric current in a cylinder?",True,False,False,Physics,t5_2qhi6,1467394,public,self,Faraday's law,0,[],1.0,https://www.reddit.com/r/Physics/comments/ja8fhu/faradays_law/,all_ads,6,,,,,,,,,,,,,,,,,,,
[],False,routable,,[],,text,t2_fzk26,False,False,[],False,False,1602571190,i.imgur.com,https://www.reddit.com/r/Physics/comments/ja8635/this_is_a_water_bridge_in_the_netherlands_im/,{},ja8635,True,False,False,False,True,False,False,,[],dark,text,False,False,True,85,0,False,all_ads,/r/Physics/comments/ja8635/this_is_a_water_bridge_in_the_netherlands_im/,False,6,1602571202,1,,True,False,False,Physics,t5_2qhi6,1467368,public,https://a.thumbs.redditmedia.com/GDRvmx5BOgK1aeMF-BAEVPuBSqcbTU7brKUaLJhcpb4.jpg,"This is a water bridge in the Netherlands. I’m curious how the structure’s carrying capacity is rated and now a passing vessel would impact it. My hypothesis is that the hull of a vessel would displace some of the water, reducing the load, but would the ship’s weight be carried by the bridge?",0,[],1.0,https://i.imgur.com/1lb1Cr0.jpg,all_ads,6,image,Image,image,"{'enabled': True, 'images': [{'id': 'NumVkZ7Znzm2I1fuv2me15H3zaQQocc8Txe9iB95OkY', 'resolutions': [{'height': 85, 'url': 'https://external-preview.redd.it/2n_0NyNVWlyrceD5Wq3DHSBBp7pefl1AIj4EZaavrMc.jpg?width=108&amp;crop=smart&amp;auto=webp&amp;s=e9235b4d4ae74e1311a52b70e849eda8174a2d59', 'width': 108}, {'height': 170, 'url': 'https://external-preview.redd.it/2n_0NyNVWlyrceD5Wq3DHSBBp7pefl1AIj4EZaavrMc.jpg?width=216&amp;crop=smart&amp;auto=webp&amp;s=dfa6810bbb580f7aac473733af546e2766681302', 'width': 216}, {'height': 252, 'url': 'https://external-preview.redd.it/2n_0NyNVWlyrceD5Wq3DHSBBp7pefl1AIj4EZaavrMc.jpg?width=320&amp;crop=smart&amp;auto=webp&amp;s=cfe0ca925ca96db16fb16617dbb5d720d09cb9ae', 'width': 320}, {'height': 505, 'url': 'https://external-preview.redd.it/2n_0NyNVWlyrceD5Wq3DHSBBp7pefl1AIj4EZaavrMc.jpg?width=640&amp;crop=smart&amp;auto=webp&amp;s=75cad657598297cb60044ca6bb48679f6189cc37', 'width': 640}, {'height': 758, 'url': 'https://external-preview.redd.it/2n_0NyNVWlyrceD5Wq3DHSBBp7pefl1AIj4EZaavrMc.jpg?width=960&amp;crop=smart&amp;auto=webp&amp;s=457c9e32b5f2d274ca341d34acf0ff4beb7b4b36', 'width': 960}, {'height': 853, 'url': 'https://external-preview.redd.it/2n_0NyNVWlyrceD5Wq3DHSBBp7pefl1AIj4EZaavrMc.jpg?width=1080&amp;crop=smart&amp;auto=webp&amp;s=a04e02da25d33ab4e156d6318302d10b2cf23453', 'width': 1080}], 'source': {'height': 1423, 'url': 'https://external-preview.redd.it/2n_0NyNVWlyrceD5Wq3DHSBBp7pefl1AIj4EZaavrMc.jpg?auto=webp&amp;s=0a4aed9c73e323ee40005277dfcbfc499c77d6d3', 'width': 1800}, 'variants': {}}]}",,110.0,140.0,https://i.imgur.com/1lb1Cr0.jpg,,,,,,,,,,,
[],False,Throwawayidkplz,,[],,text,t2_489ic02k,False,False,[],False,False,1602566827,self.Physics,https://www.reddit.com/r/Physics/comments/ja7b26/sometimes_i_wonder_if_someone_else_found_the_laws/,{},ja7b26,True,False,False,False,True,True,False,,[],dark,text,False,False,True,5,0,False,all_ads,/r/Physics/comments/ja7b26/sometimes_i_wonder_if_someone_else_found_the_laws/,False,6,1602566838,1,"Imagine someone from the BCs found out about f=ma, kinematics and gravity is 9.81m/s^2 but their notes have never been found and we credit newton for everything. I know it wouldn't be 9.81, it would be whatever units they used but yeah what if it was some kid who got bored and realized that everything falls at the same rate and ended up discovering how forces work and acceleration and all that. Idk just an odd thought.",True,False,False,Physics,t5_2qhi6,1467263,public,self,Sometimes I wonder if someone else found the laws of newtonian physics before newton,0,[],1.0,https://www.reddit.com/r/Physics/comments/ja7b26/sometimes_i_wonder_if_someone_else_found_the_laws/,all_ads,6,,,,,,,,,,,,,,,,,,,
