all_awardings,allow_live_comments,author,author_flair_css_class,author_flair_richtext,author_flair_text,author_flair_type,author_fullname,author_patreon_flair,author_premium,awarders,can_mod_post,contest_mode,created_utc,domain,full_link,gildings,id,is_crosspostable,is_meta,is_original_content,is_reddit_media_domain,is_robot_indexable,is_self,is_video,link_flair_background_color,link_flair_richtext,link_flair_text_color,link_flair_type,locked,media_only,no_follow,num_comments,num_crossposts,over_18,parent_whitelist_status,permalink,pinned,pwls,retrieved_on,score,selftext,send_replies,spoiler,stickied,subreddit,subreddit_id,subreddit_subscribers,subreddit_type,thumbnail,title,total_awards_received,treatment_tags,upvote_ratio,url,whitelist_status,wls,link_flair_css_class,link_flair_text,post_hint,preview,removed_by_category,thumbnail_height,thumbnail_width,url_overridden_by_dest,author_flair_template_id,author_flair_text_color,author_flair_background_color,media,media_embed,secure_media,secure_media_embed,gallery_data,is_gallery,media_metadata,distinguished
[],False,rohitbobli,,[],,text,t2_8dalho4v,False,False,[],False,False,1602672791,self.Physics,https://www.reddit.com/r/Physics/comments/jayfsy/i_dont_understand_this/,{},jayfsy,True,False,False,False,True,True,False,,[],dark,text,False,False,True,8,0,False,all_ads,/r/Physics/comments/jayfsy/i_dont_understand_this/,False,6,1602672801,1,"""The concept of the potential energy would not be meaningful if the work depended on path""

What does that mean??? It's in my textbook but I don't know how to imagine or understand it. Please help",True,False,False,Physics,t5_2qhi6,1469416,public,self,I don't understand this,0,[],1.0,https://www.reddit.com/r/Physics/comments/jayfsy/i_dont_understand_this/,all_ads,6,,,,,,,,,,,,,,,,,,,
[],False,Decopi,,[],,text,t2_14co405j,False,False,[],False,False,1602672567,self.Physics,https://www.reddit.com/r/Physics/comments/jaye7j/newbie_simple_question_about_infinite_universe/,{},jaye7j,True,False,False,False,True,True,False,,[],dark,text,False,False,True,8,0,False,all_ads,/r/Physics/comments/jaye7j/newbie_simple_question_about_infinite_universe/,False,6,1602672578,1,"Hi, newbie here with another very basic knowledge of Physics:


AFAIK the Universe seems to be flat and infinite. Please, my questions:


1) Is that applied to the observable Universe? To the non-observable Universe? To both of them?


2) Is the ""infinite Universe"" a mathematical speculation? Or is it considered a proven scientific theory?


3) If we can see the CBR, how can we affirm that the Universe is infinite? From my ignorance, the CBR is the ""limit"" of the observable Universe, so at least the observable Universe is finite. Am I wrong?


4) Let's suppose we can travel at speed of light. If the Universe is expanding, then the CBR distance (from my eye) also is expanding (it'll be &gt; than ±13.8 billion years old). So, can we said that the CBR is unreachable (in the sense that we never can travel to there, even at the speed of light)?


Thank you in advance!",True,False,False,Physics,t5_2qhi6,1469413,public,self,Newbie simple question about infinite Universe,0,[],1.0,https://www.reddit.com/r/Physics/comments/jaye7j/newbie_simple_question_about_infinite_universe/,all_ads,6,question,Question,,,,,,,,,,,,,,,,,
[],False,Decopi,,[],,text,t2_14co405j,False,False,[],False,False,1602670318,self.Physics,https://www.reddit.com/r/Physics/comments/jaxxuo/newbie_simple_question_about_age_of_the_university/,{},jaxxuo,True,False,False,False,True,True,False,,[],dark,text,False,False,False,3,0,False,all_ads,/r/Physics/comments/jaxxuo/newbie_simple_question_about_age_of_the_university/,False,6,1602670328,1,"Hi, newbie here with a very basic knowledge of Physics:


AFAIK laws of physics can't be applied to the very beginning of the Universe (first expansion of the singularity), so we don't know what happened at the first moment, how long it took etc.


We also know nothing about the non-observable Universe.


So please, how can we say that the Universe age is around ±13.8 billion years? 


From my ignorance, the age of the Universe must include: a) The initial expansion of the singularity; b) The CBR expansion and c) The non-observable Universe. Am I wrong?


Thank you in advance!",True,False,False,Physics,t5_2qhi6,1469396,public,self,Newbie simple question about age of the University,0,[],1.0,https://www.reddit.com/r/Physics/comments/jaxxuo/newbie_simple_question_about_age_of_the_university/,all_ads,6,question,Question,,,,,,,,,,,,,,,,,
[],False,andrewvanzyl,,[],,text,t2_1vz39gi,False,False,[],False,False,1602669708,self.Physics,https://www.reddit.com/r/Physics/comments/jaxtlf/extra_time_professor_sir_roger_penrose_in/,{},jaxtlf,True,False,False,False,True,True,False,,[],dark,text,False,False,False,0,0,False,all_ads,/r/Physics/comments/jaxtlf/extra_time_professor_sir_roger_penrose_in/,False,6,1602669719,1," The interview brings out Nobel Prize Winner Professor Sir Roger Penrose's highly unconventional choice of subjects for deep study, which completely ignored the boundary between ‘pure’ and ‘applied’ mathematics. Those familiar with his world-leading development of relativity theory in the 1960s may be surprised to learn how much he was influenced by quantum theory in the 1950s, and also by the early origin of his new ideas.  Roger also explains the influence of Dirac, Sciama and other leading figures of the 1950s, and goes on to characterise the emergence of twistor theory. Non-experts will be interested to hear how the ideas of his best-known work, The Emperor’s New Mind, also had an origin in this early period. He also adds fascinating detail about the psychology of mathematical discovery, explaining how he was very slow at school, needing extra time to think issues through for himself. The mystery of time, in physics and human consciousness, runs through the entire conversation, and lights up even the most technical aspects of the discussion. [https://www.youtube.com/watch?v=zN5eLsI\_Tuo](https://www.youtube.com/watch?v=zN5eLsI_Tuo)",True,False,False,Physics,t5_2qhi6,1469395,public,self,Extra Time: Professor Sir Roger Penrose in conversation with Andrew Hodges (2014) – part 1/2 I Oxford University,0,[],1.0,https://www.reddit.com/r/Physics/comments/jaxtlf/extra_time_professor_sir_roger_penrose_in/,all_ads,6,,,self,"{'enabled': False, 'images': [{'id': 'WFTr4SWQ-ZIFL7JXZRVaRbYJpLCMt2njvFcCoEy5kZ4', 'resolutions': [{'height': 81, 'url': 'https://external-preview.redd.it/zmV27WdtxCewVY0EVtGlOMwZ-f-8_Nlm5ctuUOF4q3w.jpg?width=108&amp;crop=smart&amp;auto=webp&amp;s=fe50f7f0bf3b51f67b02052cee2b39c0eb7dcf76', 'width': 108}, {'height': 162, 'url': 'https://external-preview.redd.it/zmV27WdtxCewVY0EVtGlOMwZ-f-8_Nlm5ctuUOF4q3w.jpg?width=216&amp;crop=smart&amp;auto=webp&amp;s=2fed3b704653d0857f3fa3dacc24e859cd78bdc1', 'width': 216}, {'height': 240, 'url': 'https://external-preview.redd.it/zmV27WdtxCewVY0EVtGlOMwZ-f-8_Nlm5ctuUOF4q3w.jpg?width=320&amp;crop=smart&amp;auto=webp&amp;s=b3a96064b6406bb39e0702aac5f6618f17b9cd03', 'width': 320}], 'source': {'height': 360, 'url': 'https://external-preview.redd.it/zmV27WdtxCewVY0EVtGlOMwZ-f-8_Nlm5ctuUOF4q3w.jpg?auto=webp&amp;s=6e521c085fb9c3e73e8c2608138b433dc14a23d8', 'width': 480}, 'variants': {}}]}",,,,,,,,,,,,,,,
[],False,Itchy-Organization-4,,[],,text,t2_8devciqm,False,False,[],False,False,1602666353,kkozmos.blogspot.com,https://www.reddit.com/r/Physics/comments/jax7h2/last_moments_of_the_star_swallowed_by_the_black/,{},jax7h2,False,False,False,False,False,False,False,,[],dark,text,False,False,True,0,0,False,all_ads,/r/Physics/comments/jax7h2/last_moments_of_the_star_swallowed_by_the_black/,False,6,1602666364,1,,True,False,False,Physics,t5_2qhi6,1469351,public,https://b.thumbs.redditmedia.com/gRUeax_QUwatunZaE_OGhcytD6fB5OCYvmwiCvyFlQw.jpg,Last moments of the star swallowed by the black hole were seen for the first time,0,[],1.0,https://kkozmos.blogspot.com/2020/10/last-moments-of-star-swallowed-by-black.html,all_ads,6,article,Article,link,"{'enabled': False, 'images': [{'id': 'ldF0F8ZmqovqiKPXOwckvgzD__ezF2ZgullWgCVtNHc', 'resolutions': [{'height': 65, 'url': 'https://external-preview.redd.it/7taVaXWlfwaBNpZdQ7bfCuETQALLX5eb_-UofSldc1Y.jpg?width=108&amp;crop=smart&amp;auto=webp&amp;s=3c033c81ca0ea7a19d9cba5b670266f78ca954b1', 'width': 108}, {'height': 130, 'url': 'https://external-preview.redd.it/7taVaXWlfwaBNpZdQ7bfCuETQALLX5eb_-UofSldc1Y.jpg?width=216&amp;crop=smart&amp;auto=webp&amp;s=0fd80caf669b551dfa7f95df0b29ee069090aeef', 'width': 216}, {'height': 194, 'url': 'https://external-preview.redd.it/7taVaXWlfwaBNpZdQ7bfCuETQALLX5eb_-UofSldc1Y.jpg?width=320&amp;crop=smart&amp;auto=webp&amp;s=b1d27d2d8b85602edb79b61172309eee6b59d86e', 'width': 320}], 'source': {'height': 194, 'url': 'https://external-preview.redd.it/7taVaXWlfwaBNpZdQ7bfCuETQALLX5eb_-UofSldc1Y.jpg?auto=webp&amp;s=378579ff44c7945819c890d7d36f5c8794cb3512', 'width': 320}, 'variants': {}}]}",reddit,84.0,140.0,https://kkozmos.blogspot.com/2020/10/last-moments-of-star-swallowed-by-black.html,,,,,,,,,,,
[],False,Skydancerrr,,[],,text,t2_3nr3yns1,False,False,[],False,False,1602662189,self.Physics,https://www.reddit.com/r/Physics/comments/jawg2y/elementaryintermediate_physics_question/,{},jawg2y,True,False,False,False,True,True,False,,[],dark,text,False,False,False,6,0,False,all_ads,/r/Physics/comments/jawg2y/elementaryintermediate_physics_question/,False,6,1602662200,1,"Just asking, when I am trying to find acceleration which is Final Velocity minus Initial Velocity over Time. What if the given time is at minutes? like 30 minutes? Should I convert it to 1800 seconds or not? Just asking because if I did, the number really looks small.",True,False,False,Physics,t5_2qhi6,1469292,public,self,Elementary/Intermediate Physics Question,0,[],1.0,https://www.reddit.com/r/Physics/comments/jawg2y/elementaryintermediate_physics_question/,all_ads,6,question,Question,,,,,,,,,,,,,,,,,
[],False,spacetravelingcactus,,[],,text,t2_tjxh5p2,False,False,[],False,False,1602654663,self.Physics,https://www.reddit.com/r/Physics/comments/jauz60/gravity_is_not_a_force/,{},jauz60,True,False,False,False,True,True,False,,[],dark,text,False,False,False,14,0,False,all_ads,/r/Physics/comments/jauz60/gravity_is_not_a_force/,False,6,1602654674,1,If gravity is not a force then why does mass curve space-time? Or does curved space-time cause mass? Is mass just curved space-time? I'm so confused!!,True,False,False,Physics,t5_2qhi6,1469158,public,self,Gravity is not a force?,0,[],1.0,https://www.reddit.com/r/Physics/comments/jauz60/gravity_is_not_a_force/,all_ads,6,question,Question,,,,,,,,,,,,,,,,,
[],False,MasterOgon,,[],,text,t2_1pzpuj2w,False,False,[],False,False,1602649623,sci-article.ru,https://www.reddit.com/r/Physics/comments/jatuzz/wave_drive_flying_saucer_experiment/,{},jatuzz,True,False,False,False,True,False,False,,[],dark,text,False,False,True,1,0,False,all_ads,/r/Physics/comments/jatuzz/wave_drive_flying_saucer_experiment/,False,6,1602649635,1,,False,False,False,Physics,t5_2qhi6,1469071,public,https://b.thumbs.redditmedia.com/uaYK0DfQzipTmC75zYKysgC2ojip5zPr2i1VQvwInlc.jpg,Wave drive flying saucer experiment,0,[],1.0,http://sci-article.ru/stat.php?i=1601957819,all_ads,6,,,link,"{'enabled': False, 'images': [{'id': 'ShPcEU5L0gG4ytG6TFpJH9PuxzzKurXVy6cBq1UiVJc', 'resolutions': [{'height': 144, 'url': 'https://external-preview.redd.it/uY5tvmOme9PEIRCajJqLcfbwKfC7R5TCr0iiJ3UU7sQ.jpg?width=108&amp;crop=smart&amp;auto=webp&amp;s=a9902d496b219f6a0b7690e80f47e3c82af6e7a1', 'width': 108}, {'height': 288, 'url': 'https://external-preview.redd.it/uY5tvmOme9PEIRCajJqLcfbwKfC7R5TCr0iiJ3UU7sQ.jpg?width=216&amp;crop=smart&amp;auto=webp&amp;s=63d3e80bea11b6b411063d2eaff1f919cffe2d24', 'width': 216}, {'height': 426, 'url': 'https://external-preview.redd.it/uY5tvmOme9PEIRCajJqLcfbwKfC7R5TCr0iiJ3UU7sQ.jpg?width=320&amp;crop=smart&amp;auto=webp&amp;s=25cb6ebbb8eaba87cc86f71be1fe9a3f4899a984', 'width': 320}], 'source': {'height': 591, 'url': 'https://external-preview.redd.it/uY5tvmOme9PEIRCajJqLcfbwKfC7R5TCr0iiJ3UU7sQ.jpg?auto=webp&amp;s=db381d738489df6e1a4f3564dc8230fa4ab98f17', 'width': 443}, 'variants': {}}]}",,140.0,140.0,http://sci-article.ru/stat.php?i=1601957819,,,,,,,,,,,
[],False,ryujinambitieux,,[],,text,t2_8gxqb3hj,False,False,[],False,False,1602647942,/r/Physics/comments/jatg5d/whats_causing_the_particles_in_the_melted_candle/,https://www.reddit.com/r/Physics/comments/jatg5d/whats_causing_the_particles_in_the_melted_candle/,{},jatg5d,True,False,False,False,True,False,True,,[],dark,text,False,False,False,0,0,False,all_ads,/r/Physics/comments/jatg5d/whats_causing_the_particles_in_the_melted_candle/,False,6,1602647952,1,,True,False,False,Physics,t5_2qhi6,1469026,public,https://b.thumbs.redditmedia.com/x_ZmDBh6IREMc4q3pxH0_y72aYv2WWo9PlV1wS0GfcA.jpg,What’s causing the particles in the melted candle wax to move like that and why?,0,[],1.0,https://v.redd.it/uvl2paq4hzs51,all_ads,6,,,hosted:video,"{'enabled': False, 'images': [{'id': 'QCixscrcPkTxgB2cKDvUuW197XCgGn_S8xt5eJCHNJ4', 'resolutions': [{'height': 192, 'url': 'https://external-preview.redd.it/0vOxeHnEqtt7KhZ9wLMv3i3RvAOlr0ZpS3Oe6IOOyEQ.png?width=108&amp;crop=smart&amp;format=pjpg&amp;auto=webp&amp;s=79b286a31710fd26237ce636b71f243db81146f9', 'width': 108}, {'height': 384, 'url': 'https://external-preview.redd.it/0vOxeHnEqtt7KhZ9wLMv3i3RvAOlr0ZpS3Oe6IOOyEQ.png?width=216&amp;crop=smart&amp;format=pjpg&amp;auto=webp&amp;s=2f1431bb979c0e76e15b8a8c55e67ff1b3854018', 'width': 216}, {'height': 568, 'url': 'https://external-preview.redd.it/0vOxeHnEqtt7KhZ9wLMv3i3RvAOlr0ZpS3Oe6IOOyEQ.png?width=320&amp;crop=smart&amp;format=pjpg&amp;auto=webp&amp;s=5285532cf25463234bf4997f0a1583a15dc8d65e', 'width': 320}, {'height': 1137, 'url': 'https://external-preview.redd.it/0vOxeHnEqtt7KhZ9wLMv3i3RvAOlr0ZpS3Oe6IOOyEQ.png?width=640&amp;crop=smart&amp;format=pjpg&amp;auto=webp&amp;s=10f14a8ca279a68064ca5eb005f4c5d188999401', 'width': 640}], 'source': {'height': 1280, 'url': 'https://external-preview.redd.it/0vOxeHnEqtt7KhZ9wLMv3i3RvAOlr0ZpS3Oe6IOOyEQ.png?format=pjpg&amp;auto=webp&amp;s=9de0c9ab2a087d8c341234bf516e1e883f3531dc', 'width': 720}, 'variants': {}}]}",,140.0,140.0,https://v.redd.it/uvl2paq4hzs51,,,,,,,,,,,
[],False,Ivan_He,,[],,text,t2_7c7t1f5w,False,False,[],False,False,1602645475,self.Physics,https://www.reddit.com/r/Physics/comments/jastjv/physics_30hs_really_need_help_i_am_super_confused/,{},jastjv,True,False,False,False,True,True,False,,[],dark,text,False,False,True,0,0,False,all_ads,/r/Physics/comments/jastjv/physics_30hs_really_need_help_i_am_super_confused/,False,6,1602645486,1," A 100g bullet traveling at 500m/s lodges in a 3kg block at rest of a frozen lake

If the force of friction is 5N how long does it take to stop

How far does the block slide on the lake",True,False,False,Physics,t5_2qhi6,1469008,public,self,[Physics 30HS] Really need help I am super confused!!,0,[],1.0,https://www.reddit.com/r/Physics/comments/jastjv/physics_30hs_really_need_help_i_am_super_confused/,all_ads,6,,,,,,,,,,,,,,,,,,,
[],False,Jason_Protell,inter,[],Education and outreach,text,t2_7rwi6l2j,False,False,[],False,False,1602643645,arxiv.org,https://www.reddit.com/r/Physics/comments/jasc8d/weighing_milky_way_satellites_with_lisa/,{},jasc8d,True,False,False,False,True,False,False,,[],dark,text,False,False,True,2,0,False,all_ads,/r/Physics/comments/jasc8d/weighing_milky_way_satellites_with_lisa/,False,6,1602643656,1,,True,False,False,Physics,t5_2qhi6,1468912,public,default,Weighing Milky Way Satellites with LISA,0,[],1.0,https://arxiv.org/abs/2010.05918,all_ads,6,article,Academic,,,,,,https://arxiv.org/abs/2010.05918,4a8885d4-c6b2-11e4-827e-22000b2a8bad,dark,,,,,,,,,
[],False,liahngg,,[],,text,t2_6i861kf5,False,False,[],False,False,1602643094,self.Physics,https://www.reddit.com/r/Physics/comments/jas72f/question/,{},jas72f,True,False,False,False,True,True,False,,[],dark,text,False,False,True,1,0,False,all_ads,/r/Physics/comments/jas72f/question/,False,6,1602643105,1,How many square pieces with an area of 4.00 ft squared can u cut from a rectangular plywood with dimensions 12.0 ft by 15.0 ft?,True,False,False,Physics,t5_2qhi6,1468877,public,self,Question!,0,[],1.0,https://www.reddit.com/r/Physics/comments/jas72f/question/,all_ads,6,question,Question,,,,,,,,,,,,,,,,,
[],False,Smallz1107,,[],,text,t2_17ivkp,False,False,[],False,False,1602642668,self.Physics,https://www.reddit.com/r/Physics/comments/jas2xt/those_who_are_in_undergrad_do_you_do_your/,{},jas2xt,True,False,False,False,True,True,False,,[],dark,text,False,False,True,13,0,False,all_ads,/r/Physics/comments/jas2xt/those_who_are_in_undergrad_do_you_do_your/,False,6,1602642678,1,,True,False,False,Physics,t5_2qhi6,1468874,public,self,"Those who are in undergrad, do you do your homework in latex? Why or why not?",0,[],1.0,https://www.reddit.com/r/Physics/comments/jas2xt/those_who_are_in_undergrad_do_you_do_your/,all_ads,6,question,Question,,,,,,,,,,,,,,,,,
[],False,Confident_007,,[],,text,t2_71e09yn5,False,False,[],False,False,1602635227,self.Physics,https://www.reddit.com/r/Physics/comments/jaq2lz/nuclear_reactor/,{},jaq2lz,True,False,False,False,True,True,False,,[],dark,text,False,False,True,1,0,False,all_ads,/r/Physics/comments/jaq2lz/nuclear_reactor/,False,6,1602635238,1,Does anyone know why the shape so characteristic in the construction of nuclear reactors?,True,False,False,Physics,t5_2qhi6,1468670,public,self,Nuclear Reactor,0,[],1.0,https://www.reddit.com/r/Physics/comments/jaq2lz/nuclear_reactor/,all_ads,6,,,,,,,,,,,,,,,,,,,
[],False,BeyondImages,,[],,text,t2_3bo5auc0,False,False,[],False,False,1602634846,self.Physics,https://www.reddit.com/r/Physics/comments/japyt1/searching_a_quote_about_big_bang_and_cappucinos/,{},japyt1,True,False,False,False,True,True,False,,[],dark,text,False,False,False,0,0,False,all_ads,/r/Physics/comments/japyt1/searching_a_quote_about_big_bang_and_cappucinos/,False,6,1602634857,1,"I'm writing an article on George Lemaitre, father of the Big Bang theory. I'm looking for a quote by a writer I think... something that goes on somewhat like this : ""There were an explosion 13 billion years ago and here we are drinking cappucinos""... I just see a guy drinking a coffee and calling a taxi. So it might aslo be something about ""and we have a guy at the corner of a cafe yelling at a taxi""  


I really can't remember but I've heard it twice at least.",True,False,False,Physics,t5_2qhi6,1468664,public,self,Searching a quote about Big Bang and cappucinos,0,[],1.0,https://www.reddit.com/r/Physics/comments/japyt1/searching_a_quote_about_big_bang_and_cappucinos/,all_ads,6,,,,,,,,,,,,,,,,,,,
[],False,AspirantB,,[],,text,t2_7vhadihv,False,False,[],False,False,1602618413,self.Physics,https://www.reddit.com/r/Physics/comments/jakwf8/ba_in_physics_am_i_screwed/,{},jakwf8,True,False,False,False,True,True,False,,[],dark,text,False,False,True,4,0,False,all_ads,/r/Physics/comments/jakwf8/ba_in_physics_am_i_screwed/,False,6,1602618424,1,"Hello all! I am currently a junior in college working towards a physics degree. I was working for the B.S. in physics but I am not sure I can finish it out for various reasons, not necessarily related to the difficulty of the courses. The school I go to isn't well-known at all.

I am wondering what my employment opportunities will look like after I graduate. Say I'll have a B.A. in Physics, Minor in Math and possibly something else. I am doing Machine Learning research for Icecube with my Astrophysics professor, and I have taken other programming courses before. I am also a SI for a physics course. Will this be enough to get a job in a physics field? I know I can certainly go to graduate school with a B.A., but I am not sure if thats the route I want to go down yet. Please be honest.",True,False,False,Physics,t5_2qhi6,1468331,public,self,B.A. in Physics - Am I Screwed?,0,[],1.0,https://www.reddit.com/r/Physics/comments/jakwf8/ba_in_physics_am_i_screwed/,all_ads,6,question,Question,,,,,,,,,,,,,,,,,
[],False,BlazeOrangeDeer,,[],,text,t2_568ur,False,False,[],False,False,1602618202,youtube.com,https://www.reddit.com/r/Physics/comments/jaktuc/do_the_past_and_future_exist_pbs_space_time/,{},jaktuc,True,False,False,False,True,False,False,,[],dark,text,False,False,False,13,0,False,all_ads,/r/Physics/comments/jaktuc/do_the_past_and_future_exist_pbs_space_time/,False,6,1602618216,1,,True,False,False,Physics,t5_2qhi6,1468329,public,https://b.thumbs.redditmedia.com/SPIK4mk-Vmymgbdt20TVGtaB87_4aVJOxVDcridtnEg.jpg,Do the Past and Future Exist? | PBS Space Time,0,[],1.0,https://www.youtube.com/watch?v=EagNUvNfsUI,all_ads,6,image,Video,rich:video,"{'enabled': False, 'images': [{'id': '61i3__jz11sxSzXRo4H8gW4ZYgVkiEdNTnNg9duJelk', 'resolutions': [{'height': 81, 'url': 'https://external-preview.redd.it/YZFmoRgMOmUPN0RmSExAJcBK4Qf_XYgd-BiOvcb51mw.jpg?width=108&amp;crop=smart&amp;auto=webp&amp;s=a058f903263cffa10c391306203f894c186c4176', 'width': 108}, {'height': 162, 'url': 'https://external-preview.redd.it/YZFmoRgMOmUPN0RmSExAJcBK4Qf_XYgd-BiOvcb51mw.jpg?width=216&amp;crop=smart&amp;auto=webp&amp;s=0754bf44120d11c49ebc6f8f6cb680e2bb79b69e', 'width': 216}, {'height': 240, 'url': 'https://external-preview.redd.it/YZFmoRgMOmUPN0RmSExAJcBK4Qf_XYgd-BiOvcb51mw.jpg?width=320&amp;crop=smart&amp;auto=webp&amp;s=e53c45f4ae8a6301bf0f77fd76aadf342bde0fbc', 'width': 320}], 'source': {'height': 360, 'url': 'https://external-preview.redd.it/YZFmoRgMOmUPN0RmSExAJcBK4Qf_XYgd-BiOvcb51mw.jpg?auto=webp&amp;s=986963c2ec8a2fe23240f5f8528039795dde22cb', 'width': 480}, 'variants': {}}]}",,105.0,140.0,https://www.youtube.com/watch?v=EagNUvNfsUI,,dark,,"{'oembed': {'author_name': 'PBS Space Time', 'author_url': 'https://www.youtube.com/channel/UC7_gcs09iThXybpVgjHZ_7g', 'height': 338, 'html': '&lt;iframe width=""600"" height=""338"" src=""https://www.youtube.com/embed/EagNUvNfsUI?feature=oembed&amp;enablejsapi=1"" frameborder=""0"" allow=""accelerometer; autoplay; clipboard-write; encrypted-media; gyroscope; picture-in-picture"" allowfullscreen&gt;&lt;/iframe&gt;', 'provider_name': 'YouTube', 'provider_url': 'https://www.youtube.com/', 'thumbnail_height': 360, 'thumbnail_url': 'https://i.ytimg.com/vi/EagNUvNfsUI/hqdefault.jpg', 'thumbnail_width': 480, 'title': 'Do the Past and Future Exist?', 'type': 'video', 'version': '1.0', 'width': 600}, 'type': 'youtube.com'}","{'content': '&lt;iframe width=""600"" height=""338"" src=""https://www.youtube.com/embed/EagNUvNfsUI?feature=oembed&amp;enablejsapi=1"" frameborder=""0"" allow=""accelerometer; autoplay; clipboard-write; encrypted-media; gyroscope; picture-in-picture"" allowfullscreen&gt;&lt;/iframe&gt;', 'height': 338, 'scrolling': False, 'width': 600}","{'oembed': {'author_name': 'PBS Space Time', 'author_url': 'https://www.youtube.com/channel/UC7_gcs09iThXybpVgjHZ_7g', 'height': 338, 'html': '&lt;iframe width=""600"" height=""338"" src=""https://www.youtube.com/embed/EagNUvNfsUI?feature=oembed&amp;enablejsapi=1"" frameborder=""0"" allow=""accelerometer; autoplay; clipboard-write; encrypted-media; gyroscope; picture-in-picture"" allowfullscreen&gt;&lt;/iframe&gt;', 'provider_name': 'YouTube', 'provider_url': 'https://www.youtube.com/', 'thumbnail_height': 360, 'thumbnail_url': 'https://i.ytimg.com/vi/EagNUvNfsUI/hqdefault.jpg', 'thumbnail_width': 480, 'title': 'Do the Past and Future Exist?', 'type': 'video', 'version': '1.0', 'width': 600}, 'type': 'youtube.com'}","{'content': '&lt;iframe width=""600"" height=""338"" src=""https://www.youtube.com/embed/EagNUvNfsUI?feature=oembed&amp;enablejsapi=1"" frameborder=""0"" allow=""accelerometer; autoplay; clipboard-write; encrypted-media; gyroscope; picture-in-picture"" allowfullscreen&gt;&lt;/iframe&gt;', 'height': 338, 'media_domain_url': 'https://www.redditmedia.com/mediaembed/jaktuc', 'scrolling': False, 'width': 600}",,,,
[],False,haileysomething,,[],,text,t2_6givd7k6,False,False,[],False,False,1602617939,self.Physics,https://www.reddit.com/r/Physics/comments/jakql8/what_is_the_total_velocity_of_a_ball_at_the_apex/,{},jakql8,True,False,False,False,True,True,False,,[],dark,text,False,False,True,4,0,False,all_ads,/r/Physics/comments/jakql8/what_is_the_total_velocity_of_a_ball_at_the_apex/,False,6,1602617950,1,\^\^,True,False,False,Physics,t5_2qhi6,1468325,public,self,What is the Total Velocity of a Ball at the Apex? (not vertical velocity),0,[],1.0,https://www.reddit.com/r/Physics/comments/jakql8/what_is_the_total_velocity_of_a_ball_at_the_apex/,all_ads,6,question,Question,,,,,,,,,,,,,,,,,
[],False,Roomba_with_a_Knife,,[],,text,t2_3uk9etwg,False,False,[],False,False,1602616725,self.Physics,https://www.reddit.com/r/Physics/comments/jakbvc/zenos_paradox_in_nuclear_fission/,{},jakbvc,True,False,False,False,True,True,False,,[],dark,text,False,False,True,0,0,False,all_ads,/r/Physics/comments/jakbvc/zenos_paradox_in_nuclear_fission/,False,6,1602616737,1,"The title kind of explains it, but in more detail I want to know if it’s possible to split the products nuclear fission, and if so, how many times could you split the fragments?",True,False,False,Physics,t5_2qhi6,1468301,public,self,Zeno’s paradox in nuclear fission?,0,[],1.0,https://www.reddit.com/r/Physics/comments/jakbvc/zenos_paradox_in_nuclear_fission/,all_ads,6,question,Question,,,,,,,,,,,,,,,,,
