[],False,BiracialDisaster,,[],,text,t2_6boaouzj,False,False,[],False,False,1601674809,self.Physics,https://www.reddit.com/r/Physics/comments/j43m2b/time_as_a_spacial_dimension_on_the_quantum_level/,{},j43m2b,True,False,False,False,True,True,False,,[],dark,text,False,False,True,3,0,False,all_ads,/r/Physics/comments/j43m2b/time_as_a_spacial_dimension_on_the_quantum_level/,False,,,6,1601674820,1,"As someone who thinks space is pretty and doesn't like math, I'm sure this has been thought of before, but I wanted to ask. Particles popping in and out of existence is difficult for me to wrap my head around, but if at the quantum level these particles treat time as a spacial dimension rather than a time dimension, would it explain how they're able to just disappear and reappear like they do?",True,False,False,Physics,t5_2qhi6,1450903,public,self,Time as a spacial dimension on the quantum level?,0,[],1.0,https://www.reddit.com/r/Physics/comments/j43m2b/time_as_a_spacial_dimension_on_the_quantum_level/,all_ads,6,question,Question,,,,,,,,,,,,,,,,,,
[],False,poetryforhalloween,,[],,text,t2_6bxmkqaj,False,False,[],False,False,1601673983,self.Physics,https://www.reddit.com/r/Physics/comments/j43dew/undergraduate_textbook/,{},j43dew,True,False,False,False,True,True,False,,[],dark,text,False,False,True,2,0,False,all_ads,/r/Physics/comments/j43dew/undergraduate_textbook/,False,,,6,1601673994,1,I've recently started my physics course in London and am wondering which textbook you guys would recommend specifically for year 1 physics covering the physics content as opposed to the maths content as I already have the maths books necessary. Thanks for any help.,True,False,False,Physics,t5_2qhi6,1450876,public,self,Undergraduate textbook,0,[],1.0,https://www.reddit.com/r/Physics/comments/j43dew/undergraduate_textbook/,all_ads,6,,,,,,,,,,,,,,,,,,,,
[],False,kromem,,[],,text,t2_1diz8,False,False,[],False,False,1601673623,researchfrontiers.uark.edu,https://www.reddit.com/r/Physics/comments/j439m0/physicists_build_circuit_that_generates_clean/,{},j439m0,True,False,False,False,True,False,False,,[],dark,text,False,False,True,100,0,False,all_ads,/r/Physics/comments/j439m0/physicists_build_circuit_that_generates_clean/,False,link,"{'enabled': False, 'images': [{'id': 'Q2W9FykS7RAJUsd1IHcWMG2CJu4dkc9gtlNkbYfY29g', 'resolutions': [{'height': 60, 'url': 'https://external-preview.redd.it/OD68TkcBldK9vJ4LTz35b0mowlOP3eDR9XQ7xn8PPlI.jpg?width=108&amp;crop=smart&amp;auto=webp&amp;s=eae625f06dcd9b6b935156fa7a862489841100dc', 'width': 108}, {'height': 121, 'url': 'https://external-preview.redd.it/OD68TkcBldK9vJ4LTz35b0mowlOP3eDR9XQ7xn8PPlI.jpg?width=216&amp;crop=smart&amp;auto=webp&amp;s=fdb4b0f5fed889c275f4079e18949f64e3d80a23', 'width': 216}, {'height': 180, 'url': 'https://external-preview.redd.it/OD68TkcBldK9vJ4LTz35b0mowlOP3eDR9XQ7xn8PPlI.jpg?width=320&amp;crop=smart&amp;auto=webp&amp;s=1472d97870edfa3fdedeb74bc85b4505e5613daf', 'width': 320}, {'height': 360, 'url': 'https://external-preview.redd.it/OD68TkcBldK9vJ4LTz35b0mowlOP3eDR9XQ7xn8PPlI.jpg?width=640&amp;crop=smart&amp;auto=webp&amp;s=619e2cf9fe55716f8ac6c3021a6c7c48ebfa8971', 'width': 640}, {'height': 540, 'url': 'https://external-preview.redd.it/OD68TkcBldK9vJ4LTz35b0mowlOP3eDR9XQ7xn8PPlI.jpg?width=960&amp;crop=smart&amp;auto=webp&amp;s=8c9895f85a9c0317a46d672d48c24c746cbc3f27', 'width': 960}, {'height': 607, 'url': 'https://external-preview.redd.it/OD68TkcBldK9vJ4LTz35b0mowlOP3eDR9XQ7xn8PPlI.jpg?width=1080&amp;crop=smart&amp;auto=webp&amp;s=ba22f2645a18760adc8dc6c26949dd92b73cdea1', 'width': 1080}], 'source': {'height': 857, 'url': 'https://external-preview.redd.it/OD68TkcBldK9vJ4LTz35b0mowlOP3eDR9XQ7xn8PPlI.jpg?auto=webp&amp;s=1b9778830df2cc60d19c543de0f4d5523882ef33', 'width': 1523}, 'variants': {}}]}",6,1601673634,1,,True,False,False,Physics,t5_2qhi6,1450874,public,https://b.thumbs.redditmedia.com/U9vkhS-dUjhH6HVA5fxqLAoEnMLYYjDcBeAVAoW8bQU.jpg,"Physicists Build Circuit That Generates Clean, Limitless Power From Graphene",0,[],1.0,https://researchfrontiers.uark.edu/physicists-build-circuit-that-generates-clean-limitless-power-from-graphene/,all_ads,6,,,,,78.0,140.0,https://researchfrontiers.uark.edu/physicists-build-circuit-that-generates-clean-limitless-power-from-graphene/,,,,,,,,,,,,,
[],False,LogicUpgrade,,[],,text,t2_3dsrbe0i,False,False,[],False,False,1601673517,self.Physics,https://www.reddit.com/r/Physics/comments/j438l2/explaining_waveparticle_duality_as_waves_with/,{},j438l2,True,False,False,False,True,True,False,,[],dark,text,False,False,True,11,0,False,all_ads,/r/Physics/comments/j438l2/explaining_waveparticle_duality_as_waves_with/,False,,,6,1601673527,1,"I'm a layman, I've always been bothered by the wave/particle duality as it tends to be explained.

Imagine this hypothesis: there is no such thing as particles. None of them. They're all field excitations, travelling always as waves. Upon encountering an obstacle, three things may happen:

1. It passes through. As a wave.
2. It reflects. As a wave.
3. It gets absorbed, in a transactional discrete (""quantized"") way.

The last I imagine much like how a dripping tap works. A light stream of water doesn't fall down in a molecule-thin stream. It is transactional, in droplets, due to water's surface tension. 

Similar mechanism is likely present in quantum fields (that we can think for visual purposes as ""liquids""). For absorption to occur, you need a certain energy level to cross the boundary between being uncoupled with the obstacle, and then being coupled with it (i.e. absorbed).

The strong force is implicated in holding protons and neutrons together, as well as quarts within protons and so on. The same strong force may provide this ""you should be this high to jump over this hoop"" obstacle for unit of energy being absorbed into another configuration.

As I said. I'm a layman. So roast me :-) But I'm very curious how this hypothesis can be falsified. Some aspects can probably be tuned to explain wider range of phenomena, but it does explain the double slit experiment, for example.",True,False,False,Physics,t5_2qhi6,1450872,public,self,Explaining wave/particle duality as waves with discrete energy transfer transactions,0,[],1.0,https://www.reddit.com/r/Physics/comments/j438l2/explaining_waveparticle_duality_as_waves_with/,all_ads,6,,,,,,,,,,,,,,,,,,,,
[],False,Halmets,,[],,text,t2_5y0urg38,False,False,[],False,False,1601671018,self.Physics,https://www.reddit.com/r/Physics/comments/j42hm4/how_do_i_this/,{},j42hm4,True,False,False,False,True,True,False,,[],dark,text,False,False,True,3,0,False,all_ads,/r/Physics/comments/j42hm4/how_do_i_this/,False,,,6,1601671029,1,"(I posted this on r/askphysics, too. But I think my chances of finding a good answer are increased by posting it here as well.)

So, I was having a conversation my father just an hour ago and I told him about this cool aircraft that I recently heard of. And then I had the thought ""Huh, I wonder what would happen if this plane crashed into something in midair?"". So I googled and watched a bunch of YouTube videos in order to find out how to calculate how damaging such an impact would be.

No luck.

And now I am hear, lookin' for answers. If someone could explain how to calculate this (like, in a way a fourteen year old would understand) then that'd be much appreciated!",True,False,False,Physics,t5_2qhi6,1450811,public,self,How Do I This?,0,[],0.99,https://www.reddit.com/r/Physics/comments/j42hm4/how_do_i_this/,all_ads,6,question,Question,,,,,,,,,,,,,,,,,,
[],False,Crythos,,[],,text,t2_s7m8i,False,False,[],False,False,1601669241,self.Physics,https://www.reddit.com/r/Physics/comments/j41y2s/what_dictates_when_a_compound_will_undergo_a/,{},j41y2s,True,False,False,False,True,True,False,,[],dark,text,False,False,True,2,0,False,all_ads,/r/Physics/comments/j41y2s/what_dictates_when_a_compound_will_undergo_a/,False,,,6,1601669252,1,"As title says, I'm curious to understand what actually prompts a phase change at temperature X for compound 1 for example. I assume because energy reached some cap and moves to another form of energy level or something but an explanation as to what specific happens would be greatly appreciated. Thanks!",True,False,False,Physics,t5_2qhi6,1450805,public,self,What dictates when a compound will undergo a phase change (from thermodynamic standpoint)?,0,[],1.0,https://www.reddit.com/r/Physics/comments/j41y2s/what_dictates_when_a_compound_will_undergo_a/,all_ads,6,question,Question,,,,,,,,,,,,,,,,,,
[],False,aboobforallseasons,,[],,text,t2_865oecep,False,False,[],False,False,1601666618,self.Physics,https://www.reddit.com/r/Physics/comments/j414f5/i_need_help_from_physicists/,{},j414f5,True,False,False,False,True,True,False,,[],dark,text,False,False,True,17,0,False,all_ads,/r/Physics/comments/j414f5/i_need_help_from_physicists/,False,,,6,1601666630,1,"I live with fat people. Their foot steps walking through the house are like a stampede all day long. I cannot have any peace in my office. My desk and laptop screen shakes and rattles and I hear thumping all day long. I feel it in my chair when I'm sitting and in the soles of my feet. It's like living with two rhinos. I really need a solution. How can I absorb the shock so my desk, laptop screen, and computer chair are not constantly shaking from their heavy foot steps. Imagine a low grade earthquake every day all day long while trying to get work done. I desperately need help. This is not a joke.",True,False,False,Physics,t5_2qhi6,1450784,public,self,I need help from physicists...,0,[],1.0,https://www.reddit.com/r/Physics/comments/j414f5/i_need_help_from_physicists/,all_ads,6,,,,,,,,,,,,,,,,,,,,
[],False,malonekt1,,[],,text,t2_dbz98,False,False,[],False,False,1601664366,discord.gg,https://www.reddit.com/r/Physics/comments/j40ejy/really_cool_philosophy_discord_they_talk_about/,{},j40ejy,True,False,False,False,True,False,False,,[],dark,text,False,False,True,1,0,False,all_ads,/r/Physics/comments/j40ejy/really_cool_philosophy_discord_they_talk_about/,False,link,"{'enabled': False, 'images': [{'id': 'ERCbHm1ZovrrFaVO1A1b04msWGOt9tM1OJkurZOwdJc', 'resolutions': [{'height': 72, 'url': 'https://external-preview.redd.it/G5JyUJblAn8L00b6ZxRTp-YL4DtO23oSsyvpWIIH3e4.jpg?width=108&amp;crop=smart&amp;auto=webp&amp;s=4da91ac8853cd2405139d1305a274a925f5660e6', 'width': 108}, {'height': 144, 'url': 'https://external-preview.redd.it/G5JyUJblAn8L00b6ZxRTp-YL4DtO23oSsyvpWIIH3e4.jpg?width=216&amp;crop=smart&amp;auto=webp&amp;s=4ef27219ab484dd27119d207242299b8b396ae30', 'width': 216}, {'height': 213, 'url': 'https://external-preview.redd.it/G5JyUJblAn8L00b6ZxRTp-YL4DtO23oSsyvpWIIH3e4.jpg?width=320&amp;crop=smart&amp;auto=webp&amp;s=1737b8320010467013b7e95ac4309652db910313', 'width': 320}], 'source': {'height': 342, 'url': 'https://external-preview.redd.it/G5JyUJblAn8L00b6ZxRTp-YL4DtO23oSsyvpWIIH3e4.jpg?auto=webp&amp;s=79c744236f3cdc3b787a12018ce4101f88b6dcae', 'width': 512}, 'variants': {}}]}",6,1601664378,1,,True,False,False,Physics,t5_2qhi6,1450727,public,https://b.thumbs.redditmedia.com/OtVjX11A--lqn8IosaKjVLeqji41ftqe13cCPPkQeIo.jpg,"Really cool philosophy discord. They talk about mostly philosophy and have: debates, weekly meetups and generally just chat. Great place for physics!",0,[],1.0,https://discord.gg/edn3C4v,all_ads,6,,,,,93.0,140.0,https://discord.gg/edn3C4v,,,,,,,,,,,,,
[],False,daymo,,[],,text,t2_4o4et,False,False,[],False,False,1601664280,youtube.com,https://www.reddit.com/r/Physics/comments/j40dke/possible_dzanibekov_effect_spin_in_a_projectile/,{},j40dke,True,False,False,False,True,False,False,,[],dark,text,False,False,True,1,0,False,all_ads,/r/Physics/comments/j40dke/possible_dzanibekov_effect_spin_in_a_projectile/,False,rich:video,"{'enabled': False, 'images': [{'id': '0YRC2mo3gvwfS2wYhb25EBux-w3NnVERPO0Pv-s_UQo', 'resolutions': [{'height': 81, 'url': 'https://external-preview.redd.it/ELAPsNZJTxSicZf95D4fGMGlvu0QptRUEN09Jh03RhQ.jpg?width=108&amp;crop=smart&amp;auto=webp&amp;s=be135f4977113d1990f690900cfd62c8e420b729', 'width': 108}, {'height': 162, 'url': 'https://external-preview.redd.it/ELAPsNZJTxSicZf95D4fGMGlvu0QptRUEN09Jh03RhQ.jpg?width=216&amp;crop=smart&amp;auto=webp&amp;s=a75d3d50ae0c40c1171aba87abe846e35406828a', 'width': 216}, {'height': 240, 'url': 'https://external-preview.redd.it/ELAPsNZJTxSicZf95D4fGMGlvu0QptRUEN09Jh03RhQ.jpg?width=320&amp;crop=smart&amp;auto=webp&amp;s=b4a13ef5932edaab77dcf344c1853d9c2cedca5e', 'width': 320}], 'source': {'height': 360, 'url': 'https://external-preview.redd.it/ELAPsNZJTxSicZf95D4fGMGlvu0QptRUEN09Jh03RhQ.jpg?auto=webp&amp;s=f3599ed6bde432fe3c4ab3d54a9a33eb6a02e77a', 'width': 480}, 'variants': {}}]}",6,1601664292,1,,True,False,False,Physics,t5_2qhi6,1450727,public,https://b.thumbs.redditmedia.com/zpY8QBapFPzzOz0NlCrFOeMLARwLh37sgfsY6Ybm9Fk.jpg,Possible Dzanibekov effect spin in a projectile?,0,[],1.0,https://www.youtube.com/watch?v=H1RJ8BxZ89k&amp;feature=share,all_ads,6,image,Video,,,105.0,140.0,https://www.youtube.com/watch?v=H1RJ8BxZ89k&amp;feature=share,"{'oembed': {'author_name': 'TAOFLEDERMAUS', 'author_url': 'https://www.youtube.com/user/taofledermaus', 'height': 338, 'html': '&lt;iframe width=""600"" height=""338"" src=""https://www.youtube.com/embed/H1RJ8BxZ89k?feature=oembed&amp;enablejsapi=1"" frameborder=""0"" allow=""accelerometer; autoplay; clipboard-write; encrypted-media; gyroscope; picture-in-picture"" allowfullscreen&gt;&lt;/iframe&gt;', 'provider_name': 'YouTube', 'provider_url': 'https://www.youtube.com/', 'thumbnail_height': 360, 'thumbnail_url': 'https://i.ytimg.com/vi/H1RJ8BxZ89k/hqdefault.jpg', 'thumbnail_width': 480, 'title': 'Blue Falcon 12ga. slug -  Most BIZARRE Aerodynamics', 'type': 'video', 'version': '1.0', 'width': 600}, 'type': 'youtube.com'}","{'content': '&lt;iframe width=""600"" height=""338"" src=""https://www.youtube.com/embed/H1RJ8BxZ89k?feature=oembed&amp;enablejsapi=1"" frameborder=""0"" allow=""accelerometer; autoplay; clipboard-write; encrypted-media; gyroscope; picture-in-picture"" allowfullscreen&gt;&lt;/iframe&gt;', 'height': 338, 'scrolling': False, 'width': 600}",,"{'oembed': {'author_name': 'TAOFLEDERMAUS', 'author_url': 'https://www.youtube.com/user/taofledermaus', 'height': 338, 'html': '&lt;iframe width=""600"" height=""338"" src=""https://www.youtube.com/embed/H1RJ8BxZ89k?feature=oembed&amp;enablejsapi=1"" frameborder=""0"" allow=""accelerometer; autoplay; clipboard-write; encrypted-media; gyroscope; picture-in-picture"" allowfullscreen&gt;&lt;/iframe&gt;', 'provider_name': 'YouTube', 'provider_url': 'https://www.youtube.com/', 'thumbnail_height': 360, 'thumbnail_url': 'https://i.ytimg.com/vi/H1RJ8BxZ89k/hqdefault.jpg', 'thumbnail_width': 480, 'title': 'Blue Falcon 12ga. slug -  Most BIZARRE Aerodynamics', 'type': 'video', 'version': '1.0', 'width': 600}, 'type': 'youtube.com'}","{'content': '&lt;iframe width=""600"" height=""338"" src=""https://www.youtube.com/embed/H1RJ8BxZ89k?feature=oembed&amp;enablejsapi=1"" frameborder=""0"" allow=""accelerometer; autoplay; clipboard-write; encrypted-media; gyroscope; picture-in-picture"" allowfullscreen&gt;&lt;/iframe&gt;', 'height': 338, 'media_domain_url': 'https://www.redditmedia.com/mediaembed/j40dke', 'scrolling': False, 'width': 600}",,,,,,,,
[],False,vanavv,,[],,text,t2_7i3yg,False,False,[],False,False,1601663023,self.Physics,https://www.reddit.com/r/Physics/comments/j3zz28/physics_projects_for_high_schoolers/,{},j3zz28,True,False,False,False,True,True,False,,[],dark,text,False,False,True,14,0,False,all_ads,/r/Physics/comments/j3zz28/physics_projects_for_high_schoolers/,False,,,6,1601663034,1,"I'm a physics teacher at a high school where I also have a class of 'gifted' students, and I can design projects for them to work on a for a full day. Now I'm looking for inspiration for interesting and fun physics concepts to explore with them for a day, preferably also with some sort of experimental component (it's more boring if it's just theory for a full day). I already have a couple of ideas myself, but I'm also still looking for other cool things do with them, and figured people here might have great ideas I wouldn't come up with myself. The target audience is students aged 16 - 18, so difficulty wise it should be a little bit easier than first year university stuff. 

I'd be grateful for any ideas you could share, preferably concepts that I could really dive into with them for an entire day, but anythinig is welcome!",True,False,False,Physics,t5_2qhi6,1450722,public,self,Physics projects for high schoolers,0,[],1.0,https://www.reddit.com/r/Physics/comments/j3zz28/physics_projects_for_high_schoolers/,all_ads,6,,,,,,,,,,,,,,,,,,,,
[],False,LogicUpgrade,,[],,text,t2_3dsrbe0i,False,False,[],False,False,1601661993,self.Physics,https://www.reddit.com/r/Physics/comments/j3zn62/speed_of_electron_rotating_in_orbit_in_an_atom/,{},j3zn62,True,False,False,False,True,True,False,,[],dark,text,False,False,True,16,0,False,all_ads,/r/Physics/comments/j3zn62/speed_of_electron_rotating_in_orbit_in_an_atom/,False,,,6,1601662004,1,"I was trying to find the speed of electron rotating in orbit in an atom and there seems to be no accepted speed per se. Makes me wonder, given the particle-wave duality, can't we see the electron as a wave shaped like the orbit diagrams we see (which show probability of the electron being ""found"" in a given place in orbit), rather than thinking of it as a particle spinning in orbit? Is there anything to falsify this?",True,False,False,Physics,t5_2qhi6,1450669,public,self,Speed of electron rotating in orbit in an atom,0,[],1.0,https://www.reddit.com/r/Physics/comments/j3zn62/speed_of_electron_rotating_in_orbit_in_an_atom/,all_ads,6,,,,,,,,,,,,,,,,,,,,
[],False,WARROVOTS,,[],,text,t2_5csxww52,False,False,[],False,False,1601661452,self.Physics,https://www.reddit.com/r/Physics/comments/j3zgpz/rotation_of_parabolic_lenses/,{},j3zgpz,True,False,False,False,True,True,False,,[],dark,text,False,False,True,0,0,False,all_ads,/r/Physics/comments/j3zgpz/rotation_of_parabolic_lenses/,False,,,6,1601661462,1,"I have noticed in interesting phenomena that occurs when you rotate a parabolic convex lenses on a ""hard"" surface. I don't have a video, but I believe it is interesting. Does anyone know how this occurs? I believe it may have to do with the mass distribution of the lenses but I am not sure.

\*I used a f = 50mm lenses.",True,False,False,Physics,t5_2qhi6,1450619,public,self,Rotation of parabolic lenses,0,[],1.0,https://www.reddit.com/r/Physics/comments/j3zgpz/rotation_of_parabolic_lenses/,all_ads,6,,,,,,,,,,,,,,,,,,,,
[],False,SandraBay2001,,[],,text,t2_86sh25k6,False,False,[],False,False,1601657514,collective-spark.xyz,https://www.reddit.com/r/Physics/comments/j3y763/physicists_prove_time_travel_is_theoretically/,{},j3y763,False,False,False,False,False,False,False,,[],dark,text,False,False,True,2,0,False,all_ads,/r/Physics/comments/j3y763/physicists_prove_time_travel_is_theoretically/,False,link,"{'enabled': False, 'images': [{'id': '-i-IXWs7eH_VUha2mor7QE5SHIIJRnpc1__xjzaDl7o', 'resolutions': [{'height': 64, 'url': 'https://external-preview.redd.it/axFwFgBQjGYr5NUIotdaV7twcjUxD9y8nYLyHNcMLU0.jpg?width=108&amp;crop=smart&amp;auto=webp&amp;s=8c505c3deb76af06da74bbe258d507a097b380f7', 'width': 108}, {'height': 129, 'url': 'https://external-preview.redd.it/axFwFgBQjGYr5NUIotdaV7twcjUxD9y8nYLyHNcMLU0.jpg?width=216&amp;crop=smart&amp;auto=webp&amp;s=62f3a33fddb34f436fddc86a846079a300498c1b', 'width': 216}, {'height': 192, 'url': 'https://external-preview.redd.it/axFwFgBQjGYr5NUIotdaV7twcjUxD9y8nYLyHNcMLU0.jpg?width=320&amp;crop=smart&amp;auto=webp&amp;s=bc1113b3d010561d57f1c7b5894e40a561339f0b', 'width': 320}, {'height': 384, 'url': 'https://external-preview.redd.it/axFwFgBQjGYr5NUIotdaV7twcjUxD9y8nYLyHNcMLU0.jpg?width=640&amp;crop=smart&amp;auto=webp&amp;s=2630c052481a2b52d4499a325c5a4fb7b10f4bd6', 'width': 640}, {'height': 576, 'url': 'https://external-preview.redd.it/axFwFgBQjGYr5NUIotdaV7twcjUxD9y8nYLyHNcMLU0.jpg?width=960&amp;crop=smart&amp;auto=webp&amp;s=da708440fee0c31eb8e74139a3f20178cf710fb0', 'width': 960}], 'source': {'height': 600, 'url': 'https://external-preview.redd.it/axFwFgBQjGYr5NUIotdaV7twcjUxD9y8nYLyHNcMLU0.jpg?auto=webp&amp;s=818edf7746ddfab4d0075b43f02a4e7035e46d95', 'width': 1000}, 'variants': {}}]}",6,1601657525,1,,True,False,False,Physics,t5_2qhi6,1450531,public,https://b.thumbs.redditmedia.com/v8hbn7Qx8q2Bcei2T3FZZ0G1MQ5D8nnqgYZvaljCt4A.jpg,"Physicists Prove Time Travel Is Theoretically ‘Possible,’ But Changing The Past Is Not",0,[],1.0,https://collective-spark.xyz/physicists-prove-time-travel-is-theoretically-possible-but-changing-the-past-is-not/,all_ads,6,,,,,84.0,140.0,https://collective-spark.xyz/physicists-prove-time-travel-is-theoretically-possible-but-changing-the-past-is-not/,,,reddit,,,,,,,,,,
[],False,partev,,[],,text,t2_14gacq,False,False,[],False,False,1601656863,writings.stephenwolfram.com,https://www.reddit.com/r/Physics/comments/j3xzf2/faster_than_light_in_our_model_of_physics_some/,{},j3xzf2,True,False,False,False,True,False,False,,[],dark,text,False,False,True,18,0,False,all_ads,/r/Physics/comments/j3xzf2/faster_than_light_in_our_model_of_physics_some/,False,,,6,1601656874,1,,True,False,False,Physics,t5_2qhi6,1450526,public,default,Faster than Light in Our Model of Physics: Some Preliminary Thoughts—Stephen Wolfram Writings,0,[],1.0,https://writings.stephenwolfram.com/2020/10/faster-than-light-in-our-model-of-physics-some-preliminary-thoughts/,all_ads,6,,,,,,,https://writings.stephenwolfram.com/2020/10/faster-than-light-in-our-model-of-physics-some-preliminary-thoughts/,,,,,,,,,,,,,
[],False,Masol_The_Producer,,[],,text,t2_5o88as7l,False,False,[],False,False,1601656207,i.redd.it,https://www.reddit.com/r/Physics/comments/j3xrt0/a_5_meter_bar_is_hung_by_2_strings_05meters_from/,{},j3xrt0,True,False,False,True,True,False,False,,[],dark,text,False,False,True,0,0,False,all_ads,/r/Physics/comments/j3xrt0/a_5_meter_bar_is_hung_by_2_strings_05meters_from/,False,image,"{'enabled': True, 'images': [{'id': 'MRxZDjmNE8V-onKyMvGyG9WT6SyS3oMG992SKtCKTYI', 'resolutions': [{'height': 144, 'url': 'https://preview.redd.it/sptdvn5pkpq51.jpg?width=108&amp;crop=smart&amp;auto=webp&amp;s=b7fb2ee8c866d0b04abc9e82e42d881581183785', 'width': 108}, {'height': 288, 'url': 'https://preview.redd.it/sptdvn5pkpq51.jpg?width=216&amp;crop=smart&amp;auto=webp&amp;s=fa84f443ba1f0c596654ac199732935ba3f7ce0a', 'width': 216}, {'height': 426, 'url': 'https://preview.redd.it/sptdvn5pkpq51.jpg?width=320&amp;crop=smart&amp;auto=webp&amp;s=8f07d0ebd4f8a701cc55694d7003e7634a14b59d', 'width': 320}, {'height': 853, 'url': 'https://preview.redd.it/sptdvn5pkpq51.jpg?width=640&amp;crop=smart&amp;auto=webp&amp;s=3d13afacfb31a8d8f3932ef5bce3b31ef2a91d7d', 'width': 640}, {'height': 1280, 'url': 'https://preview.redd.it/sptdvn5pkpq51.jpg?width=960&amp;crop=smart&amp;auto=webp&amp;s=290f215e1e5d7bd9d7c6b38ab0278bd47ac17c1f', 'width': 960}, {'height': 1440, 'url': 'https://preview.redd.it/sptdvn5pkpq51.jpg?width=1080&amp;crop=smart&amp;auto=webp&amp;s=5266a4ba34f950c84a0addbab1ce136884fd5ab3', 'width': 1080}], 'source': {'height': 3264, 'url': 'https://preview.redd.it/sptdvn5pkpq51.jpg?auto=webp&amp;s=a7a5d09ac2e2097004d5fb39bed8fec9fdc6dd59', 'width': 2448}, 'variants': {}}]}",6,1601656219,1,,True,False,False,Physics,t5_2qhi6,1450520,public,https://a.thumbs.redditmedia.com/RpDzejyiZIq8HqeLol0-vQ38_L4WowXssKZy6JR2OP4.jpg,A 5 meter bar is hung by 2 strings. 0.5meters from the center is 1 string. 2.5 meters is another string. What is the tension in the strings? Why does a book feel lighter when you hold 1 hand in center and the other hand at other end? What is torque?,0,[],1.0,https://i.redd.it/sptdvn5pkpq51.jpg,all_ads,6,image,Image,,,140.0,140.0,https://i.redd.it/sptdvn5pkpq51.jpg,,,,,,,,,,,,,
[],False,ErikAliMontalvo,,[],,text,t2_4efakm0k,False,False,[],False,False,1601655819,self.Physics,https://www.reddit.com/r/Physics/comments/j3xn5k/someone_in_here_likes_4d_physics/,{},j3xn5k,True,False,False,False,True,True,False,,[],dark,text,False,False,True,0,0,False,all_ads,/r/Physics/comments/j3xn5k/someone_in_here_likes_4d_physics/,False,,,6,1601655830,1,"I'm trying to study the fourth dimension, and in this subreddit we're trying to share some basic concepts about it to have more information to work on. So I don't know if someone here likes this topic or would like to share something about this, or if you're interested but don't know about it you can also enter to see our posts and understand it better.

[https://www.reddit.com/r/4Dimension/](https://www.reddit.com/r/4Dimension/)",True,False,False,Physics,t5_2qhi6,1450517,public,self,Someone in here likes 4D physics?,0,[],1.0,https://www.reddit.com/r/Physics/comments/j3xn5k/someone_in_here_likes_4d_physics/,all_ads,6,question,Question,,,,,,,,,,,,,,,,,,
[],False,vineethparathil,,[],,text,t2_5ba5vzhr,False,False,[],False,False,1601655229,self.Physics,https://www.reddit.com/r/Physics/comments/j3xgmm/how_does_a_mobile_communicate_with_a_tower/,{},j3xgmm,True,False,False,False,True,True,False,,[],dark,text,False,False,True,4,0,False,all_ads,/r/Physics/comments/j3xgmm/how_does_a_mobile_communicate_with_a_tower/,False,,,6,1601655240,1,,True,False,False,Physics,t5_2qhi6,1450518,public,self,How does a mobile communicate with a tower? Resonance is involved like in radio right?,0,[],1.0,https://www.reddit.com/r/Physics/comments/j3xgmm/how_does_a_mobile_communicate_with_a_tower/,all_ads,6,question,Question,,,,,,,,,,,,,,,,,,
