all_awardings,allow_live_comments,author,author_flair_css_class,author_flair_richtext,author_flair_text,author_flair_type,author_fullname,author_patreon_flair,author_premium,awarders,can_mod_post,contest_mode,created_utc,domain,full_link,gildings,id,is_crosspostable,is_meta,is_original_content,is_reddit_media_domain,is_robot_indexable,is_self,is_video,link_flair_background_color,link_flair_richtext,link_flair_text_color,link_flair_type,locked,media_only,no_follow,num_comments,num_crossposts,over_18,parent_whitelist_status,permalink,pinned,post_hint,preview,pwls,retrieved_on,score,selftext,send_replies,spoiler,stickied,subreddit,subreddit_id,subreddit_subscribers,subreddit_type,thumbnail,title,total_awards_received,treatment_tags,upvote_ratio,url,whitelist_status,wls,link_flair_css_class,link_flair_text,author_flair_background_color,author_flair_text_color,thumbnail_height,thumbnail_width,url_overridden_by_dest,media,media_embed,removed_by_category,secure_media,secure_media_embed,gallery_data,is_gallery,media_metadata,distinguished,author_flair_template_id,edited,link_flair_template_id,banned_by
[],False,Onw_,,[],,text,t2_38shs0ze,False,False,[],False,False,1601745217,self.Physics,https://www.reddit.com/r/Physics/comments/j4itpt/the_registrations_for_fyziklani_online_are_open/,{},j4itpt,True,False,False,False,True,True,False,,[],dark,text,False,False,True,0,0,False,all_ads,/r/Physics/comments/j4itpt/the_registrations_for_fyziklani_online_are_open/,False,self,"{'enabled': False, 'images': [{'id': 'lLzu1tFB3oOcCyPJlzlJOYA0uSMJZB1-rluX2o1Hl0U', 'resolutions': [{'height': 71, 'url': 'https://external-preview.redd.it/ZHAST4jc5P4mikOKPHG4A-KjaWlpnV7EkCiL6pzIDaw.jpg?width=108&amp;crop=smart&amp;auto=webp&amp;s=9335aa3a0f2c9020e981ae836a7548a7b8b26471', 'width': 108}, {'height': 142, 'url': 'https://external-preview.redd.it/ZHAST4jc5P4mikOKPHG4A-KjaWlpnV7EkCiL6pzIDaw.jpg?width=216&amp;crop=smart&amp;auto=webp&amp;s=30d111ebc1c062dfef927e2dd71382d2c9ce2d3f', 'width': 216}], 'source': {'height': 146, 'url': 'https://external-preview.redd.it/ZHAST4jc5P4mikOKPHG4A-KjaWlpnV7EkCiL6pzIDaw.jpg?auto=webp&amp;s=772c3664fc410de856efa9984131a0106d4c370b', 'width': 221}, 'variants': {}}]}",6,1601745229,1,"What is fyziklani online?  It is a 3 hour physics competition of international teams of up to 5 members. There are multiple categories, based on how far into the education you are, including an open bracket, where everyone can join. All contestants solve the same problems. Participation is free and you can win prices!

Link: [https://online.fyziklani.cz/en/](https://online.fyziklani.cz/en/)

P.S.: Sorry, if it doesn't belong in here, feel free to delete it then.

P.P.S.: I am in no way affiliated with the organizers, I just think it is cool and fun.",True,False,False,Physics,t5_2qhi6,1451786,public,self,The registrations for Fyziklani online are open!,0,[],0.99,https://www.reddit.com/r/Physics/comments/j4itpt/the_registrations_for_fyziklani_online_are_open/,all_ads,6,,,,,,,,,,,,,,,,,,,,
[],False,Mikahopff,,[],,text,t2_7x3d3f2v,False,False,[],False,False,1601745068,self.Physics,https://www.reddit.com/r/Physics/comments/j4is33/about_the_energy_of_partial_differential_equations/,{},j4is33,True,False,False,False,True,True,False,,[],dark,text,False,False,True,2,0,False,all_ads,/r/Physics/comments/j4is33/about_the_energy_of_partial_differential_equations/,False,,,6,1601745079,1,"Hello all. I'm a mathematics Ph.D. student working on something related to PDE's, where the notion of Energy is used and it refers to a functional (we can say function) E, which we derive by multiplying the equation by  u\_t and integrating by parts.

For the homogeneous wave equation u\_tt -u\_xx=0 in I=\]0,1\[ with homogeneous Dirichlet boundary conditions u(0)=u(1)=0 this functional is E(t)= int\_0\^1\[(u\_t)\^2+(u\_x)\^2 \]dx

But if we take a damped wave equation u\_tt -u\_xx+u\_t=0 in I=\]0,1\[ with the same boundary conditions. After multiplying by u\_t and integrating by parts we find

int\_0\^1\[u\_t\*u\_tt +u\_t\*u\_tx+(u\_t)\^2\]dx=0

so (1/2) d/dt {int\_0\^1\[(u\_t)\^2+(u\_x)\^2 \]dx}=-int\_0\^1\[(u\_t)\^2 \]dx

and by then they always take E(t)=int\_0\^1\[(u\_t)\^2+(u\_x)\^2 \]dx without justifinf their choice.

My questions are:

Why they choose E(t) to be that functional instead of any other one?

Where this process comes from (multiplying by u\_t+ integrating by parts..etc )?

What are the physic principles behind all this?

Could you please, provide me an example of a study where I can see what is this E represents in a real experience?

Any answer, comment, recommendation, explanation, are welcome, please, write whatever you know about this.

Thank you in advance.",True,False,False,Physics,t5_2qhi6,1451787,public,self,About the Energy of Partial Differential Equations,0,[],1.0,https://www.reddit.com/r/Physics/comments/j4is33/about_the_energy_of_partial_differential_equations/,all_ads,6,,,,,,,,,,,,,,,,,,,,
[],False,Mikahopff,,[],,text,t2_7x3d3f2v,False,False,[],False,False,1601744974,self.Physics,https://www.reddit.com/r/Physics/comments/j4ir3z/about_the_energy_of_a_partial_differential/,{},j4ir3z,True,False,False,False,True,True,False,,[],dark,text,False,False,True,0,0,False,all_ads,/r/Physics/comments/j4ir3z/about_the_energy_of_a_partial_differential/,False,,,6,1601744985,1,"Hello all. I'm a mathematics Ph.D. student working on something related to PDE's, where the notion of Energy is used and it refers to a functional (we can say function) E, which we derive by multiplying the equation by  u\_t and integrating by parts. 

For the homogeneous wave equation u\_tt -u\_xx=0 in I=\]0,1\[ with homogeneous Dirichlet boundary conditions u(0)=u(1)=0 this functional is E(t)= int\_0\^1\[(u\_t)\^2+(u\_x)\^2 \]dx 

But if we take a damped wave equation u\_tt -u\_xx+u\_t=0 in I=\]0,1\[ with the same boundary conditions. After multiplying by u\_t and integrating by parts we find 

int\_0\^1\[u\_t\*u\_tt +u\_t\*u\_tx+(u\_t)\^2\]dx=0

so (1/2) d/dt {int\_0\^1\[(u\_t)\^2+(u\_x)\^2 \]dx}=-int\_0\^1\[(u\_t)\^2 \]dx 

and by then they always take E(t)=int\_0\^1\[(u\_t)\^2+(u\_x)\^2 \]dx without justifinf their choice. 

My questions are: 

Why they choose E(t) to be that functional instead of any other one? 

Where this process comes from (multiplying by u\_t+ integrating by parts..etc )?

What are the physic principles behind all this? 

Could you please, provide me an example of a study where I can see what is this E represents in a real experience? 

Any answer, comment, recommendation, explanation, are welcome, please, write whatever you know about this. 

Thank you in advance.",True,False,False,Physics,t5_2qhi6,1451787,public,self,About the Energy of a Partial Differential Equation,0,[],1.0,https://www.reddit.com/r/Physics/comments/j4ir3z/about_the_energy_of_a_partial_differential/,all_ads,6,,,,,,,,,,,,,,,,,,,,
[],False,Withboozen,,[],,text,t2_848ka9bt,False,False,[],False,False,1601744340,self.Physics,https://www.reddit.com/r/Physics/comments/j4ijxl/help_me_out/,{},j4ijxl,True,False,False,False,True,True,False,,[],dark,text,False,False,True,4,0,False,all_ads,/r/Physics/comments/j4ijxl/help_me_out/,False,,,6,1601744351,1,Soo I’m 16 an I’m gettin interested in learnin about the cosmos and physics. I’m in high school rn an idk if it’s a good move to make or a bad one. I want y’all’s opinion,True,False,False,Physics,t5_2qhi6,1451780,public,self,Help me out,0,[],1.0,https://www.reddit.com/r/Physics/comments/j4ijxl/help_me_out/,all_ads,6,,,,,,,,,,,,,,,,,,,,
[],False,_TatsuShi_,,[],,text,t2_5vn1zqvd,False,False,[],False,False,1601741791,self.Physics,https://www.reddit.com/r/Physics/comments/j4hsdp/new_student/,{},j4hsdp,True,False,False,False,True,True,False,,[],dark,text,False,False,True,6,0,False,all_ads,/r/Physics/comments/j4hsdp/new_student/,False,,,6,1601741801,1,"Hey as you read from the title i just got into physics. Never studied at school but now at Uni i chose introductory physics as a subject. Kinda embarassing to post it in this group but can someone give me a website or a pdf which has problems about velocity, acceleration etc... and solutions so i could practice.",True,False,False,Physics,t5_2qhi6,1451686,public,self,New Student,0,[],1.0,https://www.reddit.com/r/Physics/comments/j4hsdp/new_student/,all_ads,6,,,,,,,,,,,,,,,,,,,,
[],False,3lli3,,[],,text,t2_bfj4b,False,False,[],False,False,1601739522,self.Physics,https://www.reddit.com/r/Physics/comments/j4h39n/can_someone_explain_the_time_crystal_in_laymens/,{},j4h39n,True,False,False,False,True,True,False,,[],dark,text,False,False,True,3,0,False,all_ads,/r/Physics/comments/j4h39n/can_someone_explain_the_time_crystal_in_laymens/,False,,,6,1601739534,1,I took a year of algebra based physics so I have some knowledge but I was reading about this crystal and I just want to know what the fuck is going on.,True,False,False,Physics,t5_2qhi6,1451666,public,self,Can someone explain the time crystal in laymen’s terms.,0,[],1.0,https://www.reddit.com/r/Physics/comments/j4h39n/can_someone_explain_the_time_crystal_in_laymens/,all_ads,6,,,,,,,,,,,,,,,,,,,,
[],False,Pahriuon,,[],,text,t2_3fx7sz1m,False,False,[],False,False,1601739136,self.Physics,https://www.reddit.com/r/Physics/comments/j4gz80/is_the_lack_of_consensus_on_issues_in_cosmology/,{},j4gz80,True,False,False,False,True,True,False,,[],dark,text,False,False,True,0,0,False,all_ads,/r/Physics/comments/j4gz80/is_the_lack_of_consensus_on_issues_in_cosmology/,False,,,6,1601739148,1,"Hello y'all,

I was wondering, there are issues in Cosmology that are not in consensus in the physics community such as:

\- discrepancy in the velocity of masses orbiting galaxy centers, between those measured and those predicted by Newtonian models (which are based on observable masses).

\- accelerating expansion of the universe.

and other issues. 

Now, the physics community is divided on these issues right? So it makes sense that the spotlight, at least the public non-academic spotlight, are on issues in this scope.

My idea is that, hence this is why going beyond this scope to attempts at unified field theory; to attempts at theories that take into account both cosmology and sub-atomic physics is way beyond today's progress. Which is why these attempts are not given the public spotlight.

Keep in mind I'm not a physicist, I'm totally pulling what I said out of my ass. 

Also keep in mind that my question is not completely a technical one (feel free to give me knowledge though) but rather about the physics community itself and the relation between the community and the non-academic public.",True,False,False,Physics,t5_2qhi6,1451666,public,self,"Is the lack of consensus on issues in Cosmology, the reason why the search for a Unified Field Theory is not on the spotlight?",0,[],1.0,https://www.reddit.com/r/Physics/comments/j4gz80/is_the_lack_of_consensus_on_issues_in_cosmology/,all_ads,6,question,Question,,,,,,,,,,,,,,,,,,
[],False,dethfire,inter,[],Education and outreach,text,t2_d6zed,False,False,[],False,False,1601737334,physicsforums.com,https://www.reddit.com/r/Physics/comments/j4ggr6/i_know_the_math_says_so_but_is_it_really_true/,{},j4ggr6,True,False,False,False,True,False,False,,[],dark,text,False,False,True,193,0,False,all_ads,/r/Physics/comments/j4ggr6/i_know_the_math_says_so_but_is_it_really_true/,False,link,"{'enabled': False, 'images': [{'id': 'KZy7KvWsELT_tpUbMmDPaJF3FFdQLCrC_rY6zy2hnLc', 'resolutions': [{'height': 60, 'url': 'https://external-preview.redd.it/mkrXigwjWO82v11DRkKGjZzPtvjc-tU402kla0f0SaI.jpg?width=108&amp;crop=smart&amp;auto=webp&amp;s=7cb4df8449e25ba7a369a12234266b7e401c787f', 'width': 108}, {'height': 121, 'url': 'https://external-preview.redd.it/mkrXigwjWO82v11DRkKGjZzPtvjc-tU402kla0f0SaI.jpg?width=216&amp;crop=smart&amp;auto=webp&amp;s=7572ca60913d7a1af46b9b1da657f852f2a9ecba', 'width': 216}], 'source': {'height': 135, 'url': 'https://external-preview.redd.it/mkrXigwjWO82v11DRkKGjZzPtvjc-tU402kla0f0SaI.jpg?auto=webp&amp;s=f56ab05a8543530a5e93b96429c9fa43b447fded', 'width': 240}, 'variants': {}}]}",6,1601737344,1,,True,False,False,Physics,t5_2qhi6,1451656,public,https://b.thumbs.redditmedia.com/IPAKLF6ia8Uala8rqkLvXhA_44hkjSrP8FPXndRdybY.jpg,"I Know the Math Says so, but Is It Really True?",0,[],1.0,https://www.physicsforums.com/insights/i-know-the-math-says-so-but-is-it-really-true/,all_ads,6,,,,dark,78.0,140.0,https://www.physicsforums.com/insights/i-know-the-math-says-so-but-is-it-really-true/,,,,,,,,,,,,,
[],False,malobre,,[],,text,t2_lmqf6,False,False,[],False,False,1601736419,news.uark.edu,https://www.reddit.com/r/Physics/comments/j4g7z6/physicists_build_circuit_that_generates_clean/,{},j4g7z6,True,False,False,False,True,False,False,,[],dark,text,False,False,True,0,0,False,all_ads,/r/Physics/comments/j4g7z6/physicists_build_circuit_that_generates_clean/,False,link,"{'enabled': False, 'images': [{'id': 'Zp2zUlzQ_SkduIhNI2qHzIcxJOXGJhKb5BTpK8mdbZA', 'resolutions': [{'height': 72, 'url': 'https://external-preview.redd.it/DjWk_86NNyUihUzZTR4ubaikrrhAEdVepZd9okC_t3s.jpg?width=108&amp;crop=smart&amp;auto=webp&amp;s=aadfb502a74a841c3dad2e66fe91e22573ee8dd9', 'width': 108}, {'height': 144, 'url': 'https://external-preview.redd.it/DjWk_86NNyUihUzZTR4ubaikrrhAEdVepZd9okC_t3s.jpg?width=216&amp;crop=smart&amp;auto=webp&amp;s=f44e91a6f05f4b6c9230066dceff5b6d78466bc9', 'width': 216}, {'height': 213, 'url': 'https://external-preview.redd.it/DjWk_86NNyUihUzZTR4ubaikrrhAEdVepZd9okC_t3s.jpg?width=320&amp;crop=smart&amp;auto=webp&amp;s=722a6c6df5cb9b25763b5993a3f9e71cc76e9943', 'width': 320}], 'source': {'height': 384, 'url': 'https://external-preview.redd.it/DjWk_86NNyUihUzZTR4ubaikrrhAEdVepZd9okC_t3s.jpg?auto=webp&amp;s=fbd246139f23ece1fc4a03c8c282b90d44617cb8', 'width': 576}, 'variants': {}}]}",6,1601736430,1,,False,False,False,Physics,t5_2qhi6,1451631,public,https://b.thumbs.redditmedia.com/giUjqdfWCKHFRWBc0ZlOk9-WN5hWK6jPVW2YkiLruQw.jpg,"Physicists Build Circuit That Generates Clean, Limitless Power From Graphene",0,[],1.0,https://news.uark.edu/articles/54830/physicists-build-circuit-that-generates-clean-limitless-power-from-graphene,all_ads,6,article,News,,,93.0,140.0,https://news.uark.edu/articles/54830/physicists-build-circuit-that-generates-clean-limitless-power-from-graphene,,,,,,,,,,,,,
[],False,Im_peach_not_orange,,[],,text,t2_50tkqecb,False,False,[],False,False,1601736196,reddit.com,https://www.reddit.com/r/Physics/comments/j4g5uy/the_relationship_between_time_speed_and_time/,{},j4g5uy,True,False,False,False,True,False,False,,[],dark,text,False,False,True,12,0,False,all_ads,/r/Physics/comments/j4g5uy/the_relationship_between_time_speed_and_time/,False,,,6,1601736206,1,,True,False,False,Physics,t5_2qhi6,1451617,public,default,"The relationship between time, speed and time travel",0,[],1.0,https://www.reddit.com/r/math/comments/j4g3f6/the_relationship_between_time_speed_and_time/?utm_medium=android_app&amp;utm_source=share,all_ads,6,,,,,,,https://www.reddit.com/r/math/comments/j4g3f6/the_relationship_between_time_speed_and_time/?utm_medium=android_app&amp;utm_source=share,,,,,,,,,,,,,
[],False,abdullahnawaz9,,[],,text,t2_2llphg70,False,False,[],False,False,1601736006,self.Physics,https://www.reddit.com/r/Physics/comments/j4g409/does_a_scale_used_to_measure_weight_require/,{},j4g409,True,False,False,False,True,True,False,,[],dark,text,False,False,True,50,0,False,all_ads,/r/Physics/comments/j4g409/does_a_scale_used_to_measure_weight_require/,False,,,6,1601736017,1,Or can it just be recalibrated. I’m not taking about a balance,True,False,False,Physics,t5_2qhi6,1451609,public,self,Does a scale used to measure weight require gravity?,0,[],1.0,https://www.reddit.com/r/Physics/comments/j4g409/does_a_scale_used_to_measure_weight_require/,all_ads,6,question,Question,,,,,,,,,,,,,,,,,,
[],False,Natedoggsk8,,[],,text,t2_4nz4xsxz,False,False,[],False,False,1601730575,self.Physics,https://www.reddit.com/r/Physics/comments/j4eqx0/im_looking_for_a_paperstory_that_i_read_about_in/,{},j4eqx0,True,False,False,False,True,True,False,,[],dark,text,False,False,True,0,0,False,all_ads,/r/Physics/comments/j4eqx0/im_looking_for_a_paperstory_that_i_read_about_in/,False,,,6,1601730585,1,"It’s a story about a joint venture between more than a few countries. Their goal (in Alaska irc) was to harness the energy that is released when tnt or other explosive is detonated on the outside of steel tubing. This can create something like a lightning strike’s worth of kw’s out the axis of the tube.  

I’d really like to read about this again if anyone has any info. 

Ps: please forgive my grammar or terminology mistakes",True,False,False,Physics,t5_2qhi6,1451493,public,self,I’m looking for a paper/story that I read about in 2015. If anyone has any info please help.,0,[],1.0,https://www.reddit.com/r/Physics/comments/j4eqx0/im_looking_for_a_paperstory_that_i_read_about_in/,all_ads,6,,,,,,,,,,,,,,,,,,,,
[],False,creecoblog,,[],,text,t2_88nxmw15,False,False,[],False,False,1601728606,creeco.in,https://www.reddit.com/r/Physics/comments/j4elm4/careers_in_physics_bscmsc_institutions_job/,{},j4elm4,True,False,False,False,True,False,False,,[],dark,text,False,False,True,0,0,False,all_ads,/r/Physics/comments/j4elm4/careers_in_physics_bscmsc_institutions_job/,False,link,"{'enabled': False, 'images': [{'id': 'zvECgLeAd0B-_2eqg_7V0zArUhshRhWU5InjNm_eTkA', 'resolutions': [{'height': 56, 'url': 'https://external-preview.redd.it/IqqZT4h8PzbhR4DAJGGWSzkh5QVVEbMYCtDEN2u7HMs.jpg?width=108&amp;crop=smart&amp;auto=webp&amp;s=dcafc4e4c486666435b52e7605a8e5427368991f', 'width': 108}, {'height': 113, 'url': 'https://external-preview.redd.it/IqqZT4h8PzbhR4DAJGGWSzkh5QVVEbMYCtDEN2u7HMs.jpg?width=216&amp;crop=smart&amp;auto=webp&amp;s=d7024ab28283ae5a1b7dc0f638fd4c652e690dfa', 'width': 216}, {'height': 168, 'url': 'https://external-preview.redd.it/IqqZT4h8PzbhR4DAJGGWSzkh5QVVEbMYCtDEN2u7HMs.jpg?width=320&amp;crop=smart&amp;auto=webp&amp;s=72a2dcfcf83b9cf46a99d06ac5861feb376c164a', 'width': 320}, {'height': 336, 'url': 'https://external-preview.redd.it/IqqZT4h8PzbhR4DAJGGWSzkh5QVVEbMYCtDEN2u7HMs.jpg?width=640&amp;crop=smart&amp;auto=webp&amp;s=f5f48d1802df3d64010936def7c89dcaa4fdd550', 'width': 640}, {'height': 504, 'url': 'https://external-preview.redd.it/IqqZT4h8PzbhR4DAJGGWSzkh5QVVEbMYCtDEN2u7HMs.jpg?width=960&amp;crop=smart&amp;auto=webp&amp;s=f09c949f55b1c6354d480cc0cfb348bb6d869de1', 'width': 960}, {'height': 567, 'url': 'https://external-preview.redd.it/IqqZT4h8PzbhR4DAJGGWSzkh5QVVEbMYCtDEN2u7HMs.jpg?width=1080&amp;crop=smart&amp;auto=webp&amp;s=4a32de8a80b739ff88c129e068aa7bbfe20181d5', 'width': 1080}], 'source': {'height': 630, 'url': 'https://external-preview.redd.it/IqqZT4h8PzbhR4DAJGGWSzkh5QVVEbMYCtDEN2u7HMs.jpg?auto=webp&amp;s=c455cc2064feb92f69da9d304959bcb01af73323', 'width': 1200}, 'variants': {}}]}",6,1601730175,4,,True,False,False,Physics,t5_2qhi6,1451463,public,https://a.thumbs.redditmedia.com/aYROJpq3HPPjWH3Xt6tekfJpwKKuZBve52p9s8LL6L4.jpg,"CAREERS IN PHYSICS – B.SC,M.Sc, Institutions, Job Openings, Salary Package",0,[],1.0,https://www.creeco.in/2020/09/careers--in-physics.html,all_ads,6,,,,,73.0,140.0,https://www.creeco.in/2020/09/careers--in-physics.html,,,,,,,,,,,,,
[],False,Yasshy1,,[],,text,t2_6b1cu83j,False,False,[],False,False,1601722713,i.redd.it,https://www.reddit.com/r/Physics/comments/j4dvsm/does_anyone_knows_how_to_do_this_10_i_cant_seem/,{},j4dvsm,True,False,False,True,True,False,False,,[],dark,text,False,False,True,3,0,False,all_ads,/r/Physics/comments/j4dvsm/does_anyone_knows_how_to_do_this_10_i_cant_seem/,False,image,"{'enabled': True, 'images': [{'id': 'WCUkiAhkiM4y7S0zT84qyls4AXz4Bjg4kNV9xq_weYc', 'resolutions': [{'height': 81, 'url': 'https://preview.redd.it/0477m9hg2vq51.jpg?width=108&amp;crop=smart&amp;auto=webp&amp;s=7ea8c6da09e935c0288406ebdf7d3ef1c7e8795c', 'width': 108}, {'height': 162, 'url': 'https://preview.redd.it/0477m9hg2vq51.jpg?width=216&amp;crop=smart&amp;auto=webp&amp;s=c1e78f8a9da36e50caf5949e6d2970e61b3bc731', 'width': 216}, {'height': 240, 'url': 'https://preview.redd.it/0477m9hg2vq51.jpg?width=320&amp;crop=smart&amp;auto=webp&amp;s=87eb1ea30948cc36cc764c6b5f3cd740c99c8bee', 'width': 320}, {'height': 480, 'url': 'https://preview.redd.it/0477m9hg2vq51.jpg?width=640&amp;crop=smart&amp;auto=webp&amp;s=0932e7e708f2ed1efedfa62a6fc5d9c04d312200', 'width': 640}, {'height': 720, 'url': 'https://preview.redd.it/0477m9hg2vq51.jpg?width=960&amp;crop=smart&amp;auto=webp&amp;s=0630b2db87f5e24254090a50c155137519c28a13', 'width': 960}, {'height': 810, 'url': 'https://preview.redd.it/0477m9hg2vq51.jpg?width=1080&amp;crop=smart&amp;auto=webp&amp;s=d74c71d440f59d7fc32f8ad50989d66fbef2100b', 'width': 1080}], 'source': {'height': 2730, 'url': 'https://preview.redd.it/0477m9hg2vq51.jpg?auto=webp&amp;s=84c8777475f46472a432eca8c4342e2329f0a910', 'width': 3640}, 'variants': {}}]}",6,1601722723,1,,True,False,False,Physics,t5_2qhi6,1451453,public,https://b.thumbs.redditmedia.com/TIPMRfESUKD2qtSOlsAUhsU7b5gDbZ9Vb-19TDokXAI.jpg,Does anyone knows how to do this (#10) I can't seem to figure it out. This module doesn't teach anything.,0,[],1.0,https://i.redd.it/0477m9hg2vq51.jpg,all_ads,6,image,Image,,,105.0,140.0,https://i.redd.it/0477m9hg2vq51.jpg,,,,,,,,,,,,,
[],False,Safisolar,,[],,text,t2_5qdl5hk3,False,False,[],False,False,1601721985,youtu.be,https://www.reddit.com/r/Physics/comments/j4dr3k/httpsyoutube8_wvowjqfcu/,{},j4dr3k,False,False,False,False,False,False,False,,[],dark,text,False,False,True,0,0,False,all_ads,/r/Physics/comments/j4dr3k/httpsyoutube8_wvowjqfcu/,False,rich:video,"{'enabled': False, 'images': [{'id': 'r8JS3Gt5jLZUHt0sadjAvw6pJQQhdPG_24Prfr1O1lo', 'resolutions': [{'height': 81, 'url': 'https://external-preview.redd.it/67i2XewW5TPa3j3dr_9jCy0mlA20ieaWV95JXhWFLbw.jpg?width=108&amp;crop=smart&amp;auto=webp&amp;s=dc0be2804bf5be55285bdd93d2ce66b4bceaf52f', 'width': 108}, {'height': 162, 'url': 'https://external-preview.redd.it/67i2XewW5TPa3j3dr_9jCy0mlA20ieaWV95JXhWFLbw.jpg?width=216&amp;crop=smart&amp;auto=webp&amp;s=0b30ed644819e564454a8675da013a30f12cfa10', 'width': 216}, {'height': 240, 'url': 'https://external-preview.redd.it/67i2XewW5TPa3j3dr_9jCy0mlA20ieaWV95JXhWFLbw.jpg?width=320&amp;crop=smart&amp;auto=webp&amp;s=53872773b74e1d60396d8e75f57b4ec834f72f8d', 'width': 320}], 'source': {'height': 360, 'url': 'https://external-preview.redd.it/67i2XewW5TPa3j3dr_9jCy0mlA20ieaWV95JXhWFLbw.jpg?auto=webp&amp;s=63d532eebaeb392a6be941c0f5627f9aa924d6ec', 'width': 480}, 'variants': {}}]}",6,1601721995,1,,True,False,False,Physics,t5_2qhi6,1451435,public,https://b.thumbs.redditmedia.com/dkJzlSGG8mGIEZLNK-HlSbsZxgyjzWZQUFSkcxaXcSI.jpg,https://youtu.be/8_wVOWJQfcU,0,[],1.0,https://youtu.be/8_wVOWJQfcU,all_ads,6,,,,,105.0,140.0,https://youtu.be/8_wVOWJQfcU,"{'oembed': {'author_name': 'solar energy for all &amp; Electric control', 'author_url': 'https://www.youtube.com/channel/UCrluVC6Lyma-dLCRCXn2JVQ', 'height': 338, 'html': '&lt;iframe width=""600"" height=""338"" src=""https://www.youtube.com/embed/8_wVOWJQfcU?feature=oembed&amp;enablejsapi=1"" frameborder=""0"" allow=""accelerometer; autoplay; clipboard-write; encrypted-media; gyroscope; picture-in-picture"" allowfullscreen&gt;&lt;/iframe&gt;', 'provider_name': 'YouTube', 'provider_url': 'https://www.youtube.com/', 'thumbnail_height': 360, 'thumbnail_url': 'https://i.ytimg.com/vi/8_wVOWJQfcU/hqdefault.jpg', 'thumbnail_width': 480, 'title': 'Home 3. الكهرباء المنزلية', 'type': 'video', 'version': '1.0', 'width': 600}, 'type': 'youtube.com'}","{'content': '&lt;iframe width=""600"" height=""338"" src=""https://www.youtube.com/embed/8_wVOWJQfcU?feature=oembed&amp;enablejsapi=1"" frameborder=""0"" allow=""accelerometer; autoplay; clipboard-write; encrypted-media; gyroscope; picture-in-picture"" allowfullscreen&gt;&lt;/iframe&gt;', 'height': 338, 'scrolling': False, 'width': 600}",automod_filtered,"{'oembed': {'author_name': 'solar energy for all &amp; Electric control', 'author_url': 'https://www.youtube.com/channel/UCrluVC6Lyma-dLCRCXn2JVQ', 'height': 338, 'html': '&lt;iframe width=""600"" height=""338"" src=""https://www.youtube.com/embed/8_wVOWJQfcU?feature=oembed&amp;enablejsapi=1"" frameborder=""0"" allow=""accelerometer; autoplay; clipboard-write; encrypted-media; gyroscope; picture-in-picture"" allowfullscreen&gt;&lt;/iframe&gt;', 'provider_name': 'YouTube', 'provider_url': 'https://www.youtube.com/', 'thumbnail_height': 360, 'thumbnail_url': 'https://i.ytimg.com/vi/8_wVOWJQfcU/hqdefault.jpg', 'thumbnail_width': 480, 'title': 'Home 3. الكهرباء المنزلية', 'type': 'video', 'version': '1.0', 'width': 600}, 'type': 'youtube.com'}","{'content': '&lt;iframe width=""600"" height=""338"" src=""https://www.youtube.com/embed/8_wVOWJQfcU?feature=oembed&amp;enablejsapi=1"" frameborder=""0"" allow=""accelerometer; autoplay; clipboard-write; encrypted-media; gyroscope; picture-in-picture"" allowfullscreen&gt;&lt;/iframe&gt;', 'height': 338, 'media_domain_url': 'https://www.redditmedia.com/mediaembed/j4dr3k', 'scrolling': False, 'width': 600}",,,,,,,,
