[],False,theattackchicken,,[],,,,text,t2_5os2gly0,False,False,[],False,False,1601255205,self.Physics,https://www.reddit.com/r/Physics/comments/j12np6/airplane_velocity_problem/,{},j12np6,True,False,False,False,True,True,False,,,[],,dark,text,False,False,True,1,0,False,all_ads,/r/Physics/comments/j12np6/airplane_velocity_problem/,False,6,1601255216,1,"I have a question about relative velocity between a car and a 4 propeller airplane. 

If a car is traveling east at 70 mph, and an airplane is flying west at say, 140 mph, then the relative velocity of the airplane with respect to the driver of the car would be 70+140=210 mph, right? As in, the plane would appear to be moving much more quickly to the driver?

Also, in regards to a different variation of relative motion. If a plane is flying at 140 mph into a headwind of 140 mph, the airplane would appear to hover in the air to an outside observer, right? Like, it would still be airborne, because the wind would still be providing enough lift, even though it wouldn't be making forward ground speed?

Am I right in these thoughts? It's been a long time since I studied physics",True,False,False,Physics,t5_2qhi6,1444165,public,self,Airplane velocity problem,0,[],1.0,https://www.reddit.com/r/Physics/comments/j12np6/airplane_velocity_problem/,all_ads,6,,,,,,,,,,,,,
[],False,BrandonPohlman,,[],,,,text,t2_43tpw92c,False,False,[],False,False,1601251981,self.Physics,https://www.reddit.com/r/Physics/comments/j11um5/physics_help_with_homework/,{},j11um5,True,False,False,False,True,True,False,,,[],,dark,text,False,False,True,4,0,False,all_ads,/r/Physics/comments/j11um5/physics_help_with_homework/,False,6,1601251992,1,Is there anyone online that can help me with some physics homework?,True,False,False,Physics,t5_2qhi6,1444133,public,self,Physics help with homework,0,[],1.0,https://www.reddit.com/r/Physics/comments/j11um5/physics_help_with_homework/,all_ads,6,,,,,,,,,,,,,
[],False,BrandonPohlman,,[],,,,text,t2_43tpw92c,False,False,[],False,False,1601250996,self.Physics,https://www.reddit.com/r/Physics/comments/j11lti/physics_help/,{},j11lti,True,False,False,False,True,True,False,,,[],,dark,text,False,False,True,4,0,False,all_ads,/r/Physics/comments/j11lti/physics_help/,False,6,1601251007,1,Is anyone online that can help me with a physics test?,True,False,False,Physics,t5_2qhi6,1444106,public,self,Physics help.,0,[],1.0,https://www.reddit.com/r/Physics/comments/j11lti/physics_help/,all_ads,6,,,,,,,,,,,,,
[],False,EssamBerikaa,,[],,,,text,t2_6jk72v6e,False,False,[],False,False,1601247668,self.Physics,https://www.reddit.com/r/Physics/comments/j10rl7/do_you_want_to_learn_about_nanofabrication_for/,{},j10rl7,True,False,False,False,True,True,False,,question,[],Question,dark,text,False,False,True,1,0,False,all_ads,/r/Physics/comments/j10rl7/do_you_want_to_learn_about_nanofabrication_for/,False,6,1601247680,1,"Hi ðŸ¥³ðŸ¥³ .. 

This is my course on Microfabircation and Nanofabrication techniques. It covers the fabrication technologies for ICs / MEMS / Photonics. I am offering it for free for 3 days ðŸ¤©, and I am looking forward to your positive reviews.

The course is helpful for undergraduate students from electrical and electronics engineering student. I hope it helps.

https://www.udemy.com/course/introduction-to-micro-and-nano-fabrication-techniques-by-essamberikaa/?couponCode=6FC25BA93302B979CD1F",True,False,False,Physics,t5_2qhi6,1443954,public,self,Do you want to learn about Nanofabrication for free?,0,[],1.0,https://www.reddit.com/r/Physics/comments/j10rl7/do_you_want_to_learn_about_nanofabrication_for/,all_ads,6,self,"{'enabled': False, 'images': [{'id': 'krfJhkwRvUa_Yy6ApbtF2b829CZyvcmQJ13yL2gDM5A', 'resolutions': [{'height': 60, 'url': 'https://external-preview.redd.it/FbcEjt_gX-eQo8aI3SOuFMr0dgs8K7Ohx8IvVqtG4Sw.jpg?width=108&amp;crop=smart&amp;auto=webp&amp;s=12b96f754308402f58c0b4efa156e7a2096a332d', 'width': 108}, {'height': 121, 'url': 'https://external-preview.redd.it/FbcEjt_gX-eQo8aI3SOuFMr0dgs8K7Ohx8IvVqtG4Sw.jpg?width=216&amp;crop=smart&amp;auto=webp&amp;s=a70edc57064ea7db706c2f2c20703cc78055f89d', 'width': 216}, {'height': 180, 'url': 'https://external-preview.redd.it/FbcEjt_gX-eQo8aI3SOuFMr0dgs8K7Ohx8IvVqtG4Sw.jpg?width=320&amp;crop=smart&amp;auto=webp&amp;s=d58daeb973b6a32a43e0e0443efcf134e8aa1dcd', 'width': 320}], 'source': {'height': 270, 'url': 'https://external-preview.redd.it/FbcEjt_gX-eQo8aI3SOuFMr0dgs8K7Ohx8IvVqtG4Sw.jpg?auto=webp&amp;s=04e278051ab0e6922c4aa3b17e77a6484444b057', 'width': 480}, 'variants': {}}]}",,,,,,,,,,,
[],False,fiorellanutella,,[],,,,text,t2_745tldrz,False,False,[],False,False,1601246228,self.Physics,https://www.reddit.com/r/Physics/comments/j10e28/why_do_i_love_physics_but_hate_maths/,{},j10e28,True,False,False,False,True,True,False,,question,[],Question,dark,text,False,False,True,4,0,False,all_ads,/r/Physics/comments/j10e28/why_do_i_love_physics_but_hate_maths/,False,6,1601246239,1,"I even like the mechanics part of physics, I find the problem solving so fun. I just hate maths on itâ€™s own as a subject!! Itâ€™s literally just like â€œSolve 49487429x2 by djebdkqndd8473891xxxxxxxhrndoab squaredâ€

Am I weird or delusional? Everyone says you have to like maths to like physics!!",True,False,False,Physics,t5_2qhi6,1443944,public,self,Why do I love physics but hate maths?,0,[],1.0,https://www.reddit.com/r/Physics/comments/j10e28/why_do_i_love_physics_but_hate_maths/,all_ads,6,,,,,,,,,,,,,
[],False,Anomalistic_Username,,[],,,,text,t2_yco4jxv,False,False,[],False,False,1601244471,i.imgur.com,https://www.reddit.com/r/Physics/comments/j0zx36/how_do_you_solve_this_i_know_that_the_answer_is_4/,{},j0zx36,True,False,False,False,True,False,False,,image,[],Image,dark,text,False,False,True,14,0,False,all_ads,/r/Physics/comments/j0zx36/how_do_you_solve_this_i_know_that_the_answer_is_4/,False,6,1601244482,1,,True,False,False,Physics,t5_2qhi6,1443920,public,https://b.thumbs.redditmedia.com/eCFNMRgoZFNSpeJ54isrqRvVSQGLI3cO0kYTHvbdPBo.jpg,"How do you solve this? I know that the answer is 4 from the web, but there is no step by step explanation. Thanks",0,[],1.0,https://i.imgur.com/s6vxMhW.jpg,all_ads,6,image,"{'enabled': True, 'images': [{'id': '9euHy6kDAxl90EhOBNfWUy9wkAg7C8strH5xdADxMAA', 'resolutions': [{'height': 144, 'url': 'https://external-preview.redd.it/1OsI195btSJmL0_ALVS2z1zeuAEuiMp7I1CJw0y7Sgo.jpg?width=108&amp;crop=smart&amp;auto=webp&amp;s=f05ed8ede8d84c7285d71d3933cfb02c8407cd3a', 'width': 108}, {'height': 288, 'url': 'https://external-preview.redd.it/1OsI195btSJmL0_ALVS2z1zeuAEuiMp7I1CJw0y7Sgo.jpg?width=216&amp;crop=smart&amp;auto=webp&amp;s=520bb1188db409d64b04a0aa41bb19ad46c29656', 'width': 216}, {'height': 426, 'url': 'https://external-preview.redd.it/1OsI195btSJmL0_ALVS2z1zeuAEuiMp7I1CJw0y7Sgo.jpg?width=320&amp;crop=smart&amp;auto=webp&amp;s=c9ec00946a65349cda00e9e04a3f93de6654c51d', 'width': 320}, {'height': 853, 'url': 'https://external-preview.redd.it/1OsI195btSJmL0_ALVS2z1zeuAEuiMp7I1CJw0y7Sgo.jpg?width=640&amp;crop=smart&amp;auto=webp&amp;s=da9db1c0e8a34121b8bb14ad5559234dc9631e5c', 'width': 640}, {'height': 1280, 'url': 'https://external-preview.redd.it/1OsI195btSJmL0_ALVS2z1zeuAEuiMp7I1CJw0y7Sgo.jpg?width=960&amp;crop=smart&amp;auto=webp&amp;s=783165b5f7e152cab42ce6bf6148995cfa8844f8', 'width': 960}, {'height': 1440, 'url': 'https://external-preview.redd.it/1OsI195btSJmL0_ALVS2z1zeuAEuiMp7I1CJw0y7Sgo.jpg?width=1080&amp;crop=smart&amp;auto=webp&amp;s=c382eb87e6272766d106f13f51081a9c8856ef22', 'width': 1080}], 'source': {'height': 3226, 'url': 'https://external-preview.redd.it/1OsI195btSJmL0_ALVS2z1zeuAEuiMp7I1CJw0y7Sgo.jpg?auto=webp&amp;s=616605ad568f245b38008ace69436c8791e7cbe1', 'width': 2419}, 'variants': {}}]}",140.0,140.0,https://i.imgur.com/s6vxMhW.jpg,,,,,,,,
[],False,Bird_Person68,,[],,,,text,t2_84phwwzi,False,False,[],False,False,1601243198,self.Physics,https://www.reddit.com/r/Physics/comments/j0zkg0/does_your_mind_have_any_affect_on_your_reality_im/,{},j0zkg0,True,False,False,False,True,True,False,,question,[],Question,dark,text,False,False,True,7,0,False,all_ads,/r/Physics/comments/j0zkg0/does_your_mind_have_any_affect_on_your_reality_im/,False,6,1601243209,1,"Can your brain emit signals to the universe to get what you want?they claim your brain sends a signal and the frequency changes based on what youâ€™re thinking and feeling and eventually after you feel and think correspondingly to what it is you want then itâ€™ll manifest into your experience of life. Witch can be anything you want, they say you can be do or have anything you want. By envisioning it and feeling what it would be like to be experiencing what it is you want.",True,False,False,Physics,t5_2qhi6,1443916,public,self,Does your mind have any affect on your reality? Iâ€™m referring to the law of attraction. Gurus claim it has backing in physics and quantum physics,0,[],1.0,https://www.reddit.com/r/Physics/comments/j0zkg0/does_your_mind_have_any_affect_on_your_reality_im/,all_ads,6,,,,,,,,,,,,,
[],False,biz-nus,,[],,,,text,t2_4qg9rz73,False,False,[],False,False,1601243015,self.Physics,https://www.reddit.com/r/Physics/comments/j0zimo/what_are_some_of_the_most_fascinating_concepts_in/,{},j0zimo,True,False,False,False,True,True,False,,question,[],Question,dark,text,False,False,True,1,0,False,all_ads,/r/Physics/comments/j0zimo/what_are_some_of_the_most_fascinating_concepts_in/,False,6,1601243028,1,I love physics and Iâ€™ve only been in the class for a month lol. Enlighten me!!,True,False,False,Physics,t5_2qhi6,1443915,public,self,What are some of the most fascinating concepts in physics?,0,[],1.0,https://www.reddit.com/r/Physics/comments/j0zimo/what_are_some_of_the_most_fascinating_concepts_in/,all_ads,6,,,,,,,,,,,,,
[],False,Keithic,,[],,,,text,t2_9r92f,False,False,[],False,False,1601238189,self.Physics,https://www.reddit.com/r/Physics/comments/j0y5m5/how_do_you_know_when_youre_doing_too_much_work/,{},j0y5m5,True,False,False,False,True,True,False,,question,[],Question,dark,text,False,False,True,1,0,False,all_ads,/r/Physics/comments/j0y5m5/how_do_you_know_when_youre_doing_too_much_work/,False,6,1601238200,1,"My subject title sorta explains what I'm asking.

Over the last 2 years I've done really well in all my classes, finished an associates and transferred with a 3.8 GPA. I still love physics and still enjoy solving my problem sets and learning, but my desire to be one of the bests in my classes is fading. Over the last two years during the school years I've pretty much stopped playing games in order to get an A in every class, but I feel so done with that. My lowest grade as of right now this semester is my Real Analysis class at a B/B+, and I could probably push it to an A, but I've learned that getting an A requires such a significant amount of additional work, I just don't want to put it in, especially for a class I'm not super interested in.

I'm currently working as a lab assistant in a high energy particle physics lab and I'm doing good work in there I think, the people seem to like me, even though I mess up sometimes because the work is hard. I feel like at this point I should be that sort of star student that's doing lab work and working in the library every day until 11, but I don't want that anymore really. I want to get into grad school for physics and do work I love, but I don't want to dedicate all hours of my life to it. I usually manage about 5-6 hours a day of work outside of class, but on Friday/Saturday I can't be bothered anymore, I just want to play games with my friends.

This kind of sparked when I watched a lecture from one of the professor from my school, in his part time he's working on a theory for quantum gravity. It sounds fucking awesome, but I thought that if I had his job, that'd be my main work if anything. After my 8 hours each day, I'd play games every week with my friends and hang out with my girlfriend, I'm just tired of performing at my best all the damn time.

I suppose I should clarify I'm currently holding an A in my physics courses because they aren't that difficult because of being online mostly. However, I've noticed that if I'm not interested in the class I have a really hard time pushing myself to do the work, or as much work as I should.

This is sort of a rant/asking for advice, what do you guys think?

I also want to add that I don't much care for getting into the best grad schools, but I think I'd still be interested in research work in astronomy.",True,False,False,Physics,t5_2qhi6,1443803,public,self,How do you know when you're doing too much work?,0,[],1.0,https://www.reddit.com/r/Physics/comments/j0y5m5/how_do_you_know_when_youre_doing_too_much_work/,all_ads,6,,,,,,,,,,,,,
[],False,nass1515,,[],,,,text,t2_7qezk725,False,False,[],False,False,1601237992,youtu.be,https://www.reddit.com/r/Physics/comments/j0y3jl/albert_einstein_real_speech_in_colour_ai_enhanced/,{},j0y3jl,True,False,False,False,True,False,False,,image,[],Video,dark,text,False,False,True,0,0,False,all_ads,/r/Physics/comments/j0y3jl/albert_einstein_real_speech_in_colour_ai_enhanced/,False,6,1601238002,1,,True,False,False,Physics,t5_2qhi6,1443799,public,https://b.thumbs.redditmedia.com/MY2mm-IcHH1FcewH3BR9YNAOAzC5DY4jg7XGxrs3izU.jpg,Albert Einstein Real Speech in Colour AI Enhanced High Quality !,0,[],1.0,https://youtu.be/2XDTO7c_v0w,all_ads,6,rich:video,"{'enabled': False, 'images': [{'id': 'HYM0nKhfojmfYMhha7pDPROenKxPaYjmWJLbHNEmhXI', 'resolutions': [{'height': 81, 'url': 'https://external-preview.redd.it/pS99wcLsi7HmyCxATU5AQGbkHm4Plif7hs67CN252Xs.jpg?width=108&amp;crop=smart&amp;auto=webp&amp;s=29121e9e41f91ca6ffdd0e651f1196325902ee0c', 'width': 108}, {'height': 162, 'url': 'https://external-preview.redd.it/pS99wcLsi7HmyCxATU5AQGbkHm4Plif7hs67CN252Xs.jpg?width=216&amp;crop=smart&amp;auto=webp&amp;s=4269e8ee18e95542e7906a992312a81a794a93bc', 'width': 216}, {'height': 240, 'url': 'https://external-preview.redd.it/pS99wcLsi7HmyCxATU5AQGbkHm4Plif7hs67CN252Xs.jpg?width=320&amp;crop=smart&amp;auto=webp&amp;s=2b73af2962a371b1a136008a91c4290821a4017f', 'width': 320}], 'source': {'height': 360, 'url': 'https://external-preview.redd.it/pS99wcLsi7HmyCxATU5AQGbkHm4Plif7hs67CN252Xs.jpg?auto=webp&amp;s=a68b1fe5e032c932da3c1000e0075aae358850b4', 'width': 480}, 'variants': {}}]}",105.0,140.0,https://youtu.be/2XDTO7c_v0w,"{'oembed': {'author_name': 'NASS', 'author_url': 'https://www.youtube.com/channel/UC1W8ShdwtfgjRHdbl1Lctcw', 'height': 338, 'html': '&lt;iframe width=""600"" height=""338"" src=""https://www.youtube.com/embed/2XDTO7c_v0w?feature=oembed&amp;enablejsapi=1"" frameborder=""0"" allow=""accelerometer; autoplay; clipboard-write; encrypted-media; gyroscope; picture-in-picture"" allowfullscreen&gt;&lt;/iframe&gt;', 'provider_name': 'YouTube', 'provider_url': 'https://www.youtube.com/', 'thumbnail_height': 360, 'thumbnail_url': 'https://i.ytimg.com/vi/2XDTO7c_v0w/hqdefault.jpg', 'thumbnail_width': 480, 'title': 'Albert Einstein Real Speech in Colour! [AI Enhanced High Quality!]', 'type': 'video', 'version': '1.0', 'width': 600}, 'type': 'youtube.com'}","{'content': '&lt;iframe width=""600"" height=""338"" src=""https://www.youtube.com/embed/2XDTO7c_v0w?feature=oembed&amp;enablejsapi=1"" frameborder=""0"" allow=""accelerometer; autoplay; clipboard-write; encrypted-media; gyroscope; picture-in-picture"" allowfullscreen&gt;&lt;/iframe&gt;', 'height': 338, 'scrolling': False, 'width': 600}","{'oembed': {'author_name': 'NASS', 'author_url': 'https://www.youtube.com/channel/UC1W8ShdwtfgjRHdbl1Lctcw', 'height': 338, 'html': '&lt;iframe width=""600"" height=""338"" src=""https://www.youtube.com/embed/2XDTO7c_v0w?feature=oembed&amp;enablejsapi=1"" frameborder=""0"" allow=""accelerometer; autoplay; clipboard-write; encrypted-media; gyroscope; picture-in-picture"" allowfullscreen&gt;&lt;/iframe&gt;', 'provider_name': 'YouTube', 'provider_url': 'https://www.youtube.com/', 'thumbnail_height': 360, 'thumbnail_url': 'https://i.ytimg.com/vi/2XDTO7c_v0w/hqdefault.jpg', 'thumbnail_width': 480, 'title': 'Albert Einstein Real Speech in Colour! [AI Enhanced High Quality!]', 'type': 'video', 'version': '1.0', 'width': 600}, 'type': 'youtube.com'}","{'content': '&lt;iframe width=""600"" height=""338"" src=""https://www.youtube.com/embed/2XDTO7c_v0w?feature=oembed&amp;enablejsapi=1"" frameborder=""0"" allow=""accelerometer; autoplay; clipboard-write; encrypted-media; gyroscope; picture-in-picture"" allowfullscreen&gt;&lt;/iframe&gt;', 'height': 338, 'media_domain_url': 'https://www.redditmedia.com/mediaembed/j0y3jl', 'scrolling': False, 'width': 600}",,,,
[],False,intrepid_duck21,,[],,,,text,t2_5w0mfi1b,False,False,[],False,False,1601231390,self.Physics,https://www.reddit.com/r/Physics/comments/j0w4la/how_to_measure_wind_speed_in_homemade_wind_tunnel/,{},j0w4la,True,False,False,False,True,True,False,,question,[],Question,dark,text,False,False,True,1,0,False,all_ads,/r/Physics/comments/j0w4la/how_to_measure_wind_speed_in_homemade_wind_tunnel/,False,6,1601231401,1,"For a research paper, I constructed a basic homemade wind tunnel with a box fan, but need to calculate the wind speed of each of its settings/speeds for some of my equations. What is the best way to do this? 

Would a cup anemometer be acceptable, or is this too juvenile/potentially inaccurate?",True,False,False,Physics,t5_2qhi6,1443662,public,self,How to measure wind speed in homemade wind tunnel?,0,[],1.0,https://www.reddit.com/r/Physics/comments/j0w4la/how_to_measure_wind_speed_in_homemade_wind_tunnel/,all_ads,6,,,,,,,,,,,,,
[],False,kaulsayan,,[],,,,text,t2_7i6a0kxz,False,False,[],False,False,1601231321,youtu.be,https://www.reddit.com/r/Physics/comments/j0w3w3/rare_videos_about_einstein/,{},j0w3w3,True,False,False,False,True,False,False,,image,[],Video,dark,text,False,False,True,0,0,False,all_ads,/r/Physics/comments/j0w3w3/rare_videos_about_einstein/,False,6,1601231339,1,,True,False,False,Physics,t5_2qhi6,1443662,public,https://b.thumbs.redditmedia.com/6sVlvQtr58UriTNmpuDDZRFhixEtoTX4tuPhKM-tAzY.jpg,Rare videos about Einstein,0,[],1.0,https://youtu.be/_ZtnBgXBqbE,all_ads,6,rich:video,"{'enabled': False, 'images': [{'id': 'VrmSl7GQoK6sMRMnQeQrCT5oOUbzVtvAPf746zSOcTE', 'resolutions': [{'height': 81, 'url': 'https://external-preview.redd.it/__W4CN1SyIW2YBk_gdjIlTq57HOAcyZDoe9lIsjJX0c.jpg?width=108&amp;crop=smart&amp;auto=webp&amp;s=9ca399402f836f99baaacc5ebecb7211bd64c25c', 'width': 108}, {'height': 162, 'url': 'https://external-preview.redd.it/__W4CN1SyIW2YBk_gdjIlTq57HOAcyZDoe9lIsjJX0c.jpg?width=216&amp;crop=smart&amp;auto=webp&amp;s=78ee162d323dcd61c84fff1453db8d8d469befbe', 'width': 216}, {'height': 240, 'url': 'https://external-preview.redd.it/__W4CN1SyIW2YBk_gdjIlTq57HOAcyZDoe9lIsjJX0c.jpg?width=320&amp;crop=smart&amp;auto=webp&amp;s=526916b1d7866ae807b3bdf2c595a476e63a2d32', 'width': 320}], 'source': {'height': 360, 'url': 'https://external-preview.redd.it/__W4CN1SyIW2YBk_gdjIlTq57HOAcyZDoe9lIsjJX0c.jpg?auto=webp&amp;s=ceb5ec767eeea94f57c5542548a910ce4c25455c', 'width': 480}, 'variants': {}}]}",105.0,140.0,https://youtu.be/_ZtnBgXBqbE,"{'oembed': {'author_name': 'Fact Sci Guy', 'author_url': 'https://www.youtube.com/channel/UC5eZpaCexQV7fSuxBbkYMaA', 'height': 338, 'html': '&lt;iframe width=""600"" height=""338"" src=""https://www.youtube.com/embed/_ZtnBgXBqbE?feature=oembed&amp;enablejsapi=1"" frameborder=""0"" allow=""accelerometer; autoplay; clipboard-write; encrypted-media; gyroscope; picture-in-picture"" allowfullscreen&gt;&lt;/iframe&gt;', 'provider_name': 'YouTube', 'provider_url': 'https://www.youtube.com/', 'thumbnail_height': 360, 'thumbnail_url': 'https://i.ytimg.com/vi/_ZtnBgXBqbE/hqdefault.jpg', 'thumbnail_width': 480, 'title': '5 Rare Videos About Einstein...Â© Sayan', 'type': 'video', 'version': '1.0', 'width': 600}, 'type': 'youtube.com'}","{'content': '&lt;iframe width=""600"" height=""338"" src=""https://www.youtube.com/embed/_ZtnBgXBqbE?feature=oembed&amp;enablejsapi=1"" frameborder=""0"" allow=""accelerometer; autoplay; clipboard-write; encrypted-media; gyroscope; picture-in-picture"" allowfullscreen&gt;&lt;/iframe&gt;', 'height': 338, 'scrolling': False, 'width': 600}","{'oembed': {'author_name': 'Fact Sci Guy', 'author_url': 'https://www.youtube.com/channel/UC5eZpaCexQV7fSuxBbkYMaA', 'height': 338, 'html': '&lt;iframe width=""600"" height=""338"" src=""https://www.youtube.com/embed/_ZtnBgXBqbE?feature=oembed&amp;enablejsapi=1"" frameborder=""0"" allow=""accelerometer; autoplay; clipboard-write; encrypted-media; gyroscope; picture-in-picture"" allowfullscreen&gt;&lt;/iframe&gt;', 'provider_name': 'YouTube', 'provider_url': 'https://www.youtube.com/', 'thumbnail_height': 360, 'thumbnail_url': 'https://i.ytimg.com/vi/_ZtnBgXBqbE/hqdefault.jpg', 'thumbnail_width': 480, 'title': '5 Rare Videos About Einstein...Â© Sayan', 'type': 'video', 'version': '1.0', 'width': 600}, 'type': 'youtube.com'}","{'content': '&lt;iframe width=""600"" height=""338"" src=""https://www.youtube.com/embed/_ZtnBgXBqbE?feature=oembed&amp;enablejsapi=1"" frameborder=""0"" allow=""accelerometer; autoplay; clipboard-write; encrypted-media; gyroscope; picture-in-picture"" allowfullscreen&gt;&lt;/iframe&gt;', 'height': 338, 'media_domain_url': 'https://www.redditmedia.com/mediaembed/j0w3w3', 'scrolling': False, 'width': 600}",,,,
[],False,quantum_steve,,[],,,,text,t2_5aur6aft,False,False,[],False,False,1601231129,youtu.be,https://www.reddit.com/r/Physics/comments/j0w1v5/hey_guys_ive_made_a_video_on_how_you_can_make_a/,{},j0w1v5,True,False,False,False,True,False,False,,image,[],Video,dark,text,False,False,True,19,0,False,all_ads,/r/Physics/comments/j0w1v5/hey_guys_ive_made_a_video_on_how_you_can_make_a/,False,6,1601231183,1,,True,False,False,Physics,t5_2qhi6,1443662,public,https://b.thumbs.redditmedia.com/ddWBNYuQOfgXe4DQDahX9e-YzQ2I8Chxvc_1J_Y0BSg.jpg,Hey guys! I've made a video on how you can make a quantum calculator that runs on IBMs real Quantum Computers. Let me know what you think!,0,[],1.0,https://youtu.be/SvhEE9aBtc4,all_ads,6,rich:video,"{'enabled': False, 'images': [{'id': 'FFQXAAWeBiQlTGbdEPjlJVUCj6w0tri2S4xrL6FH3JI', 'resolutions': [{'height': 81, 'url': 'https://external-preview.redd.it/SFvNXunkl3t7h3i0uIg8EhzbEwKUdJFJa-HAKJlWgLs.jpg?width=108&amp;crop=smart&amp;auto=webp&amp;s=3beb3f1690316e7e145205070e65dc6d30b4fa19', 'width': 108}, {'height': 162, 'url': 'https://external-preview.redd.it/SFvNXunkl3t7h3i0uIg8EhzbEwKUdJFJa-HAKJlWgLs.jpg?width=216&amp;crop=smart&amp;auto=webp&amp;s=05c5acaab15062358ee00b5ebbd7995977d79b89', 'width': 216}, {'height': 240, 'url': 'https://external-preview.redd.it/SFvNXunkl3t7h3i0uIg8EhzbEwKUdJFJa-HAKJlWgLs.jpg?width=320&amp;crop=smart&amp;auto=webp&amp;s=0ae784529e5ad06ea271742fdd53969bfc481e24', 'width': 320}], 'source': {'height': 360, 'url': 'https://external-preview.redd.it/SFvNXunkl3t7h3i0uIg8EhzbEwKUdJFJa-HAKJlWgLs.jpg?auto=webp&amp;s=437286782651d101e293a289fe98472ecc958fcf', 'width': 480}, 'variants': {}}]}",105.0,140.0,https://youtu.be/SvhEE9aBtc4,"{'oembed': {'author_name': 'Quantum Steve', 'author_url': 'https://www.youtube.com/channel/UClJb9qILKt0lhmrbLW7-eVw', 'height': 338, 'html': '&lt;iframe width=""600"" height=""338"" src=""https://www.youtube.com/embed/SvhEE9aBtc4?feature=oembed&amp;enablejsapi=1"" frameborder=""0"" allow=""accelerometer; autoplay; clipboard-write; encrypted-media; gyroscope; picture-in-picture"" allowfullscreen&gt;&lt;/iframe&gt;', 'provider_name': 'YouTube', 'provider_url': 'https://www.youtube.com/', 'thumbnail_height': 360, 'thumbnail_url': 'https://i.ytimg.com/vi/SvhEE9aBtc4/hqdefault.jpg', 'thumbnail_width': 480, 'title': 'How To Make A Quantum Calculator - Quantum Computing Tutorial', 'type': 'video', 'version': '1.0', 'width': 600}, 'type': 'youtube.com'}","{'content': '&lt;iframe width=""600"" height=""338"" src=""https://www.youtube.com/embed/SvhEE9aBtc4?feature=oembed&amp;enablejsapi=1"" frameborder=""0"" allow=""accelerometer; autoplay; clipboard-write; encrypted-media; gyroscope; picture-in-picture"" allowfullscreen&gt;&lt;/iframe&gt;', 'height': 338, 'scrolling': False, 'width': 600}","{'oembed': {'author_name': 'Quantum Steve', 'author_url': 'https://www.youtube.com/channel/UClJb9qILKt0lhmrbLW7-eVw', 'height': 338, 'html': '&lt;iframe width=""600"" height=""338"" src=""https://www.youtube.com/embed/SvhEE9aBtc4?feature=oembed&amp;enablejsapi=1"" frameborder=""0"" allow=""accelerometer; autoplay; clipboard-write; encrypted-media; gyroscope; picture-in-picture"" allowfullscreen&gt;&lt;/iframe&gt;', 'provider_name': 'YouTube', 'provider_url': 'https://www.youtube.com/', 'thumbnail_height': 360, 'thumbnail_url': 'https://i.ytimg.com/vi/SvhEE9aBtc4/hqdefault.jpg', 'thumbnail_width': 480, 'title': 'How To Make A Quantum Calculator - Quantum Computing Tutorial', 'type': 'video', 'version': '1.0', 'width': 600}, 'type': 'youtube.com'}","{'content': '&lt;iframe width=""600"" height=""338"" src=""https://www.youtube.com/embed/SvhEE9aBtc4?feature=oembed&amp;enablejsapi=1"" frameborder=""0"" allow=""accelerometer; autoplay; clipboard-write; encrypted-media; gyroscope; picture-in-picture"" allowfullscreen&gt;&lt;/iframe&gt;', 'height': 338, 'media_domain_url': 'https://www.redditmedia.com/mediaembed/j0w1v5', 'scrolling': False, 'width': 600}",,,,
