[],False,awang_789-,,[],,text,t2_7v6c1bug,False,False,[],False,False,1602907340,reddit.com,https://www.reddit.com/r/Physics/comments/jcoixi/need_help_with_a_few_questions_needs_to_be_checked/,{},jcoixi,True,False,False,False,True,False,False,,,[],,dark,text,False,False,True,1,0,False,all_ads,/r/Physics/comments/jcoixi/need_help_with_a_few_questions_needs_to_be_checked/,False,6,1602907351,1,,True,False,False,Physics,t5_2qhi6,1474251,public,https://b.thumbs.redditmedia.com/yTgYj_4G4VkZyFMpMj_k9pC5chXhYbDJNu389pWT2sk.jpg,Need help with a few questions/ needs to be checked,0,[],1.0,https://www.reddit.com/gallery/jcoixi,all_ads,6,,,140.0,140.0,https://www.reddit.com/gallery/jcoixi,,,,,,,,,,,"{'items': [{'id': 8976635, 'media_id': 'rwea8r9ywkt51'}, {'id': 8976636, 'media_id': 'g511pq9ywkt51'}, {'id': 8976637, 'media_id': '19me4r9ywkt51'}, {'id': 8976638, 'media_id': '9lw1rr9ywkt51'}]}",True,"{'19me4r9ywkt51': {'e': 'Image', 'id': '19me4r9ywkt51', 'm': 'image/jpg', 'p': [{'u': 'https://preview.redd.it/19me4r9ywkt51.jpg?width=108&amp;crop=smart&amp;auto=webp&amp;s=15067e7a65c4eb36638e043563c331f9fccf90b0', 'x': 108, 'y': 144}, {'u': 'https://preview.redd.it/19me4r9ywkt51.jpg?width=216&amp;crop=smart&amp;auto=webp&amp;s=1532dc67ed5d1edfeaef79309b8c64b8945f9f63', 'x': 216, 'y': 288}, {'u': 'https://preview.redd.it/19me4r9ywkt51.jpg?width=320&amp;crop=smart&amp;auto=webp&amp;s=fc25bdca4d7d7a3774367afe93635dfbb7462284', 'x': 320, 'y': 426}, {'u': 'https://preview.redd.it/19me4r9ywkt51.jpg?width=640&amp;crop=smart&amp;auto=webp&amp;s=0a41e65edb6eb98ca31d6e93a34a125b539e98e1', 'x': 640, 'y': 853}, {'u': 'https://preview.redd.it/19me4r9ywkt51.jpg?width=960&amp;crop=smart&amp;auto=webp&amp;s=74fb88053b7f6bd6d1bb7e0d3aa77ea6c6d4be4d', 'x': 960, 'y': 1280}, {'u': 'https://preview.redd.it/19me4r9ywkt51.jpg?width=1080&amp;crop=smart&amp;auto=webp&amp;s=af946687b6d2942372c10d22d69c99bc391924e7', 'x': 1080, 'y': 1440}], 's': {'u': 'https://preview.redd.it/19me4r9ywkt51.jpg?width=3024&amp;format=pjpg&amp;auto=webp&amp;s=1acbb8942fb6850107af15f54747475c642afd0f', 'x': 3024, 'y': 4032}, 'status': 'valid'}, '9lw1rr9ywkt51': {'e': 'Image', 'id': '9lw1rr9ywkt51', 'm': 'image/jpg', 'p': [{'u': 'https://preview.redd.it/9lw1rr9ywkt51.jpg?width=108&amp;crop=smart&amp;auto=webp&amp;s=90555cef03f20edffbc81bf131cf7b0457aee28d', 'x': 108, 'y': 144}, {'u': 'https://preview.redd.it/9lw1rr9ywkt51.jpg?width=216&amp;crop=smart&amp;auto=webp&amp;s=1f2f9d55fcf8b500f1b5a1fdfcbe96835d69f9aa', 'x': 216, 'y': 288}, {'u': 'https://preview.redd.it/9lw1rr9ywkt51.jpg?width=320&amp;crop=smart&amp;auto=webp&amp;s=609d749badd54091cf0ad43eb84abfa8c910d9ea', 'x': 320, 'y': 426}, {'u': 'https://preview.redd.it/9lw1rr9ywkt51.jpg?width=640&amp;crop=smart&amp;auto=webp&amp;s=05e6a009e310f1e4a678168f7d3e98264e03cfb6', 'x': 640, 'y': 853}, {'u': 'https://preview.redd.it/9lw1rr9ywkt51.jpg?width=960&amp;crop=smart&amp;auto=webp&amp;s=18dd8442b2395f611d151d477f2952bcc84c7b67', 'x': 960, 'y': 1280}, {'u': 'https://preview.redd.it/9lw1rr9ywkt51.jpg?width=1080&amp;crop=smart&amp;auto=webp&amp;s=b4521fae44c88403333d06cccef1bfb2a76ffdb3', 'x': 1080, 'y': 1440}], 's': {'u': 'https://preview.redd.it/9lw1rr9ywkt51.jpg?width=3024&amp;format=pjpg&amp;auto=webp&amp;s=31cfa5cff52ebd4010c5e596f2e6e3bca683a895', 'x': 3024, 'y': 4032}, 'status': 'valid'}, 'g511pq9ywkt51': {'e': 'Image', 'id': 'g511pq9ywkt51', 'm': 'image/jpg', 'p': [{'u': 'https://preview.redd.it/g511pq9ywkt51.jpg?width=108&amp;crop=smart&amp;auto=webp&amp;s=07cf48d89d2811125dd81b45e916db26a3a90acb', 'x': 108, 'y': 144}, {'u': 'https://preview.redd.it/g511pq9ywkt51.jpg?width=216&amp;crop=smart&amp;auto=webp&amp;s=a4db85247c9b6346115ad5a796acdb23e265b69a', 'x': 216, 'y': 288}, {'u': 'https://preview.redd.it/g511pq9ywkt51.jpg?width=320&amp;crop=smart&amp;auto=webp&amp;s=f700853dac9603215e3a3d566830d38daae2459d', 'x': 320, 'y': 426}, {'u': 'https://preview.redd.it/g511pq9ywkt51.jpg?width=640&amp;crop=smart&amp;auto=webp&amp;s=836886bf48e98c2cb9eefce45898bf99960ef26a', 'x': 640, 'y': 853}, {'u': 'https://preview.redd.it/g511pq9ywkt51.jpg?width=960&amp;crop=smart&amp;auto=webp&amp;s=d904f03a2342d01d87d9af9f4b68ae60f3c5b59d', 'x': 960, 'y': 1280}, {'u': 'https://preview.redd.it/g511pq9ywkt51.jpg?width=1080&amp;crop=smart&amp;auto=webp&amp;s=e0a2d825eee76d79012c41da722f2ab4aa6d417d', 'x': 1080, 'y': 1440}], 's': {'u': 'https://preview.redd.it/g511pq9ywkt51.jpg?width=3024&amp;format=pjpg&amp;auto=webp&amp;s=56396c6c240163c9c0dfe25fbabf4c377860b202', 'x': 3024, 'y': 4032}, 'status': 'valid'}, 'rwea8r9ywkt51': {'e': 'Image', 'id': 'rwea8r9ywkt51', 'm': 'image/jpg', 'p': [{'u': 'https://preview.redd.it/rwea8r9ywkt51.jpg?width=108&amp;crop=smart&amp;auto=webp&amp;s=c5db0f55fa2de303647e5081fd3e48bae4724546', 'x': 108, 'y': 144}, {'u': 'https://preview.redd.it/rwea8r9ywkt51.jpg?width=216&amp;crop=smart&amp;auto=webp&amp;s=6d681fe36e865fa82e4e6d9984c26ba061b9516f', 'x': 216, 'y': 288}, {'u': 'https://preview.redd.it/rwea8r9ywkt51.jpg?width=320&amp;crop=smart&amp;auto=webp&amp;s=f943a789a6fe79ed7d2d3a03e5088cc410b3d8fa', 'x': 320, 'y': 426}, {'u': 'https://preview.redd.it/rwea8r9ywkt51.jpg?width=640&amp;crop=smart&amp;auto=webp&amp;s=4c0d645fffbe2f4b630b7dc5fd8899c206d7f5cd', 'x': 640, 'y': 853}, {'u': 'https://preview.redd.it/rwea8r9ywkt51.jpg?width=960&amp;crop=smart&amp;auto=webp&amp;s=7ae2d48b0e71fdf47213d1af0afacd20d79ce4f3', 'x': 960, 'y': 1280}, {'u': 'https://preview.redd.it/rwea8r9ywkt51.jpg?width=1080&amp;crop=smart&amp;auto=webp&amp;s=49516f74291309e54fed5827acd548781ed2a392', 'x': 1080, 'y': 1440}], 's': {'u': 'https://preview.redd.it/rwea8r9ywkt51.jpg?width=3024&amp;format=pjpg&amp;auto=webp&amp;s=6104b334aa8adddd3181bfb1fc208f390d7ff5a5', 'x': 3024, 'y': 4032}, 'status': 'valid'}}",
[],False,john-bacho,,[],,text,t2_1biyv6rz,False,False,[],False,False,1602905786,self.Physics,https://www.reddit.com/r/Physics/comments/jco6jm/questions_for_smart_people_about_electricity_and/,{},jco6jm,True,False,False,False,True,True,False,,question,[],Question,dark,text,False,False,False,5,0,False,all_ads,/r/Physics/comments/jco6jm/questions_for_smart_people_about_electricity_and/,False,6,1602905797,1,"Question 1. Why does wrapping more copper in a coil produce more energy/more stronger electrical magnet 
. Question 2. Why does the magnetic field need to be moving for electrical current to generate. Question 3 why is it when you apply a current to a bolt or something it acts like a magnet I’m guess this is because it force the electron domains to point in the same direction thus producing a magnetic field.",True,False,False,Physics,t5_2qhi6,1474238,public,self,Questions for smart people about electricity and magnets,0,[],1.0,https://www.reddit.com/r/Physics/comments/jco6jm/questions_for_smart_people_about_electricity_and/,all_ads,6,,,,,,,,,,,,,,,,,,,
[],False,Stuff_Former,,[],,text,t2_6ybg3ipe,False,False,[],False,False,1602904110,4h.net,https://www.reddit.com/r/Physics/comments/jcntqh/high_tech_pen_and_notebook_will_help_you_to_write/,{},jcntqh,False,False,False,False,False,False,False,,,[],,dark,text,False,False,True,0,0,False,all_ads,/r/Physics/comments/jcntqh/high_tech_pen_and_notebook_will_help_you_to_write/,False,6,1602904122,1,,True,False,False,Physics,t5_2qhi6,1474229,public,default,High tech pen and notebook will help you to write your notes without any handwork,0,[],1.0,https://4h.net/vojZ8,all_ads,6,,,,,https://4h.net/vojZ8,reddit,,,,,,,,,,,,,
[],False,Top-Calligrapher-240,,[],,text,t2_8guw7d3j,False,False,[],False,False,1602903660,self.Physics,https://www.reddit.com/r/Physics/comments/jcnq7a/holofractal_theory/,{},jcnq7a,True,False,False,False,True,True,False,,,[],,dark,text,False,False,True,3,0,False,all_ads,/r/Physics/comments/jcnq7a/holofractal_theory/,False,6,1602903671,1,"https://www.reddit.com/r/holofractal/comments/d382s3/holofractal_eli5/

https://www.reddit.com/r/holofractal/comments/jckjz0/re_nothingness_is_the_same_as_fullness/

https://www.reddit.com/r/holofractal/comments/ddcjp3/comment/f2fk3l6

I saw these three osits about the holofractal theory. I'm a bit unfamiliar with the theory but it seems like this: If you zoom in on any 1 singular point for long enough you’ll see that somehow you’re zooming in on the entirety of the universe. Zoom in on another point and the same thing will happen.

Zoom out far enough in the universe and you’ll realize that you’ve gone through the macro back to the micro and you’re zooming back out of an atom to where you starts

I was wondering if my interpersion was correct and if so, do any of these posts have anything to do with simulation theory?",True,False,False,Physics,t5_2qhi6,1474222,public,self,Holofractal theory,0,[],1.0,https://www.reddit.com/r/Physics/comments/jcnq7a/holofractal_theory/,all_ads,6,,,,,,,,,,,,,,,,,,,
[],False,HeLovesThatStuff,,[],,text,t2_6et5ywl9,False,False,[],False,False,1602903272,self.Physics,https://www.reddit.com/r/Physics/comments/jcnn2p/can_someone_explain_to_me_what_the_higgs_boson_in/,{},jcnn2p,True,False,False,False,True,True,False,,question,[],Question,dark,text,False,False,True,3,0,False,all_ads,/r/Physics/comments/jcnn2p/can_someone_explain_to_me_what_the_higgs_boson_in/,False,6,1602903283,1,,True,False,False,Physics,t5_2qhi6,1474202,public,self,Can someone explain to me what the Higgs boson in and what it does in simple terms?,0,[],1.0,https://www.reddit.com/r/Physics/comments/jcnn2p/can_someone_explain_to_me_what_the_higgs_boson_in/,all_ads,6,,,,,,,,,,,,,,,,,,,
[],False,liahngg,,[],,text,t2_6i861kf5,False,False,[],False,False,1602902185,i.redd.it,https://www.reddit.com/r/Physics/comments/jcneb3/homework_help_can_someone_help_me_understand_the/,{},jcneb3,True,False,False,True,True,False,False,,image,[],Image,dark,text,False,False,True,1,0,False,all_ads,/r/Physics/comments/jcneb3/homework_help_can_someone_help_me_understand_the/,False,6,1602902196,1,,True,False,False,Physics,t5_2qhi6,1474176,public,https://b.thumbs.redditmedia.com/drn5T67Lz34iwkB2ylbGY47yHBD1Zb0idYS4wO8Kqxg.jpg,HOMEWORK HELP? Can someone help me understand the instructions? It says measure the magnitude with a compass but I still don't get it 😭,0,[],1.0,https://i.redd.it/z1vdihemhkt51.jpg,all_ads,6,image,"{'enabled': True, 'images': [{'id': 'GlHtYPcrZQZ7lXlhOKTmOQPc6uWwyLtvUVK0s7DFUzM', 'resolutions': [{'height': 192, 'url': 'https://preview.redd.it/z1vdihemhkt51.jpg?width=108&amp;crop=smart&amp;auto=webp&amp;s=79fc4eed4df9d75bfc7038cc4d05bd9a79b2913b', 'width': 108}, {'height': 384, 'url': 'https://preview.redd.it/z1vdihemhkt51.jpg?width=216&amp;crop=smart&amp;auto=webp&amp;s=c40d8d637aff03267ef22d1ff4d02f48ee39ffbb', 'width': 216}, {'height': 568, 'url': 'https://preview.redd.it/z1vdihemhkt51.jpg?width=320&amp;crop=smart&amp;auto=webp&amp;s=a5c4805c69bd064efe43dc88cc110a59be016554', 'width': 320}, {'height': 1137, 'url': 'https://preview.redd.it/z1vdihemhkt51.jpg?width=640&amp;crop=smart&amp;auto=webp&amp;s=0a4bf0eb4eb178e6f6dcebbd515d5756e33a4260', 'width': 640}, {'height': 1706, 'url': 'https://preview.redd.it/z1vdihemhkt51.jpg?width=960&amp;crop=smart&amp;auto=webp&amp;s=e3b3d87a80c833ce279757eafe6ac45353e6f927', 'width': 960}, {'height': 1920, 'url': 'https://preview.redd.it/z1vdihemhkt51.jpg?width=1080&amp;crop=smart&amp;auto=webp&amp;s=8b776c42288bb3b485f78e0d202c28ab7d3275eb', 'width': 1080}], 'source': {'height': 1920, 'url': 'https://preview.redd.it/z1vdihemhkt51.jpg?auto=webp&amp;s=0f2df1def76408d8265848e2311ad95bbcc52961', 'width': 1080}, 'variants': {}}]}",140.0,140.0,https://i.redd.it/z1vdihemhkt51.jpg,,,,,,,,,,,,,,
[],False,Randomness_Acquired,,[],,text,t2_6nga4wy5,False,False,[],False,False,1602901701,self.Physics,https://www.reddit.com/r/Physics/comments/jcnabv/looking_at_the_world_through_plankscale_colored/,{},jcnabv,True,False,False,False,True,True,False,,question,[],Question,dark,text,False,False,True,7,0,False,all_ads,/r/Physics/comments/jcnabv/looking_at_the_world_through_plankscale_colored/,False,6,1602901713,1,"Could quantization just be the interference pattern between matter/energy and space/time? Are we looking at the world through ""plank-scale colored glasses?"" Perhaps what appears to us as quantized is only some sort of an illusion due to our angle/perspective in n-dimensional space.

Thoughts?",True,False,False,Physics,t5_2qhi6,1474175,public,self,Looking at the world through plank-scale colored glasses?,0,[],1.0,https://www.reddit.com/r/Physics/comments/jcnabv/looking_at_the_world_through_plankscale_colored/,all_ads,6,,,,,,,,,,,,,,,,,,,
[],False,xccza7q6123,,[],,text,t2_yrdbtie,False,False,[],False,False,1602896235,self.Physics,https://www.reddit.com/r/Physics/comments/jclz6f/computer_science_and_physics_double_major_please/,{},jclz6f,True,False,False,False,True,True,False,,,[],,dark,text,False,False,True,11,0,False,all_ads,/r/Physics/comments/jclz6f/computer_science_and_physics_double_major_please/,False,6,1602896246,1,"Long story short is I have to make a decision in a couple of days about double majoring, or minoring in comp sci or just doing Physics specialisation 

I’m trying to understand if anyone has any experience with any of these and knows about the opportunities with a double major in these subjects 

I’d like to go to grad school at some point I think but I thought it would be a good idea as comp sci is a professional qualification at my university and so might be good if I wanted to work in the industry right away to make some money before grad school

I do find computer science interesting from the basic classes I’ve taken but I could always do a minor for interests. A double major would be a setup for my future 

I’m not sure what I want to do in the future I’m aware jobs in actual physics are difficult and a lot more computation is happening in physics now so I thought this combination may be good however I might be spreading myself too thin to do grad school in something more physics related but I have no idea

I’m extremely confused and feel like I might mess Up my next 2 years or so if I make the wrong choice. ANY. Advice at all is appreciated 

I live in Toronto Canada If it’s any relevance",True,False,False,Physics,t5_2qhi6,1474059,public,self,Computer science and Physics double major. Please help me decide.,0,[],1.0,https://www.reddit.com/r/Physics/comments/jclz6f/computer_science_and_physics_double_major_please/,all_ads,6,,,,,,,,,,,,,,,,,,,
[],False,Silicon-Based,,[],,text,t2_zo42t,False,False,[],False,False,1602895523,self.Physics,https://www.reddit.com/r/Physics/comments/jclsx8/what_are_some_important_modern_thought_experiments/,{},jclsx8,True,False,False,False,True,True,False,,question,[],Question,dark,text,False,False,True,5,0,False,all_ads,/r/Physics/comments/jclsx8/what_are_some_important_modern_thought_experiments/,False,6,1602895534,1,"The most well-known thought experiments are now at least \~100 years old, e.g. Schrödinger's cat, Einstein's lifts/trains, Laplace/Maxwell's Demons. Are there any notable modern examples of thought experiments of similar spirit which had an impact on the development of physical theories?",True,False,False,Physics,t5_2qhi6,1474054,public,self,What are some important modern thought experiments?,0,[],1.0,https://www.reddit.com/r/Physics/comments/jclsx8/what_are_some_important_modern_thought_experiments/,all_ads,6,,,,,,,,,,,,,,,,,,,
[],False,New-Dragonfly1776,,[],,text,t2_76bdfmiz,False,False,[],False,False,1602894303,self.Physics,https://www.reddit.com/r/Physics/comments/jclhrs/why_and_how_do_universal_constants_exist/,{},jclhrs,True,False,False,False,True,True,False,,question,[],Question,dark,text,False,False,True,14,0,False,all_ads,/r/Physics/comments/jclhrs/why_and_how_do_universal_constants_exist/,False,6,1602894315,1,"I’m almost done with high school physics, I’ve taken all offered physics courses except for one. I’ve worked with the gravitational constant, plank’s constant, avagadro’s constant (more chemistry I guess). I’ve never asked how or why they exist, and after thinking about it for a while I haven’t been able to come up with an answer in my head that makes sense. If anyone wants to say something about this that’d be awesome, thank you.",True,False,False,Physics,t5_2qhi6,1474041,public,self,Why and how do universal constants exist?,0,[],1.0,https://www.reddit.com/r/Physics/comments/jclhrs/why_and_how_do_universal_constants_exist/,all_ads,6,,,,,,,,,,,,,,,,,,,
[],False,the-software-man,,[],,text,t2_4q1dqjwj,False,False,[],False,False,1602891136,abcnews.go.com,https://www.reddit.com/r/Physics/comments/jckolv/how_is_this_possible/,{},jckolv,True,False,False,False,True,False,False,,image,[],Video,dark,text,False,False,True,3,0,False,all_ads,/r/Physics/comments/jckolv/how_is_this_possible/,False,6,1602891147,1,,True,False,False,Physics,t5_2qhi6,1473976,public,https://b.thumbs.redditmedia.com/3-SmZl4RtyKbyThVkf8GnbwTcnWdszxB8LEjbm_7uOk.jpg,How is this possible?,0,[],1.0,https://abcnews.go.com/US/video/florida-man-speeds-leaf-blower-powered-vehicle-73659512,all_ads,6,link,"{'enabled': False, 'images': [{'id': 'OuDOGoY1SYiTz51uElIRSfPLIjJA6INCfNzK6aKwnYM', 'resolutions': [{'height': 60, 'url': 'https://external-preview.redd.it/b5SVIgAnII_ufjf1EcfoGsu5Bc9dpa06iTFid-7l8tQ.jpg?width=108&amp;crop=smart&amp;auto=webp&amp;s=19519769348432be7843ecc5e75f72f8b9bf71b0', 'width': 108}, {'height': 121, 'url': 'https://external-preview.redd.it/b5SVIgAnII_ufjf1EcfoGsu5Bc9dpa06iTFid-7l8tQ.jpg?width=216&amp;crop=smart&amp;auto=webp&amp;s=7d40b172ddc753b79991674e21543bd9e809645b', 'width': 216}, {'height': 180, 'url': 'https://external-preview.redd.it/b5SVIgAnII_ufjf1EcfoGsu5Bc9dpa06iTFid-7l8tQ.jpg?width=320&amp;crop=smart&amp;auto=webp&amp;s=0b5a602b8eae6c35cf6646c87c57c6dc86d086a7', 'width': 320}, {'height': 360, 'url': 'https://external-preview.redd.it/b5SVIgAnII_ufjf1EcfoGsu5Bc9dpa06iTFid-7l8tQ.jpg?width=640&amp;crop=smart&amp;auto=webp&amp;s=587d6818ced4285a72dad893c59e8b1722010287', 'width': 640}, {'height': 540, 'url': 'https://external-preview.redd.it/b5SVIgAnII_ufjf1EcfoGsu5Bc9dpa06iTFid-7l8tQ.jpg?width=960&amp;crop=smart&amp;auto=webp&amp;s=24caba49c5a805dfda7508df44341b58fb78638a', 'width': 960}], 'source': {'height': 558, 'url': 'https://external-preview.redd.it/b5SVIgAnII_ufjf1EcfoGsu5Bc9dpa06iTFid-7l8tQ.jpg?auto=webp&amp;s=67a1425c0bb163a042cff60aab30903fef5830d4', 'width': 992}, 'variants': {}}]}",78.0,140.0,https://abcnews.go.com/US/video/florida-man-speeds-leaf-blower-powered-vehicle-73659512,,,,,,,,,,,,,,
[],False,EndlessPane,,[],,text,t2_4i2hzaig,False,False,[],False,False,1602890116,self.Physics,https://www.reddit.com/r/Physics/comments/jckf0s/theoretical_problem_i_conjured_up_any_way_to/,{},jckf0s,True,False,False,False,True,True,False,,question,[],Question,dark,text,False,False,True,0,0,False,all_ads,/r/Physics/comments/jckf0s/theoretical_problem_i_conjured_up_any_way_to/,False,6,1602890127,1,A convertible vehicle with the sun roof down is traveling on a circular road with a constant 2 degree turn. The windshield is perfectly perpendicular and parallel to the road and the windshield is 2 cm thick. How fast does the convertible vehicle need to be moving before a vacuum forms on the opposite side of the windshield that the force of air is not hitting? (Assume altitude is sea level),True,False,False,Physics,t5_2qhi6,1473914,public,self,Theoretical problem I conjured up. Any way to answer?,0,[],1.0,https://www.reddit.com/r/Physics/comments/jckf0s/theoretical_problem_i_conjured_up_any_way_to/,all_ads,6,,,,,,,,,,,,,,,,,,,
[],False,cheez-zit,,[],,text,t2_63zyquqc,False,False,[],False,False,1602885793,self.Physics,https://www.reddit.com/r/Physics/comments/jcj8h6/just_wondering/,{},jcj8h6,True,False,False,False,True,True,False,,,[],,dark,text,False,False,True,5,0,False,all_ads,/r/Physics/comments/jcj8h6/just_wondering/,False,6,1602885804,1,A tourist accidentally drops a camera from a 43.2 m high bridge. If air resistance is disregarded what is the speed in m/s of the camera as it hits the water?,True,False,False,Physics,t5_2qhi6,1473785,public,self,Just wondering...,0,[],1.0,https://www.reddit.com/r/Physics/comments/jcj8h6/just_wondering/,all_ads,6,,,,,,,,,,,,,,,,,,,
[],False,xximadukxx,,[],,text,t2_tz09wq4,False,False,[],False,False,1602882802,self.Physics,https://www.reddit.com/r/Physics/comments/jci8ct/what_is_energy_please_read_before_writing_it_off/,{},jci8ct,True,False,False,False,True,True,False,,question,[],Question,dark,text,False,False,True,4,0,False,all_ads,/r/Physics/comments/jci8ct/what_is_energy_please_read_before_writing_it_off/,False,6,1602882842,1,"***What is energy?***

Although this might come off as a seemingly simple question, it's not. I'm being entirely serious, what is energy? From my physics experience thus far, energy has been treated as this random scalar quantity that just happens to be useful. It seems to just exist and be conserved without any sort of rhyme or reason. I understand how to use energy transfer to solve for different quantities and the typical stuff that you would find in a introductory mechanics course, but past the equations, is there any sort of intuition? Simply put, what I would like to know is whether or not there is a way to understand the notion of energy ***intuitively***. 

In order to elaborate on what I mean by intuitively, let me go about explaining why other quantities make sense while energy does not:

* **Position:** We happen to live in a 3d world so having a vector that describes your spatial position makes quite a bit of sense. There are several objects around you so having a way to quantify your placement in space with respect to another object seems to be rather useful.
* **Time**: This is not philosophically rigorous, but simply put, things happen. All of the events around us don't occur simultaneously so having a way to describe the placement of one event with respect to another is inherently useful.
* **Velocity:** All of these aforementioned objects aren't static, we know they go from place to place, and that they don't teleport from one place to another in an instant, thus having a vector that describe the rate at which an object's position changes with respect to time makes quite a bit of sense too.
* **Acceleration (and higher order derivatives like jounce, jerk, etc.):** There's nothing stopping these objects from changing their velocities over time so having a vector that describes the rate at which an object's velocity changes over time makes sense too. This line of reasoning would seem to be applicable for quantities that have higher order derivatives too.
* **Mass:** Not all objects are the same. Some are harder to move than others. Our world is more than just points in space on a large scale, so having a scalar quantity that describes how much substance is in an object makes sense.
* **Momentum:** As stated before, not all objects are the same, and we know that these objects aren't stationary. This would seem to imply that some objects are going to be harder to stop than others, which is what momentum quantifies (I think that momentum is introduced intuitively most frequently).
* **Force:** Similar to the reasoning for acceleration, we know that the two quantities that effect the momentum (mass and velocity) are able to change over time. Although velocity tends change more frequently than mass (because we tend to assume mass is constant), both quantities do have the potential to change over time, hence a vector that describes the rate at which momentum changes over time is rather intuitive useful as well.

Now, the notion of energy is defined by the Joule (or at least in the SI system it is).  We know that a Joule is a kg\*(m/s)\^2, but at the end of the day, what does this intuitively mean? What does it mean to divide a kg\*m\^2 by a s\^2? I fail to wrap my head around what this ***truly*** means so if someone could provide a bit of intuition it would be greatly appreciated. 

Finally, part of me wants to believe it just exists without any sort of rhyme or reason. Just as several quantities are merely constants that relate several quantities to several others. The problem is that I find this rather disappointing, and I feel as if there must be a way to intuitively grasp what energy is. Given that the law of conservation of energy underlies a lot of physical events in the universe, it seems like an intuitive understanding must exist. I suppose that the answer of something just existing doesn't seem to be very satisfying when it comes to something this useful. 

Just a quick side note, please note that I'm a high schooler so keeping as much math out of this as possible would be useful. If you must include math, I'm currently enrolled in a dual enrollment calc 2 class, and have self studied some calc 3 and differential equations. If we're being honest though, an intuitive explanation shouldn't rely too heavily on math, but please note that higher-level explanations are appreciated. Any sort of discourse is good, and I wouldn't want to discourage it. I'm also willing to do research if necessary so feel free to fire away! Thanks in advance to anyone that responds :)",True,False,False,Physics,t5_2qhi6,1473756,public,self,What is Energy? (Please read before writing it off as a low-effort post),0,[],1.0,https://www.reddit.com/r/Physics/comments/jci8ct/what_is_energy_please_read_before_writing_it_off/,all_ads,6,,,,,,,,,,,,,,,,,,,
