all_awardings,allow_live_comments,author,author_flair_css_class,author_flair_richtext,author_flair_template_id,author_flair_text,author_flair_text_color,author_flair_type,author_fullname,author_patreon_flair,author_premium,awarders,can_mod_post,contest_mode,created_utc,domain,full_link,gildings,id,is_crosspostable,is_meta,is_original_content,is_reddit_media_domain,is_robot_indexable,is_self,is_video,link_flair_background_color,link_flair_css_class,link_flair_richtext,link_flair_text,link_flair_text_color,link_flair_type,locked,media_only,no_follow,num_comments,num_crossposts,over_18,parent_whitelist_status,permalink,pinned,pwls,retrieved_on,score,selftext,send_replies,spoiler,stickied,subreddit,subreddit_id,subreddit_subscribers,subreddit_type,thumbnail,title,total_awards_received,treatment_tags,upvote_ratio,url,whitelist_status,wls,post_hint,preview,thumbnail_height,thumbnail_width,url_overridden_by_dest,media,media_embed,secure_media,secure_media_embed,media_metadata,removed_by_category,distinguished,author_flair_background_color
[],False,Neopyrrhu,inter,[],4a8885d4-c6b2-11e4-827e-22000b2a8bad,Education and outreach,dark,text,t2_n34h1,False,False,[],False,False,1601352786,self.Physics,https://www.reddit.com/r/Physics/comments/j1s61v/are_anton_petrovs_descriptions_accurate/,{},j1s61v,True,False,False,False,True,True,False,,question,[],Question,dark,text,False,False,True,7,0,False,all_ads,/r/Physics/comments/j1s61v/are_anton_petrovs_descriptions_accurate/,False,6,1601352797,1,"Anton Petrov has an educational YouTube channel where he describes physics research. I enjoy watching his videos, but since he doesn't have any degree in physics, I wonder if he accurately describes the research.

Do any physicists here watch his channel? Hopefully someone with more expertise can weigh in on the accuracy of Anton's vids.

Peace.",True,False,False,Physics,t5_2qhi6,1445560,public,self,Are Anton Petrov's Descriptions Accurate?,0,[],1.0,https://www.reddit.com/r/Physics/comments/j1s61v/are_anton_petrovs_descriptions_accurate/,all_ads,6,,,,,,,,,,,,,
[],False,Titratius,,[],,,,text,t2_81nlx4xn,False,False,[],False,False,1601347971,i.redd.it,https://www.reddit.com/r/Physics/comments/j1qx1p/how_did_they_get_eq_427/,{},j1qx1p,True,False,False,True,True,False,False,,image,[],Image,dark,text,False,False,True,3,0,False,all_ads,/r/Physics/comments/j1qx1p/how_did_they_get_eq_427/,False,6,1601347982,1,,True,False,False,Physics,t5_2qhi6,1445489,public,https://b.thumbs.redditmedia.com/UOVdqWL3x2kQerq5Mj6EObDVfIUwmHeXKaJJJqLosZU.jpg,How did they get Eq 4-27???,0,[],1.0,https://i.redd.it/9uxdymh240q51.jpg,all_ads,6,image,"{'enabled': True, 'images': [{'id': '0Pseq45YA-Ji7UgjADlMPJQh8LOJN-Tj54KdE4FuI-k', 'resolutions': [{'height': 81, 'url': 'https://preview.redd.it/9uxdymh240q51.jpg?width=108&amp;crop=smart&amp;auto=webp&amp;s=214c1dc90143a374240f63f7cffc804158ed1288', 'width': 108}, {'height': 162, 'url': 'https://preview.redd.it/9uxdymh240q51.jpg?width=216&amp;crop=smart&amp;auto=webp&amp;s=cc491d78ee1b8295012742876a8d62f2df0c839a', 'width': 216}, {'height': 240, 'url': 'https://preview.redd.it/9uxdymh240q51.jpg?width=320&amp;crop=smart&amp;auto=webp&amp;s=fc429513945e0c3bd9eaf77f66fa1bae55c8b169', 'width': 320}, {'height': 480, 'url': 'https://preview.redd.it/9uxdymh240q51.jpg?width=640&amp;crop=smart&amp;auto=webp&amp;s=afc4e9b693cda70533e8d4489d253361601a24de', 'width': 640}, {'height': 720, 'url': 'https://preview.redd.it/9uxdymh240q51.jpg?width=960&amp;crop=smart&amp;auto=webp&amp;s=73211ff8f9134fb6952d77fcab5eaf1e69acb5bd', 'width': 960}, {'height': 810, 'url': 'https://preview.redd.it/9uxdymh240q51.jpg?width=1080&amp;crop=smart&amp;auto=webp&amp;s=3cec707b46f8218623c142b0915353d10993dc12', 'width': 1080}], 'source': {'height': 3024, 'url': 'https://preview.redd.it/9uxdymh240q51.jpg?auto=webp&amp;s=ce76b079a10ec66647484f29e634aef0aaa63189', 'width': 4032}, 'variants': {}}]}",105.0,140.0,https://i.redd.it/9uxdymh240q51.jpg,,,,,,,,
[],False,partev,,[],,,,text,t2_14gacq,False,False,[],False,False,1601347131,writings.stephenwolfram.com,https://www.reddit.com/r/Physics/comments/j1qoz0/the_empirical_metamathematics_of_euclid_and/,{},j1qoz0,True,False,False,False,True,False,False,,,[],,dark,text,False,False,True,0,0,False,all_ads,/r/Physics/comments/j1qoz0/the_empirical_metamathematics_of_euclid_and/,False,6,1601347142,1,,True,False,False,Physics,t5_2qhi6,1445488,public,default,The Empirical Metamathematics of Euclid and Beyondâ€”Stephen Wolfram Writings,0,[],1.0,https://writings.stephenwolfram.com/2020/09/the-empirical-metamathematics-of-euclid-and-beyond/,all_ads,6,,,,,https://writings.stephenwolfram.com/2020/09/the-empirical-metamathematics-of-euclid-and-beyond/,,,,,,,,
[],False,Kylinho21,,[],,,,text,t2_6nf8byv0,False,False,[],False,False,1601345188,i.redd.it,https://www.reddit.com/r/Physics/comments/j1q5tk/can_yall_help_me_figure_this_out_pls_sorry_for/,{},j1q5tk,True,False,False,True,True,False,False,,image,[],Image,dark,text,False,False,True,2,0,False,all_ads,/r/Physics/comments/j1q5tk/can_yall_help_me_figure_this_out_pls_sorry_for/,False,6,1601345199,1,,True,False,False,Physics,t5_2qhi6,1445472,public,https://a.thumbs.redditmedia.com/FebL8Bp2PPgsdVPVkYmYuDGMG5UdXLYJVWHFt6xJIp8.jpg,Can yâ€™all help me figure this out pls?? Sorry for the bad image,0,[],1.0,https://i.redd.it/l53kpavvvzp51.jpg,all_ads,6,image,"{'enabled': True, 'images': [{'id': 'D4R-siMkSfw9xCDUZM8TYat4SDjqW9aH43Bl8gRoa1A', 'resolutions': [{'height': 192, 'url': 'https://preview.redd.it/l53kpavvvzp51.jpg?width=108&amp;crop=smart&amp;auto=webp&amp;s=34114d552eeae5790fa77ea3fa79ca5c7e5e9ee0', 'width': 108}, {'height': 384, 'url': 'https://preview.redd.it/l53kpavvvzp51.jpg?width=216&amp;crop=smart&amp;auto=webp&amp;s=71581ef43628041efd2033c8343d1a7247f8dcb8', 'width': 216}, {'height': 569, 'url': 'https://preview.redd.it/l53kpavvvzp51.jpg?width=320&amp;crop=smart&amp;auto=webp&amp;s=3dc2f4ecb7030d1c839553dfcc46d76bd9c5fca4', 'width': 320}, {'height': 1138, 'url': 'https://preview.redd.it/l53kpavvvzp51.jpg?width=640&amp;crop=smart&amp;auto=webp&amp;s=50659d4f348ef8122adab5393712fc87f27381c5', 'width': 640}], 'source': {'height': 1334, 'url': 'https://preview.redd.it/l53kpavvvzp51.jpg?auto=webp&amp;s=55e70eb6a8c6aec28e001bec937e633aca14bbbf', 'width': 750}, 'variants': {}}]}",140.0,140.0,https://i.redd.it/l53kpavvvzp51.jpg,,,,,,,,
[],False,jufffffff,,[],,,,text,t2_811knxyt,False,False,[],False,False,1601344983,i.redd.it,https://www.reddit.com/r/Physics/comments/j1q3p7/been_a_month_since_class_started_and_i_have_no/,{},j1q3p7,True,False,False,True,True,False,False,,image,[],Image,dark,text,False,False,True,6,0,False,all_ads,/r/Physics/comments/j1q3p7/been_a_month_since_class_started_and_i_have_no/,False,6,1601344993,1,,True,False,False,Physics,t5_2qhi6,1445469,public,https://b.thumbs.redditmedia.com/YvoQXd9b-aCAmmWEE24cdubzQOy7kHD5J_slQXfgGxA.jpg,Been a month since class started and i have no idea what im doing in physics :(( just hoping someone would be down to teach me this basic stuffðŸ‘‰ðŸ‘ˆ,0,[],1.0,https://i.redd.it/n3676js6vzp51.jpg,all_ads,6,image,"{'enabled': True, 'images': [{'id': 'SRJI6dZUrar9nvX9Mxg6sGqY1lFNnJqoyff0Qyy6pRM', 'resolutions': [{'height': 108, 'url': 'https://preview.redd.it/n3676js6vzp51.jpg?width=108&amp;crop=smart&amp;auto=webp&amp;s=877bf311600a911348b039e41b3f67fc2a38778c', 'width': 108}, {'height': 216, 'url': 'https://preview.redd.it/n3676js6vzp51.jpg?width=216&amp;crop=smart&amp;auto=webp&amp;s=addedec823ca5e50878e1503414541140a4ead40', 'width': 216}, {'height': 320, 'url': 'https://preview.redd.it/n3676js6vzp51.jpg?width=320&amp;crop=smart&amp;auto=webp&amp;s=6a457e8fa001169b782ca3cdf5b4188d1aa9c25e', 'width': 320}, {'height': 640, 'url': 'https://preview.redd.it/n3676js6vzp51.jpg?width=640&amp;crop=smart&amp;auto=webp&amp;s=50bc03e2f9a0d8c518ab24bc80ee0f1179599e8e', 'width': 640}, {'height': 960, 'url': 'https://preview.redd.it/n3676js6vzp51.jpg?width=960&amp;crop=smart&amp;auto=webp&amp;s=d4707c7ca2f399c8cb7dc75cc8a459497a398fa8', 'width': 960}, {'height': 1080, 'url': 'https://preview.redd.it/n3676js6vzp51.jpg?width=1080&amp;crop=smart&amp;auto=webp&amp;s=b8d5c938f56a98bd8a484cba46418444464e3d50', 'width': 1080}], 'source': {'height': 3024, 'url': 'https://preview.redd.it/n3676js6vzp51.jpg?auto=webp&amp;s=34845fd784e055220c961ac0140a59e608bfb97e', 'width': 3024}, 'variants': {}}]}",140.0,140.0,https://i.redd.it/n3676js6vzp51.jpg,,,,,,,,
[],False,deeisfordee,,[],,,,text,t2_7fmo07g3,False,False,[],False,False,1601344917,self.Physics,https://www.reddit.com/r/Physics/comments/j1q2zb/what_is_the_deal_with_kinetic_energy/,{},j1q2zb,True,False,False,False,True,True,False,,question,[],Question,dark,text,False,False,True,2,0,False,all_ads,/r/Physics/comments/j1q2zb/what_is_the_deal_with_kinetic_energy/,False,6,1601344927,1,"I'm surfing through my physicochemistry book right now, and cannot help but to move back and forward with the idea that all of energyÂ´s manifestations are nothing but a macroscopic view of kinetic and potential energy at an atomical level.

This being said, my professor told us on class that this is not really accurate, since kinetic energy is just an image of potential energy going through the system that contains it.

This last part is where Im stuck conceptually, and cannot really go through both views without a real understanding of both of them (my professor's teaching and what is written on the books).

If any has already gone through this issue, or has a more concrete explanation to why this might or not to be true, please I suggest to leave it on the comments.",True,False,False,Physics,t5_2qhi6,1445469,public,self,What is the deal with kinetic energy?,0,[],1.0,https://www.reddit.com/r/Physics/comments/j1q2zb/what_is_the_deal_with_kinetic_energy/,all_ads,6,,,,,,,,,,,,,
[],False,BrickThePhysicist,,[],,,,text,t2_15eq5pq,False,False,[],False,False,1601343917,self.Physics,https://www.reddit.com/r/Physics/comments/j1pt2f/is_there_an_easy_software_for_creating_images_for/,{},j1pt2f,True,False,False,False,True,True,False,,question,[],Question,dark,text,False,False,True,0,0,False,all_ads,/r/Physics/comments/j1pt2f/is_there_an_easy_software_for_creating_images_for/,False,6,1601343927,1,I'm working on a project where I have to write some textbooks for introductory physics and manually creating the images for the block problems in an image editor is a bit too time consuming. I'm thinking something similar to GeoGebra. Is there such a thing?,True,False,False,Physics,t5_2qhi6,1445461,public,self,Is there an easy software for creating images for block problems?,0,[],1.0,https://www.reddit.com/r/Physics/comments/j1pt2f/is_there_an_easy_software_for_creating_images_for/,all_ads,6,,,,,,,,,,,,,
[],False,de_dust1123,,[],,,,text,t2_68wlstjx,False,False,[],False,False,1601341126,self.Physics,https://www.reddit.com/r/Physics/comments/j1p1vd/can_someone_tell_me_what_a_free_buddy_diagram_is/,{},j1p1vd,True,False,False,False,True,True,False,,,[],,dark,text,False,False,True,0,0,False,all_ads,/r/Physics/comments/j1p1vd/can_someone_tell_me_what_a_free_buddy_diagram_is/,False,6,1601341137,1,much appreciated,True,False,False,Physics,t5_2qhi6,1445375,public,self,Can someone tell me what a free buddy diagram is,0,[],1.0,https://www.reddit.com/r/Physics/comments/j1p1vd/can_someone_tell_me_what_a_free_buddy_diagram_is/,all_ads,6,,,,,,,,,,,,,
[],False,HappyDadOfFourJesus,,[],,,,text,t2_67hi5myl,False,False,[],False,False,1601329352,self.Physics,https://www.reddit.com/r/Physics/comments/j1lmsk/im_looking_for_a_physicist_by_the_name_of_terry/,{},j1lmsk,True,False,False,False,True,True,False,,,[],,dark,text,False,False,True,8,0,False,all_ads,/r/Physics/comments/j1lmsk/im_looking_for_a_physicist_by_the_name_of_terry/,False,6,1601329363,1,"Back in the early 1960s my dad went to high school with a kid named Terry Mackelwynn and he heard through the grapevine that after college, Terry went on to become a physicist but lost touch after that.

I've probably misspelled his last name horribly but does anyone know of this man and any of his accomplishments?",True,False,False,Physics,t5_2qhi6,1445273,public,self,I'm looking for a physicist by the name of Terry Mackelwynn (spelling is probably way off),0,[],1.0,https://www.reddit.com/r/Physics/comments/j1lmsk/im_looking_for_a_physicist_by_the_name_of_terry/,all_ads,6,,,,,,,,,,,,,
[],False,ohh_senghhh,,[],,,,text,t2_44v44ivk,False,False,[],False,False,1601327643,youtu.be,https://www.reddit.com/r/Physics/comments/j1l2zc/question_on_what_einstein_said_in_the_video/,{},j1l2zc,True,False,False,False,True,False,False,,image,[],Video,dark,text,False,False,True,1,0,False,all_ads,/r/Physics/comments/j1l2zc/question_on_what_einstein_said_in_the_video/,False,6,1601327654,1,,True,False,False,Physics,t5_2qhi6,1445226,public,https://b.thumbs.redditmedia.com/lz_U1z2NOoVAL_ccG6cGRumuwCgkngA7SQqNbQgivAE.jpg,Question on what Einstein said in the video,0,[],1.0,https://youtu.be/_idhkSVGaEc,all_ads,6,rich:video,"{'enabled': False, 'images': [{'id': 'ftt7ccEPnt8DvVgMfYs1zUkZ6XPXY1AmRKaaYKIofRI', 'resolutions': [{'height': 81, 'url': 'https://external-preview.redd.it/IShES50CkYqpitM57cYOPh_W0yKBNqKPzUqk_d33AfQ.jpg?width=108&amp;crop=smart&amp;auto=webp&amp;s=97844068d8b0bb12bdd77993990c62cea0edf78b', 'width': 108}, {'height': 162, 'url': 'https://external-preview.redd.it/IShES50CkYqpitM57cYOPh_W0yKBNqKPzUqk_d33AfQ.jpg?width=216&amp;crop=smart&amp;auto=webp&amp;s=b5c02bc38f94d0ff9e40112b73b468e37297bc11', 'width': 216}, {'height': 240, 'url': 'https://external-preview.redd.it/IShES50CkYqpitM57cYOPh_W0yKBNqKPzUqk_d33AfQ.jpg?width=320&amp;crop=smart&amp;auto=webp&amp;s=763f2e2901643e2bd17f82c33fac442bbcbdbc0f', 'width': 320}], 'source': {'height': 360, 'url': 'https://external-preview.redd.it/IShES50CkYqpitM57cYOPh_W0yKBNqKPzUqk_d33AfQ.jpg?auto=webp&amp;s=cb2e84197a91d145031adb81f591f265f74d1b5a', 'width': 480}, 'variants': {}}]}",105.0,140.0,https://youtu.be/_idhkSVGaEc,"{'oembed': {'author_name': 'JSUNIL TUTORIAL,', 'author_url': 'https://www.youtube.com/channel/UCVaXBDZk-x0P025mFKkZDfQ', 'height': 344, 'html': '&lt;iframe width=""459"" height=""344"" src=""https://www.youtube.com/embed/_idhkSVGaEc?feature=oembed&amp;enablejsapi=1"" frameborder=""0"" allow=""accelerometer; autoplay; clipboard-write; encrypted-media; gyroscope; picture-in-picture"" allowfullscreen&gt;&lt;/iframe&gt;', 'provider_name': 'YouTube', 'provider_url': 'https://www.youtube.com/', 'thumbnail_height': 360, 'thumbnail_url': 'https://i.ytimg.com/vi/_idhkSVGaEc/hqdefault.jpg', 'thumbnail_width': 480, 'title': 'Einstein explain his famous formula  E = MC^2', 'type': 'video', 'version': '1.0', 'width': 459}, 'type': 'youtube.com'}","{'content': '&lt;iframe width=""459"" height=""344"" src=""https://www.youtube.com/embed/_idhkSVGaEc?feature=oembed&amp;enablejsapi=1"" frameborder=""0"" allow=""accelerometer; autoplay; clipboard-write; encrypted-media; gyroscope; picture-in-picture"" allowfullscreen&gt;&lt;/iframe&gt;', 'height': 344, 'scrolling': False, 'width': 459}","{'oembed': {'author_name': 'JSUNIL TUTORIAL,', 'author_url': 'https://www.youtube.com/channel/UCVaXBDZk-x0P025mFKkZDfQ', 'height': 344, 'html': '&lt;iframe width=""459"" height=""344"" src=""https://www.youtube.com/embed/_idhkSVGaEc?feature=oembed&amp;enablejsapi=1"" frameborder=""0"" allow=""accelerometer; autoplay; clipboard-write; encrypted-media; gyroscope; picture-in-picture"" allowfullscreen&gt;&lt;/iframe&gt;', 'provider_name': 'YouTube', 'provider_url': 'https://www.youtube.com/', 'thumbnail_height': 360, 'thumbnail_url': 'https://i.ytimg.com/vi/_idhkSVGaEc/hqdefault.jpg', 'thumbnail_width': 480, 'title': 'Einstein explain his famous formula  E = MC^2', 'type': 'video', 'version': '1.0', 'width': 459}, 'type': 'youtube.com'}","{'content': '&lt;iframe width=""459"" height=""344"" src=""https://www.youtube.com/embed/_idhkSVGaEc?feature=oembed&amp;enablejsapi=1"" frameborder=""0"" allow=""accelerometer; autoplay; clipboard-write; encrypted-media; gyroscope; picture-in-picture"" allowfullscreen&gt;&lt;/iframe&gt;', 'height': 344, 'media_domain_url': 'https://www.redditmedia.com/mediaembed/j1l2zc', 'scrolling': False, 'width': 459}",,,,
[],False,J_Dex,,[],,,,text,t2_60i3fxp1,False,False,[],False,False,1601326453,self.Physics,https://www.reddit.com/r/Physics/comments/j1kp45/future_of_interstellar_travel_question/,{},j1kp45,True,False,False,False,True,True,False,,question,[],Question,dark,text,False,False,True,0,0,False,all_ads,/r/Physics/comments/j1kp45/future_of_interstellar_travel_question/,False,6,1601326465,1,"
Let's say in few hundreds of years we achieved technology similar to this seen in series ""The Expanse"" ( Epstein Drive). Modified fusion drive,  with very low fuel consumption as well as massive thrust output ect. They used their ships to fly to point A to B around solar system, accelerating all the time, turning direction half way to slow down( getting fastest asap ). 

My question is, given that there's enough fuel for the voyage, how long would it take to reach Proxima Centauri ( accelerating at constant 9.81ms/sÂ² ) and slowing down half way? How would that trip affect time dilatation? 
Thanks.",True,False,False,Physics,t5_2qhi6,1445217,public,self,Future of Interstellar Travel [Question],0,[],1.0,https://www.reddit.com/r/Physics/comments/j1kp45/future_of_interstellar_travel_question/,all_ads,6,,,,,,,,,,,,,
[],False,J_Dex,,[],,,,text,t2_60i3fxp1,False,False,[],False,False,1601326380,self.Physics,https://www.reddit.com/r/Physics/comments/j1ko8d/future_of_interstellar_travel/,{},j1ko8d,True,False,False,False,True,True,False,,,[],,dark,text,False,False,True,0,0,False,all_ads,/r/Physics/comments/j1ko8d/future_of_interstellar_travel/,False,6,1601326391,1,"Let's say in few hundreds of years we achieved technology similar to this seen in series ""The Expanse"" ( Epstein Drive). Modified fusion drive,  with very low fuel consumption as well as massive thrust output ect. They used their ships to fly to point A to B around solar system, accelerating all the time, turning direction half way to slow down( getting fastest asap ). 

My question is, given that there's enough fuel for the voyage, how long would it take to reach Proxima Centauri ( accelerating at constant 9.81ms/sÂ² ) and slowing down half way? How would that trip affect time dilatation? 
Thanks.",True,False,False,Physics,t5_2qhi6,1445217,public,self,Future of interstellar Travel.,0,[],1.0,https://www.reddit.com/r/Physics/comments/j1ko8d/future_of_interstellar_travel/,all_ads,6,,,,,,,,,,,,,
[],False,J_Dex,,[],,,,text,t2_60i3fxp1,False,False,[],False,False,1601326300,self.Physics,https://www.reddit.com/r/Physics/comments/j1knah/future_of_intersolar_travel/,{},j1knah,True,False,False,False,True,True,False,,,[],,dark,text,False,False,True,0,0,False,all_ads,/r/Physics/comments/j1knah/future_of_intersolar_travel/,False,6,1601326311,1,"Let's say in few hundreds of years we achieved technology similar to this seen in series ""The Expanse"" ( Epstein Drive). Modified fusion drive,  with very low fuel consumption as well as massive thrust output ect. They used their ships to fly to point A to B around solar system, accelerating all the time, turning direction half way to slow down( getting fastest asap ). 

My question is, given that there's enough fuel for the voyage, how long would it take to reach Proxima Centauri ( accelerating at constant 9.81ms/sÂ² ) and slowing down half way? How would that trip affect time dilatation? 
Thanks.",True,False,False,Physics,t5_2qhi6,1445214,public,self,Future of interSolar Travel.,0,[],1.0,https://www.reddit.com/r/Physics/comments/j1knah/future_of_intersolar_travel/,all_ads,6,,,,,,,,,,,,,
[],False,Monkeydfdg,,[],,,,text,t2_5l6wwz7h,False,False,[],False,False,1601325595,self.Physics,https://www.reddit.com/r/Physics/comments/j1ket4/good_honors_physics_textbook/,{},j1ket4,True,False,False,False,True,True,False,,question,[],Question,dark,text,False,False,True,2,0,False,all_ads,/r/Physics/comments/j1ket4/good_honors_physics_textbook/,False,6,1601325606,1,Hi I am tutoring physics to an advanced 8th grader that wants to go through the equivalent of an honors physics course. I was curious if anyone had any recommendations for a textbook that would be good to use? Most of the materials I am finding are college level.,True,False,False,Physics,t5_2qhi6,1445214,public,self,Good Honors Physics Textbook?,0,[],1.0,https://www.reddit.com/r/Physics/comments/j1ket4/good_honors_physics_textbook/,all_ads,6,,,,,,,,,,,,,
[],False,letsgoth,,[],,,,text,t2_6xhaqru3,False,False,[],False,False,1601324051,self.Physics,https://www.reddit.com/r/Physics/comments/j1jvvr/question_herch_moysÃ©s_nussenzveig_book_vol_ii/,{},j1jvvr,True,False,False,False,True,True,False,,question,[],Question,dark,text,False,False,True,0,0,False,all_ads,/r/Physics/comments/j1jvvr/question_herch_moysÃ©s_nussenzveig_book_vol_ii/,False,6,1601324062,1,"A vibrant string/rope of length L, attached at both ends, is vibrating at its nth normal mode, with transversal displacement given by (5.7.10)

https://preview.redd.it/yshezoku4yp51.png?width=608&amp;format=png&amp;auto=webp&amp;s=00959853df003c04775a55d1a419128782564db1

Calculate the total oscillation energy of the string. Suggestion: Consider an instant when the rope/string is passing through the equilibrium position, so that its total energy of oscillation is in purely kinetic form. Calculate the linear density of kinetic energy and integrate over the whole string.",True,False,False,Physics,t5_2qhi6,1445176,public,https://a.thumbs.redditmedia.com/6vmmuHmYTZLVNJzqED2NJ5YviuBlZ4cdPOzO8ujB5W0.jpg,"(Question) Herch MoysÃ©s Nussenzveig BOOK Vol II chapter 5, Q.10",0,[],1.0,https://www.reddit.com/r/Physics/comments/j1jvvr/question_herch_moysÃ©s_nussenzveig_book_vol_ii/,all_ads,6,,,23.0,140.0,,,,,,"{'yshezoku4yp51': {'e': 'Image', 'id': 'yshezoku4yp51', 'm': 'image/png', 'p': [{'u': 'https://preview.redd.it/yshezoku4yp51.png?width=108&amp;crop=smart&amp;auto=webp&amp;s=28b4db92e7e5192bba6e80f1024a61b4ff25b77c', 'x': 108, 'y': 17}, {'u': 'https://preview.redd.it/yshezoku4yp51.png?width=216&amp;crop=smart&amp;auto=webp&amp;s=9e6d5b2f8ec114107a6012799111095f19edeea3', 'x': 216, 'y': 35}, {'u': 'https://preview.redd.it/yshezoku4yp51.png?width=320&amp;crop=smart&amp;auto=webp&amp;s=85cf4efe5f603738d2eac9e35fd586d04bade9fa', 'x': 320, 'y': 52}], 's': {'u': 'https://preview.redd.it/yshezoku4yp51.png?width=608&amp;format=png&amp;auto=webp&amp;s=00959853df003c04775a55d1a419128782564db1', 'x': 608, 'y': 100}, 'status': 'valid'}}",,,
[],False,Kegath,,[],,,,text,t2_gxo69,False,False,[],False,False,1601323203,self.Physics,https://www.reddit.com/r/Physics/comments/j1jl6j/bullet_while_accelerating/,{},j1jl6j,True,False,False,False,True,True,False,,question,[],Question,dark,text,False,False,True,17,0,False,all_ads,/r/Physics/comments/j1jl6j/bullet_while_accelerating/,False,6,1601323215,1,"Hey Reddit,

I've been thinking about this all day, and am curious. What would happen if a gun was fired (pointing forward) while the gun was accelerating the same speed as, or faster than the acceleration of the bullet?

Would the gun explode? Would nothing crazy happen?

Thank You!",True,False,False,Physics,t5_2qhi6,1445164,public,self,Bullet while accelerating?,0,[],1.0,https://www.reddit.com/r/Physics/comments/j1jl6j/bullet_while_accelerating/,all_ads,6,,,,,,,,,,,,,
[],False,tycrow08,,[],,,,text,t2_68zgst7f,False,False,[],False,False,1601323022,self.Physics,https://www.reddit.com/r/Physics/comments/j1jiz7/newtons_second_law/,{},j1jiz7,True,False,False,False,True,True,False,,,[],,dark,text,False,False,True,0,0,False,all_ads,/r/Physics/comments/j1jiz7/newtons_second_law/,False,6,1601323033,1,"Iâ€™m doing some work before I start undergrad physics so this should be about A level physics level.

I have seen Newtonâ€™s Second Law as F=m*a, F=m*dv/dt, and F=dp/dt but this work shows an equivalence of m*dv/dt = m*v*dv/dx and I canâ€™t seem to wrap my head around. Any help is appreciated thank you",True,False,False,Physics,t5_2qhi6,1445146,public,self,Newtonâ€™s Second Law,0,[],1.0,https://www.reddit.com/r/Physics/comments/j1jiz7/newtons_second_law/,all_ads,6,,,,,,,,,,,,,
